body,subreddit,moderated
The Main Enemy is an interesting read that should be on your list. ,AskHistorians,1
Is this the same area that the fertile cradle and the surrounding desert.,AskHistorians,1
"http://www.sacred-texts.com/chr/apo/

Try here but sometimes sacred texts has issues with good translations so be wary.",AskHistorians,1
"I reported every message I received, but for a while I was getting more than 10 at a time. I deleted my old account because the harassment was pretty nonstop. ",AskHistorians,1
"Hi, there. I removed your question because of the reference to a ""current political movement"". It might not be your intention, but that may very well serve as bait for people who will begin discussing contemporary politics.

I kindly ask that you rephrase your post so as to avoid references to recent politics (e.g. please follow the 20 year rule). You will still get the answer you´re looking for without mentioning contemporary politics and it´ll prevent extra work for mods who would otherwise need to periodically purge the replies of soapboxing and discussion of recent events.

Thanks for understanding.",AskHistorians,1
There is a good book The California Gold Rush and the Coming of the Civil War - https://www.amazon.com/dp/B000OI0G66/ref=dp-kindle-redirect?_encoding=UTF8&btkr=1,AskHistorians,1
Drink ,AskHistorians,1
"> the Manhattan Company

Which is essentially still in business, by the way. It's the oldest predecessor firm of the many absorbed by JPMorgan Chase over the years.",AskHistorians,1
"Ha... Now who's the revisionist? :) 

In a November 22nd, 1944 letter to U.S State Department officials, regarding visits to these alleged ""death-camps"", the Red Cross said; ""(We) had not been able to discover any trace of installations for exterminating civilian prisoners..."" 

Rado Loenid, director of the Holocaust Survivors Registry at the U.S. Holocaust Memorial Museum even claimed, ""There is no doubt the Red Cross let itself be used by the Nazis... there is no doubt they were fooled!""

Now why would 'ol Rado be saying such a thing if the Red Cross had not in fact concluded this?

BTFO.

>Denying History: Who Says the Holocaust Never Happened and Why Do They Say It? by Michael Shermer and Alex Grobman (2002).

Lol... Michael Shermer, the guy who back-stabbed David Cole (a JEWISH revisionist) on the Phil Donahue show back in the 90's. He had conceded to Cole, prior to the show. Admitting, that neither himself, the Auschwitz museum, nor his many intellectual buddies could provide a rational response to David Cole's ""38 Questions"". Yet, Shermer cucked after supposedly getting scolded by Phil Donahue himself over it (this was Shermer's first time on television, I believe) Shermer would later call David Cole to apologize and again agree that he was correct... David Cole recorded that conversation. I'd share the videos with you, but I'm sure you've seen them, ""EVIDENCE-DENIER!!!"" Lol 

He was on Montel Williams in the 90's too. Then the Jewish Defamation League put a $25,000 purse on his head, of which I believe they were exposed for, leading him to go into hiding and change his name. He would later be exposed and have his life RUINED a SECOND time... for asking questions. Hmmmmm

>Denying the Holocaust: The Growing Assault on Truth and Memory by Deborah Lipstadt (1994).
>History on Trial: My Day in Court with David Irving. by Deborah Lipstadt (2005).

Deborah Lipstadt does nothing more than witch-hunt for ""anti-Semites"" and advocate to throw them in prison on shit premises. Disgusting... As Martin said, ""When you tear out a man's tongue, you are not proving him a liar, you're only telling the world that you fear what he might say."" 

Also, could she possibly be a little bias, as a Jew, who seeks to lock up anyone who questions a Jew???

David Irving, regarded as the most renowned historian on the subject, sued Deborah Lipstadt for libel after she tried branding him a ""Holocaust-denier"" in her continuing witch-hunts. This term is simply a communist-inspired silencing-tactic, much like ""anti-Semite"", ""racist"", ""bigot"" and others are. 

>Lying About Hitler: History, Holocaust, and the David Irving Trial by Richard J. Evans (2002).

Lmao... Richard J. Evans, the feminist, Marxist, star-witness in in the Irving v. Lipstadt case. 

""In 2014,writing in the Daily Mail, Michael Gove accused Evans in particular of distorting history with regards to Britain's role in the war.[41] Evans countered that Gove was engaging in the defamation of academic historians and ""narrow, tub-thumping jingoism"". Lol (How to politely call someone a racist, in response... Silencing-tactic.)

""In In Hitler's Shadow, Evans strongly criticized Nolte for statements which implied that perhaps there was something to Holocaust denial.[11] In addition, Evans took Nolte to task for his claim that the victors write history, and that the only reason why Nazi Germany is seen as evil is because Germany lost the war rather than because of the Holocaust.[12] In addition, Evans attacked Nolte for claiming that a letter written to Neville Chamberlain from Chaim Weizmann on 3 September 1939 promising that the Jewish Agency would support the war effort was a ""Jewish declaration of war"" on Germany that justified ""interning"" all Jews in concentration camps as an attempt to justify the Holocaust.[13] Writing from a functionalist perspective, Evans took Hillgruber and Hildebrand to task in In Hitler's Shadow for their intentionalist theories about the Holocaust.[14]""
https://en.wikipedia.org/wiki/Richard_J._Evans

Yeah... When you are supporting enemies we are at war with, you are our enemy. Mr. Evans doesn't seem to want to admit that though... This man is constantly called out for his twisting of facts and distortions of history. FAIL. 

""Hey, let's knight him!""

All the people you have cited here have distorted history, as you have also. 

Yet another reason why no one believes this Holo-hoax bullshit.

Good day, Mr. u/commiespaceinvader (Appropriate username). 
",AskHistorians,1
"Very well written and very well said.  While we - historians and non-historians alike - may wish to look back at a nineteenth century conflict through a twenty-first century prism and reduce the actors' motives down to a single narrative, such a deterministic approach fails to recognize the humanity of the individuals involved.  In truth, what induced the Southerner to the Colors is so deeply complex that it would be unjust to paint the ""principles behind the cause"" with a single narrative's brush.


Instead, I suggest examining the question not from the macro to the micro - ""the Confederacy fought for X, so the States seceded because of X, the individual must believe X"" - but from the other way around.  Put more succinctly, from the perspective of the individual (man or woman, solider or not) and their motivations for supporting the cause, how those individuals' motives influenced their states, and finally how those states created the identity of the Confederacy.  


This is, of course, still an oversimplification of the interplay of the myriad of factors that brought about and sustained the conflict.  However, I do think it's helpful to illustrate the futility of the deterministic narrative and thereby suggest that an examination of motive is best made at the level of the individuals involved.  Upon such examination, I think it will be clear that no single reason is pervasive; instead, that the motivation to fight came from many and varied sources as the conflict began and as it progressed.

As you have so well put, there are several overall themes that can be pointed to as sources of motivation for war - societal (slavery and the stratified class structure), economic (planter/yeoman vs. industrialist), political (expansion of slavery), etc.  Though these themes are well supported, they are created by historians looking through a prism and essentially categorizing their observations.  I suggest that the Southerner's rational is even a step further complex - that the participants were not only induced by their own individual reason or reasons but that those motives were fluid and changing over time.  


Take, for example, a volunteer making his way to Richmond in the spring of 1861.  Sure, he may be aware of some of the geopolitical concerns at play, but is that why he's enlisting?  It could be, but more likely it's because war is some grand adventure and all the local boys joined his town's unit.  Now contrast him with a draftee in the winter of 1864.  He almost certainly holds some notion of a need to preserve the Southern system and possesses some vague hatred of Those People, but that's not why he's fighting. He's fighting because he has to.  Now what if this recruit and this draftee find themselves in the same trench outside of Petersburg in the winter of 1865?  There is no pretense for why they're there - they're there because the invaders are there.  What motivates them then? If their lines break, there is noting to stop the Army of the Potomac from marching to their hometown.  If they fight they'll likely freeze, starve,  or catch a Federal ball.  If they desert they'll likely freeze, starve, or catch a provost's ball.  Many such men stayed at their posts throughout the war, many deserted, and some who deserted even found their way back to arms.  But the reasoning behind each such decision and action of such soldiers - though potentially influenced by pressures from society, family, and duty - were uniquely his own.


In conclusion and tangential, longwinded, response to the overall question, boiling down the ""Southern belief"" to the alternatives of states rights and slavery does a disservice to the humanity of the individuals involved.  Acknowledging the complexities of the factors that the conflict encompassed is certainly more correct and just, but still does not get to the root of ideological motivations.  However, with these factors in mind, it is possible to go a step further and examine individual actors to determine their individual motivations.  This can be accomplished in part by reviewing diary entries and letter exchanges between ordinary soldiers and their families, which are often contained in the plethora of memorandum published after the War.  However, it is wise to exercise caution when considering the text surrounding the four corners of letters contained in such publications - the recollections recorded therein are often influenced by the ""Southern Myth"" which I will not get into as it is discussed well above.   Even with (or, perhaps, including) such post war influence, I think it will be apparent that Southern motivations were unique to the individual and were subject to change over time.",AskHistorians,1
"I'm on my tablet, so no link, but ""Tudor Monastery Farm"" is another very good one by that group. It can also be found on YouTube.",AskHistorians,1
I'm surprised no one has mentioned the Kama Sucre.,AskHistorians,1
"Islam forbids drawings of things that have a soul, as it is considered trying to imitate the god himself. It is not in Quran, but in the hadits.

> 'Aisha reported that Gabriel (peace be upon him) made a promise with Allah's Messenger (may peace be upon him) to come at a definite hour; that hour came but he did not visit him. And there was in his hand (in the hand of Allah's Apostle) a staff. He threw it from his hand and said: Never has Allah or His messengers (angels) ever broken their promise. Then he cast a glance (and by chance) found a puppy under his cot and said: 'Aisha, when did this dog enter here? She said: BY Allah, I don't know He then commanded and it was turned out. Then Gabriel came and Allah's Messenger (may peace be upon him) said to him: You promised me and I waited for you, but you did not come, whereupon he said: It was the dog in your house which prevented me (to come), for we (angels) do not enter a house in which there is a dog or a picture.

[Sahih Muslim Book 024, Hadith Number 5246.](http://hadithcollection.com/sahihmuslim/152-Sahih%20Muslim%20Book%2024.%20Clothes%20and%20Decorations/13592-sahih-muslim-book-024-hadith-number-5246.html)          

Cannot answer the jesus side of the question, sorry!",AskHistorians,1
"Yeah, Almond milk was actually rather common for dairy -- certainly consumed far more frequently than cow milk products.

[Great Recipes here](http://www.godecookery.com/goderec/goderec.htm)",AskHistorians,1
i saw that exact article too; i found many google-digitized magazines/papers that seem to basically copy [the original article](https://www.google.com/search?num=30&q=professor+muller+newfoundland+whale+milking&oq=professor+muller+newfoundland+whale+milking&gs_l=serp.3...12779.14327.0.14718.10.10.0.0.0.0.162.1147.0j10.10.0....0...1c.1.64.serp..0.4.516...30i10k1.NKjZwoiI5NY) (but [which one's the original](https://www.youtube.com/watch?v=oYsOdf0HJeQ)?!) i wanted to ask Historians about it but I Am pretty wasted by now.,AskHistorians,1
"But more importantly, What is the oldest dam that we know of (built by beavers?)",AskHistorians,1
"The original inhabitants of Europe came in between 40-45,000BP (before the invention of writing).  This is a question for prehistorians, not historians.

",AskHistorians,1
"Not a historian...

Nazi? You mean Wehrmacht? Nazi units were a small percentage of the actual fighting force and had higher casualty rates compared to the actual Wehrmacht. 

During WW1 the Wehrmacht was considered the best equipped and trained on the battlefield. The Prussian culture at the core of the Wehrmacht was strict and efficient and much respected. That could have been the origin of the opinion. 

Another take is that the engineering of tanks and or other large mechanized was very good but in terms of field repair, the high engineering standards of german armor was not easy to repair. Allied tanks were worse in terms of protection but could be repaired way faster than german armor. Mass production and fast turnaround on repairs helped the allies in ww2. German manufacturing became worse later in the conflict. Lack of materials and labor shortages took it's toll on quality control. Interchangeable parts and mass production won over brilliant equipment.     ",AskHistorians,1
"If one considers that multiplicity of nationalities that lived within the Dual Monarchy and the direct threats that existed on almost every border, I am not sure they had time to be concerned. These nationalities included German, Magyar, Slovak, Slovene, Ruthenian, Pole, Croat, Greek, Turkoman, Rumanian, Italian, Ukrainian, Serb, and then the Gypsy Romani and Senti groups.  Many of these racial/national groups were active in seeking the creation of a nation-state. Maybe not the best answer, but it was a VERY divided empire with Catholic, Orthodox Christian, and Muslim religions and all of the nationalities.",AskHistorians,1
"Speculation here: the WTC bombing in 93 likely spurred a disdain for ""ethnic"" food amongst the primary demographic (older, conservative, white) of the NYT, and it wasn't until the turn of the century that any food type outside of French, Italian, and Japanese was considered ""fancy"" or high-class in the West.",AskHistorians,1
"So, Mr. Moderator, nobody knows then. ",AskHistorians,1
good book. ,AskHistorians,1
"Interesting, but I think you mean Himmler?",AskHistorians,1
"The Inka controlled a region of comparable size to the Roman Empire; at its height, theirs spanned from Quito in present-day Ecuador to southern Chile. This large area was divided into administrative zones and controlled by militaristic intervention, which was facilitated by an impressive road system and accompanying storehouses.",AskHistorians,1
"A few hundred years has a ton of variables, and they were happening all over the world. At least set it in a place and time. ",AskHistorians,1
"I am taking a educated guess here, please someone correct me if I'm totally wrong.
Many of Japan's former emperors were simply puppets for one particular family. The emperor had been known to have very little real power over the government and the decisions made. The amount of conspirators in the 1850-1877 could have something to do with why it was written into the constitution. Author Paul Akamatsu, writes that ""Emperor Komei, had already shown the desire to abdicate in 1858...however that may be, the February 13 conspirators were said to have blamed [Ando] him for entertaining such intentions. "" (Meiji 1868: Revolution and counter- revolution in Japan, page 93). ",AskHistorians,1
But rebuilding costly infrastructure and it actually changes settings.,AskHistorians,1
"You may need to clarify your question. Do you mean did they perceive that they their government had the negative characteristics that people now associate with ""fascism""?  Because an Italian during Mussolini's rule certainly would have understood that it was a Fascist government---the name of Mussolini's party was literally the National Fascist Party (Partito Nazionale Fascista). ",AskHistorians,1
"Sorry for asking here, but it seems like the right topic: is the reason Europe wasn't really succesful for longer periods of time because of being in heavy hot metal armor?",AskHistorians,1
"Basically (at least according to CGP Grey's video on the spread of disease in the new world) the reason south America had more cities and infrastructure than north American people was because North America had terrible animals for domestication. South America wasn't much better mind you, the only pack animal they had was the Llama. 

",AskHistorians,1
We,AskHistorians,1
The past.,AskHistorians,1
"Ok, this isn't going to be a proper answer, mainly because I think your premise is incorrect. The Maori got screwed over by the British. But have you ever seen a Maori? They are tough dudes.
Hell, even their weddings are scary.
https://www.youtube.com/watch?v=YT7Iyk8LoEg",AskHistorians,1
"I am in no way an expert on early Islam, however, I would say it may have had some minor effect on the adoption of Islam, but likely much less than other precipitating sociopolitical, military, and economic factors. One thing to note is many of the Christian sects predominating the middle East and North Africa were remnants of groups that had been deemed heretical or anathema in the previous centuries, and so may have felt little connection to either the  western or eastern Christian empires.",AskHistorians,1
"MA in Medieval History here:

It would be problematic to say that the aristocracy and nobility were incapable of monogamy. However, I would say that adultery was not an uncommon activity. Yes, adultery was seen as a sin but it was not a capital crime like heresy. 

Religion was a very personal belief to the average medieval person, as it is today. Many people had their own internal relationship with God and did not have training in canon law or theology. There were many mixtures of pagan rites and holdovers from the Arian heresy in Europe. Mass was given in Latin which many lay people did not really understand because the languages had shifted to the vernacular versions. They knew the basics of Christianity but were really guided by the town clergy. Church attendance was not super common until the passing of Lateran IV in 1215 when the Church (at this time, there was only one) began to use life milestones (such as marriage) to insert itself into the lives of its parishioners. It used church attendance as a way to levy taxes. Parishioners were then required to attend mass at least once a year on Easter in order to be counted for a census for tax reasons. That isn't to say that you didn't have very devout Christians. You can find examples of devout Christians all over history and since you mention ""The Tudors,"" Catherine of Aragon was famously very pious. 

Fornication of any sort, if discovered, was typically punished based on gender, social status, age, religion. The older the offenders, the more they were thought to know better. If a person of higher social class wanted to rape a peasantwoman, it was thought to be permissible. Historian Vern L. Bullough stated in his article ""Prostitution in the Later Middle Ages"" that ""If a nobleman desired a peasantwoman so strongly that he could not resist the temptation, he was free to rape her on the spot since a courteous approach would only be wasted on a woman who could not possibly feel love."" If you are curious about medieval sexuality, check out Vern L. Bullough's stuff, it's really enlightening. Sexual relations before marriage were extremely common. Once a couple were betrothed, they often engaged in sexual intercourse. It was not uncommon for a bride to walk down the aisle pregnant. A woman who was promiscuous before she was betrothed could spell disaster for her reputation, especially if she was a noblewoman. This was usually because if a woman then got married, it could be difficult for her husband to prove the progeny were his. Unmarried men did not have the restrictions that women had.

If the fornicators were married individuals, obviously it was seen as a greater sin than those having sex outside of wedlock who were unmarried because it went against the sanctity of marriage and could produce illegitimate children, complicating the inheritance process. 

Did it happen? Absolutely. In general, marriage, especially in the upper classes was seen as a business transaction. Dowries were given by the bride's father to secure her marriage and was quite often a political move. Historian Pieter Spierenburg would argue that people did not really start marrying for love until the Revolution of Love in the 18th century. In that case, it was seen that some people would fulfill their marital duty but also take lovers.

In regards to the clergy not maintaining celibacy, you have to understand that a vow of celibacy was a relatively new thing to the Church in the medieval period. Lateran IV in 1215 made the vow of celibacy a mandatory practice within the Church. Prior to 1215, a priest could have taken a wive and fathered children but due to inheritance laws, children of priests were inheriting Church lands. Therefore, this was problematic to the Church and therefore, was eradicated. 

When it came to nobility, there was a very different set of rules for kings and queens. If a queen was found to have cuckolded her husband by taking a lover, it was often seen as treason for which she could be beheaded (see Anne Boleyn). By contrast, a king's mistress was often seen as a coveted and powerful position. In fact, there were even levels of mistresses at some courts with the main mistress as having a significant amount of power.

Here are some famous examples that you may be familiar with of different situations that occurred in the late medieval/renaissance that have been portrayed by popular culture:

Sir Thomas More: Was a wealthy, well-connected man who held high political office in Henry VIII's court. He was a very devout Catholic and noted to have had two happy marriages and no known mistresses.

Henry II of France - Henry II was famously known to have fallen in love with a woman who was 21 years older than him, Diane de Poitiers. Henry loved Diane so much that Diane would force him to lay with his queen, Catherine dei Medici, in order to produce heirs. This relationship is shown in the TV show Reign.

Pope Alexander VI: If you have seen the show The Borgias, you know about Rodrigo Borgia or Pope Alexander VI (fantastic performance by Jeremy Irons, highly recommend!). Pope Alexander VI famously had a decades-long affair with a thrice-married woman, Vannozza dei Cattanei, with whom he fathered four children. He also had an affair with another married woman, Guilia Farnese.

George III of England: This 18th century English king is the famous king that ruled England during the American Revolution. Another fun fact about him is that he never took a mistress and had a deep love for his queen, Charlotte of Mecklenburg with whom he fathered 15 children. He was also noted to be mad however.

To answer your question simply: Yes adultery happened but it is also so much more fun to watch it magnified in a period piece. Hope that helps answer your question!

Information on sex and punishments from Brown University's study on medieval sexuality and the Decameron:

https://www.brown.edu/Departments/Italian_Studies/dweb/society/sex/fornication-adultery.php
",AskHistorians,1
"It's worth considering or looking into because it's quite rampant in my experience.

You have shows like Mazinkaiser, Shwarzmarken (East Germany), Legend of the Galactic Heroes (big space opera), Tytania (another opera), FMA, AoT, and many many more. There is also a huge following on the ship girls or Kantai/KanColle or High School Fleet. These are World War II maybe World War I era naval fleets that have avatars as women. It's akin to the bomber pinups in the USA but goes a step further. I'd have to link to a myanimelist and I'm sure I'd still miss some older obscure ones. These touch on Germanic roots in some way or at least European traditions or cultures in recent history (19th-20th century). 

It would be interesting to see some actual studies and data on this but it's unlikely with how things are run currently.",AskHistorians,1
"Exactly, how could a barbarian become emperor? Did he live in a majestic palace or a stone fortress as a simbol of authority? Or did he live in a camp surrounded by wooden palisade?",AskHistorians,1
Why not include China? ,AskHistorians,1
I can say IBM was hired to create and produce computers (mechanical) to keep track of all of the Jews. Many people don't realize those numbers on their wrists were punched into those computers for identification and to keep tabs on the camps inmates. So in a way yes IBM and Thomas Watson made money off of the Holocaust. ,AskHistorians,1
