body,subreddit,moderated
"Sources are highly recommended, but not *mandatory* (unless requested), so moderators do not remove comments simply for lacking them. 

The comment was removed for failing to meet subreddit standards in terms of depth and detail, as well as accuracy (for example, here's the most recent thread discussing the urban myth re eyepatches - [link](https://www.reddit.com/r/AskHistorians/comments/3m1f8e/did_pirates_wear_eye_patches_for_better_vision_in/)).",AskHistorians,0
[removed],AskHistorians,0
"Thanks for the information. You, along with wikipedia, mentioned ""The Secret Histories"", I was originally confused as to which book this was since there is one called ""The Secret History of the Mongols"". But now I see that this is the same book...right? So when I use this as a source, should I use the whole name or could I use ""The Secret Histories"" as wikipedia just states along with other people such as yourself?",AskHistorians,0
[removed],AskHistorians,0
"This submission has been removed because it violates the [rule on poll-type questions](http://www.reddit.com/r/AskHistorians/wiki/rules#wiki_no_.22poll.22-type_questions). These poll-type questions do not lend themselves to answers with a firm foundation in sources and research, and the resulting threads usually turn into monsters with enormous speculation and little focussed discussion. “Most”, “least”, ""best"" and ""worst"" questions usually lead to vague, subjective, and speculative answers.  For further information, please consult [this Roundtable discussion](https://www.reddit.com/r/AskHistorians/comments/48hjn0/rules_roundtable_6_the_no_polltype_questions_rule/).

For questions of these types, we ask that you redirect them to more appropriate subreddits, such as /r/history or /r/askhistory.",AskHistorians,0
Is there any relation between the diamond story and the older accounts of using fleeces to collect gold flakes?,AskHistorians,0
[removed],AskHistorians,0
"Muzzle-loaders of the 18th-19th c. are muzzle-heavy, and if the buttstocks are long enough to fit a typical man's arms, they are too long for the average woman.  Most women today find the modern reproductions of these very awkward to hold and aim. What about surviving guns from the period?
The survival rate for American guns , rifles from the 18th c.,  is rather low: they mostly got worn out. However , later ones, muzzle-loaders circa 1820-1860 had only a few decades of use before they were made obsolete by breech-loading cartridge guns, and a good number of those do survive. Among them are indeed found some lighter pieces with shorter buttstocks. These have sometimes been called boy's rifles, but given the fact that a rifle was not cheap and that a boy would soon grow too big to use a small one, it's most likely that they were made for women, and now they're usually called ladies' rifles.  I doubt anyone has ever done some sort of survey to come up with a percentage,  to say if the average woman would own one, but it's pretty safe to say that the average surviving period rifle is more often sized to fit an average man.  This is different from saying whether the average woman on the frontier c. 1820-1860 would be ABLE to load and shoot a gun if required, of course- but if she was average-sized, she'd be looking for something to rest it on.

Looking around online for an example of a ladies' rifle, I have only found [this](http://ehcnc.org/decorative-arts/historic-trades/the-kentucky-rifle/) .  If you scroll far down to Fig 69, the Cofer rifle is a good- though overly fancy- example.",AskHistorians,0
"The last time I read a survey on this point, there had been ""Bigfoot"" reports from every US state except Hawaii. [This online database](http://www.bfro.net/gdb/) suggests this remains true. By no means all involve reports from remote locations. This, to me, is one excellent reason for assuming hoaxes, witness psychology and folklore are all significant factors. There are plenty of cryptozoologists who would disagree, no doubt.

",AskHistorians,0
[removed],AskHistorians,0
"There are lots of dimensions to this question. Firstly, there's the simple fact that Stalin was not very interested in spreading world revolution because of the principle of Socialism in One Country. The failures of communist revolutions across Europe between 1917-1922 convinced Stalin of the futility of aiding in the subversion of European states towards communism. Stalin felt that it was more beneficial/sensible to construct socialism within the Soviet Union and shore up its own defenses against perceived aggression from capitalist powers. 

Stalin's army was also not nearly as well-equipped as Hitler's or Mussolini's and therefore the assistance that Stalin could offer the Spanish Republic was limited. There were also additional diplomatic concerns- if Stalin offered overt military aid to Spain, this would anger the Western powers who, while not fans of Hitler, were equally distrustful of Stalin. Stalin understood that victory against Franco would need the help of Western allies like France and Britain. If he overplayed his hand in Spain, he risked alienating them. Conversely, he also had to worry that if he showed too much support for the Republic, Germany might also be compelled to invade the Soviet Union. Germany had signed the ""Anti-Comintern Pact"" with Japan and a number of European states, which sent a strong message to the Soviets that Hitler was prepared to undermine the Soviet regime by military efforts if necessary (which, as we know, he eventually did). 

I think that we have to realize that Stalin had a myriad of priorities within the Soviet Union that prevented him from throwing full support behind the Republic. He was concerned about the preservation of his own regime and state, and to that end he felt that an excessive entanglement in foreign affairs could risk making too many enemies that might seek to undermine the Soviet Union. As long as he kept out of their affairs, or, as long as he offered limited support, he felt that he was playing enough of a diplomatic game of chess to keep different European powers satisfied.
",AskHistorians,0
"*The Great Escape.* There's a woman onscreen for about two seconds in one of the jail scenes at the end. (In the book, the Gestapo bring in a female tailor to examine the escaped prisoners' ""civilian"" clothing and demonstrate it was recut from military uniforms--certifying they are POWs as not spies). Might be a woman or two on the train station platform as well.

Given the setting, though, I'm inclined to forgive this one. It's far better than a lot of the standard Hollywood alternatives.",AskHistorians,0
[removed],AskHistorians,0
"Sorry about that!

If I were to make a new post with the question rephrased to be about one instance or event, would that be more acceptable?",AskHistorians,0
[removed],AskHistorians,0
[removed],AskHistorians,0
[removed],AskHistorians,0
[removed],AskHistorians,0
"I can answer that one a little bit, at least for parts of Europe (mostly Britain). Coinage across Europe was influenced by the coinage of big empires. The earliest Gallic and Britannic coins we have found are traceable in form to the coinage (namely the gold *stater*) of Macedonia under Philip of Macedon (359-336 BC). On one side of these coins, there was the head of Apollo, on the reverse was a two horse chariot. Interpretations of this coin design persisted up to the Roman invasions of Britain and Gaul, when British coinage begins to incorporate Roman elements and imagery, namely signifying titles like *rex* (lit. *king*), as well as the names of rulers, and Gallic coinage is largely replaced by Roman money. 

**TL;DR large groups of Celts, especially in Gaul and subsequently Britain, adopted round coinage with heads on one side from Macedonian designs, and this was only reinforced by Roman styles in the 1st century BC.**

Sources:

David Mattingly, *An Imperial Possession, Britain in the Roman Empire*

Patricia Southern, *Roman Britain, A New History 55 BC-AD 450*",AskHistorians,0
"The term ""The Holocaust"" in its most common usage in popular culture and academia is generally understood and defined as the systematic, bureaucratic, state-sponsored persecution and murder of six million Jews and up to half a million Roma, Sinti, and other groups persecuted as ""gypsies"" by the Nazi regime and its collaborators. During the time of the Holocaust the Nazis also targeted other groups on grounds of their perceived ""inferiority"", such as the disabled and Slavs, and on grounds of their religion, ideology or behavior among them Communists, Socialists, Jehovah's Witnesses and homosexuals.

The focus of this definition on Jews and more recently so-called gypsies as well as the common association of the term Holocaust with the murder of six million Jews in Europe results from the difference in persecutorial practice and the totality of the planned annihilation of the Jews by the Nazis.

It was the Nazis' plan and policy to kill every Jew and every ""gypsy"" they could get their hands on, regardless of who they were, what they did, their gender, age, nationality, class or political conviction. They built an entire administration, bureaucracy, and infrastructure to that specific end and used all the tools the modern state has at its disposal from the rail way to the army in order to achieve this goal. What the Nazis referred to as the ""final solution to the Jewish question"" was genocide in its most encompassing and most extreme form.

The Nazi regime subjected millions of people to violence, starvation, exploitation of labor, imprisonment, and murder but no other group was targeted so systematically and with such totality than the Jews and ""gypsies"". These key differences become apparent when we look at how this was put in practice. While the Nazis did indeed start killing handicapped and disabled Germans before they started killing Jews, they did not pressure foreign governments to hand over their handicapped for example as they did with Jews. The fact that the Nazi government exerted diplomatic pressure on the Imperial Japanese government to hand over the 18.000 Jews in Shanghai demonstrates that for the Nazis even a comparatively small number of Jews thousands of miles away from any of their territory represented such a danger to them in their minds that they had to die.

Similarly, the Nazi regime imprisoned and shot thousands upon thousands of Soviet and Polish citizens, yet they never built camps that only existed with the sole purpose of murdering all Poles or Soviets they could get their hands on like they did with Jews. Camps such as Sobibor, Treblinka and Belzec were nothing but a modicum of infrastructure surrounding a gas chamber. In Treblinka, a camp barely the size of two soccer fields, up to 900.000 Jews were murdered in the span of a year.

This all does in no way minimize or trivialize the horrors and cruelty of how the Nazis treated their non-Jewish victims. Soviets and Poles, handicapped and mentally ill people, Communists and Socialists, Jehovah's Witnesses and homosexuals, all suffered tremendously under the Nazis and unimaginable numbers of them were killed. They all need to be remembered.

Yet, when we describe what the Nazis termed the ""final solution"" some structural and ideological differences become apparent. I have previously mentioned death camps and diplomatic pressure but another example would be that the Nazis indeed did try to kill every Jew, including babies and children. Even within the gruesome and savage history of Nazi atrocities against so many people, the description of SS troops invading a hospital and killing Jewish babies by smashing their heads against walls or setting up a whole state apparatus concerned with the systmeatic gassing and shooting of men, women, children, and the elderly evokes a special kind of terror and revulsion.

The term Holocaust is in the historical field first and foremost intended as a term that acknowledges and contains the description of this difference, without attempting to moralize this difference or make any sort of statement, which was ""worse"", because when you deal in the category of Nazi atrocities against all its victims ""worse"" is not really a category that can cover it anymore.

That the term has become so ingrained within popular memory and culture and that popular memory and culture associate the Nazi regime with its murder of Europe's Jews (and sometimes tends to forget about the other victims of Nazi murder and oppression) has to do with the fact that the genocide against the Jews challenged the Western Meta-Narrative of History. As /u/agentdcf describes [here](https://www.reddit.com/r/AskHistorians/comments/4tln3x/steve_king_the_contributions_of_western_civ/d5ibayl):

&gt; the Holocaust (...) struck right at the heart of the narrative of Western Civilization. See, the narrative imagines the West to be uniquely rational, scientific, prosperous, inventive--in short, active and progressive. It posits that the West has been the driving force of capital-H History. The Nazis are The Problem for the Western Civilization narrative because they used so many of the elements of the West that its proponents saw as good, but in ways that were so obviously terrible: democracy, since Hitler and the National Socialists came to power at least partly through elections; science, as the Nazis built a foundation of what we now call pseudo-science but that was really the culmination of 19th-century scientific racism, in order to marginalize, attack, and attempt to utterly destroy specific groups of people in Europe, in the West (this sort of thing had happened before in imperial encounters but could be excused as occurring against non-Western Others); industrial technology, as the Holocaust itself used essentially factory methods. How, then, could the West be the home of a civilization that should be the best for everyone, when it created the worst as well?

In short the Western imagination of itself had experienced atrocities and horrors inflicted against political opponents, ""deviants"", and colonial subjects but it had never experienced that all it used to define itself as good and progressive – the modern state and its bureaucracy, industry, science, the police – was used to murder an entire group of European peoples. This is why, the originally descriptive term of Holocaust has turned into a symbolic and signifying term and why, when we hear Nazi atrocities, we tend to immediately think of the murder of six million Jews.",AskHistorians,0
[removed],AskHistorians,0
"Sorry, but your submission has been removed because we [don't allow hypothetical questions](http://www.reddit.com/r/AskHistorians/wiki/rules#wiki_is_this_the_right_place_for_your_question.3F). If possible, please feel free to rephrase the question so that it does not call for such speculation, and resubmit. Otherwise, this sort of thing is better suited for /r/HistoryWhatIf. You can find a more in-depth discussion of this rule [here](https://www.reddit.com/r/AskHistorians/comments/4mtauf/rules_roundtable_no_12_dont_play_the_whatif_game/).",AskHistorians,0
"*1. Find some recent, good, books that are related to your topic.* Are any of those books you read from like the past ten years? If not, look for a couple that are. Next, search their titles in JSTOR and see if they've been reviewed by academics in the field, and then scan the reviews briefly to make sure they don't all say ""this is a terrible book with no redeeming value.""

*2. Read the introduction and conclusion and see what questions the author is engaging with.* Do they mention other scholars who have done good work? Who have done bad work? Do they mention questions that the book hasn't fully answered? Try to pick a few questions or disagreements they mention that sounds interesting to you. 

*3. Look at primary sources the book mentions:* Look at the footnotes in the text or endnotes at the back, and also the intro and conclusion. Look for any documents it mentions. See if you can find ones that seem like they might help you answer one of the questions you came up with in part 2. Google them. If you don't know German, see if they're available in English.

*4. Go talk to that professor:* Make an appointment, and say ""I'm thinking about studying [x aspect of Jewish collaboration in the Holocaust from Part 2] using [y primary sources from part 3.] Do you think that could work?"" ",AskHistorians,0
[removed],AskHistorians,0
Thank you sir! I knew I trusted this subject for a reason.,AskHistorians,0
"This reply is not appropriate for this subreddit. While we [aren't](https://www.reddit.com/r/askhistorians/wiki/aprilfools) as [humorless](https://www.reddit.com/r/askhistorians/wiki/aprilfools2) as our [reputation](https://www.reddit.com/r/askhistorians/wiki/aprilfools3) implies, [a comment should not consist solely of a joke](https://www.reddit.com/r/AskHistorians/wiki/rules#wiki_jokes_and_humour), although incorporating humor into a proper answer is acceptable. Do not post in this manner again.",AskHistorians,0
"In short: Columbian Exchange. 
Europeans unknowingly introduced a number of highly contagious diseases to Americas, including smallpox, which devastated the native populations of the western hemisphere.
By the time Spanish, French, and English settlers started to make their way into the mainland, the native civilizations were either destroyed completely, i.e. the Mississippian culture, or disrupted to the point at which no effective resistance to European incursions could be mounted in time, i.e. Incan Empire.
Along with killing off some 80-90% of the population, the epidemics also disrupted the ties between the survivors, resulting in several internal conflicts. 
In the end, there just weren't too many Native Americans left to dominate, and the land, cultivated by the generations of the locals was too good to pass up, even in the face of the resistance put up by the survivors.",AskHistorians,0
[removed],AskHistorians,0
[removed],AskHistorians,0
[removed],AskHistorians,0
Interesting ideas; I'll definitely take a look! Thanks :),AskHistorians,0
Follow up question in regards to the first minute - why the eleventh hour of the eleventh day of the eleventh month? ,AskHistorians,0
[removed],AskHistorians,0
"&gt; a Republic is a form of government in which elected officials exercise executive power on behalf of the people.

I'm not sure about this definition of ""Republic.""

In the UK, the Prime Minister (an elected official) exercises executive power (some of which is his power, some of which is the Queen's but he exercises it) on behalf of the people. But it's surely a Constitutional Monarchy, not a Republic.
In the People's Republic of China, the executive is not elected by the people, and in the Republic of China (Taiwan), the executive is elected now, but in the past wasn't. In fact there are and have been many countries in the 21st and 20th century that are/were called Republics, but did not have elected executives.",AskHistorians,0
"Can you show any studies that confirms that ""the opposite is true""?",AskHistorians,0
[removed],AskHistorians,0
"Personalities.

How comfortable are historians at assigning personalities to historical figures prior to all the first-hand documentations of the 20th century?

Is there a way to tell what descriptions of personality is real and what is propaganda from chroniclers a long time ago? Could some actions be thought of as irrationally aggressive from someone easy to anger, while inactions be though of by weak and indecisive people? Or should historians just focus on recorded and confirmed events and actions and forget personality?

Related, should actions by historical characters always be thought of as rational or at least justified from a certain of view, or should we consider decisions being made a certain day just because the person was having a good/bad day due to the weather.",AskHistorians,0
[removed],AskHistorians,0
"Thank you, much appreciated.",AskHistorians,0
"It actually played a major role, if not the defining factor, in Hitler's life. It was after all in Vienna that he first encountered Jews in a proper sense (I say this because I can't recall if he ever saw them in Linz), and noted in *Mein Kampf* this: the chance meeting where he met a Jewish man and his first thought was: ""Is this a Jew?"" which morphed into the idea of ""Is this a German?""

Stalin was only in Vienna a short while, and had grown up in multi-ethnic Tbilisi, which while in Georgia was governed by Russians and dominated by Armenian business. He had also spent more time in the oil-boom cities of Baku and Batumi, which were melting pots of foreign labourers (a lot of Persians in the former, Turks in the latter, as well as various Europeans and peoples from across the Russian Empire and Middle East). The effect this had on him is not something I believe has ever really been studied, though Stalin's worldliness gave him a certain credibility amongst the Bolsheviks as an ""expert"" on nationality, so much that Lenin asked him to write the 1913 essay ""Marxism and the Nationality Question,"" which came to dominate Bolshevik nationality policy for decades (Lenin by contrast, despite his years in exile, was never that in touch with national minorities, despite writing about them on occasion).",AskHistorians,0
"Cliometrics for the win!

Your analysis is very illuminating.

The difference between 35 men per 1000 koku and 60 men per 1000 koku is pretty substantial.  Any idea what the shape of the distribution was?

On the 30 Years War, most combatants army sizes varied greatly over the course of the conflict.  Wallenstien famously was able to ""field"" an army of nearly 230,000 men in 1631, but a in reality he was never able to bring more than about 100,00 effectives into combat at any one time.  The technology and social organization of the era meant that logistical requirements tended to increase logarithmically above a certain size.  An army of 50,000 could forage and be resupplied by a relatively manageable supply train, while an army of 100,000 men needed a logistical train nearly as large again as itself just to keep the people at the front fed and the horses supplied with fodder.

",AskHistorians,0
[removed],AskHistorians,0
"Thank you, word scrambles were never my strong suit",AskHistorians,0
[removed],AskHistorians,0
/r/AskSocialScience is a good place to start looking for the answer to this question. :),AskHistorians,0
[removed],AskHistorians,0
[removed],AskHistorians,0
[removed],AskHistorians,0
"Right. But you also have to remember, we're talking about a world where most people don't live in cities, where automobiles and aircraft don't exist, where telephones don't exist, etc. A lot of the people you interact with are going to be people you already know and people who live nearby. People aren't going to get coffee because that's just not a thing that is possible, instead people are going to come visit and share a meal, for example. Now, this gets more complicated when you get into the modern age where people still might have some aspects of polychronic time due to their culture but live in industrialized settings. In Hawaii, for example, people go out of their way to indicate what variety of appointment they're making with people, whether it's a monochronic time appointment (so-called ""haole time"") or a polychronic time appointment (""hawaiian time""). In a lot of the developing world most of the locals still adhere to a polychronic notion of time (for cultural reasons) which can often make them seem intensely flaky when monochronic folks interact with them (and, indeed, this can have some severe consequences if you call to schedule a cab to pick you up for a drive to the airport and they show up extremely late).",AskHistorians,0
[removed],AskHistorians,0
"Cool, I will do this with my questions!

While my questions have gotten some answers, most of them aren't really detailed nor do they cover my whole question!",AskHistorians,0
"Thanks.  From what I got from the book, the personal situation between the two high commands was poor.  The Germans of course looked down on the performance of the Austrians, and the Austrians were resentful that the Germans looked at them that way.  

It seems the Germans were reluctant at times to commit manpower to bailing out the Austrians unless they had to (which of course they did sometimes).",AskHistorians,0
[removed],AskHistorians,0
"whilst I don't know of any sources regarding if Da Vinci personally knew of Caesar. I do know that Caecar appeared in Dante Alighieri's 'Inferno' in Limbo. So it can be assumed that people in the renaissance did have knowledge of Caecar and admired him enough to  place him Limbo rather than a worst circle of hell. 

I'll answer your last question with a yes, we certainly have the most knowledge of Human history. ",AskHistorians,0
[deleted],AskHistorians,0
[removed],AskHistorians,0
"Wicker shields, covered or bound in hide are much sturdier than commonly credited.  In fact it would be hard to explain the ubiquitous guilloche pattern on bronze aspis rims if the ancestor of the aspis was not at least in part made of wicker.  The Persian shields at Plataia were set up as a literal barricade, so once the Greeks pushed past these, the front line troops were shieldless.",AskHistorians,0
