body,subreddit,moderated
"While I can't tell you what happened after the collapse of the Western Roman Empire I can give You a little more insight into how the Bourbons came to power. The house of Bourbon was really just a cadet branch of the Capetian dynasty, which itself was related to the Robertians which were related to the Carolingian Dynasty, to which Charlemagne belonged.

The Carolingian Dynasty had no direct connection to the preceeding dynasty, The Mirovingians, but took power though a gradual power struggle and appointment by the pope. So the Bourbons can follow the history of their rule back to Pepin the Short in 751 AD (Though not always through the most tightly related connections)",AskHistorians,1
"I, too, would be at a loss there. I don't imagine that Nero's mania would be evident in a bust. And saying he's the one with the Roman nose wouldn't help either, probably.",AskHistorians,1
"Where do you live, FFS?",AskHistorians,1
It was important in keeping athletics the purview of the rich elite with lots of free time.  It is why Jim Thorpe was assailed by Avery Brundige for the effrontery to be a WOG.  ,AskHistorians,1
"I'm just here to remind people that watermelons in previous centuries did not all look spirally as in one particular painting.  That is just dehydration and if you don't water them properly today, the same thing can occur.  ",AskHistorians,1
Would they wear their armor at all times regardless of type? ,AskHistorians,1
"According to the OED, a horde is:

>  A tribe or troop of Tartar or kindred Asiatic nomads, dwelling in tents or wagons, and migrating from place to place for pasturage, or for war or plunder.

or

> A large gathering of people, esp. of wild or fierce people; a gang, troop, crew.

So there is a large civilian component. It's more like a tribal migration than a military campaign.  It's also a Turkic word with the implication of being a group of Turkic-related people.",AskHistorians,1
"Instead of an Empire, the Holy Roman Empire was really more of a Confederation.  Member territories were independent principalities that weren't tied to other peerages.  The best example of this confusion came from the Hapsburgs that controlled territory in the HRE, Austria, and Spain.

The Emperor was effectively an elected 'president' of the territories, and the territories had the practical ability to choose their allegiance.  Most banded together in the HRE for the mutual protection it gave each principality to invasion from surrounding countries, the support of similar-minded princes/local lords, or the central governmental structure provided by the Emperor's administration (such that it was).

This complication and uncertainty was exactly what led to the 30 years war: the Emperor thought he could dictate his desires to the member territories, and a large number of territories disagreed with him.",AskHistorians,1
I think people killed themselves...,AskHistorians,1
The uniforms aren't frightening at all. It might be an association to fear you have with the uniform. Is a gun intrinsically scary? No. But many people are afraid of them for what they do.,AskHistorians,1
"Because US.

In Canada, Juno Beach is the best known, because it's ""our"" beach. Plus the Canadians made it furthest inland on D-Day (or so I'm led to believe; I'm unable to research that easily since I'm on my phone, but feel free to correct me).",AskHistorians,1
"I think Singapore might be a slightly different case, as the population there is primarily ethnically Chinese (aka [Peranakan Chinese](https://en.wikipedia.org/wiki/Peranakan)) who settled there primarily after its establishment as a British colony. In that sense, one could argue it was also ""settled"", though not by the British themselves. Obviously this isn't this isn't the same as Canada/Australia/New Zealand, but it does make it a bit different than Malaysia or other relatively wealthy non-settler British colonies like Oman and the Trucial States (modern-day United Arab Emirates).",AskHistorians,1
"Famous quote from General Patton of the US army after the surrender of all German forces ""We defeated the wrong enemy"".

Also, google Operation Unthinkable. A plan seriously debated in British parliament and i believe supported by Churchill. It would continue the allied war effort into Eastern Europe.

German soldiers **did** fight alongside the allies in the battle of Castle Itter. Whermacht, Austrian resitance, 12th US armored division, 142nd US infantry regiment and former French POW's fought alongside against the 17th Waffen-SS Panzer Grenadier Division there.

So yes, Allied/German troops working together was speculated and even a reality for a short time.",AskHistorians,1
Waffen SS were involved trying to take Moscow instead. The most elite of the  SS typically were in SS panzer divisions rather than purely infantry. Part of the SS mystique was due to having some of the best equipped units and being fanatical rather than better trained. ,AskHistorians,1
"
NPR has a brief summary based on data from Pew: http://www.npr.org/2016/04/30/475794063/why-are-highly-educated-americans-getting-more-liberal",AskHistorians,1
"Random fact - the guy in charge of implementing the 1696 currency was Newton. Yeah, the laws of motion guy from high school.",AskHistorians,1
"Has there been a subscriber spike recently? Maybe it's just me, but it seems that the last few weeks have seen a lot more of these threads, where responders appear to have no concept of how the subreddit operates.",AskHistorians,1
">  It has also been used in a wide variety of naval configurations,

My old man was on the USS Harry S. Truman for a while (not in the Navy, civilian contractor). 

He said they had .50 Cal's on the boat, they would set them up when anchored at various points around the flight deck, with orders to fire a warning shot to any vessel that came within 1,000 yards of The Truman, and to ""fire for effect"" anything that came within 750 yards. They used to do target practice on buoys that The Truman would float out when docked, and apparently the ""Ma Deuce"" can turn fairly hard objects into Swiss cheese at pretty long ranges. It really is an incredibly versatile and reliable weapon.",AskHistorians,1
"How would you categorize these folks?

https://en.wikipedia.org/wiki/Ficquelmont_family

The family line is completely documented after 1277 and well-attested to as far back as 1030.  Less certain are their links further back, but legend holds that they came to prominence under the Merovingians, which means there's SOME possibility that they do reach back into the days of the Roman Empire. 

Although they would have been Franks, not Romans.",AskHistorians,1
I feel like there's a good movie in there somewhere. Could be quite entertaining!,AskHistorians,1
"As far as I've ever read, most of the rest of the ""theories"" fall under what I call ""revisionist"". Simply put, some will take specific facts that support their view and ignore the rest. A better place to ask this question might be r/CIVILWAR ",AskHistorians,1
"As a linguist you might find this funny: 

I have a very Celtic name. Living in Texas I interact with a lot of native Spanish speakers. Well one day a new coworker who wanted to know my name was having trouble pronouncing it. So she says to me in Spanish, ""It sounds like a dog."" Then every day she would bark at me as a greeting. It was all fun and games. 

But the history nerd in me thought back to the Roman Legions marching into Gaul and Germania and listening to the natives speak. That must be what they thought as well and where the stereotype might have first started. ",AskHistorians,1
"I'm going to use as a source The Institute of weight and measurements of Sao Paulo ([IPEM-SP](https://ipemsp.wordpress.com/2010/08/26/por-que-os-sumerios-contavam-com-base-no-doze/)) 

Probably, it started with the sumerians. They had this particular way of counting by using their thumb to navigate through the other 4 fingers' phalanges. 

Each one of the has 3 phalanges which means we have 12. 

They would use the right hand to do this and their left to count how many ""hands"" they had counted. 

5 fingers on their left hand would count as 60  (like we still use to count time and angles).

I hope I didn't break any rule here, I'm sorry if I did. 

But since I've used an official source to answer it, I believe that's the answer. ",AskHistorians,1
for the romans i would say the etruscans and for the greeks there was this island where it all started but i forgot the name.,AskHistorians,1
There are two threads with this exact title that you could look at.,AskHistorians,1
"They weren't trying to colonise South Africa. They already existed in South Africa. They were simply fighting hostile intruders on their land. 

",AskHistorians,1
"First off, baby poo, was probably not considered as disgusting as it is nowadays, second there were much lowered standards of absorption considering natural materials, and third, hypothermia was a much greater risk for them than it would be for you. So fuck you, you'll never know what it was like to be a Native American, sorry not sorry. ",AskHistorians,1
Dude is that some kind of subreddit only switcheroo? ,AskHistorians,1
"My wife!  She is of Clan Wallace and she can buy something from a Dutchman, sell it to a Jew and turn a profit !",AskHistorians,1
"I believe the first suicide of a specific person that we can be relatively confident was not mythologized would be that of Socrates. While he was sentenced to death by the authorities, and so did not end his own life entirely of his own will, Xenophon and Plato agree (notably in Plato's *Crito*) that he could have arranged to escape from captivity prior to being forced to drink poison had he wished to.",AskHistorians,1
"It depends on the master, but a common Roman slave-owner mindset was to be nice to the slaves to they don't band together and revolt. ",AskHistorians,1
"TIL: not everyone calls rocket ""rocket"". came for the historical knowledge, stayed for the regional weirdness",AskHistorians,1
"I believe that the natives of the North-West (British Columbia) had slaves. There were also different levels of society, lowrer and upper classes. Also check out the Aztecs and the Incas. ",AskHistorians,1
"..and she was right.
That airplane crash was as shady as it gets.",AskHistorians,1
But they'd need to make a post asking when the moon landings were first.,AskHistorians,1
"I know that spinning and weaving was considered specifically a female thing in a lot of European cultures, and that was true at least up until the industrial revolution.",AskHistorians,1
"Likely mechanical issues. I don't have scources, but any minor issues in the workings could easily cause it to work improperly. It could also be that the monks wanted to ensure proper dicipline, and did not want anyone to become complacent by relying on the water clock to perform their job, or to prevent any mistakes from happening due to lack of attentiveness. The most accurate of clocks wouldn't help if the monks got lazy and didn't pay attention to it.

This was speculation, so if anyone has scources on what the reason truly was it would be appreciated.",AskHistorians,1
"I guess his friend believes that among men more straight casualtues during the war, so the gays became a bigger demographic. Which still makes little sense, there is no evidence that being gay is an inherited trait. Also the fact that there is a term like baby boomer, means that people were as straight as you might expect.",AskHistorians,0
[removed],AskHistorians,0
[deleted],AskHistorians,0
[removed],AskHistorians,0
[deleted],AskHistorians,0
"The Romans were afraid of Gallic invasions for pretty much the entire duration of the Republic. This appears to have been mostly the result of a collective trauma from the sacking of the city in 390 BC. By the second half of the third century, the Gauls weren't much of an actual threat. Many of the wars with the Gauls from that point on were actually initiated or provoked by Rome: Roman colonies and allies crept up on Gallic lands for the entire period.

As for the Greeks, Rome pretended that their involvement in Greece was to protect the Greeks from first Macedon and later the Seleucid Empire.",AskHistorians,0
[removed],AskHistorians,0
"What about:
""What has prevented a sustainable peace treaty between Pakistan an India""?

I am a Pakistani. However, in recent years, there is an increasing amount of propaganda that my country is somehow evil. I don't believe this is true because of my personal experience. However, I would like to know the academic perspective with regards to conflict between Pakistan and India. ",AskHistorians,0
[removed],AskHistorians,0
[removed],AskHistorians,0
"Interestingly this definition implies that as services become a larger and larger share of modern economies then modern economies become less and less capitalist. After all, services are by their nature consumed (or start to be consumed) immediately on production. If you think you might need a heart bypass in 20 years you can't schedule one now when you're in good health and have some free time in your calendar. And, having had your heart bypass, you can't trade it for a week's groceries. Ditto for cleaning your house, or taking a week's holiday by the beach. 

(On the other side, this definition implies virtually all cities are capitalist, because people trade to get food rather than going out into the fields.)",AskHistorians,0
[removed],AskHistorians,0
"Follow up question: Aside from who was doing the courting, is there any major difference to how a Prince would be spending his time?",AskHistorians,0
[removed],AskHistorians,0
[removed],AskHistorians,0
"The problem here is that the Crimean goths are mentioned over 200 years ago, and nobody has ever found any of them left. This is common with the disappearance of an ethnic group and doesn't imply that any ""event"" caused their disappearance. Instead, the Crimean goths, like the many other groups of goths, assimilated with local populations.",AskHistorians,0
[removed],AskHistorians,0
[removed],AskHistorians,0
[removed],AskHistorians,0
[removed],AskHistorians,0
Thanks for the reply!,AskHistorians,0
"The question has already been answered several times. In short, Bosnia and Albania aren't special, population of Serbia, Bulgaria and other Balkan states also converted to Islam. During the 19th century liberation movements most muslims in those states were killed, forced to convert or forced to leave. Belgrade up until Serbia's independence was a majority muslim city, with almost 300 mosques. Now there is one. Montnegro used to be majority muslim up until late 1600's when ""Investigation of Turklings"" was commited by Montenegrin tribal leaders who exterminated or converted trough force most of Montenegro's muslims. 

As such, Bosnia and Albania are not exceptions due to conversions, but due to that population surviving. Albanians managed to create a state for themselves, while Bosniaks benefited from major Serb losses in WW1, which forced Serbs to try to assimilate rather than exterminate local muslims in order to replenish their own numbers (Serbia lost half its male population in the war)",AskHistorians,0
"Thank you, I'll look into it.",AskHistorians,0
[removed],AskHistorians,0
[removed],AskHistorians,0
"Good point about ""vulnerable"" economies. I'm sure that when trade systems of one empire became severely disrupted, it affected the whole trade system of the Eurasian world to a degree. This was certainly the case for the internal economy of the Roman Empire, with its contiguous parts that relied and were dependent on each other for far-flung trade, so that areas like Britannica were relying on goods coming from as far away as Roman Syria. With the collapse of the Western Roman Empire and state authorities to ensure security and free movement of goods and people, this trade system naturally went down the drain. Compare it to the state of things in the Early Middle Ages, when the kings of France were fearful of straying too far from Paris in the threat of being literally kidnapped by rival nobles for a ransom. This changed dramatically with the enhancement of the central power of monarchies across Europe during the High Middle Ages. Even ""balkanized"" areas like northern Italy saw a flourishing of trade between city-states and republics thanks to the maritime routes around the Adriatic, Ligurian, and Tyrrhenian seas within the Mediterranean, once the persistent threat of Arab and Berber raids were finally squashed by the Normans. Around that same time (11th century) the Eastern Romans also had a resurgence in wealth and territorial gains.",AskHistorians,0
"Sorry, but your submission has been removed because we [don't allow hypothetical questions](http://www.reddit.com/r/AskHistorians/wiki/rules#wiki_is_this_the_right_place_for_your_question.3F). If possible, please feel free to rephrase the question so that it does not call for such speculation, and resubmit. Otherwise, this sort of thing is better suited for /r/HistoryWhatIf. You can find a more in-depth discussion of this rule [here](https://www.reddit.com/r/AskHistorians/comments/4mtauf/rules_roundtable_no_12_dont_play_the_whatif_game/).",AskHistorians,0
"/u/Okieconservative

Check out [one of the many previous times this was asked here](https://www.reddit.com/r/AskHistorians/comments/4ahsg6/chinese_communist_revolution_why_did_the/)",AskHistorians,0
[removed],AskHistorians,0
" I had a long answer typed up but the app crashed. I'll simplify for you.

Late 500s, Gregory de Tours did lots of empirical observation and wrote ""The Course of the Stars"", which accurately contains records of eclipses and Comets.

However,

The key source for this period is the Anglo Saxon Chronicle. It's a gold mine record for astronomy in the time period. Here's a source that will answer all questions you have:

http://adsabs.harvard.edu/full/1984JRASC..78L..56B

As an added bonus, Haley's comet showed up in 1066 and people at Hastings could allegedly see it. ",AskHistorians,0
[removed],AskHistorians,0
[removed],AskHistorians,0
"Have you read *The Comanche Empire* by Pekka Hämäläinen? I've been meaning to read it, it seems quite interesting. ",AskHistorians,0
"To my knowledge, the longest pikes ever used in war are the Late Hellenistic phalangites' *sarissa* pikes, which could be over 20 feet in length. However, these were still meant to be wielded by one person. When pikemen made a comeback in the 15th century AD, the pikes they used were significantly shorter.

The problem with a 2-man pike would be that it severely reduces the mobility and flexibility of the men carrying it. This is already a problem with the *sarissa*; anyone who could get beyond the pike's point could no longer be harmed by the pikeman, and anyone who could get at a block of pikemen from the side or rear would render the pikemen completely helpless. For protection, men wielding long pikes must rely on wide, dense formations, which in turn are vulnerable to disruption when moving across a battlefield. A field wall, a ditch, a slope, even a single tree can cause major disruption in a pike formation. Unless the battlefield was prepared in advance, pikemen could be easily thrown into chaos. All of these problems would be massively worsened by the use of pikes that need 2 men to wield them.

Meanwhile it's hard to see what advantage could be gained from yoking 2 men to a single pike. They wouldn't be able to do anything more than a single man could do, and if each man has one pike, those 2 men also have two deadly weapons aimed at the enemy instead of one.",AskHistorians,0
[removed],AskHistorians,0
"Doesn't the Catholic Church require grape wine only to be used in the Eucharist, or is there allowance for substitutes if grape wine is not available? What does the Canon Law say on these? ",AskHistorians,0
"As sunagainstgold says, the Gawain poet used a version of the West Midlands dialect. This would have been (relatively) far removed from the influence of the main nobility and aristocracy based in London. Chaucer, being based in London and part of the ""clerical bureaucracy,"" would have been writing in the courtly dialect. 

Now keep in mind I'm not a linguist but rather just a literary scholar of the period but the context you likely lacked in determining the genesis of the dialects of the Gawain poem vs Chaucer is that after the Normans invaded in 1066 the language of the nobility became heavily influenced by the French language. This is what eventually gave rise to Middle English. First the nobility and then the common folk assimilated bits of French grammar, syntax, pronunciation, etc. The further removed from the political centers, the slower the dialect in that area morphed.

To really drive the point home here is a short passage from the Anglo-Saxon (the language spoken in England before the Normans invaded) poem ""Exodus"":

*Folc wæs afæred; flodegsa becwom*

*gastas geomre, geofon deadðe hweop.*

*Wæron beorhhliðu blode bestemed,*

*holm heolfre spaw, hream wæs on yðum,*

*wæter wæpna ful, wælmist astah.*

As you can see, SGGK is more similar to this earlier language of England than Chaucer is. Now I will caveat all of that by saying that it is not uncommon for modern editions to modernize the language and spelling. So the passage from Chaucer may have looked a bit more similar to SGGK in its original manuscripts (can't say for sure. Chaucer was a bit late for my focus) but even then, just based on what words are used in the two poems it becomes obvious that SGGK was written in a dialect that retained more of the older vernacular than the dialect of Chaucer.

(The passage taken from Exodus starts at Line 447. I used the Exeter Press Edition, Edited by Peter J. Lucas. It is a scholarly edition meant for mid-level Anglo-Saxon students and so much of the spelling and punctuation has been standardized to make it easier on modern readers. Also, I just picked a passage basically at random. If you want a translation just ask but it has no relevance to the current discussion outside being an example of Anglo-Saxon.)",AskHistorians,0
"Our rules for [questions](https://www.reddit.com/r/AskHistorians/wiki/rules#wiki_questions) do not require a question to be ""correct"". Part of the purpose of a good answer is to correct misconceptions, debunk myths, and supply facts to replace hunches and impressions. This involves much more than simply replying to a generalising statement with a contrary anecdote.",AskHistorians,0
[removed],AskHistorians,0
Thanks for the clarification. I got that date from the map linked elsewhere in this thread.,AskHistorians,0
[removed],AskHistorians,0
[removed],AskHistorians,0
[removed],AskHistorians,0
[removed],AskHistorians,0
"Do they even try to explain away the mass of evidence showing that Hitler was chomping at the bit for a war of conquest, or are they simply relying on their target audience not knowing that?",AskHistorians,0
"I'm always taken aback by how many people, even scholars, seem convinced of The Great Streetcar Conspiracy.  They often don't even get the players right (citing the wrong auto or oil company as conspirators), or they're talking about a city where the conspirators never played any role whatsoever—but their faith in the conspiracy can't be shaken.  I'm not sure why it resonates so deeply.

In past posts, [I've tried to lay to rest the conspiracy theory](https://www.reddit.com/r/AskHistorians/comments/tq9fa/whats_the_truth_about_the_great_american/) and to explain [what really happened to streetcars.](https://www.reddit.com/r/AskHistorians/comments/4v6vxv/why_did_virtually_every_us_city_give_up_on_using/d5x8eyg)",AskHistorians,0
"Please understand that people come here because they want an informed response from someone capable of engaging with the sources, and providing follow up information. Wikipedia is a great tool, but merely repeating information found there doesn't provide the type of answers we seek to encourage here. As such, we don't allow a link or quote to make up the entirety or majority of a response. If someone wishes to simply get the Wikipedia answer, they are welcome to look into it for themselves, but posting here is a presumption that they either don't want to get the answer that way, or have already done so and found it lacking. You can find further discussion of this policy [here](https://www.reddit.com/r/AskHistorians/comments/3yjz53/rules_roundtable_2_explaining_the_rules_regarding/).

In the future, please take the time to better familiarize yourself with [the rules](http://www.reddit.com/r/AskHistorians/wiki/rules#wiki_write_an_in-depth_answer), and take these key points into account before crafting an answer:

* Do I have the expertise needed to answer this question?
* Have I done research on this question?
* Can I cite my sources?
* Can I answer follow-up questions?

Thank you!",AskHistorians,0
"The uniform is actually essentially unchanged since WW2, with antecedents dating all the way back to WW1. So yes while it is still worn by the Corps today, it is contemporary with WW2. ",AskHistorians,0
"Hopefully someone else can pop in to go more in depth, but /u/Illegal1234x gave a good write up on the importance of Gettysburg [here](https://www.reddit.com/r/AskHistorians/comments/1hfbrl/how_did_gettysburg_come_to_so_greatly_overshadow/catsa5m). This comment is more related to why it overshadowed Vicksburg, but until someone pops into the comments here, it's a good start.",AskHistorians,0
