body,subreddit,moderated
"It should also be noted that the Hudson Bay Company remains a prominent icon of Canadian commerce to this day-- it is a significant department store chain that can be found in all major Canadian cities and many small towns. It is a [publicly traded enterprise] (http://web.tmxmoney.com/quote.php?qm_symbol=HBC) valued at nearly $8bn Canadian. I am not exaggerating when I say that in my Canadian house, sitting on my HBC bedspread *as we speak.*

A little more on HBC's role in Canada. One of the most significant products produced by HBC is the iconic [point blanket] (http://www.hbcheritage.ca/hbcheritage/faq/pointblanketfaq/default#1), first made and sold in 1780. The blankets are made of a rich, thick wool, which made them incredibly valuable in the harsh Canadian winters. 

While the blankets are still fairly ubiquitous as a symbol of Canada, they have taken on a particular value in the culture of the Indigenous peoples of the prairies (Cree, Saulteaux, Metis in particular.) In modern Canada, great pains are taken to involve Indigenous peoples in decision making, ceremonies, research, and so on. Most institutional decision making involves consulting with Elders-- respected older people within their communities. To appropriately address an Elder when asking advice, the standard protocol is to offer [tobacco or cloth] (https://carleton.ca/aboriginal/resources/guidelines-for-working-with-elders/)-- ideally thick cloth, like [blankets.] (http://www.provost.ualberta.ca/en/~/media/provost/Documents/CAI/Elders.pdf)

HBC blankets are widely considered the starting point of this ceremonial tradition; Indigenous people traded beaver furs caught with their superior hunting methods for, among other things, blankets. However, the history of the HBC blanket is a double-edged colonial metaphor. There is a widespread hoax that in the 18th century, HBC blankets were deliberately infected with smallpox by British General [James Amherst] (http://www.biographi.ca/en/bio/amherst_jeffery_4E.html) and distributed to Six Nation people in what is now Ontario and Quebec to sicken and kill them. This story has been dismissed as apocryphal, but given the tenuous and often fraught relationship between Indigenous people and colonial Canadians it has sustained itself as a story.

As a minor anecdote-- during a meeting between the Saskatoon Tribal Council and myself, in Saskatchewan, Canada, one of the Elders got a glimpse of my HBC [phone case] (https://s-media-cache-ak0.pinimg.com/736x/2d/5a/c3/2d5ac389f1ebcd1ce4e668f8ced0882d.jpg) which looks like the blankets and I *did not hear the end of it.* Whenever we met on policy issues, they called me Miss Hudson Bay and joked about when the smallpox would be arriving.",AskHistorians,1
"Beirut is now known as the ""Las Vegas"" of the Middle East, so it still has a reputation.",AskHistorians,1
"While we await new insights, here's [a previous AskHistorians thread on this question](https://www.reddit.com/r/AskHistorians/comments/10argk/may_he_luckier_than_augustus_and_better_than/).",AskHistorians,1
"The last time there was a famine in Iran was WWI, when the Allies invaded the country and diverted resources. ",AskHistorians,1
"For 3, ""boy"" is a slur in this context. I don't hear it often today (doesn't mean it isn't used), but it was common at one point.",AskHistorians,1
"Not attempting to answer the question here, but I'm sure that some Christians, particularly South American Roman Catholics are named after Jesus.",AskHistorians,1
"/u/ConfusedHistorian36 ,

>academic historian

I am going to assume that you are a student, and that you have decent access to academic resources. 

I will start with a strong advice: most ""experts"" here are not academic historians. They may be trained in history, but very few are working as an academic historian. So I strongly suggest that you take all advice here with lots of salt, mine included. Have you asked your academic advisors for advice tailored to somebody aspiring to be an academic historian? At what stage are you at this point? 

Have you read the [Monday Methods series on grad school](https://www.reddit.com/r/AskHistorians/comments/4z0poh/monday_methods_so_i_heard_youd_like_to_go_to_grad/)? /u/commiespaceinvader has posted a series of threads. 

>Is it possible (and, if so, common) to have two separate focus areas? 

Never say never, but at the same time what is possible is not always what is wise. Name some of your favorite academic historians and tell me which ones have two focus areas. How far apart are they? 

>How long of a time period do historians usually focus on?

For what area of history? It depends on the depth of the focus, geographic span, availability of research material. Tell me some of your favorite PhD theses and tell me the span of their time periods, geographic span, subject focus. 

If somebody purports to write a PhD thesis on ""History of the East Indies, 1500-1850"", I expect that thesis to be at least 800 pages long. Somebody who writes a PhD thesis on ""The evolution of the Chinese tributary trade in Manila, 1500-1850"" can probably get away with a more reasonable 300 pages. 

In closing, I respect your enthusiasm but please ask your academic advisors for proper advice. ",AskHistorians,1
I'm sure a Nuremberg type trial would have happened if he were somehow captured.But Hitlers Gotterdamerung sense of destiny would have never let that happen.He wanted to go out like some Wagnerian opera hero with Berlin burning to ashes around in his final act.He was quailed as saying the best Germans had died in the war and only the weak were left.He ordered destruction of vital German industries needed for after the war to Albert Speer He refused multiple times to be evacuated out of Berlin w Hanna Reitisch Condor flight being the last known German plane to leave Berln.Many bunker witnesses like Traudle Younge (Hitlers secretary) Rochus Milch (Hitlers valet) say he was determined to end it in Berlin with Eva.,AskHistorians,1
"I think its worth noting that much of Greek mythology, including the Promethius, story may have been influenced from older traditions such as Egyptian mythology, and Egyptian mythology may have been itself inherited from even older traditions.  The liver is fairly common in ancient religion and folklore as having restorative power.  For instance, in ancient eastern folklore, the fox with 9 tails needs to consume human livers in order to maintain its immortal state/grow more powerful.  Also, the story of Spear Finger comes to mind from Native American folklore.  ",AskHistorians,1
In italian the c sounds like tch in dutch.,AskHistorians,1
Perhaps Wu Zetian?,AskHistorians,1
"There was another German joke where they parodied der Deutsche Gruß (the German salute) with der Deutsche blink  (the German blink) by looking over there shoulder for enemy aircraft. 

Another one I like goes something like:

If you see a group of troops and don't know who they are fire one shot over their head. If you're met by a storm of machine gun fire they're German. If you're met with a fusillade of well aimed rifle fire they're British. If they throw down they're guns and surrender they're Italian. If nothing happens for five minutes and then you're position is obliterated by all the artillery and air power in the world they're American. ",AskHistorians,1
"Well, considering they were attacked and gathered by other Africans and loaded onto ""the white mans boats"", how could they?",AskHistorians,1
"In the Bible, ""idolatry"" is synonymous with ""worshiping other gods."" So, idol worship really encompassed all other religious practice.

If you're part of a monotheistic religion, there can be no other gods.",AskHistorians,1
Records say that about 1 in 10 people in Rome in the 1st century were Jewish ,AskHistorians,1
"The Peoples Action Party of Singapore in the early 1960s campaigned to merge with the Federation of Malaya and in 1963 along with North Borneo and Sarawak signed the Malaysia Agreement and together formed Malaysia. 

However during the following years increasing racial tensions and fears of Singapore's increasing economic dominance led Kuala Lumpur to expel Singapore from the union in 1965.  ",AskHistorians,1
If Israel is denying this won't all answers end up at least some what speculative? ,AskHistorians,1
"A Taste of Ancient Rome by Ilaria Gozzini Giacosa is an excellent work that has around 200 recipes, rustic and regal that have been redone from information found in classical sources. This book is amazing and answers all your questions and more. It even includes the original recipe in latin, a translation, and a way to make it using modern kitchens. ",AskHistorians,1
"> What a very British view of WW2.

I'm not even English. This is historical canon. What it does ignore, however, are battlefield details as you mentioned given that I was attempting to answer the rather distasteful question of ""Why do we think of the French as 'cheese eating surrender monkeys' as per the Simpsons trope?"" One could write an entire book on this topic, easily disproving the notion that France has anything but a glorious military past. It's just that France's losses in the 19th and 20th centuries were far more globally significant than its victories in the 17th and 18th. Obviously, one can look at France's history of successful interventions over the past 20 years to understand what a crack force the French Army continues to be in the modern world.

>No word on Dunkirk?

Dunkirk was largely the fault of the French.

>""Copenhagen the French Fleet at Mers-el-Kébir"" is a very disingenuous way of putting things...

It's not at all. The fact of the matter is that the French Navy was in the hands of collaborators and these collaborators would have turned over the Mediterranean Squadron over to the Germans -- they already had orders to do so from François Darlan despite Darlan's existing promises to Churchill. His successor, Jean de Laborde, literally had to be removed from command after he attempted to hand over the remains of the French Navy at Toulon to the Germans in 1942.

>No word on how it was the Russians who really defeated Germany?

That's irrelevant to the conversation at hand.

>As for the French resistance Eisenhower said himself

As for the French Resistance, Speer said himself:

""What French Resistance?""

The impact of the Resistance was dramatically overinflated by Allied propaganda in order to keep up morale of the troops doing the actual fighting. The domestic resistance in countries such as Greece and Yugoslavia was considerably more effective and pronounced than that of France.",AskHistorians,1
While you could mount a metal head on a stick like that the rock version has the virtue of being far less expensive (for the time) without sacrificing much efficiency in the process.,AskHistorians,1
"This is exactly why the electoral college was created. The people who chose the president would be literate well educated citizens who would have been picked long prior to the election. the popular vote would guide the college but the electorites could, and in some cases still can, vote contrary to their peers. ",AskHistorians,1
"Taney, ironically, was also the author of the Dread Scott decision, FYI.  Takes a bit away from his ethos as defender of civil liberties.",AskHistorians,1
"China was falling apart, Japan wasn't.",AskHistorians,1
"I found Howard Zinns work to be heavily biased, but thats intentional and advertised in the title. It's the Peoples History, so it's from a marxist perspective. 

I noted that certain passages, while factually accurate, omitted facts in order to create a seamless narrative. So I'd suggest looking at it as a work of counter culture or criticism rather than as a primary source.",AskHistorians,1
"The best answers on this subreddit usually have sources cited for what they are saying, so instead of citing the post, cite the sources the post uses. ",AskHistorians,1
Quite possibly for the same reason Japan limits their involvement in Chinese atrocities. No one is alive nor is it the same government and even culturally quite different yet they are to blame.,AskHistorians,1
"Is there any way to view a comment a mod as removed? I appreciate all the hard work you guys as mods do, I also think it would be an interesting take to learn from ""wrong answers"" sort of like process of elimination on multiple choice tests. ",AskHistorians,1
\>RPG games,AskHistorians,1
Can't he give himself an honorable discharge? ,AskHistorians,1
"Actually, there are temples in India that feed the deities food made from only traditional Indian ingredients. So no potatoes, tomatoes, chilies, etc...
The most famous is the Jaganatha temple in Puri. I know that's not answering you, but I hope it might steer you in the right direction.",AskHistorians,1
The old testament was written a couple thousand years before roman rule at a minimum. ,AskHistorians,1
"Note that Metropolis panned in cinema and was then re-cut to salvage what was possible and shown again with a simplified story, removing many of the metaphors and messages. The original cut was only reconstructed in 2008 after a copy from Argentinia turned up in an archive. It is likely that Goebbels referred to that butchered cut in his praise.",AskHistorians,1
"My French ex-mother-in-law was fascinated by my garbage disposal, it was hilarious, she stuffed everything she could get her hands on down it, finally killing it with peach pits. She had never seen one in her life before coming here.

The ex-wife (French) chalked it up to culture, lack of adequate plumbing in some older areas, and the fact that Europe has had strong recycling laws and programs for decades now.


",AskHistorians,1
"Are *you* joking? [Here is an essentially equivalent post](https://www.reddit.com/r/AskHistorians/comments/26cgmj/in_renaissance_italy_how_much_would_it_have_cost/) from 2014, welcomed at that time *in this sub*. Lot's of good info. Nobody laughed.",AskHistorians,1
I'll say that Dan Carlin mentions something similar to this in hardcore history. Mostly around tanks in early WW1 though.,AskHistorians,1
"There WAS a civil war in russia, the coup, and the conflict between the soviet republics of armenia and azerbaijan",AskHistorians,1
"Just like overwatch, Am I Right?",AskHistorians,1
"""Lake"", from Lake Chad in the country's southwest, whose name derives from the Kanuri tsade (""lake"").",AskHistorians,1
"You may be interested in reading about Shep Gordon. 

http://www.nytimes.com/1993/03/17/garden/the-man-who-would-turn-chefs-into-household-names.html
http://www.laweekly.com/restaurants/the-man-who-convinced-chefs-they-were-rock-stars-6972088",AskHistorians,1
"I see numbers, I automatically think math.  I confess to not thinking about which subreddit I'm in, and having to enlarge bigly to see that you were not, in fact, claiming he died at age 99^2 (99 squared).  D'oh! 

",AskHistorians,1
"When it comes to questions like these, [/u/ConanofCimmeria said it well](https://www.reddit.com/r/AskHistorians/comments/10kb4m/are_there_any_famous_fairy_talesstories_that_are/c6e75yh):

>Lots of the Bible is assumed to have some kind of historical basis, although it's hardly a good idea to approach it with the idea that it represents a work of history. As a student of folklore, though, I think that there's a far more useful way to use these stories in a historical context than simply looking for the ""truth"" behind them: they illustrate the mental world of the period in which they were written. For the longest time, there was a big push to find the ""true story"" behind the Norse sagas; archaeologists would try to find stuff that correlated with information preserved in those stories. That's a waste of time. What the Norse sagas tell us about, in a way that the archaeology simply can't, is what the Norse were thinking about: how they conceptualized things like honor and shame, family relationships, crime, even life and death. By reading these stories, we have an unparallelable window into what historical people regarded as important and meaningful in the world. I think such an approach is vastly more useful than worrying about whether X event actually happened.",AskHistorians,1
"Of course. Various slavic tribes located around the baltic would raid the coasts of scandinavia regurarly. Sorry for not providing much more info, I'm on my phone. One example i could find is a little late for ""viking"" age (1135) https://pl.m.wikipedia.org/wiki/Bitwa_o_Konungahel%C4%99 the raid on konugahel. Now in Sweden then Norway.",AskHistorians,1
"It's not a good answer at all, the guy just described a essay devoted to analysing the book, it's so long that it's practically unreadable, not at all what the question was asking, yours answers it exactly but it is not what people want to hear -even though you tried to do your own interpretations in saying it should have been less well received.",AskHistorians,1
"Seriously? You didn't even do a quick google search to see which country invented the automobile? You just ""assumed"" it was the United States? It would have taken you literally seconds man.",AskHistorians,1
"How can you know they actually committed the crimes if you bypass the investigation?

You will also find nearly all lynchings recorded involved a black owned business competing with a white business. (At least that's what was asserted in my college history class.)",AskHistorians,1
Yes,AskHistorians,1
"The medieval times last from the 5th to the 15th century. The theory of evolution wasn't published until 19th century. Based off of that and the strong push of Christianty from the crusades, I'm going to guess they did not.",AskHistorians,1
"The Republic of Texas declared independence from Mexico in 1836 and wasn't annexed by the U.S. until a decade later. If any historians would like to elaborate on this, it may meet the criteria you set out.",AskHistorians,1
"Fantastic post, cheers",AskHistorians,1
"Societies are big, hard to collapse things, and they've been known to get through disasters like this - Hungary lost a third of its population as a result of Mongol invasion circa 1250 (from 3 to 2 million in some six months), but recovered to its previous levels in 300 years (3.5 million circa 1550).

That said, you could make an argument that society did in fact collapse, changes that came as a result of Black Death (or that Mongol invasion of Hungary, for that matter) were pretty huge shifts in all areas of life. Black Death did more to bring us Renaissance than fall of Constantinople ever did.",AskHistorians,1
"A someone who was mixed would be treated as a person of color, and therefore a someone would not be able to join army.",AskHistorians,1
"Was the old testament condemned? Maybe that's a source of the confusion. It seems part of the the official religious issue with the Jewish people of the twentieth century wasn't their adherence to the old testament, but their refusal to acknowledge Jesus as Christians.",AskHistorians,1
"My parents grew tomatoes in a Summer on a balcony of our 4th floor apartment, I was like 10 at a time. Also we grew green onions and some garden starters from seeds in the winter time.

A lot of my friend's parents did the same, I saw it when was visiting them in their apartments.",AskHistorians,1
Thanks. I'll check it out. ,AskHistorians,1
It's where you were born,AskHistorians,1
"Could you define primary weapon a bit more as this reads like a trick question. Most battles pre gunpowder all the way back to the start of history had the spear, pike or other pole arm as the main weapon.

",AskHistorians,1
Hi. Being a history teacher myself. don't have any sources on hand but that topic was one of my favorites at university. it is widely believed that the clergy elite was selling the whole indulgence thing mainly to the public while they themselves knew what the money was really raised for. and there was no common sentence for everyone. that depended on the priest you were dealing with. ,AskHistorians,1
"no, in fact 3 of the 4 rashidun caliphs were not related to him",AskHistorians,1
"Olive Oatman?

https://en.m.wikipedia.org/wiki/Olive_Oatman",AskHistorians,1
"Rommel was fighting 500km away from it in Alamein as Rauff was looting.
Rauff was ""probably"" assigned to staff officer=Rommel responsible for Rauff's actions 500km from him?

These orders say there were forced labour by SS-SD. 
Again, which author or which order says that Rommel knew or was complicited?
 ",AskHistorians,1
"My father was a pilot with the US Navy's famous Seawolves squadron from 1969-70. One of the only tales he'll happily tell of his 13-month vacation South Vietnam is that instead of playing propaganda tapes over their loudspeakers when they were swooping in on an attack, they'd play classic rock, the most memorable being ""Light My Fire"" by the Doors, ""All Along the Watchtower"" by Jimi Hendrix, and ""Born to Be Wild"" by Steppenwolf. 

",AskHistorians,1
"This is going to be hard to source but:



> Would it have been possible for the Nazis to create a fully functional Ak47 pre world war 2 using the technology they had available at that time ?

Building AK47s would probably not have been a major problem for any industrial nation in the 1930's, assuming the plans somehow fell in their lap. Building them at a reasonable cost might have been a challenge.

>Also what was the earliest time an Ak47 could have been created

The first smokeless military cartridge was adopted in 1886 (8mm Lebel). With some changes in detail to accomodate differences in metalwork technology and metallurgy, I think Kalashnikovs could have been built at that time, although (probably) at a prohibitive cost.",AskHistorians,1
Did I know about this topic ? How would the size of the Korean Empire in 1897.,AskHistorians,1
"I think it would help to clear up your definition of anti-semitism.

Anti-zionism is *not* the same as ant-semitism. There are some that would argue that the Israeli state's goals are for the good of all Jews, and that the two are intertwined, but there are many Jews, even in Israel, that could be considered anti-zionist.

Anti-zionism is opposition to the foundation/actions of the Israeli state, whereas Antisemitism is opposition/prejudice/descrimination against any/all people of Jewish belief or descent.

Without trying to get too political, it's entirely possible for a left-leaning party to sympathize with the oppressed Palestinians (anti-zionist) while a right-leaning party could appeal people with antisemitic leanings in general. Taken at face value, they may seem similar, but they are ideologically much different.

",AskHistorians,1
"> and what was the doctrinal justification for their crusades/conquests at the time?

There were 4 major reasons for crusades.

1) The Pope Urban II asked for people/soldiers to do them

2) The Byzantine Empire needed help from the invasions coming from the Turks

3) It was said the Muslims had the ""Holy Land"" and Crusaders were needed to get it back

4) Crusaders were promised enternal salvation

The Crusades ended when the crusaders sacked Constantinople, instead of the enemy. This pretty much ended this ""support"" the Pope was sending. 

________________________________

In a lot of ways, the current Jihad going on is pretty much the same. The people are trying to get back ""their land"" and are promised salvation by Allah. I can't really saw how it will end though...",AskHistorians,1
