body,subreddit,moderated
">Your a idiot

Jesus...",creepyPMs,1
"used to work for a bank. just got released from jail for ""embezzling"" or something. i call it ""making my own paycheck"". why does the world punish you for being an independent entrepenour ",creepyPMs,1
Point is the real freely pm here is from op . And know it ,creepyPMs,1
user name checks out,creepyPMs,1
"You seem entitled and he seems like he has some insecurities. Having insecurities is IMO not bad. Especially if someone on a site like that is as unfriendly as you. Maybe he had to built up a lot of self esteem to message you and you crushed it. Some posts on here are genuinely creepy, but yours is just...dumb.",creepyPMs,1
Do NOT disgrace the wonderful experience that is drugs (used in moderation of course) by comparing it to this lunatic.,creepyPMs,1
Play along gain his trust then post his dick pick and phone number,creepyPMs,1
"The guy is a creep, a jerk, and clearly desperate - it is no wonder that he doesn't have much of a sex life.  On the other hand, it also isn't sexual harassment under the law, because Sexual Harassment is something that is connected with the workplace.
",creepyPMs,1
"If it works 0.5/10 times, better to spam everyone to even the odds of getting laid!",creepyPMs,1
"/s. Holy shit and I would not do that, ever.",creepyPMs,1
"""My profile is set to friends only as well""

Why are you two geniuses *still* on a dating website then? I really don't get it.",creepyPMs,1
How was that creepy? I used the medical term.  Atleast i didn't say for science.  If anything you should find my honesty refreshing.,creepyPMs,1
"and yet she has them stored in her phone, and doesn't block them?",creepyPMs,1
"Because its not, don't ask the rest of us to tip toe around the fact that you're destroying your life by eating 5000 calories a day of fast food and candy.  If anything the honesty should be a wake up call",creepyPMs,1
"Man jeez, so many downvotes?! What in the world? No need to be negative also.",creepyPMs,1
Hey at least she knows what she wants!,creepyPMs,1
OP which post was this?,creepyPMs,1
"Poor guy, probably in a horrible state of mind.",creepyPMs,1
And THIS is negging. :p,creepyPMs,1
Probably because that's what works in some Middle Eastern places as the sole factor for adding her and the odd time Reddit.,creepyPMs,1
Ummm....am I missing something? Is there more context to this? ,creepyPMs,1
You are either insane or twelve years old or you live in Saudi Arabia.  They can give you money for pictures all day long.  Go to bed kiddo. ,creepyPMs,1
"Wait I don't see the turning it around on you. Unless I'm missing a cap. 
Also why not just block him?",creepyPMs,1
"This is more funny than creepy, LOL rat ads",creepyPMs,1
Sorry op but yourr a fucking faggot. That chick is everything i want in a girl. Girls who want sex and are fun like that are rare. Youre an idiot OP. Serious,creepyPMs,1
"My kink is to stalking women and make them fear for their lives.

You don't get genuine fear if it's consentual.

>/s because reddit users can't tell gallows humor from psychopathy because they're idiots ",creepyPMs,1
"Oh I'm sorry, I didn't know giving an honest opinion wasn't allowed.",creepyPMs,1
"I would rather be a ""helicopter parent"" than have someone like you get ahold of my son online.  You claim concern for your ""friend"" yet all of your posts are either you or someone else nude and/or performing sexual acts.

If you are someone your ""friend"" looks up to, maybe you should try and be a better role model.  I would hate to find out that your posts are getting back around to your young ""friend"" and her thinking that posts like yours are the norm. ",creepyPMs,1
"Uh oh, we've got a couple of fellas hanging around who are going to think you are 100% serous about setting people aflame. ",creepyPMs,1
This man is definitely earning his 72 virgins by *blowing up* on the internet.,creepyPMs,1
"It's my duty to inform you after finding this Reddit post at random that not all men,you shouldn't string along and REEEEEEEEEEEEEE!",creepyPMs,1
"You could have taken one extra second to add one extra line by the ""ke"" lol nonetheless, kid is a weirdo",creepyPMs,1
"Why so vague? , just be straight with him.",creepyPMs,1
"Make sure to notify me if this sub gets any useful mods, might come back at some point",creepyPMs,1
"Try zapping him with a cattle prod, maybe *he'll* become not interested.  Or dead, although that works just as well I suppose.",creepyPMs,1
"You mean someone doing something mean just to karma whore?

Plus I'm not accusing I'm saying if that is the case than its totally not cool to do.  ",creepyPMs,1
"Right, and like my first sentence states, I absolutely agree that people cross the line but for instance the first example in your post is more of what I'm talking about. ",creepyPMs,1
Why are you friends with this person in the first place?,creepyPMs,1
"Sorry, the ""who dis"" made me kind of think you're an idiot.",creepyPMs,1
Lol what a cuck,creepyPMs,1
95% of that could have been avoided if you just stopped responding when you should have.,creepyPMs,1
How in the hell is this creepy? This  looks like you showing off that you're an ass hole. ,creepyPMs,1
"* Are

Your spelling and grammar *are* atrocious.  Not ""is"".",creepyPMs,1
But this guy wasn't really creepy. Let's see some of the other creeps! ,creepyPMs,1
I take it you already know how to squirt then?  /s,creepyPMs,1
"You could argue that. Whether it'd hold weight is a different matter considering guys generally do not care about a gal's height as much as gal's care about a guy's height.

It's not 'bad' to feel confident. It is pretty deceptive in my opinion to intentionally wear something to give someone a false impression. I highly doubt he's wearing taller shoes for his confidence and more likely to appeal to gals who like height.

Personally I think it's a bit bias to claim rejecting someone based on their height makes someone not worth knowing as I highly doubt you don't have attraction preferences yourself. So to think your preferences/criteria is somehow 'better' than a person who has height in theirs is a bit skewed to me. People like what they like. To me it comes across like a guy approaching a gal based on his attraction to her yet getting pissy when he's rejected because she doesn't find him attractive.",creepyPMs,1
Yeah this was less creepy more amusing.,creepyPMs,1
"Just curious, why are you still talking to your ex? I assume that you guys ended off on food terms and stayed friends?",creepyPMs,1
Anyone else feel she was just trying to be cute and OP totally shot her down?,creepyPMs,1
I'd get just say give me a second I need to get my magnifying glass,creepyPMs,1
"""Wensday"" just shoot me now I can't go on",creepyPMs,1
Pretty dumb thing to say tbh.,creepyPMs,1
"jesus fucking christ. 

That is if christ were a little kid. sicko. ",creepyPMs,1
What does it say about me? I'm trying to become more self aware I'd like to know how people view me. Honestly,creepyPMs,1
"That's not what the person I was replying to said, but now they've deleted their comment.",creepyPMs,1
That's not right. ,creepyPMs,1
I would have been arrested for reckless driving if a girl was talking to me like that. ,creepyPMs,1
"Wow, thay guy literally has no life other than stalking people and trying to make them feel bad. He probably has a mental deficiency.",creepyPMs,1
sounds hot except for the baby part,creepyPMs,1
"Are you kidding me? Why even post this? You guys are such little bitches on this subreddit. ""Oh em gee, a stranger on the internet how awkward and creepy!!"" Tf do you expect?",creepyPMs,1
Do you really believe they wish death on a 2 year old?,creepyPMs,1
"Why did you shame a 15 year old kid who obviously doesn't know how to approach the situation and in no real shape or form is creepy or abusive? 
Not right",creepyPMs,1
Lol wtf that's not weird at all. Guys want a 3 some with 2 women because they're attracted to women lmfao. A 3 some with another guy it's like you don't want to see/hear a naked guy. I'm not homophobic at all but I would not want a 3 some with another guy. I don't think it's weird that other guys would want that but I just don't see how you can't understand how some straight men wouldn't want it ,creepyPMs,1
"What gets me is how he uses the fact that a lot of posts are by new accounts as some sort of evidence to his claim.  Does he not realize that some people create throw away accounts specifically so their post is, in no way, associated with their actual account?  
  
A great example would be the people that post to NSFW subreddits and then like to post some of the terrible messages people send them, or want to vent about the scum bags trying to blackmail them with their NSFW posts... Why on earth would you want to post their comments HERE under the same account someone is trying to blackmail and give the lurker creeps an idea to try the same by your post history?!  
  
I hope he gets stabbed for real. Like REAL real.",creepyPMs,1
*happenED,creepyPMs,1
Wow you were generous in comparing his tiny dick to a dying flower. Should've called it a nasty slimy slug that's being buried in rock salt.,creepyPMs,1
"Was just about to say this,

Send them the screenshot of the messages (Without the guys name censored) to the admins and he'll receive a ban.

Granted it won't stop him making alt accounts, all I can say is, sorry for people like this and just learn to immediately block them and not reply back to the message. Replying back to messages to people like this is like tossing oil in the fire.",creepyPMs,1
"That is unbelieavably creepy of him, glad you shut him down firmly but not rudely (family and all that). 

Must say though it kind of sucks to see a trans person use the slur ""tr****,"" especially to someone such as your cousin wgo obviously doesn't have a lot/any interaction with trans people- hearing someone else use that word in a negative way to mean ""any person who identifies as trans"" could normalize the usage for him- and he really, really shouldn't say it. ",creepyPMs,1
"If I was your boyfriend and I knew you were going out with a past FWB while prepping to MOVE IN with me, I'd dump your ass. ",creepyPMs,1
"I dunno, vore is pretty fucked up. ",creepyPMs,1
"Spoiler alert: he wasn't attractive. And he obviously can't read or write. And he called me ""older.""

It's all a bunch of ""how about, no?"" ",creepyPMs,1
What's the other sub?,creepyPMs,1
"I dare you to quit being a bitch.


I know it's not possible for you, but I thought I'd try",creepyPMs,1
It gets less cringey/weird when she starts toying around with it/taking it lightly.,creepyPMs,1
"He seems perfectly forthright in his introduction.    
He wasn't disrespectful, he just politely let you know he was looking for a hookup, wasn't trying to guilt you or anything.   
Is it because he's a man he's creepy? If a girl messages this and replaced I like boobs with I like abs she'd be independent and applauded for having a voracious sexual appetite.",creepyPMs,1
"My new favourite insult is now ""Twat-waffle""",creepyPMs,1
Swagggggg,creepyPMs,1
"Lol, Trump fraud. Settle down, shill. I'm not even an avid Trump supporter, but there's FAR more beef on Hillary for comitting fraud.",creepyPMs,1
I don't think they want them to or should. But if you're subscribed here you would see that like no one respects that. Just don't have a dating profile up if you don't wanna get creeped on. Dudes are creepy.. ,creepyPMs,1
"So I don't mean to be ""that guy,"" but these messages don't really seem any worse than any I've gotten, and I'm a man. Don't get me wrong; they're messed up and shouldn't have happened, but I don't think it was because OP is a woman...",creepyPMs,1
maybe you should reply and tell him no? wow,creepyPMs,1
More like R.I.P your 2 year old. Am I right???,creepyPMs,1
"I apologize if I ever sent you a creepy PM. I do follow your posts, because frankly you are pretty, I am not the kind of guy to harass or act like a creep. Sometimes what I think is funny or playful comes out wrong",creepyPMs,1
"As a ""proud feminist"" why do you consider categorizing a human being (in this case men )with facial hair extended to their neck as creeps ? Is it alright to call a women who has feminist views as a ""bitch""? ",creepyPMs,1
Yea idk why I'm being down voted i just would of handled the situation differently. ,creepyPMs,1
"Trump is pro-LGBT. Since he's been elected he's been open about that, but the RNC didn't really allow him to be before the election.",creepyPMs,1
"No wonder you think this is creepy, your reading comprehension was way off! He has 2000 friends, most of which are female, not 2000 female friends. ",creepyPMs,1
"?  A good looking girl is a good looking girl.

I'd go for an attractive 27 year old at 15 the same way I'd go for an attractive 37 year old now when I'm 26.",creepyPMs,1
"So because he used a bad line, you spoiled the show for him. That's fucked up.",creepyPMs,1
r/thatsmyfetish,creepyPMs,1
"dumb question, I've never heard of imgur, what is your KIK?",creepyPMs,1
"If he's your ex, why are you telling him?",creepyPMs,1
You could have just left the party? I'm sorry but they were just getting high? Do people not smoke crack or shoot up at parties you usually go to? I know when I went to parties after high school there was always a couple people smoking crack in the back or shooting dope in the bathroom and there was definitely people snorting coke and popping x pills! I just can't believe everything I'm reading... I'm really surprised that this type of thing isn't normal everywhere,creepyPMs,1
"A) It's a site wide rule that using alts to circumvent bans from subs will get you banned from reddit in general. Great to hear a mod suggesting this. But, maybe that's your goal. 

B) Does the fact that you just pointed out part of the reason this is a broken system not even give you a pause? It seems to me that this preemptive strike thing is an excuse not to actually moderate at all. ""They might be problems in the future, better take care of them now"". Which, ironically, is usually looked down by society at large. Especially in historical context. ",creepyPMs,1
"I don't even think about Asperger's that way. It's just another type of person. Many of my friends with Asperger's do things like this and don't realize it's weird until someone explains.

The creepiness is separate from any diagnosis, but the role-playing was an interesting way for him to convey how creepy he is.",creepyPMs,1
Your friend is probably a pedo btw,creepyPMs,1
"Kind of clever, actually.... Hahaha but I'm a Prince fan, so that would've won brownie points with me ",creepyPMs,1
You must do hella kegels. ,creepyPMs,1
My boyfriend thinks I have cute feet and he doesn't even have a fetish. He just thinks all of me is adorable af.,creepyPMs,1
"This made me laugh more than anything. He wasn't even being that creepy, just weird.",creepyPMs,1
Since when did 'Bombay' exist in asoiaf? You sound like a colossal retard,creepyPMs,1
This is ridiculous.,creepyPMs,1
"I think, he knows that many people see Drag Queens as fabulous Exagerated caricature of a woman ( often the main stream acceptance ). Cross dressers wear just aspects of women's clothing such as panties, transvestite try to pass as a real woman head to toes. Those who are Cross dressers and transvestites are not as accepted as Drag queens. Often , they keep their dressing as a secret life. Finally, there are sissy fetish types, who enjoy being feminized and forced to wear classic girly colours and fabrics in lingerie / clothing. To me, this guy was easing you into to being open to either him being a cross dresser, transvestite or sissy depending on your reaction to the question.",creepyPMs,1
"It seems like you think a ""sex worker"" is someone who exchanges money for sex. That is not the definition. 

For your education: https://en.wikipedia.org/wiki/Sex_worker",creepyPMs,1
Please explain how.,creepyPMs,1
If you're attractive enough. You'd be surprised. ,creepyPMs,1
well /r/pedo101 got banned about 4 hrs ago,creepyPMs,1
"Call me crazy... I believe him.


Seems like a real gent",creepyPMs,1
I love short girls personally and honestly don't know any guys that ever say a girl is too short. ,creepyPMs,1
"Why do you think it wasn't terse?  The definition of ""terse"":

terse


/tərs/


adjective

adjective: terse; comparative adjective: terser; superlative adjective: tersest




sparing in the use of words; abrupt.
""a terse statement""


synonyms: brief, short, to the point, concise, succinct, crisp, pithy, incisive, trenchant, short and sweet, laconic, elliptical;  

",creepyPMs,1
Isn't she the arsehole?,creepyPMs,1
Couldn't care less,creepyPMs,1
Nobody cares that you don't want to live in the US. Just move away. ,creepyPMs,1
Say hello to creepypms is like the lamest burn ever. ,creepyPMs,1
"Holy christ on a cracker, how is this ""normal"" to come out this shitstick's hands and be typed. Does this fucking fool do this all the time? Cause if so you have a patience that is admirable

Dis boy needs a good axe in the mouth, I tell you hwat",creepyPMs,1
"Exactly! I mean, why the hell would I even care if I have weird earlobes? Men are weird",creepyPMs,1
These generations coming up now are too pussified and sensitive. They have no back bone. It's not my fault if someone gets their panties in a bunch over a word that has multiple meanings. ,creepyPMs,1
"the difference between me and this guy is that he says it, while i just think it. REALLY HARD",creepyPMs,1
I'm gonna need a photo. No hot chick is that desperate. Hahahah ,creepyPMs,1
"Not explicitly listing them in the first place is a bad idea and not telling the users who are actually asking so that they can tiptoe around the mod team's feelings is just setting them up for failure. With how sensitive this mod team is, I wouldn't put it past them to label a totally innocent sub as ""affiliated with whiterights"" just because the head mod commented on a whiterights sub once. ",creepyPMs,1
Suicune master race. ,creepyPMs,1
Allow,creepyPMs,1
"That's not a personal message. Sad and pathetic yes, but creepy PM no.",creepyPMs,1
"Dile de mi parte que se vaya a follar a una cabra y se lance de un puente, hijo de puta abusador.

I hope you're in a better place and he's 100% out of your life one day. Hugs and cookies :).",creepyPMs,1
"Here is Reddit's response to the messages:

http://imgur.com/a/0HF3z

I censored the admin's name just in case. I guess by this point, I have to keep posting and ignore him.",creepyPMs,1
I absolutely agree. There is a little more to see a few posts down though... ,creepyPMs,1
Dick pills are a helluva drug,creepyPMs,1
"No one outside of a monogamous relationship deserves sex. Its a luxury. Also just because someone can get sex doesn't mean they want to. Just because you could drink piss doesn't mean you want to (yes it is sterile). I only have sex because I am in a relationship. If I weren't I probably wouldn't ever have sex because I have no sex drive. I don't think I'm asexual because I am still attracted to people, I just really don't like sex. So why would I do something I dislike with someone I think is unattractive, or not up to my standards, just so they don't have to face the fact that they are these things. I have to face the facts of my downfalls every day, like my OCD and anxiety which weigh heavily on me. So do you. Learn some game, even ass ugly dudes with game get hot chicks, I've seen it many times. Deal with it *puts on sunglasses*.",creepyPMs,1
When you reply you just add fuel to the fire. And good luck ,creepyPMs,1
Call me crazy but I don't think this is creepy by itself,creepyPMs,1
YOU of all people? huh,creepyPMs,1
"Forgive me if I was unfair to the wife beater, but I wasn't trying to compare him to anyone.  His was the behavior of a crazy person.",creepyPMs,1
"Of course you should. That's someone on the other end, actually communicating with you.",creepyPMs,1
But..but..I wanna see you naked.   I don't care the race.,creepyPMs,1
He would pay a prostetitue to peg him ,creepyPMs,1
If this has been an ongoing thing why do you still respond to their messages?,creepyPMs,1
Why u message him back if it dat creepy,creepyPMs,1
On phone at work to say this. ,creepyPMs,1
He was being a gentleman about it compared to the vast majority of creeps. I am not defending him. I am just pointing out that he has not forced it upon you as most creeps would.,creepyPMs,1
"eh, I don't think this ones that bad. He more or less accepted it when you made it clear you weren't interested.",creepyPMs,1
"Please understand that I am not defending or condoning pedophiles who act out their fantasies in any capacity. 

It is important to note that the great majority of pedophiles understand that their fantasies are horrible and wrong and do not act on them. 

From everything that I understand, pedophilia is effectively a sexual orientation. Be it from some sort of chemical imbalance, there have been plenty of people who have done AMA's on Reddit, it's pretty clear that nobody but the most depraved would actually chose to be a pedophile. However, it's also one of the most stigmatized problems in our society (and rightfully so), far beyond that of other mental health problems. 

It's because of that stigmatization, many feel like they cannot go to a therapist or seek support from anyone that it becomes a deeply compartmentalized piece of who they are. 

Sorry to write you an essay, but it's something that really does make me sad. On any side of the issue it is tragic, and speaks to the need for genuine mental health services. ",creepyPMs,1
Stop whining. Try getting contacted about daily for almost 9 years. Including having your family and friends harassed along with the whole time. How about having then show up at your house at 2am on a Tuesday and them rolling around in your front yard screaming Beetlejuice Beetlejuice Beetlejuice. And still the legal system won't do shit. But then again you are female so you might get some legal help. ,creepyPMs,1
If hes a chill guy then let him know straight up. Be blunt. I'm sure he'll appreciate it hugely rather then staying there making people feel uncomfortable. It'll be a life lesson for him for the future ,creepyPMs,1
That font gave me cancer!,creepyPMs,1
"You totally missed the point. Read again.

*If you still dont get it, my point was:*

Its cool if you are gender fluid/agender whatever, you just cant expect people to know that by default, and most people dont care about your gender identity when you just wanna order a glass of water.

**Got it?**",creepyPMs,1
She must be so hot to be that crazy.,creepyPMs,1
Was in her comment on picture 7/7 .. I don't know to me that whole  comment thread on 7/7 seemed way over the top,creepyPMs,1
"You're cheating on your bf...? Eh, god speed...",creepyPMs,1
"How come this is creepy?

You're posting nude pictures.......some more riskier than others....

Isn't to get attention? And when you get it you expose comments....

If you DON'T want to read those messages...just delete or don't look......it's sadly a part of beeing online.........jeeez
",creepyPMs,1
I don't know what that means. ,creepyPMs,1
r/PMsFromNeckbeards,creepyPMs,1
That was funny.,creepyPMs,1
"OK, maybe I'm weird but I'm not really that creeped out by this. Message \#2 is a little weird and he should've taken the hint though.",creepyPMs,1
"Yes, i guessed so, because of the theme. I meant other posts.",creepyPMs,1
"Oh wow, an internet argument between two stupid people. Never seen that before....",creepyPMs,1
Your first mistake was looking for like friends not already in your normal life.,creepyPMs,1
This is more childish and immature than creepy.,creepyPMs,1
You could of also not like..... Clicked the link? ,creepyPMs,1
"Yeah, op hates men.",creepyPMs,1
Ableist? 😂😂 behave,creepyPMs,1
This is normal flirting  ,creepyPMs,1
Not sure why OP didn't just block and ignore this dude after the first few messages. Would have prevented a headache. ,creepyPMs,1
congrats on swinging your big mod dick down on the table,creepyPMs,1
"I'm hoping ""I'm a sapiosexual"" was a joke.

Either way, guys really need to learn that size does not automatically mean pleasure; if anything it means pain.",creepyPMs,1
omg! are you okay!? that's sexual harassment. can you do anything legally about this?,creepyPMs,1
hahhaa you are sad pathetic and will be lonely and blue. Unnecessary attitude. KYS!,creepyPMs,1
I don't see the creepy . I just see someone who was respectful. He/She has a weird fetish sure..,creepyPMs,1
Just started following your snapchat and I actually would love pics of your cat. 😺,creepyPMs,1
"Wait, is this unsolicited and random?

I know there are people into the whole extreme Dom/sub/slave thing and for them this type of thing from what I have seen isnt unusual.",creepyPMs,1
I think the font is even more offensive than that pathetic guy. How is glasses or hair dye even an insult though?,creepyPMs,1
"Replying to someone with just the word 'no' on a platform like this can't be considered anything else. It's rude and dismissive when someone's putting themselves out there.

Obviously this guy isnt very please tell, but OP was rude first. Be nice to people and they might be nice back.",creepyPMs,1
Why do you bait so many people?,creepyPMs,1
How do we know this isn't fake?,creepyPMs,1
"So he compliments you and you get offended. 

Nice.",creepyPMs,1
"i don't get it, creepy because he's old? it's not like you aren't an adult anyway",creepyPMs,1
