body,subreddit,moderated
The PERFECT response,creepyPMs,0
absolutely! I was tempted to message him back saying that I would recommend not showing up for the ten year reunion XD,creepyPMs,0
"I second Narryaworry's advice. OP please stay safe, we're sending you positive vibes. Take care. &lt;3 ",creepyPMs,0
[removed],creepyPMs,0
[removed],creepyPMs,0
What the fuck did I just watch?,creepyPMs,0
"Yeah or ""fuck you! You're totally not the ""compliment"" I just gave you anyways. I was lying!""

If I had a nickel for every time I've seen a Nice Guy™ go ""damn you're gorgeous"" followed almost immediately by ""Ugly bitch"", I'd be rich. ",creepyPMs,0
Isn't it just! These wonderfully interesting people never cease to amaze with their ingenuity,creepyPMs,0
Haha I think that's just the evolution. Personally I'll take hot water music over pennywise any day of the week. ,creepyPMs,0
"&gt; Too bad he can't send you a picture of his cognitive dissonance because personally I find that to be his most beautiful feature

Oh snap ",creepyPMs,0
"There's always a certain number of people that think gay/bi people are automatically incestuous.  It's super gross.  Also it makes no sense.  Its not like straight people with siblings the opposite sex automatically bang them, why would people into same sex relationships?",creepyPMs,0
[deleted],creepyPMs,0
"It seems surprisingly common, but it is one that I just can't understand. There are a lot of fetishes where I'm like ""ok I'm not into it, but I can understand why somebody might be,"" but not this one. I feel like these people's thought process or physiology or something is just completely alien.",creepyPMs,0
That's not vore. ,creepyPMs,0
"Because the rules state not to offer advice on threads not marked CAW. If you read them, you might have noticed that. If you need more clarification, try reading the rules.",creepyPMs,0
Paging /u/NoseFetish,creepyPMs,0
Yes,creepyPMs,0
"The tounge.

The fingers.

They never wanted to experience this. 

This vicious abuse of words.

The filth they were forced to voice.

Save a tounge. Or finger. Enrage creeps into a state of coma.",creepyPMs,0
"I worded that really badly, I meant that it's not a fantasy or a lie ignoring reality. Like creationism is a fantasy/lie, as evolution's obviously fact, but with art you're never ""wrong""",creepyPMs,0
"Hayyyyyy

yyyy

y

yy

",creepyPMs,0
"http://m.heute.de/ZDF/zdfportal/xml/object/43930288

You have to look through the picture at the top. It's called ""Bilderserie"" in german.",creepyPMs,0
File the report.,creepyPMs,0
*mild twitch of*  **pure rage**,creepyPMs,0
I'll bring some popcorn and my Red Dwarf box set!,creepyPMs,0
[removed],creepyPMs,0
"Read the rules, thanks.",creepyPMs,0
"Gracias! I'm proud, I never stand up for myself ",creepyPMs,0
[removed],creepyPMs,0
"Hey hey hey, we take our /r/mallninjashit seriously. ",creepyPMs,0
"I saw it before on this subreddit, like how is 11"" pleasant? I mean, I get that some women like it of course, but I personally don't know any of them. That doesn't sound comfortable at all, just painful. ",creepyPMs,0
"To be honest, I was expecting an: Ayy bby u wan sum fugg; at some point.",creepyPMs,0
"not that i know of. a lot of really shitty things happened in his life that i won't disclose out of respect for him (lol, the irony).

i know. the whole time he has been trying to get a response out of me and he knows that if i think he's upset in any way i'll usually try to make him feel better. i'm kind of starting to wonder if he's been more abusive than i thought...",creepyPMs,0
"The thing is, I played along with the ""boobies"" part on the mistaken assumption that he would take the hint that *I'm lesbian* without me having to outright say it. (After all, saying you're lesbian to a creep has almost never discouraged them.) Clearly, it backfired. Ah well, what can I do now, except laugh about it?",creepyPMs,0
"I've never looked into it, but i would assume so. I guess that way if they find someone who is a temporary resident performing sex work they're more likely to have been trafficked than doing it voluntarily? ",creepyPMs,0
[removed],creepyPMs,0
[removed],creepyPMs,0
Further proof that wank worthy is in the eye of the wanker.,creepyPMs,0
"So he just made one up in his head that happens not to be perfect (for him)? I'd ask for a time-stamped picture of HIS ASS and then respond, ""Not what I was looking for; I'd recommend working on those glutes, stat."" ",creepyPMs,0
It sure is.,creepyPMs,0
[removed],creepyPMs,0
"one word.... 

*eeeeeeeeewwwwww^wwww^^www^^^ww*",creepyPMs,0
Fairy work your magic it shows img not found! ,creepyPMs,0
What the entire fuck,creepyPMs,0
"Oooh, that's so cool! I need to watch that anime, but my backlist is scary to look at xD",creepyPMs,0
Does he really not see how this is personal? :/ And wildly inappropriate as well..,creepyPMs,0
Neeeeheheheaaahhh! *strokes creepy mustache*,creepyPMs,0
"*Engineering background and now run a farm.*

Dropped out of college, raise my own tomatoes.",creepyPMs,0
[removed],creepyPMs,0
**AA**^A^^A^^^A^^.,creepyPMs,0
Second and third image are out of order.,creepyPMs,0
"Okay, i understand now. Thank you.",creepyPMs,0
Objecting to things,creepyPMs,0
They didn't say it was but whatever,creepyPMs,0
what better way to win back your heart than with a flaccid dink,creepyPMs,0
"I probably would walk that distance for a girl

But hell to be honest I'd also walk that distance for Pokemon GO too.

So i'd walk that distance but I need some motivation, that and alot of travel music",creepyPMs,0
"I was in the car with my boyfriend when I read the message. Halfway through the first message I was like ""already this is going SO WELL!""",creepyPMs,0
"""While you were busy being Emperor of the World, I studied behavioral psychology.""",creepyPMs,0
"Most of them look no different than any ear stud just are located in different places- like back of the neck.
I like them.",creepyPMs,0
[removed],creepyPMs,0
He's salty because even women are more attractive than he is to other women.,creepyPMs,0
Genuinely disgusting in a way you usually don't even see here. Just amazing. Worse yet you know these people personally. It comes down to people like this feel entitled to sex and you are just a receptacle for their dicks to them. ,creepyPMs,0
"Ah I was wrong. Still a weirdo though, just an American one. ",creepyPMs,0
I did notice the similarities in the way this guy and Donald avoid difficult questions....,creepyPMs,0
Whats evil apples?,creepyPMs,0
"He did indeed. I mean, obviously since he was rejected for a long-term relationship, the next best thing would just have to do...",creepyPMs,0
https://s-media-cache-ak0.pinimg.com/564x/e8/9c/3f/e89c3fbcadf82d6901b8ad2805616658.jpg,creepyPMs,0
[removed],creepyPMs,0
"I had something almost as bad. Had a guy message me on POF. Wasn't interested, so I didn't respond. I think he then sent another message, still ignored. 

4am I get woken up to this peanut-brained man calling me through the POF app. Why that's a feature with people you don't know baffles me.",creepyPMs,0
[removed],creepyPMs,0
Removed for violating rule 2. ,creepyPMs,0
[deleted],creepyPMs,0
Yeah I don't know exactly but it's some combination of rice flour and heaven.,creepyPMs,0
"Didn't you know? Feeeemales aren't people.  This is how it usually goes for me: 

*****

Creep: hey bb I want put my cock in yr luscious lips

Me: No. Fuck off. 

Creep: But I have real big cock is best cock 

Me: Still no. Fuck off. 

Creep: Don't have to be a bitch about it

Me: Apparently I do.  Fuck off.

Creep: Well why the fk are you even on a hookup site u must be lez dyke

Me: At the moment, telling you to fuck off.  Fuck off. ",creepyPMs,0
This is the perfect video for OP's witty comeback and so many of the other ones that are posted here!,creepyPMs,0
"&gt;my penis is x size and you should come over to smoke and have fun

&gt;&gt;what no I never said I wanted to fuck",creepyPMs,0
He just said I should have ignored him. Not that I was too harsh!,creepyPMs,0
I love this so much. You're my hero. ,creepyPMs,0
"This is like going to a women's shelter to try and pick up chicks, uuuuuurgh.",creepyPMs,0
Gonna have to remember this one lmao,creepyPMs,0
"&gt;""This does not dom-pute!""

Would pay good money for this SNL skit.",creepyPMs,0
"See, this is the problem with creeps ruining conversation for everyone. I genuinely like tattoos, in a non-creeper way.and I'll ask what all you have when it comes to tattoos, because in interested. I'm not asking for pictures or locations, just content. Been called a creeper once for asking what was the tattoo what was half shown in a pic of her back. Like, okay girl, asking what something is, that I can already see, is sooooo creepy.

Edit: this is not to say that many are not messed up. I know a few girls that have shown me insane theings they were sent that make me almost sad just to be part of the gender that usually does this, in my experience. ",creepyPMs,0
"""New Phone, Who Dis?""",creepyPMs,0
"This picture is awful on mobile
Edit: the contents of the picture are awful anywhere.",creepyPMs,0
"Yeah but more importantly, how you b tho?",creepyPMs,0
"Yep, I never believed him for a minute considering that he would not answer my question concerning my location. You'd think if he actually had it, he would say it as to scare the person more. Even if he did have my location, I'm pretty sure it would hard to find someone when you don't have hardly any info on them. I have changed all of my passwords just in case. My security software is up to date and is reporting no threats by the way. Thank you for this information ",creepyPMs,0
"In all fairness I wasn't diagnosed with bipolar before I started sleeping with men.


But I was definitely bipolar before that so.....",creepyPMs,0
"""I want to know if I hearted you""

No. Noooooooope. You just completely disrespected my boundaries and kept showing up on my life. Despite me not wanting you. ",creepyPMs,0
OMG I totally forgot to cover the link! Lol if he hasn't noticed my post and check his pics he must be so excited thinking so many people watching his pics! ,creepyPMs,0
"I suppose so, but a little empathy goes a long way",creepyPMs,0
"Hilarious that after the first 5 ridiculous messages didn't work out, he figures that you just want some nudes to decide for sure.

*It's been 8 hours, and she hasn't responded.  She's probably just shy to ask me for nudes.  I better offer.*",creepyPMs,0
I also down dooted,creepyPMs,0
I'm glad this is helping people. :),creepyPMs,0
Definitely true,creepyPMs,0
"I do appreciate that he took the rejection like an adult and went on with his life instead of flying off the handle and making all kinds of assumptions about her and then flaming her based on them.

Don't get me wrong, it still perfectly fits the sub, but I'm just used to seeing these go in a much different direction.",creepyPMs,0
"Please post those, they sound great ",creepyPMs,0
"https://www.amazon.com/gp/aw/d/B00C2TCZ4G?vs=1&amp;vs=1
Something like this.",creepyPMs,0
...Now I have to go Google 'Happy Zombie'.,creepyPMs,0
I have two. Which one do you want to hear about?^(not that I'm saying anything about either of them to you.) But just curious which one you were referring to?,creepyPMs,0
"Oh no! Sorry for sparking that midnight munch! Haha. Green tea is really good, around vanilla. It's counter intuitive for me because I really, really do not like green, or any kind of, tea.",creepyPMs,0
An authentic creeper would never microwave their burrito's.,creepyPMs,0
Can someone please explain why everyone thinks anything Hillary did disqualifies her as a candidate more than Trump being a liar and a racist and a rapist? I am not at all kidding. Someone *please* point me to any possible basis for this viewpoint. ,creepyPMs,0
"I like how he basically said ""if you're just gonna ignore me then go ignore me more""",creepyPMs,0
OP's guy could make this into a rape,creepyPMs,0
"I'm currently sitting at my best friends house, who I met on ok cupid after putting up a profile for friendship.

Many many people use it that way, and will state their intentions right on their profile. I'm pretty sure you can filter those people out if you so choose.",creepyPMs,0
"I didn't ask for a quote  
I don't WANT a quote",creepyPMs,0
Comrade! ^5,creepyPMs,0
[removed],creepyPMs,0
What do you mean?,creepyPMs,0
"&gt;Well fuck you then bitch

Actually no, that's probably why you are so upset


&gt;That pic aint even me

So a creepy guy on the internet lied? Oh what a world, if you can't trust them who can you trust

&gt;you bitches always got attitude

So if I said yes I wouldn't have an attitude because logic?...

&gt;fuck you and suck a dick

We established I won't have sex with you, also we have established I am a lesbian so I won't be sucking any dicks.

&gt;I was just trying to fuck you a couple times and get on

You were never discrete about that man but idk

&gt;you being a gay ass bitch

Yes we've established I am indeed a homosexual, I have and always will be one for other gay asses because straight asses don't appeal to me


",creepyPMs,0
"While I agree this is indeed creepy and a PM, disjointed shit like this is often a sign of actual mental illness. This guy is sick.",creepyPMs,0
Agreed.,creepyPMs,0
So uncouth ,creepyPMs,0
[removed],creepyPMs,0
Damn there's been some terribly opening attempts but that's a whole new level ,creepyPMs,0
"Your landlord may be able to get you his full name and his forwarding address, I don't know what the laws are like in your area concerning giving that information out are. You have more than enough evidence on this guy to get a restraining order. ",creepyPMs,0
Wise choice.,creepyPMs,0
Fourth sub of mine! ,creepyPMs,0
[removed],creepyPMs,0
[removed],creepyPMs,0
You're not your. Jeeze!!!,creepyPMs,0
I watch a lot of Forensic Files and I'm incredibly suspicious of exes sending packages to their former partners. Please be safe OP,creepyPMs,0
"Lol, who reported this because they didn't agree with how OP handled this? ",creepyPMs,0
I never saw or will see lemonparty. I alread was scarred from tubgirl and 2 girls one cup. ,creepyPMs,0
"""Go back to your room and do your goddamn homework, son! No more internets for you. Let's bring that GPA up.""",creepyPMs,0
"*Searches up goatse*

It can't be that ba..... I stand corrected.",creepyPMs,0
"I bow before ye, OP. You are a hero.",creepyPMs,0
You are a true hero,creepyPMs,0
"&gt; looking for some guy will magically just like her for her mind and opinions which is never true

why do i get the vibe that he's not _even_ interested in your mind and opinions?",creepyPMs,0
The character who accidentally killed dozens of baby animals and broke a woman's neck?,creepyPMs,0
"I'm not big on vag pictures, it's fuckin weird. I also had a girl send me a picture of one boob. It looked like a weird eye staring back at me. Sorry, had to throw that out there.",creepyPMs,0
I hate replies like this. You can't say anything nice to a girl online (or similar like that comment) or suddenly you're a 'white knight' and trying to bang her. Projecting much?,creepyPMs,0
"I *think* this was one of those attempts in which they say something insulting and when they get your attention, they count it as a win, so then they keep talking as though nothing happened. ",creepyPMs,0
"Yeah, but this is a public forum. Where other, not shitbag, people come. They shouldn't have to read that.",creepyPMs,0
"&gt; He seemed disinterested to me.

Yeah, the first few messages it looked like he was ready to go for it, or at least see where it led. Looked all good. I'd have been flattered and would feel it out, too, if I wasn't married.

After she kept going on and on and on and on and got more and more explicit without any prompting, though, my sense is that he was ready to pull the parachute because he realized she was *nuts*.

Nothing wrong with being forward *if the other party is willing*, but it's a two-way street. Have to wait for that door to be opened, you can't just kick it down. This dude was at a 6 and she cranked it up to 11.

I think he'd have gone for it if she didn't immediately chase him off with the thirst.",creepyPMs,0
[deleted],creepyPMs,0
Brb adding Wingle to my LinkedIn profile,creepyPMs,0
"&gt; Yes, the policeman will be all ""oh my god did i hit on this guy or what"" 

Well of course, legally, they'd be forced to immediately arrest themselves, letting this cunning rogue get away scot-free!",creepyPMs,0
[deleted],creepyPMs,0
"☺️

 | \

 |   \

 8=👊==D💦💦

 |    |

 |.   |.",creepyPMs,0
M'muse,creepyPMs,0
"&gt; That said I also want to hear how you've been.

Uh huh.",creepyPMs,0
"Him: ""I complimented you, so I'm entitled to a response!""    
Him: ""Wait, I didn't clarify, I'm actually I'm entitled to a *polite* response!""    
Him: ""Fiiiiine, I'm sorry.""    
Him: ""I'm entitled to your forgiveness!""  

What a quality person. I'm sure he's going to have many healthy, fulfilling relationships in his life. /sssssssssssssssssssssss    ",creepyPMs,0
"I only wish I could do more. But we're all behind you no matter how far we are.
I mean look at all the people who want to come! :)",creepyPMs,0
[removed],creepyPMs,0
"bonejore, gemapple lucas. i like to mahnjur bagetts. wee wee, sah vah!!!",creepyPMs,0
Hmm. Spam cyan lobbys 100 each at him. Only way to be sure....,creepyPMs,0
"water water everywhere, not a drop to drink . . . cuz pool chlorine",creepyPMs,0
It was big of you to hold no ill will for Chris the cat lol,creepyPMs,0
"&gt; I hope to one day meet you and call you baby.

Because it's too soon to start in with the pet names now. That would just be weird.",creepyPMs,0
What do you mean?,creepyPMs,0
"NO GUY THIS IS NOT A ROMANCE MOVIE YOU ARE NOT THE HERO STOP

that last picture is honestly a really good explanation for his behavior; he probably thinks that through persistence he'll win you over and get his happy ending because that's how movies go; conquer the obstacle (in this case, probably that ""anger"" he's talking about) and get the girl. In fact, I can almost see the basic plot in his mind: boy meets girl in school, boy falls for girl, thinks girl may like him back (for no real reason in the real world) and calls her his girlfriend. One day, the girl leaves for some ~*foreign country*~ and gets married, and the boy pines after her for years. Then, one day, through the magic of the internet, he finds out she's single, and suddenly he sees his chance to make TRUE LOVE prevail! But unfortunately, she's angry about something and refuses to talk to him. No matter; he'll keep trying to slide into her dms and eventually, he shall emerge victorious, girl in hand!
Basically, he's awful.",creepyPMs,0
Dam it arizona we done it again.,creepyPMs,0
Why did he have to bring Prince into this smh,creepyPMs,0
[removed],creepyPMs,0
"[Actually it appears the American average is 15.8, lower than European countries that are more sexually liberal.](http://www.advocatesforyouth.org/publications/publications-a-z/407-european-approaches-to-adolescent-sexual-behavior-and-responsibility-call-to-action-) ",creepyPMs,0
"&gt;the pathology of political political correctness.

I want to punch this douche-canoe right in his face. Hard.",creepyPMs,0
"Him: ""*I* wouldn't feel the same way you feel, therefore your feelings are invalid!""

",creepyPMs,0
"Actually, calling 911 is great for suicide threats pretty much instills that they shouldn't play that card. I get sent out to emo kids and suddenly they stop wanting to kill themselves.",creepyPMs,0
I get the feeling he wants you to stroke something other than his ego.,creepyPMs,0
Fire Your Lazors?,creepyPMs,0
That's what I tried to point out; I don't think he wanted to hear it. They greeting after he told me to quit texting is where I lost it. I laughed so much when I woke up to that.,creepyPMs,0
But it was going so well...,creepyPMs,0
Fucking hell what a muppet. Hope he slips on cold s'getti and lands on a rock,creepyPMs,0
Scream rape while kicking him in the balls and spraying pepper spray. Lol,creepyPMs,0
"What made me the most angry was that he seemed to believe that if my boyfriend weren't holding me back I'd be racing to jump into his arms. 

Also the fact that he said 15 year old me was his dream... I look completely different from when I was 15. It makes me want to go back to 15 year old me and tell her to put some clothes on.",creepyPMs,0
That response was on point. Very well said.,creepyPMs,0
"There is a youtube channel called IRL Series that have done interpretations of OKC conversations, but just dramatisations, not actually going up to random people and saying them.",creepyPMs,0
"What REALLY pisses me off is that these guys WILL report you, and there are some manchildren working as mods that will delete you for standing up for yourself for being harassed.

It's happened to me. I lost a 2-year old profile and a great name on OKCupid because apparently I was a little too assertive to these predators. Ugh.",creepyPMs,0
"Read the rules before commenting again, this is your only warning.",creepyPMs,0
My aunt's real name is Sativa. She gets picked on for it all the time. And she doesn't even smoke weed!,creepyPMs,0
innappropriate peehavior,creepyPMs,0
"&gt; your a dude

My a dude what?",creepyPMs,0
This was so painful to read,creepyPMs,0
"When I talk to a woman, I make sure I sexualize her beloved pets. Really breaks the ice, yeah?",creepyPMs,0
I think I threw up a little ,creepyPMs,0
"Reply ""Oh it was hot, I picked Macbeth, I even got prop blood and a head on a stick""",creepyPMs,0
in world,creepyPMs,0
They don't call it a blow hobby!,creepyPMs,0
He commented on a public post that you deserve to be beaten?? This guy needs to get evaluated...,creepyPMs,0
Aaaaaaayyyyyyy,creepyPMs,0
I'm going to assume all the downvotes on it are from guys. ,creepyPMs,0
So it literally is a shit dick pic ,creepyPMs,0
"""I don't have a TRUCK, but if you're cool with having sex in aNOTHER kind of vehicle, I've also got money.""",creepyPMs,0
[removed],creepyPMs,0
"No, no, no. They don't want to date him because he is Le Nice Guy ^^TM. ",creepyPMs,0
"Yeah but boobies is a great word, it pretty accurately describes how a guy feels when we see them. Generally the thought in your head is ""hehehe... boobies.""

Or maybe I'm just really immature. Oh well.",creepyPMs,0
"Yeah, sounds like she needs to be.",creepyPMs,0
"He has judged and knew exactly he was going to talk about as soon as he saw the pic. What a douche. It's crazy how just a little cleavage can really derail a perfectly civil conversation, due to him having a one track mind.",creepyPMs,0
I wonder about this soooo often. So many of them appear mentally challenged. Don't get it.,creepyPMs,0
Was your facial piercing shaped like a skull? How are they scary?,creepyPMs,0
Okay thanks I won't then ,creepyPMs,0
"You don't even know what happened yet you can determine that I suck at receiving information lol ok.  Also it was a girl, not sure why you assumed it was a guy.  Shows how little you know about the situation, huh?",creepyPMs,0
"Most women think like you. It makes me almost puke too, when some asshole has to shove a pic of his dick on me. It's just gross. 
Not even my bf sends me such pics, since I don't like them and he thinks it's stupid too.
Sometimes I think I had so much luck with him, since he rather wants a nice pic with pretty (normal) clothes, not something dirty. ",creepyPMs,0
"Creepers will creep, the Internet just makes it easier and more anonymous. ",creepyPMs,0
Needed a hook up for some black market diabetic test strips...,creepyPMs,0
No. The long msg he clearly states he has blue balls and wants to know of shell help him out- since its been 9 months since his been with a woman.  He doesn't say sex- but those two things put together means sex.  It probably wouldn't mean nothing if he just said he hasn't been wa woman in 9 months can she help him.  But once he talks about blue balls and mentions the word sex its known hes soliciting.,creepyPMs,0
Stupid shirt. Guy should be embarrassed. ,creepyPMs,0
Some people keep their friendslist private,creepyPMs,0
Yes. Thanks. I made this on mobile and I don't have flair capabilities. ,creepyPMs,0
With a honey in the middle there's some leeway.,creepyPMs,0
"Awwh, he picked his words so carefully, didn't he?    
Protip: If you feel the need to pre-empt accusations of being a creepy asshole, you might want to think about changing your strategy.",creepyPMs,0
I think negging can work on people with low self esteem and insecurities. If you already think terrible things about yourself and ate promised the chance to impress someone and win their approval I can imagine that can seem tempting. ,creepyPMs,0
"No no, I believe that's the new enemy in the next season of Voltron",creepyPMs,0
You should get your sodium levels checked bro ,creepyPMs,0
I did this last time like 8 months ago and then blocked the number. This is a new number. It's a little crazy. ,creepyPMs,0
"I lost it at ""free will concerning their free willies"".  Good show.",creepyPMs,0
"Oh this stuff is entertaining, that has nothing to do with it. Promise ",creepyPMs,0
"But I'm different from other guys, I'm so much more ""nurutiring"" than the others. You'll see.",creepyPMs,0
[removed],creepyPMs,0
[removed],creepyPMs,0
