body,subreddit,moderated
"Why are you guys so obsessed with reporting him? Like just tell the obviously socially awkward dude ""no thanks"" because he did something unprofessional and leave it at that. If you want to go out of your way and say ""hey dude this is unprofessional and I feel uncomfortable about it. You probably shouldn't do this again because someone will report you and you will get fired."" I feel like a warning is enough. There's no need to go out of your way to make some else's life harder or be vindictive about it. Op handled it like it should be handled.",creepyPMs,1
"In all honesty, u/andreagassi is right. You didn't do a very good job of telling him off. Sounded like you would give in at any second.",creepyPMs,1
"At first I thought you were Jane, but reread and saw you were ignorant and a slut, but not an ignorant slut.",creepyPMs,1
"Just out of curiosity, why are you in OkCupid if you have a boyfriend? ",creepyPMs,1
"Not gonna lie, I didn't think anyone posted in gw was really a woman. Can't believe people actually do it, especially this being Reddit. ",creepyPMs,1
"To be fair, maybe the guys asking for plainer rejections aren't the kind to go off on women.",creepyPMs,1
did she not realize she could have blocked the second it got weird?,creepyPMs,1
"Okay, maybe I'm being thick here, but didn't he say right off the bat that if you said ""no"" he'd leave you alone?  I know that isn't always the case (it's happened to us all) but why didn't you even try saying ""nah man, no pics""?  ",creepyPMs,1
">continues to say go away

>doesn't just block him

just like any other idiot on here",creepyPMs,1
He is a lot more respectful than others on here,creepyPMs,1
I suck because I prefer long hair on women?,creepyPMs,1
"I'm not defending the guy, he's an asshole, but isn't OP at least just a wrong here? What does his penis size have to do with *anything*? Why try and insult him for something he can't control? I mean why even give him the satisfaction of a response? ",creepyPMs,1
Yes because a guy would know it's stupid to ask ,creepyPMs,1
"I swear, the internet is a small penis/inferior masculinity detector.

Bet he's hung like a pink jelly bean.",creepyPMs,1
Like a picture of the crazy lady with your face photoshopped on,creepyPMs,1
I have to admit that I concur with his question. Why did you respond to him? Why is this guy worth a minute of your life?,creepyPMs,1
"DAE feel these people have been waiting by their confederate flags to pounce? 

Finally a candidate that says it's ok to degrade women and call black people niggers because their toothless cousins who raped their brother taught them that this is how the world is supposed to be.",creepyPMs,1
"Can we just once show this guys full name so we can give him hell, please?",creepyPMs,1
How does this fit into this sub? This has nothing to do with people being creepy. Mods? ,creepyPMs,1
Fucking a 16yo kid doesn't make you a pedophile /s,creepyPMs,1
"Well, there are some women who do like it. Problem for this dude is that he was never really taight that the ""rough"" talk play comes after a healthy dose of conversation in a relationship and not just out of the blue with strangers.


That or maybe he just gets off on threatening people. Different strokes, different trolls.",creepyPMs,1
"Probably an unpopular opinion here, but your initial response (Following the automated message) was in no way called for and came off even more entitled and rude than his initial response just saying... there's no reason to take any shit of course. But tact is still a thing :/",creepyPMs,1
Fucking hell that font gave me cancer.,creepyPMs,1
hey well at least you can go back and have sex with him sometime NSA.,creepyPMs,1
"The guy in the post did nothing wrong and I support him 100%.  

fuck you ban me please",creepyPMs,1
maybe he has turrets ,creepyPMs,1
I'm sorry I made that comment ok?,creepyPMs,1
"Didn't see the ""1 more image"". Was disappointed you didn't press the prison line further. 

Had to check a second time, because I just didn't believe anyone could manage to not keep going with that. 

""1 more image"" Ah, perfect!",creepyPMs,1
This is really bad but I wouldn't say it the same as rape... ,creepyPMs,1
Guess you don't upvote Jewish guys. Racist cunt.,creepyPMs,1
Ugh. So shady. ,creepyPMs,1
He's a creep because he tried to talk to a girl who wasn't interested in him? And you just get to decide that? Words having meanings! What's happening to the world?!,creepyPMs,1
[OP](https://imgur.com/a/V68YX),creepyPMs,1
"Pardon me madam, may I send you a picture of someone else's dick?",creepyPMs,1
And men wonder why everyone hates them. ,creepyPMs,1
Ha I can't believe he sent you Hentai ..you should upload those as well so we can see just how creepy this guy is,creepyPMs,1
I would have blocked it from the first instance ,creepyPMs,1
In the other post you have social anxiety. How big is it?,creepyPMs,1
"Third message was unncessecary, but why didn't you at least respond during those 24 hours? ",creepyPMs,1
"Ugh, empathic moment of shame. I did this myself, though across like twenty four hours and only with one woman, who was initially interested (before I bombed like the Boston Marathon) One reason the one day felt like forever to me was I got obsessed with OKC for the first 4-5 days after I started using it. It turns out shame, like all emotions, has a purpose!",creepyPMs,1
"I want to be sure I word this carefully as I see this on multiple posts in this sub, but why even continue the conversation once you get beyond uncomfortable? Being a dude, I don't get nearly as many messages as you might but as soon as someone crosses the line, maybe even before if I see a rationale forming, I block them. There's a lot more to your situation here from what you described so I don't know the whole story, but even in this case where you recognized him from before, what's the point of even doing the same dance with this person all over again? And not just kick/ban and move on? Not trying to troll here, just genuinely curious. At least part of the problem is that you're on POF. There are some doozies on there! ;)",creepyPMs,1
"I mean you are kind of sending very contradicting messages lol. You said you don't want a relationship and enjoy being single, then you say you're not there to be fetished of objectified, but you also have sent them multiple pictures. 

So exactly wtf are you doing on that service? Lol",creepyPMs,1
"it kinda looks like it had a knot in it, making it lean to the side and that's why i asked. ",creepyPMs,1
Haha,creepyPMs,1
""" I can't have this happen"" says someone who violated their privacy and trust most likely because that person violated their privacy and trust...there is a way to get nudes out there and it doesn't involve telling the person or threatening them first. I had looked into it once and then I decided to be the bigger person. But for those of you that want to, I would encourage you to do so. Sometimes examples need to be made. I'm not gonna make them but I appreciate the insane people who will.",creepyPMs,1
Lol yes she needs our support. She is a trooper. God bless her. Honestly I don't know how she would survive unless we gave her support. ,creepyPMs,1
Why keep responding after you said you didn't want to have a conversation? Why not just stop? Did you keep responding just to post something to this subreddit? ,creepyPMs,1
"I mean technically grills are pieces of furniture, they're not normally considered regular furniture though.",creepyPMs,1
Why didn't she just block him?,creepyPMs,1
Was he not smiling in his pic? Did he have a creepy looking mustache?,creepyPMs,1
Go to hell. ,creepyPMs,1
Don't be a prude.  Let your ass and ballsack hang freely.,creepyPMs,1
"Maybe I've just been on this sub too long, but this doesn't really strike me as being all that creepy. He's a douche for sure, but didn't really do anything creepy like what most posts on here display.",creepyPMs,1
What did they say?,creepyPMs,1
I guess reading these creepyPMs posts has recalibrated me a bit. This is like minor leagues creepy but yeah I guess that dude is being a creeper. Now if he still persisted....,creepyPMs,1
What if you're not as fat as you think you are?,creepyPMs,1
If a brother never asks he never going to know. ,creepyPMs,1
I feel bad for the next person he does this to. ,creepyPMs,1
"I'm not saying he's not an asshat, but the second definition I found of babe basically said ""An attractive lady.""  It's meant that since the 80's or 90's probably.  ""That girl is a babe.""",creepyPMs,1
We need multiple accounts just to post without you banning us? I don't get what problem this solves. Don't downvotes typically take care of this kind of thing? This seems like a big hoop to jump through just so you don't get douchebags in here.,creepyPMs,1
"The dude is obviously a bit short on class, but I think people here are being a little too *hard on* the guy....",creepyPMs,1
It kinda seems like you're flirting in a weird way. So if you did want it to stop that's probably not how to do it.,creepyPMs,1
Feminism is gay,creepyPMs,1
Do men just have no control?,creepyPMs,1
What a stupid thing to say. ,creepyPMs,1
"Struggling with the genders here. Is this a sad lonely, overly clingy (read: crazy) woman or a desperately pathetic zeta male?",creepyPMs,1
"It's astounding how many people post pictures on stuff like GW and are surprised when they get messages from creepy, socially retarded people.",creepyPMs,1
> I get off on creeps talking to me because I'm a fucking whale,creepyPMs,1
"TFW you're older than the ""old"" guy in the story. Feelsbadman",creepyPMs,1
"Oh come on, there's ""creepy PM's"", then there's people going along with it, egging along the conversation. But *I'm* out of line for pointing it out? Got it.",creepyPMs,1
What do people expect when they whore themselves on the net like this? They gave in to the most base drive of all. The people who posts the pictures should be publicly shamed. It's a great tragedy for our societies that this is considered acceptable in modern times.,creepyPMs,1
I am sorry if I came off harsh. WhT I meant to say was that you have no sense of humor and likely take things the wrong way because you can't detect obvious jokes and sarcasm ,creepyPMs,1
"As I read it, I kept thinking ""Why do you keep answering him?!!""  He would have been shut down by me after the ""Netflix and chill"" opener.  Telling him where you're going, where you live . . . doesn't seem safe to me, if you're not looking to get stalked. . . ",creepyPMs,1
Is it though,creepyPMs,1
"Well, did you go out with him??",creepyPMs,1
Have anybody sent you a msg that was not this creepy?,creepyPMs,1
Apologies. I did it for the ease of OP finding your response. My bad!,creepyPMs,1
"Isn't that the point of posting to gonewild? Getting a bunch of creepy pms to validate you?

No no of course not....it's for...artistic purposes....",creepyPMs,1
You aren't helping with those kind of comments though. You shouldn't just lump together an entire group of people like that.,creepyPMs,1
It's pathetic that this sub can't take criticism or hell that it doesn't allow different opinions. ,creepyPMs,1
Well that wasn't creepy. Unless he kept going after that,creepyPMs,1
/r/Tulpas is a thing.,creepyPMs,1
Go for it! ,creepyPMs,1
We've got the creepiest PMs don't we folks? Fake news. ,creepyPMs,1
"90% sure this guy was high on Coke, meth, adderall, or any combination of those with booze... quite possibly the most delusional thing I've read in a very long time.... ""I'm realistically going to become a billionaire"" Bahahh",creepyPMs,1
Why is his cousin on his iPad at 4:50 am?,creepyPMs,1
"I'm very sorry, I left myself logged in and a houseguest thought she was funny.

My apologies.",creepyPMs,1
What did the girl in question.,creepyPMs,1
"It's not about you being a girl, gamers are just like this to everyone.  But whatever makes you feel special.",creepyPMs,1
"Clearly you were, at least in the beginning, the classier person here and I feel like you could gotten your point across without all the insults. ",creepyPMs,1
Lol. I think I'm aware of this? Like I said... It was an example. I knew at least one person would find it offensive. :),creepyPMs,1
Women's sexuality is far more malleable than men's for some reason. That's why women are more likely to be bi,creepyPMs,1
"Seems like a realist to me.

What's creepy about being realistic?",creepyPMs,1
"Actually, the reason it's considered fine is because they are a fictional species of fantasy setting. These are not real people with real consequences or any form of reality. Sites like Inkbunny have all porn involving humans banned and does not allow condoning molesting children or real pedophilia. It's fine if it makes you uncomfortable, but I recommend trying to stand from a more neutral perspective.",creepyPMs,1
You think you're safe on the bus?  Dumb feminist ,creepyPMs,1
I mean... I'm not that interesting myself but I feel sorry for this guy,creepyPMs,1
less creepy But funny pm though :P,creepyPMs,1
"Eh, isn't really creepy.
Sloppy kisses are... Unique. ",creepyPMs,1
"Wow, are you telling me a certain percentage of culinary school students end up becoming cooks? ",creepyPMs,1
Ask for the money upfront? No context. ,creepyPMs,1
I think this guy deserves it. I would not mind if he was not around anymore. ,creepyPMs,1
This is like Ken M level trolling I think.,creepyPMs,1
"No, that's more like TRP.",creepyPMs,1
"Nope this guy has mental issues, his train of thought is pretty much textbook ""flight of ideas""",creepyPMs,1
What about the new number you talked about?,creepyPMs,1
"Although this is extremely entertaining to read I have to ask the question:

Why do you keep responding to him when you are clearly uncomfortable talking to him. Why not just ignore him or even block him?",creepyPMs,1
Should have titled this 'Ayy bby wan some mod tools?',creepyPMs,1
"He wasn't really that bad, compared to most creepy pms ",creepyPMs,1
"You're absolutely right, OP.  I don't know what came over me and I apologize for that crass and uncalled for behavior.  If you can see it in your heart to forgive me, could there also be a chance that you would share a vid of my cat licking tuna fish off your boobies?  For cash?

I apologize in advance if my proposal is too bold.

To be clear, the cash would go to you, not my cat.",creepyPMs,1
Everything about this post is creepy... everything.,creepyPMs,1
He must be hot.,creepyPMs,1
What was the original comment? ,creepyPMs,1
You just proved his point by using a gendered insult.,creepyPMs,1
I don't see why he would waste his time when she has a fiance. And eh he has a point lmao girls clothes is way too revealing haha. Idk why everyone is obsessed with ass,creepyPMs,1
Men seem to care just fine that they are actual people-I think they understand that women are actual people.,creepyPMs,1
"I don't really find the message all that creepy actually. I think coming here and asking for an explanation is pretty needy. Maybe he is needy otherwise, I don't know. The point is, sometimes shit doesn't work out the way we want it to.",creepyPMs,1
Ugh it's men like this that make us look bad,creepyPMs,1
OP better wipe her HDD she's got kiddie porn,creepyPMs,1
yare yare daze,creepyPMs,1
Lmao what kind of reaction is that. Would you have berated just about anyone who pays you an 'unsolicited' compliment? Even in person?,creepyPMs,1
"Block him op , this guy probably thinks like 

""If I kept texting her for the next 5 years she'll eventually fall for my charm"" 
",creepyPMs,1
"If you want to build musscle just start with a ss progrem like this one.
http://www.bodybuilding.com/fun/novice-lifters-start-here.html
I dont know if you want to bench but you can replace it with a core exresize.
Start cutting after 3 month.
And try to find some one to workout with,a good workout partner can motivate you.",creepyPMs,1
Who the fuck wastes their time going back and forth like that with a wrong number? Seems pointless.,creepyPMs,1
"Oh wow, so Reddit is now a social justice arena? Every word I said was appropriate. This is the Internet. If you are unable to handle the heat, get out of the kitchen. If someone is going to get offended on Reddit, they need to leave. This is the issue with Democrats, especially you. Your party has created ""safe zones."" Due to you social justice warriors, militiamen are now allowed to show a card if they are too sensitive to certain activities in military training. This is why ISIS will destroy us. Fuck you and your sensitivity. Grow up.",creepyPMs,1
"Could have been a test from the fiance? 
You passed! ;)",creepyPMs,1
I have insurance that wouldnt let this happen,creepyPMs,1
"""Your a idiot"" ",creepyPMs,1
Nice argument. Thanks for the attention btw,creepyPMs,1
"Uhh, why would you still wanna hang with him? I'm confused.",creepyPMs,1
"What are you talking about? He asked her how she felt about being with him, he never even implied that she *had* to have sex with him or he would throw her out on the street... Did you even read the original thread?

And it would have to be a girl anyway because I'm a straight guy. The commentator was a straight girl and he was a straight guy. So your hypothetical is a false equivalency. ",creepyPMs,1
"Oh, no doubt it's passive aggressive and annoying. I can see how that's frustrating. Just not sure I'd say it's creepy per se, more frustrating, but yes it is a matter of opinion.",creepyPMs,1
haha kill yourselves please,creepyPMs,1
"no....i didnt. her decision was to not give the guy her number. i said i agreed with that. i didnt say that THAT was ""kind of crazy"". either way, its her life. her decisions arent up to me or anyone else to agree or disagree with. 

I said that if she thinks that exactly zero of the millions of people that use reddit wouldnt be able to or shouldnt have her number for the sole reason that they are reddit users, would be ""kind of crazy"". which i stand by ",creepyPMs,1
"What is wrong with just writing immediately - ""sorry no offence, but I am not interested in you"" and leave it at that. Why leave the guy hanging? That is rude in my opinion.",creepyPMs,1
"Honestly, thus is the kind of banter I have with some of my female friends and it's totally fine, but the backpedalling made this one million times worse. If he misread a situation like that, then it's time to stop.",creepyPMs,1
"Come on. The whole convo is fake.

The ""boyfriend"" is obviously roleplaying Jofferey. ",creepyPMs,1
"Maybe we should learn something different. Is this yet another reddit who has fallen to the extreme leftist safe space opinion that stifles free speech? If I engage in a relationship with someone, however insignificant and young it may be, I owe at least a small amount of time to that person, proportional to how significant that relation is. This is what I was taught by my mother. I'm sure that most women do not like never hearing from a person they had sex with and felt that that created a bond. I condemn such behaviour from all sides. This explanation is not proportional with two dates imo. It is clear that the man already had a significant emotional investment.",creepyPMs,1
"What the actual fuck? Is this a fetish? Well, you learn something new everyday... how disturbing",creepyPMs,1
"Okay, my first thought was ""why don't you own a cat"" lmao. Cats are a wonderful addition to any household. 
But also I'm sorry that guy was creeping on you. ",creepyPMs,0
"I'll take fuck off, thanks.",creepyPMs,0
"Yup.   I googled it just to be sure - like I said, the odds are very low.   But ""very low"" isn't the same as ""nonexistent"".",creepyPMs,0
Definite +1 to neopets. I just checked my 12 year old account the other day and the site is literally the same as it used to be back then. The forums are pretty tightly upheld too but I feel as though she'd be fine not even going there. I used to spend hours on that site and I didn't even know the forums existed.,creepyPMs,0
"Sounds like he may have some kind of mental illness? I knew a guy who also just got obsessed with certain people... some of them he had had significant interactions with, but others were really just acquaintances or people like retail workers whom he'd only ever talked to once.

He liked to talk about them, wondering what they were doing, devising different scenarios and then asking what I thought various ones would do, and usually he'd be giggling because they would be weird things like ""What if someone just walked up to (dude's name) and burped in his face? Do you think he would punch them? Do you think he would inhale the burp and go, 'yum yum!'?"" Keep in mind that I only knew one or two of these people, most of them I'd never met. He introduced me to one of the ones I didn't know once, and it was pretty clear they weren't exactly on the same page as far as being friends and they were probably a little creeped out by him (he was obviously mentally ill to anyone who interacted with him, but that doesn't make it less creepy). He wasn't a bad guy but he had a lot of weird stuff going on up in the ol' noodle.

Sorry, I don't know if maybe that makes it seem even creepier... but I suspect that while the guy texting you may have an easier time living day-to-day than the guy I knew, it seems like the same sort of thing. I hope it stops though, because that sucks.",creepyPMs,0
I certainly hope not. Stay safe,creepyPMs,0
"I think people actually come these threads to try and pick up girls by being ""oh but baaaaaabe, I'm so much better than that loooooser.""",creepyPMs,0
"""Are you Dewey?""",creepyPMs,0
Xx,creepyPMs,0
"Your comment has been removed in accordance with [rule 2](http://i.imgur.com/VkFOras.png) ([transcript](http://www.reddit.com/r/creepypms/wiki/rules)). If you would like to discuss this decision, please message the mods [here.](http://www.reddit.com/message/compose?to=%2Fr%2FcreepyPMs) Please read the complete rules and sidebar before commenting again.",creepyPMs,0
"You're telling me, I've been spelling it wrong too this whole time then. And I'm in the US.",creepyPMs,0
That took a very unexpected turn. ,creepyPMs,0
"She said to give her six and make it hurt, so I did her twice and hit her with a brick.",creepyPMs,0
[removed],creepyPMs,0
[removed],creepyPMs,0
"I have a tiny desk canon, now let's get scientists on an explosive device that'll shoot out glitter that says friends and we can make millions!",creepyPMs,0
"Dude, why would you even do that? 

Like randomly messaging people with 'ew' and you think that this has NOTHING to do with your behavior?

The more you talk the more convinced I have become that you pushed a lot of buttons before it got to this point. 

Banned from r/okcupid, multiple times was it? sending out random 'ew' msgs to people who you don't know that just pop up in your browse messages, the 'people say things to me that are unfair and I have to fight back' bullshit.

You're not smelling like a rose here bud. ",creepyPMs,0
"""You wouldn't know what to do with it.""

Oh yeah I would. Cut it off and keep it in my Evil Feminist Matriarch Dick Collection, fucko.",creepyPMs,0
It's an open and shut case. She'll probably get 10 years in Sing Sing.,creepyPMs,0
"PERFECT, it's a truck!",creepyPMs,0
"OP, you're classy as fuck. Gave him plenty of time to backpedal, pointed out exactly what he said that was awful, and told him what not to do last time. You have way more patience than I do.",creepyPMs,0
[](/spikenervous)Was it bad for you?~,creepyPMs,0
"Oh, my bad 😉",creepyPMs,0
"Holy Shit!

Things I'd rather see:

-A documentary on the blobfish

-A cashier covered in Cheetos dust

-Goatse (DO NOT LOOK THIS UP)

-A blender blending another blender

-A 10 hour video of people playing golf

-Donald Trump wearing a sombrero and tights

or really anything else",creepyPMs,0
"He'd trade his guns for love, 

But he's caught in the crossfire.

And he keeps waking up, 

But it's not to the sound of birds.",creepyPMs,0
"The first picture was of piss soaked panties, fine whatever you have a fetish, the second was a gross penis. Yay! ",creepyPMs,0
No ego stroke there,creepyPMs,0
[deleted],creepyPMs,0
"I think it's funny how these creeps think these kinds of messages will make them stand out and get a response. Oh you'll stand out alright, but not in a positive way. LOL",creepyPMs,0
[removed],creepyPMs,0
Possibly the weirdest pm ever. I was about to say come on where's the back story. The fact there is none is hilarious. You could be passing this freak every day in the street and you'll never know. Ask to meet up for a beer! Ask what he's wearing so you can spot him and get a friend to go for you or something. Or just go and confront him to put it to bed ,creepyPMs,0
[removed],creepyPMs,0
Wow very romance,creepyPMs,0
How you doin'? ;),creepyPMs,0
"Excellent, I'm a chav now",creepyPMs,0
"Update: I called my city police department and gave his name and age. They were able to find him in the database and confirmed he has schizophrenia. The dispatcher didn't confirm he's already seeking help, but said to avoid him. I suggested they contact his family to ensure he will, if not already. Thanks for your help all. ",creepyPMs,0
"Oh my God, this guy! 

Says he's in the hospital for 'cracked and bloody feet"" he got from walking (1-2 *whole miles* a day. Sarah is such a lucky gal! ",creepyPMs,0
I like how that was all one text. Like he was literally just typing his stream of consciousness. Too bad he didn't re-read it before he sent it. Would have saved him some serious embarrassment. ,creepyPMs,0
I wonder if he does. ,creepyPMs,0
Curiosity killed the cat. ,creepyPMs,0
