body,subreddit,moderated
Of course.,creepyPMs,1
If you don't want to talk to somebody just...don't talk to them. You could have avoided this whole creepy conversation by ignoring his first weird ass message. ,creepyPMs,1
"Come on man,  you can take it.   
  
It's only though for girls.   
  
   
Poor girls",creepyPMs,1
"Damn, thats almost as sad as making gw posts",creepyPMs,1
"You did a shitty troll and admitted it.
Please stop posting this ",creepyPMs,1
"just so you don't rule it out, i've been fucking with my friend via text for 6 years with CatFacts. he has no idea who it is because i have multiple numbers. it drives him insane because he has no idea who it is. his brother knows all about it, too, which makes it even funnier. 

one of these days, i'll post the epic story on /r/funny.",creepyPMs,1
Cant hate on the guy for trying?,creepyPMs,1
This isn't actually a threat though.....,creepyPMs,1
" I'm convinced asexuality is not equivalent to being gay or lesbian, so I'm sorta with grey message person",creepyPMs,1
"Thank God I only commented once 


And I'm only subbed to r/the_donald for dank memes ",creepyPMs,1
"How do you get btw, OP?",creepyPMs,1
"Sorry, I didn't know that this was a safe space when I left my previous comment. I will instead leave a comment in full agreement with the OP as is required.",creepyPMs,1
"Am I the only one who thinks u/farthegn acted like a dick by replying to her? Don't provoke them, just ignore, they leave you alone after sometime.",creepyPMs,1
"Hate to say it, but best aphrodisiac next to money is a wedding ring. 

For some women it's a form of quality control that since *someone* married him, not everything must be bad. Maybe she could even fix him.

Other women like it because it means the relationship will remain strictly casual since he would never leave his wife and kids.

I'm sure there's tons of other reasons, too.",creepyPMs,1
"Meanwhile in the rest of the world a giant hurricane is hitting the Caribbean and the south eastern US.

Lots of countries have weather.",creepyPMs,1
"Actually, you sound like the creepy one. ",creepyPMs,1
Obama literally just signed the worlds rights away to the NSA days ago and you are worried about trump being a fascist ,creepyPMs,1
Any chance I can get a link to the archive of that thread?  You know....for masturbatory purposes. ,creepyPMs,1
I had a similar experience with a friend of mine. Then she broke up with him because of how controlling he is,creepyPMs,1
"What app is this anyway?
",creepyPMs,1
"Yeah, it was more meant like a ""fml"" type of thing. Sorry if it didn't come across like that ",creepyPMs,1
"I don't agree. I would much rather people knew I tried something like a total creep like he did then have them send naked pictures of me to my family. That is just me though.

",creepyPMs,1
"I agree with what you're saying, but I don't see a threat here. I see some dickhead saying something fucked up, but he's not saying he's going to do it.  

Sure, you can report it to the police, but a one off post on an app is unlikely to garner their attention as a credible threat. ",creepyPMs,1
So who was it then?,creepyPMs,1
"> Trump is legally the president, which means America lost

Stay salty, loser. See ya in 8 years.",creepyPMs,1
It's a man,creepyPMs,1
"I do NOT condone the sending of dick pics at all.  I have never sent a dick pic to anybody, not even my wife.  THAT said, if my wife was feeling down and needed a ""pick me up"", the absurdity of me sending a dick pic WOULD, in this very specific case, be a ""pick me up"".  Again though, I am not saying dick pics are ever appropriate and unsolicited dick pics from strangers or non-romantic interests are even worse.",creepyPMs,1
I always wonder why the girl keeps answering in these kinda conversations,creepyPMs,1
What's your size then?,creepyPMs,1
He must not have been attractive enough for this to be funny instead,creepyPMs,1
"I suppose in a monochromoatic universe such as the one you live in this would be true, but I do not.  I have no qualms in inviting others to leave your monochromatic universe behind, either.  Eh.",creepyPMs,1
TIL being male is a negative...,creepyPMs,1
"I hope you're a teen as well, or you've got some explaining to do as well ",creepyPMs,1
Learn how to accept a compliment and leave it at that. There was nothing creepy about this one. ,creepyPMs,1
Which one's the creep?,creepyPMs,1
"That's because that is a creepy as fuck way to do it.

Like, seriously. It's not that complex is a concept that there are people out there who are just looking to get off and get on with their lives. If that's what you're looking for, then you should be upfront and honest about it.

Because imagine they already very common situation of if you went on what you thought was a date with someone who was hiding what they really wanted, thought it was going *great*, and then never hear from them again after the sex.",creepyPMs,1
"It's okay, not everyone has imagination.",creepyPMs,1
I wish you didn't have to blur the creeps names.  Might be fun to message them. ,creepyPMs,1
"I'm not antisemetic, when I call a Jewish person a Kyke I just want them to see my point of view. Jeesh thin skin much ?",creepyPMs,1
U shouldve fucked him imo. Ive never seen someone start a convo with how many animals he owns and because u said unwere on a dating site i think its a lil more acceptable to just jump straight to the point of wanting to fuck and how long he can last haahah. Who knows man he coulve been real cool in person. ,creepyPMs,1
Best reply is no reply. They want attention. They need acknowledgement. No interaction with them while you continue to participate in other threads drive these nutcases crazy.,creepyPMs,1
"Seems... like... a troll...

Feeding the troll, you are.",creepyPMs,1
"Nah, I'm just not a judgmental prick. ",creepyPMs,1
She corrected his inability to type but missed out a word in her last message ,creepyPMs,1
">Haven't had enough conversations on reddit to have developed a system like that. It's a smart one though.

this is the most braindead excuse ive ever heard",creepyPMs,1
"I don't condone the harassing, but a lot of people were peeved from the fact that the site a'ready had a small userbase which was also growing and then they were suddenly dumped after the site said they'd allow cub porn. I'm personally confused as to why people went to a site that allowed content they don't like. If they don't like it, why go there? I know there was a whole security scare on FA, but wouldn't SoFurry have been a better choice?",creepyPMs,1
"It actually does look really weirdly shaped, I was turning my phone around trying to work out what's going on in there. Obviously some kind of vegetable.",creepyPMs,1
I just don't get why OP would even entertain the fool for so long. I would've peaced on that conversation after a couple sentences. I guess it makes good fodder for this sub?,creepyPMs,1
"Thank you. I still feel guilty about it though. 

I hope that you will be able to fall asleep soon. What is the clock over there? ",creepyPMs,1
Just because you don't subscribe to an idea doesn't mean it isn't fact,creepyPMs,1
"Maybe someone can help me out here: how is this animal abuse?  I don't know anything about dogs, but it would seem with a male dog on a female woman, the dog wouldn't be getting hurt, right?  Again, I know literally nothing about dogs.  My animal knowledge extends to horses and cats, then I'm pretty much spent.",creepyPMs,1
That's not highly gay or anything. Wtf?!,creepyPMs,1
I will never understand why people continue to respond to these weirdos past the first few messages.,creepyPMs,1
are you going to be ok? Read comments that OP posted. She wants him to be ok too,creepyPMs,1
You're on FL. What do you honestly expect?,creepyPMs,1
"No idea who this guy is but anyone with 39 unread texts is a sick, twisted fuck!",creepyPMs,1
"Yea, that wasn't a woman...",creepyPMs,1
Bros* before hoes.,creepyPMs,1
Paging /u/NoseFetish ,creepyPMs,1
I just don't get this... Why not block such a person immediately? Pretty sure this is extremely annoying.,creepyPMs,1
"I like his honesty, though. Sometimes being straight forward will work.",creepyPMs,1
I can't even believe this is real what kind of pedophile would say this over text lmao,creepyPMs,1
"Just block him, it's the best thing you can do. He's just trying to manipulate you and make you feel guilty ",creepyPMs,1
[For the lazy.](https://imgur.com/zvP3Ktn),creepyPMs,1
"Why are you so friendly lmfao, tell him to fuck off. ",creepyPMs,1
"Maybe you generation should stop making euphemisms out of harmless phrases, then getting insulting us when we use them in their original form.",creepyPMs,1
That's definitely a joke though,creepyPMs,1
"To be honest, I don't feel like this was that creepy. Some people think it will make people smile to be told that they're beautiful. It's very different from the creeps that think it is their duty to tell you how sexy you are and explain all the gross things they would do to you.

With that being said, I understand why your guard is up at random guys that just have to let you know what they think about your physical appearance. It gets really annoying that you can't just exist, you have to be reminded that your appearance has been approved by Men^TM and you can now carry on with whatever you were doing. But I don't feel like, in this case, he had such a bad intent.",creepyPMs,1
"I'll rephrase:

I'm not sure those were OPs real interactions, but the replies came from a definite C You Next Tuesday ",creepyPMs,1
The white edge on the right triggered me so hard.,creepyPMs,1
Well when you post nudes online youre gonna get this type of shit. Duh.,creepyPMs,1
"I was more distracted by his unbelievable paleness. Like, damn, he looks fairly well built, go stand in the sun for a few.",creepyPMs,1
Omg its lolidaisuku or whatever the fuck i dont even care hes a fucking creep. Had the pleasure of him trying to defend his pedophilia by saying that and then correcting a grammatical error thinking hes coming out on top. Nope creep fucking pedophile,creepyPMs,1
"That Facebook post was purposely inciteful. You got exactly the response the post called for (though wouldn't have gotten it from me; I'd have simply unfriended you as I don't keep drama on my friend list). After basically daring someone to disagree with you, you've labeled the person who disagreed ""creepy"". 

The post is also highly negative, immature, and whiny. You won't change any minds or attitudes this way. ",creepyPMs,1
You... Gave him your number after meeting him in the parking lot?,creepyPMs,1
I think someone gave you that girl's kik,creepyPMs,1
Are we talking about a 13 year old or a 19 year old? How old exactly is this teenager? ,creepyPMs,1
"To be fair, he didnt do much to warrant this response",creepyPMs,1
"Assuming hes going on your progresspics post, I would disagree with his assertion. I've gone from 315 to 205 myself, and awesome for you for your progress.",creepyPMs,1
"Same, I'm gonna try it on my SO next time I wanna order pizza lol",creepyPMs,1
I'm not claiming all white people are racist; I'm reiterating the claims others make. ,creepyPMs,1
"OP, you're a useless cunt. Probably fat too.",creepyPMs,1
Why would you have a child with a guy who writes like he's 16?,creepyPMs,1
OK Satan ,creepyPMs,1
I sexually identify as your heels.,creepyPMs,1
"That wasn't a neg, you paranoid weirdo. Neither was that.",creepyPMs,1
Just say no?,creepyPMs,1
"That's when you just post your address and say ""I got all day pumpkin.""",creepyPMs,1
"Why attack her with unwanted sexual messages?  
Obviously OP is going to use whatever limited ammo she has to tell him to fuck off.
The feelings of crreps don't matter when you're fending them off.",creepyPMs,1
"If I had that conversation I'd feel proud about myself.   First manly convo I've seen here in a bit. 

(Yeah. I know I'll get down it's for this.  Down  vote away.  My opinion my consequence).  ",creepyPMs,1
over the rine*,creepyPMs,1
"I guess you're right ,the same way Rihanna, Beyonce etc all of these are funny clowns when they bleach their skin.",creepyPMs,1
I didnt really count that many chances,creepyPMs,1
"I'm a bit confused about this sub. Is it supposed to be saying someone is a creep for the sake of it or are people trying to bait guys into being creeps or what?

Don't particularly think his first comment was obscene and then you are straight up dismissive of him?

Obviously he went full dickbag after that, but I'm curious as to if I'm missing the point of this sub here.",creepyPMs,1
What was it? :/ ,creepyPMs,1
"Question though; let's say you are a pizza person and the person you're delivering to is the most attractive person you've seen and you would like to see if you two have anything in common

How would you approach the situation? Obviously you can't use the number they gave you. Do you write a letter? Haha. Obviously the other person has no obligation to respond or interact. But us it right to try and contact them?",creepyPMs,1
Why are you using comic sans,creepyPMs,1
"If he ends up in jail, with any luck, he should end up getting several inches of justice.",creepyPMs,1
Is that better? ,creepyPMs,1
"tell me where i judged the person in my comment?

maybe take a step back from your computer and read more carefully.",creepyPMs,1
Ok the guy's being weird but you were being a bitch to him before he started saying anything perverted,creepyPMs,1
Why shouldn't it?,creepyPMs,1
"So its being a ""niceguy"" to question the legitimacy of a post on reddit? ",creepyPMs,1
Yeah but if he's talking to *you* this way there's no saying how he's talking to other girls. Just send these screen caps to the local PD's page.,creepyPMs,1
"I'm confused as to how there's rules against being rude about people, yet every post here is to make fun of someone who is being a creep. And the fact that people get banned for merely showing face in certain subs. It's not as if this sub is a ""safe place"" or anything, I've spent quite some time here out of curiosity and I don't get why these rules are in place. It's not a bad sub, but it isn't some shining gem in the sea of all the subs on Reddit.",creepyPMs,1
You ruined someone's live. ,creepyPMs,1
So that's how you attract women.,creepyPMs,1
"Was he of Arab origin? The way he was expressing himself, with all that ""romantic"" approach is quite familiar to me.... Not to mention the persistence.",creepyPMs,1
"Fair 'nuff, I was only referencing in general.  People fail at monogamy pretty often, and most of them are still good people. ",creepyPMs,1
"I'm sure that a real hacker, or not even that, someone who knows a little bit will tell you that the whole conversation is cringe worthy. Point of attack? Cross reference info to a server? .... What?",creepyPMs,1
"Aside from this guy being a caveman with a phone, it's not unknown for women in a commited relationship to invite someone of the opposite gender into their bed.",creepyPMs,1
OP got trolled,creepyPMs,1
I knew what he would ask yeah but I wasn't expecting him to be such a pussy. There was this other guy who pm very similar; I'm wondering if it's the same person. He also got super upset w me. I should post that message too. ,creepyPMs,1
Your boobs look nice tho. ,creepyPMs,1
Same. I was expecting some colorful lumps that kind of resemble a bag of melted skittles and just got an weird looking dick.,creepyPMs,1
**** Always missing out on the **bees and flowers**tards! Did I miss something important?,creepyPMs,1
"I'm not sure what state you are in but if this was NY this is clear cut extortion

> ""You make it worth my while not to send them""

New York Penal Law section 155.05(2)(e). defines larceny by extortion as: 

> A person obtains property by extortion when he compels or induces
> another person to deliver such property to himself or to a third person
> by means of instilling in him a fear that, if the property is not so
> delivered, the actor or another will...:
>   
>   (v) Expose a secret or publicize an asserted fact, whether true or
> false, tending to subject some person to hatred, contempt or ridicule;

Do yourself a favor and talk to a detective
",creepyPMs,1
Stop trying to fit the word misogynist everywhere you dumb feminist ,creepyPMs,1
So did you send the nudes or wot,creepyPMs,1
"Why blur it tho? I'd out the fucking predator! If it ends up that he's shamed for it, who's fault is that? He's sending pics of his horrible little appendage to everyone and anyone, it's his own tough shit if it ends up getting posted, face 'n' all!",creepyPMs,1
You shared a pic with him? I would have just stopped messaging and moved on.,creepyPMs,1
Valid response,creepyPMs,1
Why respond in the first place? Why not block him after the first dick pic?,creepyPMs,1
Why are you pretending to be a dolphin on the Internet? ,creepyPMs,1
Boring meets stuck-up?,creepyPMs,1
"lol this looks fake as fuck,the guy in the pictures looks quite attractive and self secured in himself to not make this kind of post ,this looks like some bad tumblr/sjw strawman propaganda,notice how he says ""white men"" in 3rd person like sjws on tumblr refer to evereything thats wrong with society in their eyes.why not say white people instead of men if youre a white supremacist because they obviously have women who are white supremacist as well.i also noticed this account was created a day ago probably for the purpose of this post.",creepyPMs,1
Downvote cause astrology,creepyPMs,1
"Im not projecting anything im just not allowing you to tell a ""half truth"" to be a victim and have a self pity party parade created online for you when you choose to not acknowledge the part you played in this ""crazy"" co workers life. Clearly im just a ""triggered"" troll though careful im psychotic and mentally unstable wouldnt wanna go on a mass shotting spree at your job ;)",creepyPMs,1
I'm always a big fan of sending screenshots like these to his mom/sisters/family if you can track them down. ,creepyPMs,1
go fuck yourself,creepyPMs,1
Why are you hanging out with sketchy guys in an alley? ,creepyPMs,1
"Jesus Christ lady. You need to go sit in a fridge or something because you have -no chill- at all. What he said isn't cool at all, but you started it off by being a bitch. You. Are. A. Bitch.",creepyPMs,1
Fuck you fucking cowards,creepyPMs,1
"Tinder is the dtf app. There's loads of dating sites, not any 'casual dating' sites around. So don't complain tinder is like that, it's just filling a void in people's needs.",creepyPMs,1
"If you wanna body this thread, technically you have that right. But IMHO, this scumbag deserves worse than ""your dick is hairy & crooked, lulz."" As I said, not particularly damning. The same could be of me, TBH. Let OP live.",creepyPMs,1
"why didn't you just remove him instead of talking for an extensive amount of time, I'm don't know FB that well so maybe removing someone is hard in that case sorry.",creepyPMs,1
Depends on gender on how much sexual frustration!,creepyPMs,1
No it's not rape culture.,creepyPMs,1
"I don't know, OP sounds like a bitch just by reading this. Now I'm tempted to have everyone I know in the Midwest seek her out and msg her on fb. ",creepyPMs,1
Should've told em you were down to bang. This would've got the info you desired.,creepyPMs,1
"Seriously, I feel sorry for people with paedophillic desires because I can't imagine how awful it is to just sit on those feelings forever while society tells you that you're scum just for having them. Oh wait, no that's happened a lot. Anyway, if you're trying to justify why it's not that bad, it's that bad and you should seek help.",creepyPMs,1
It was just humorous illustration of how many people are still agitated.,creepyPMs,1
how do find that manipulative smh,creepyPMs,1
Why not just block the number?,creepyPMs,1
"While the guy's obviously a piece of shit anyway, look at the date of the first message.",creepyPMs,1
"So you're telling me my girlfriend doesn't like it when I slap her pussy as foreplay? That explains why she bites the tip of my penis, I guess. ",creepyPMs,1
"Yeah, he seems mentally ill",creepyPMs,1
"That's not any better. 

Are we supporting people here for experiencing creepy, inappropriate, bizarre, awkward, or offensive PMs or supporting their maliciousness in an unjustified way? You can't simply do that every time someone upsets you. I'm not victim blaming here, just not condoning poor behavior.",creepyPMs,1
"Yeah, while there's a chance he did this, friends are assholes when they have no repercussions...he may be telling the truth...his response gives me hope he is",creepyPMs,1
This is a while other level of creepy/crazy,creepyPMs,1
"Discussing the topic? You lost. You knew the rules. You lost. There's no discussion to be had but ridicule of a bunch of entitled crybabies who can't handle not having it their way.

You lost. You won't accept it. We have nothing to discuss.",creepyPMs,1
Now I need to see these pics to see what all the confusion is about. For science of course. ,creepyPMs,1
People took this really seriously lmfao ,creepyPMs,1
I do not know what you are complaining about.  He seemed pretty polite to me.,creepyPMs,1
"Except they aren't, lmfao. Stop making assumptions, you fool. Arguments that attempt to social shame are never effective online, because you know nothing about me in person. ",creepyPMs,1
"So petty 
What a bitch

Accept you are weird and move on",creepyPMs,1
I mean i feel like if he really does go through all that trouble the least you could do is driver,creepyPMs,1
Last girl I dated loved it. She brought it up and asked me to. ,creepyPMs,1
I personally think he is owed more of an explanation than this. It's like the girl is trying to make him act like this by not resolving the issue.,creepyPMs,1
"Stalking is different from harrassment. Harrassment should be dealt with somehow, IMO. But stalking, as a blanket and general term, is harmless (upto the point when the person actually contacts whomever they stalk/the people in their lives).",creepyPMs,1
"Not sure if that last one is too creepy. Quite odd, but not as creepy as the others.",creepyPMs,1
It was a joke lol but yh,creepyPMs,1
"Not trying to justify what the creeper said.

But can I ask why you have an OKCupid profile if you're just looking for ""normal friends?""",creepyPMs,1
What a close minded bitch.  He's better off without her.,creepyPMs,1
"Where did he explicitly threaten her? It's like saying ""I'm surprised no one has assassinated_____ yet"" vs. ""I'm going to assassinate______."" Legally the guy is safe, just creepy as hell.",creepyPMs,1
"If a guy has to tell you how big his worm is, it's basically the equivalent to fishing bait. ",creepyPMs,1
"I don't care for Trump, but his wasn't creepy... Just don't respond. It only replied when you typed no repeatedly.",creepyPMs,1
"Creepy, yeah, but you sure seemed to enjoy going along with it",creepyPMs,1
You posted the same thing 3 days ago. :(,creepyPMs,1
"Sure you don't.

Let me refresh your memory since you just deleted the last two days of your posts.

Here is the post I was responding to https://i.imgur.com/2FhD0Qc.png

Since you got banned for it, I PM'd instead of replying on the thread.

This was the link before you decided to delete everything

https://www.reddit.com/r/Morocco/comments/5cauc3/what_are_morrocans_opinions_on_kurds/d9vhnl0/",creepyPMs,1
Can't decide who's more cringey,creepyPMs,1
I mean... this is pretty fucking hilarious tbh. I'd send nudes.,creepyPMs,1
https://www.reddit.com/user/VorpalEskimo your messages are indeed racist towards white people,creepyPMs,1
"I see that it is a little inappropriate, yeah, but the guy said twice he wasn't actually into beastiality. ",creepyPMs,1
The guy is completely normal... ,creepyPMs,1
I was on board until they compared words to rape. ,creepyPMs,1
"> Woman? Man? Gay? Who cares, it's a blow job!

FTFY",creepyPMs,1
"Seeing as how OP didn't post page after page texts that went un-replied to, and it looks he just apologized and dropped it, I'd say he took rejection how one is supposed to.

",creepyPMs,1
"Eh,  looks like your typical awkward high school exchange. Hopefully that guy is still young and can laugh at his goofy thirsty attention-seeking past self later on.",creepyPMs,1
What does girl Gamer have anything to do with this,creepyPMs,1
read that as the guy wanting some barbie and thought op was a fucking cunt,creepyPMs,1
"u/NoseFetish   



Way to go full Nazi...",creepyPMs,1
"I got confused for a moment and thought this post was actually about you and submitted by the guy. There was nothing creepy about his messages, and you were very rude and curt. To be fair it is a pretty nice way of rejecting someone, as he won't feel like he is missing out after seeing such a huge red flag!",creepyPMs,1
I hear you. I just think this situation is pretty much a given when you decide to put something up on an online dating website.,creepyPMs,1
"Correct. I didn't say it was illegal, just stating how it's poor to condone.",creepyPMs,1
"Eh, this doesn't seem that bad. Maybe I've been desensitized because I've been on this and similar subs for too long, but he backed off immediately once he knew she was 17. It was a pretty lame line on you, but I don't know enough back story to know if it was appropriate or not.",creepyPMs,1
I don't get the issue with 'age gap' of the older man and younger gal relationship automatically thinking sugar baby/gold digger considering the average couple is the dude 5 years older than her. Older dudes and younger gals seem to be the norm and way more common than the inverse older gals and younger dudes (doomed failure in my opinion and that is way more suited to be a sugar baby to me).,creepyPMs,1
