body,subreddit,moderated
"Its nice, unless you have Tatoos and piercings, holes in your jeans, dread-locks, or anything other than the suit and tie.  Then you're judged and they avoid eye contact with you on the trains or on the streets.

 And If you are a member and aren't going to church that day it's apparent to your peers, they take ROLE and the kids know who not to hang out with because they stopped going and are probably bad influence.  The ones who haven't stopped but suddenly begin to become absent, neighbors are sent out to check, often the kids of your ""grade"" in sunday school are given direction from their teachers to go visit the kid and convince him to come back.",dataisbeautiful,0
"I'm pretty sure that at some point we'd reach a plateau or idk, maybe the singularity. One or the other... Or maybe hunans wilp be extinct.",dataisbeautiful,0
i always set the specific address. i never use the auto location ,dataisbeautiful,0
"It's worth noting that if no candidate gets 270 electoral college votes (tie) or a few states went to a candidate other than Clinton or Trump (and that candidate doesn't receive 270 votes), then by the [12th amendment](http://www.270towin.com/content/electoral-college-ties/) the House of Representatives votes state-wise for president from the top three candidates who received electoral college votes.  

Due to state-level gerrymandering after the 2010 census, [Republicans will almost certainly control the majority of House seats in most states](http://www.270towin.com/content/electoral-college-ties/) (betting markets put a [Republican controlled House at 98% odds](http://www.pivit.io/politics/2016-us-house-majority/5366)).  The Republican House members would then presumably vote for Trump, the Republican candidate (or face a huge backlash from their Republican constituency).

**TL;DR** If Hillary (or Johnson or Stein) doesn't get 270+ electoral college votes, then Trump will most likely become president.  Trump merely needs to prevent any single opponent from getting above 270.  (E.g., Clinton 269, Trump - 200, Stein - 69, results in a Trump presidency).",dataisbeautiful,0
"I know. I can not quite read Icelandic fluently for the joke. However it is a quite funny think and does have some degree of truth to it. Iceland is not the only place where you have to look up how close you are to your partner before you continue your relationship although maybe not at the bar while hooking up, or even the first sex. The same joke about inbred Icelandic people is also applied to the small towns in the southern US and the small eastern European villages. I am sure there are a lot of cases of relationships having been stopped because of family relations (it happened to someone in my high school). The fact that Íslendingabók makes this easy to look up is a joke with a hint of truth to it. And great work getting it in a easy digital form so soon. I still have a bookshelf filled with local history books that I need to look up if I wonder about someones distant family.",dataisbeautiful,0
"Butterburger, i like dis",dataisbeautiful,0
"Fair enough. I appreciate you taking the time to write it out instead of just downvoting and moving on, and I appreciate that you have a compassionate view. 

I still think the anti-gay view is common enough to warrant harsh criticism, as I've seen the fallout from the disowning and ostracizing of gay kids, and it's absolutely devastating. I will concede that the people I'm talking about are the product of the ""typical"" upbringing from the 80s, 90s, and 2000s, so I hope that younger Mormons are abandoning such harmful practices.",dataisbeautiful,0
do you somehow asume that people swim there and drink from it?,dataisbeautiful,0
[removed],dataisbeautiful,0
"How did HTML become one of the larger words on here? Is HTML even a thing anymore? I know it exists but who is actually writing HTML these days, it's all done in editors. I'd expect to see maybe javascript or something like that.",dataisbeautiful,0
"IDK, maybe McFlurry is different here in my country. I personally don't consider it big at all.",dataisbeautiful,0
The US comparison is homeowners that also own RV's. Basically poor people can't afford to have one unless they use it as their primary residence.,dataisbeautiful,0
*morning pre-game and then Patriots games. ,dataisbeautiful,0
Don't read them?,dataisbeautiful,0
[removed],dataisbeautiful,0
"More proof that communism is sooooo awesome. Look Redditors! Look at the wonderful things it can do for you!

/sarcasm

(bring on the downvotes, because ""socialism is in no way related to communism"")",dataisbeautiful,0
Well look at that. I have wasted hardly anytime at all on the internet. ,dataisbeautiful,0
[removed],dataisbeautiful,0
I couldn't help but read that in his voice. ,dataisbeautiful,0
"If we start requiring our presidential candidates to possess Kennedy's oratory prowess (and speech writers), there are strong odds we will never have another president. Modern US politics lack the ambition of the post war era. And even if that were not the case, modern politicians refuse to chance dividing the electorate by taking a decisive stance on damn near anything. So while it wouldn't be impossible to deliver a ""We choose to go to Mars"" speech with the engagement and compellingness Kennedy elicited, it would unimaginable to find a candidate willing to intentionally and knowingly piss off whomever the anti-Mars lobby are.",dataisbeautiful,0
"&gt; A post must be a [data visualization](https://www.reddit.com/r/dataisbeautiful/wiki/index#wiki_what_is_a_data_visualization).

This post has been removed.",dataisbeautiful,0
"About 8 (registered) 

Population is close to a third of a million. ",dataisbeautiful,0
What? The words that aren't just generic posting words all have to do with web development and administration. ,dataisbeautiful,0
[deleted],dataisbeautiful,0
[removed],dataisbeautiful,0
"Ya Ill pm you my buddy to email. We have a little political blog if you want to post it there, but this is cool / wouldn't be hard to turn into a chart",dataisbeautiful,0
"Yep, agree.",dataisbeautiful,0
"The rule of thumb is for sample size, just like the ""15 samples per independent variable"" thing. It doesn't mean if you have 60 data points you must find 4 independent variables.",dataisbeautiful,0
[removed],dataisbeautiful,0
"Yes, I agree with you sir. I didn't mean that the teachers who has a cold attitude to their students. One of my geography teacher had no interests with her students but when she made a comment about, let's say, your exam results, I could see that I am important for her as a student. Btw sorry about my bad English.. ",dataisbeautiful,0
"That would be pretty weird, considering how many jobs use them. Getting an actual license is the most difficult part, you usually wont get one unless you have a good reason to own a gun. 

The only times Ive ever even seen a gun was either on a policeman or on a US Airforce soldier",dataisbeautiful,0
[deleted],dataisbeautiful,0
"Based on the comments here, I think it's worth separating a few things:

* **Plots with linear segments between points**: Useful for interpolating somewhat sparse data, but confusing if the data is very noisy.  Potentially misleading if the data is very sparse or if the actual data points are not shown, just the lines (implying higher data density than there really is).  Generally not evil.
* **Plots with regressions**: Useful for interpreting noisy data, but potentially very misleading if the regression is too low-order to capture the underlying phenomena, if the data is too sparse, or any number of other things.  Some form of confidence measure should always be provided.  Not generally evil, but easily abused.
* **Plots with splines** (like your example): Basically always misleading.  Sharp transitions create bizarre shapes and (as in your example) can create false minima/maxima and/or imply that the trend is upward when it is downward or vice versa.  Smoothness of the curves suggests smoothness of the data, which may imply the data is far more dense and consistent than it really is.  Extremely poor behavior with noisy data.  Sometimes OK but generally evil.  When plotted without showing points for the real data, always evil.",dataisbeautiful,0
"Calling your hateful ranting a ""point"" is to do it an honour it does not warrant.",dataisbeautiful,0
"You are confusing a dictatorship installed by another dictatorship with socialism/communism. For comparison, look at how well the ""capitalistic"" ""free market economy"" ""democracies"" in Central and Southern America are doing that were installed by the USA.",dataisbeautiful,0
"American here but currently in Berlin on business. 

The difference is quite obvious. There are parts of Berlin on the west that are obviously more prosperous and parts of the east that was more reminiscent of say, Ukraine or Portugal. ",dataisbeautiful,0
"I guess they didn't include the original star trek series because of all the spin offs, but it was cancelled after three seasons.",dataisbeautiful,0
"While I'm going to guess that in some of the areas the polls are skewed by who and where they asked (and sadly alot more liars with good intentions of what they SHOULD do vs. what they actually do).  But you can see that education has a huge roll into the lives of those who are ""god fearing"" or not... something I've been aware of for a long time.  

The Northeast clearly does get it and I do agree that with all the scandals (especially those that have destroyed churches in the Northeast) - there has been a steady decline on people needing to go to church to give these organizations more money to help support what is clearly a corrupted system on many levels.

This isn't the ""put the priest on a pedestal"" society it once was (and how that movie portrayed things).  We instead speak out and sadly in some cases will SUE the religious groups themselves, something that was NEVER thought of a half century ago.  However sadly now, someone has to remove all the clutter from under the rugs that was put there all those decades ago and its not a pretty sight.

Proof in the pudding...  I cannot say I know a single person I went to school with that became a priest or nun.  As a result, the churches are losing their clergy as generations retire (or pass on) and thus no-one is there to replace them.  In some cases, entire parishes are nothing more than a transient priest from another church who comes in to help, because they have no-one living at the convent/rectory.  

Maybe its also the fact that history taught us that someone re-translated the bible only 400 years ago from something over 1500 years old... and that they CHOSE which stories went in and which didn't (that didn't follow the overall ideology of things?)  Maybe, just maybe, that in itself should be realized as one of the most questionable things history has taught us.",dataisbeautiful,0
Colorado resident. Can confirm. ,dataisbeautiful,0
"I would say you're an immigrant. Expat implies you're an adult/almost retirement age. If you've been living in Germany all your life, moreso.",dataisbeautiful,0
"Also, you're right.  A good scope and a .306 (which is a more powerful weapon than an AR15, by the way) and a sidearm would be enough if you only had to defend yourself against 2 or 3 threats.  If those were the chosen methods of defense, however, 256 rounds would still be a good suggestion.  We're talking 2+ weeks of defense planning, not a night out on the town. The idea behind the quantity is simple.  Would you rather not need it and have it, or need it, and not have it?",dataisbeautiful,0
Dude montana should be bluer. Crosses and ten commandments everywhere.,dataisbeautiful,0
"Makes sense, they have the FDA and USDA crawling up their asses constantly.",dataisbeautiful,0
I'm also in Alabama.  Sometimes I forget it's Sunday and wonder why so many people are dressed up in Walmart. ,dataisbeautiful,0
[removed],dataisbeautiful,0
"Oh, sure.  Talk about a red herring.  ""Refer to the many other comments in this post."" Sure, that's a great source.",dataisbeautiful,0
"It's less mormon in the commercial centers.  Head out of salt lake, and you'll see small towns made up of 99% mormons. ",dataisbeautiful,0
"As someone living in Florida, I spend way too much time looking at these forecast maps during hurricane season. So glad they exist.",dataisbeautiful,0
"Worth mentioning- if my guns are in the safe they are unloaded. Maybe I wasn't clear, but I'm only condition two if there is a plausible immediate need for my gun. ",dataisbeautiful,0
Mental attributes are tied psychology so like?,dataisbeautiful,0
"Good thing about today's music services though is that there are so many good artists out there that they are easier to find. I just think the talent isn't mainstream, which I'm totally okay with. People who like that garbage will never understand what great music is. Especially the younger generation. ",dataisbeautiful,0
It was weird. So weird it was absurd. The underground train network still operated it just didn't stop eat the East Berlin stations. They had a dedicated highway and Trainline right to the West but they couldn't get off while on it. The east tried to starve the West so there was the Berlin Airlift. And now we have people arguing that walls are a good idea. ,dataisbeautiful,0
I don't think you know what frying means. ,dataisbeautiful,0
[removed],dataisbeautiful,0
"It also correlates (closely resembles) other data maps; such as obesity, well-being, electoral map, high school graduation, and pickup truck ownership",dataisbeautiful,0
"Because religion is not an addiction, I personally think it's a delusion, but it is not an addiction",dataisbeautiful,0
[deleted],dataisbeautiful,0
And fuck your cousin too!,dataisbeautiful,0
"&gt; I have no idea how you interpret an ""anti-immigrant narrative"" into my comment.

Your follow up comments suggest you are trying to push a narrative. Furthermore, your original comment seems to suggest that the article is wrong.....I would think they are smart enough to not make the comparison if indeed the per capita differences in immigrant was actually in East Germany's favor. 


Again, it's your follow up comments that helped support that you have a narrative to push.You basically kept doubling down on it. ",dataisbeautiful,0
Peanut curry chicken with cauliflower rice.   Orange chicken with fried rice.  Thai chicken. Mac  ncheese BBQ chicken pasta.  It's not boring food.,dataisbeautiful,0
"""Ah swurr ah'v only had one drink offsir!"" As you spill the remnants of a big gulp filled with Long Island ice tea all over the cop that pulled you over. ",dataisbeautiful,0
"Would be interesting if the map is taken to a lower administrative level, NUTS-2 for instance (I believe that Eurostat provides such data, and there are corresponding shapefiles). There would be very big differences within the countries themselves, especially in the larger ones like Spain or France.",dataisbeautiful,0
[removed],dataisbeautiful,0
"Ruth's Chris Steakhouse.

The only place where the number of calories match the amount on your bill.",dataisbeautiful,0
"US lives in a competitive world though, unlike Rome.",dataisbeautiful,0
"""2000 for women, 2500 for men"" is really total bullshit. only active tall women can clock in at 2000 kcal expended per day, most women don't need nearly as much. same for men, 2500 kcal is the daily requirement for a 6'3, 180 lbs man who exercises several times per week.",dataisbeautiful,0
"&gt; Ampelmännchen 

Please tell me that German actually has a specific word that means ""the silhouette of the man on the traffic lights that tell pedestrians when to cross"".",dataisbeautiful,0
"Well, I think it is because they have the ""they will steal our jobs attitude"" even though I think it is wrong I can not blame them when you see ads on youtube that say ' help refugees immigrate and hire them '.",dataisbeautiful,0
Is the question weekly church attendance or weekly religious service attendance?,dataisbeautiful,0
"Yup I make most of my meals at home and sometimes don't lose weight. It is easy to overdo it with the oils, cheeses, fatty protein.  Hell I make an 8 ounce burger at home  with freshly ground hamburger and pork topped with cheese, fried mushrooms, and bacon and it is over 1000 calories not including any side dishes.

However it is also much easier to reduce calories at home since you can also avoid those oils and whatnot. (Not that I am saying oil/fats are bad, I am saying it is extremely easy to eat 200 calories of oil without even thinking about it, as it is less then 2tbl 
",dataisbeautiful,0
Fair enough,dataisbeautiful,0
Please eat more. maybe you can learn to cook foods that you might enjoy.,dataisbeautiful,0
"Life is really really short. insignificantly short. 
exaggeratedly short. wonderfully and charmingly short. and I just Realized consciously that I love being alive.",dataisbeautiful,0
[removed],dataisbeautiful,0
"The area is historically poor, having had an agricultural-based economy instead of an industry-based one like the north.",dataisbeautiful,0
"&gt;ALMOST HUMAN was good, FOX aired it out of order and confused everyone

I never watched the show, but boy does this anger me. Who could think this was a good idea for any nascent show with a continuing plot thread?",dataisbeautiful,0
[removed],dataisbeautiful,0
Tomato juice and gummy bears.,dataisbeautiful,0
"This is a particularly big problem with monitoring data in system admin type tools:

http://www.monitorix.org/imgs/ntp.png

http://i.imgur.com/ZyKj1ae.png

http://i.imgur.com/vlROK6x.png

https://www.bijk.com/images-graphs/server_stats_graph.jpg

I think computer people tend not to have backgrounds in experimental sciences where you're taught about graphing, experimental error, etc.  While it's true that you're exactly measuring the value of a variable at a specific point of time, that's also true when you're taking precise values of temperature of a black box with a scope.  Just because the scope measured an exact temperature of 507.3 Kelvins, doesn't mean that that precisely represents the external state.  Similarly, just because the network bandwidth used is 73.2 Mb/s, that's using bucketing based on discrete time intervals, and there's a lot of chance based on where those time intervals lie.

In most cases the point of the graph is to understand short and long-term trends, so joining points together doesn't help with that.  Instead, it would be better to treat those measurements as samples of some external quantity.  Then you could attempt to fit curves to the data, which can help you understand what's happening better than simply joining adjacent points.",dataisbeautiful,0
Family Medicine and Physical Therapist tend to be the lowest earning specialties in medicine; cardiology and oncology amongst the highest (middle of the scale here). ,dataisbeautiful,0
"&gt; The fax machine was invented the same year people were traveling the Oregon Trail.

For a while I thought you meant the game.",dataisbeautiful,0
It used to be that the hard left were pretty anti-immigration. It isn't really a left or right issue. ,dataisbeautiful,0
"Live in Salt Lake County, all kinds of shit is open on Sunday.",dataisbeautiful,0
"They still exist in Bergen County, NJ where I'm from.  Restaurants are open but all retailers are closed.",dataisbeautiful,0
"I mourn for that one, mostly for Amy.",dataisbeautiful,0
Technology moves fast when globally billions are being poured into it.  Every car manufacturer and startup are working on it.,dataisbeautiful,0
"Part of it might be population density. People who live far away from any churches, or only nearby one or two which they may not like, will be less inclined to go at all. ",dataisbeautiful,0
Forreal?!?!? I'm about to go get me some butterburgers.,dataisbeautiful,0
I'm surprised by the amount of backlash you're getting for wanting to protect yourself with an AR-15. People can do what they very well damn please within the laws of the nation.,dataisbeautiful,0
"&gt; I think it's more fucked up that we still use them...

fax machines are *still* significantly more secure and reliable than email, so there's no reason to throw them away.",dataisbeautiful,0
"Better Off Ted is without question one of the funniest sitcoms that nobody has ever heard of. I know it gets some reddit love, but I've met like two people in real life who have watched it. 

I was also sad that ""Reaper"" didn't make the list. Great, funny, weird show that never quite found a solid enough footing to make it past a second season. ",dataisbeautiful,0
"[Wow, nature sure is neat!](https://www.youtube.com/watch?v=Hm3JodBR-vs)",dataisbeautiful,0
North to Alaska by Johnny Horton is the only Alaska mention I can think of.,dataisbeautiful,0
[removed],dataisbeautiful,0
"&gt; there is no way you're going to eat even half of it before you want to throw up

Add another 50 on top of it, and I challenge you for a hundred bucks!",dataisbeautiful,0
Wow! This... this is awesome! Thanks.,dataisbeautiful,0
"I grew up a Mormon, and I gotta say, whether you agree with the church or not. Utah is the greatest place in the world. People are generally really friendly here. If you like the outdoors we have the greatest places in the country to go explore. Skiing here is amazing. SLC women are the most beautiful women I've ever seen. &lt;3 UT",dataisbeautiful,0
"Here they could be open, but no alcohol sales. Then stores could sell low beer (3.2%), then beer and wine... then fuck it. Do what you want. It took about ten years to run through that process if I remember correctly.",dataisbeautiful,0
Would that be appropriate here? Homicide isn't exactly a sampling issue; It's not like the police only know of 1 in every 10 of them or something. There's no error to calculate.,dataisbeautiful,0
[deleted],dataisbeautiful,0
[removed],dataisbeautiful,0
"there's a ton of cities with worse lead poisoning than Flint, Michigan. 18 in Pennsylvania alone. According to CDC data, 40% of cities that reported lead testing data had higher incidences among children. It's a little scary that no one really talked about that during the whole Flint fiasco. ",dataisbeautiful,0
"Germany had an explosion of ""Kevins"" after Kevin Keegan joined a German soccer-club (Hamburg, IIRC) in the late seventies.",dataisbeautiful,0
"Or, similar to how this article might have an agenda, McDonalds also has a vested interest in publishing lower numbers?",dataisbeautiful,0
Their god can not stop my Karma Roller Coaster.,dataisbeautiful,0
[removed],dataisbeautiful,0
"It's ok man, no problem haha.",dataisbeautiful,0
"The thought of ""getting out of the city"" just didn't occur to me. West Berlin was big and diverse enough that I never felt constrained at all. I guess that knowing *I* had the right to travel anywhere in the world (including east Germany) whenever I wanted, as opposed to the east Germans encircling us, contributed to that fact.",dataisbeautiful,0
[removed],dataisbeautiful,0
[removed],dataisbeautiful,0
[removed],dataisbeautiful,0
"Right? I mean, it's the *source* of all cheesecake.",dataisbeautiful,0
"That always seems to be the rub. Yes, housing and cost of living is higher in places like NYC and SF... but those two cities also have the highest median salaries in the nation. So you're not necessarily paying more (as a percentage of income) for housing in those cities.

(Of course, you're paying far more on a per-square-foot basis, but extending the example to the extremes, few would prefer a large cheap house 2 hours from civilization/work over a luxury apartment across the street from a Shake Shack and one's work office.) 

I'm not sure who offers this data, but it'd be interesting to see which places get you the best ""economic value"" – in terms of median income relative to median home prices/cost of living.",dataisbeautiful,0
"&gt; Why does this number matter?

I find it illuminating as it gives an indication towards cultural practices within a country. It is pretty interesting the startling difference between most countries in south and east europe with the west and north, for example, and also the notable exception of France compared to its neighbours

&gt; A non vegetarian restaurant can still sell vegetarian meals.

Of course non-vegetarian restaurants can still sell vegetarian meals, but having a restaurant that is dedicated to selling only vegetarian meals is a step further.",dataisbeautiful,0
[removed],dataisbeautiful,0
/r/The_Donald is a ~~good~~ ~~bad~~ awful place to get to know their types.,dataisbeautiful,0
I think I can trust the [ATF](https://www.atf.gov/firearms/apply-license) to do their job,dataisbeautiful,0
Also Alexander the Great,dataisbeautiful,0
"&gt;but we didn't dismantle it

1. Dismantling has nothing to do with avoiding incompatible cultures. I'm not advocating we dismantle the middle east. I'm advocating letting middle eastern people do whatever they want with their societies, but they need to stay there.
2. We did ""dismantle"" Germany. We broke it into several separate nations and started ""denazification"" of our controlled sections.

&gt;Views on what defines incompatible and where the line should be drawn depend greatly on how much you zoom in historically.

My view on what is incompatible is all that matters. ",dataisbeautiful,0
[deleted],dataisbeautiful,0
[removed],dataisbeautiful,0
"I miss Twin Peaks. They recently filmed a new season in my city (same location as the original), and hopefully it will be good! I can't wait for 2017!",dataisbeautiful,0
