body,subreddit,moderated
"The thing is that there would never be a reason to stop buying it. There's a legitimate, massive market for opioid analgesics that can be filled. Subsidies for alternative crops is also a good idea but there are other hurdles to overcome, not the least of which is how terrible infrastructure to get goods to market is in much of Afghanistan. They produce a lot of valuable crops like pomegranates, but can't get them to market easily enough. 

As for law enforcement the problems there are far more complex than salaries. The most frustrating part of trying to get anything done in Afghanistan is that you're dealing with a country with abysmally low rates of literacy and numeracy and things are made exponentially more complicated by that. ",dataisbeautiful,0
Awsome! Thank you,dataisbeautiful,0
"Doesn't fit the 2013 criteria. But yes, Hannibal is much better than anything on this list. Still devastated it wasn't picked up ",dataisbeautiful,0
"Haha I had to google what an MRE is. Exercise certainly helps, it definitely takes time to adjust to 1200 a day. ",dataisbeautiful,0
Did you just judge me based on a joke gif I posted? ,dataisbeautiful,0
Surely a labelled Y axis should be a basic requirement for posting a line graph here?,dataisbeautiful,0
"Violent crimes per capita in general are down, so it makes sense NYC would follow the trend.",dataisbeautiful,0
"I was really surprised when this got canceled just after 1 season: http://www.imdb.com/title/tt1137462/. Everything was great in this show; plot, actors. It had so much potential.",dataisbeautiful,0
"Go out, meet some people and try to learn how to socialise. 

It's an useful skill to have. ",dataisbeautiful,0
"Seems a bit useless number if it's not normalised for number of total restaurants

One country might have more vegetarian restaurants but also more restaurants in general.",dataisbeautiful,0
"Why would it collapse? Consumers save money, Uber makes money, and drivers make money. Unless the taxicab crooks manage to get it shut down (which seems unlikely at this point), it's here until something even more efficient comes along.",dataisbeautiful,0
"Godless New England. Funny that's where religious extremism in the USA started and now it's devoid, moving on out",dataisbeautiful,0
"They rose by two of three over two years. I'm not very well at statistics but that ""rise"" is statistically irrelevant, isn't it? ",dataisbeautiful,0
"Serious question: How much time do you think it takes for a marginalized group of people to recover from systematic oppression? The reason I ask is because 192 out of 240 years of American history (368ish out of 416ish pre-Revolution) blacks have been oppressed. Is 20% (or 12% if we count pre-American Revolution) enough time in history to recover? 

This also doesn't include the housing discrimination that followed the Civil Rights Movement after 1968.",dataisbeautiful,0
"Theoretically, if one were to fall into a coma in the year 2100, the world as they know it would be completely different if they woke up in 2101. It's amazing how quickly our world will begin to change in such little time with the exponential rate of technological advancement.",dataisbeautiful,0
It'd be cool to see this map broken down by county.  Southern Indiana and North Florida are MUCH more religious than their counter parts.  i'd like to see that on this map.  California would be similar.  The central valley is much more religious than the counties that touch the Pacific.  I think more precision for this map would be fascinating.  ,dataisbeautiful,0
"That takes away the companies incentive to provide the drivers with quality leads though.

If there are spare drivers who are not in the unlimited driver program then those are the ones that will get the leads.",dataisbeautiful,0
Are you insinuating that people could care more about the appearance of Christianity than the actual practice? Blasphemy!,dataisbeautiful,0
[removed],dataisbeautiful,0
"Here's the thing though: according to the church's teachings, being homosexual, i.e. having same-gender attraction etc. isn't inherently sinful. It's acting on that behavior that is sinful. So someone who steals can be forgiven if they repent and actively try to not do it again. Someone who is homosexual but doesn't act on those emotions ins't sinful and if they ""slip up"" I guess depending on the gravity can also be forgiven just the same if they repent and try to not do it again. In that sense, the person isn't a sin. 

And even if someone chooses to live out their homosexuality, there is still no reason to not treat them with anything but love and respect. It's no different than Jesus who associated with whores and others living sinful life. That doesn't mean that he condoned their lifestyle but we are constantly taught to become more like him, follow his example, develop charity which is ""the pure love of Christ"" etc. 

In my personal opinion I don't even agree with the whole sinfulness of homosexuality to start with and I actually believe that we might not have heard the last when it comes to that but that is just my very own personal opinion. I mean, we know by now that homosexuality isn't genetic, but that many people who are gay have felt that way, or have felt different from even a very young age. We believe that certain traits and parts of our personality, basically the essence of who we are, our spirit, has been with us even before birth and was created by god. To me it looks like homosexuality is part of that spiritual make-up of a person. Why would god make someone gay like that? We believe that love, attraction, sexuality and marriage are god-given gifts to us that aid us and also bring us joy and fulfillment in life, and that the highest degree of glory can only be inherited from god if we are married. Why would he make people in such a way that their inherent desires are contrary to his plan when for everyone else their desires are important and divine helps to bring his plan about? It just seems we're missing some major parts of the puzzle here, and until there is more clarity I refuse to buy into the whole homosexuality is a grievous sin thing. I mean even some animals show homosexual behavior so wtf. I might be totally wrong but that's just what I believe. Ultimately that belief fits more with who I have learned god to be and what his intentions for us are.

",dataisbeautiful,0
[removed],dataisbeautiful,0
[removed],dataisbeautiful,0
"That was my first thought, then the last few slides show the universe dying the death as fewer new stars are born.",dataisbeautiful,0
[deleted],dataisbeautiful,0
"Yeah I was a little spotty the first couple of weeks, because I wasn't familiar with the carb content of a lot of common foods, but once I had a couple of shopping trips where I loaded up on keto-friendly foods (frozen/freezable stuff is key), it became so easy.  Also I've found that getting plenty of fat in is another major 🔑 to staying full and satisfied. I have a ""bulletproof coffee"" (black coffee with butter, or ghee, and coconut oil) every morning for breakfast, and that holds me over until about 2 or 3pm. Then I make sure that whatever I eat for dinner, I get some form of fat in the mix. Chicken breast and steamed veggies for dinner? Why not start off with a salad with plenty of oil-based dressing? Or just straight up eat a tablespoon of coconut oil (shit's good!). If that's still not enough, I'll just make a cup of tea or coffee to act as an appetite suppressant.

Subscribing to /r/keto was also a huge help, as they provide a lovely support system and occasionally provide some dank keto recipes.

I still miss bread and sweets and the various fruits that aren't allowed, but with the results I've had (plus this chart that OP provided), I can't convince myself that it's worth going back.",dataisbeautiful,0
"Ah, thought that sentences was a tribute to us red/green colorblind people at first, am disappointed. ",dataisbeautiful,0
"This article's right, that asteroid that killed off (most of) the dinosaurs really was a dickish",dataisbeautiful,0
Yeah because big automakers won't monopolize the self driving car for hire market.,dataisbeautiful,0
"Strongly Disagree.

The only character on Rome I felt was particularly excellent was the mother (can't think of her name at the moment), Marc Anthony was pretty good, and the rest were just ok.

By contrast I thought the characters and performances in carnivale were excellent across the board, save for Sophie.",dataisbeautiful,0
"Dont forget the duplicates.

""Designs,"" ""Design,"" ""Designing"" counted as separate, large entries.  Also many of the top scoring words (Web Designer, design, website, HTML) being so prominently placed at the top makes me think the sample was very, very skewed towards a specific sector.  I can guarantee that across all job postings in all industries, the word ""goals"" is a lot more prevalent than ""HTML.""",dataisbeautiful,0
"Milkshakes are made from cream and sugar. Cream is usually around 30% fat (compared with whole milk which is about 3% fat). Fat packs 9 calories per gram while carbs and protein pack 4 calories per gram. So you can cram a shitload of calories in a small portion of milkshake. Your stomach doesn't register fullness based on calories, it registers fullness based on the amount of food in it. Meat, being mostly protein, would take a much larger portion to equal the calories in a milkshake. This is why high protein and fiber diets are recommended when dieting, you are eating fewer calories but feel fuller.",dataisbeautiful,0
Very good thread and subsequent commentary /u/MyAnusBleedsForYou. Thank you.,dataisbeautiful,0
"The alternative is that complex life isn't all that rare but travelling thousands of lightyears or even a few hundred lightyears has been impossible for every species that has attempted it. Maybe wormholes will never exist and we will never reach 99% the speed of light, thus hindering our ability to ever visit another planet capable of sustaining life...",dataisbeautiful,0
"However selfish that might sound to other people, I actually kinda agree lmao",dataisbeautiful,0
"So what? It's determined off a formula, you don't need any samples to come to the same conclusion with 100% confidence",dataisbeautiful,0
Not so much pickled veg. And I wouldn't EVER recommend eating olives that weren't pickled/brined.,dataisbeautiful,0
[removed],dataisbeautiful,0
"yeah, I don't like those religious zealots that call themselves atheists, they're really militant. ",dataisbeautiful,0
"I don't think that is how it works in the Mormon Church. Also, I don't know how individual names from poll data are supposed to get back to a bishop. ",dataisbeautiful,0
[deleted],dataisbeautiful,0
"Guys. The main writer died. 

Edit: okay so I originally heard this from my SO. It turns out their script coordinator died. Given the complexity and knowledge this sort of show takes to write I had always understood that key people were needed in order to continue. There was a message in the last episode of season 3 that sort of implied that I guess. Sorry for the confusion. ",dataisbeautiful,0
"Hi everyone, Election Analytics is a non-partisan, student run learning laboratory at the University of Illinois that forecasts the outcomes of the U.S. Presidential and Senate elections. Started in 2008, Election Analytics uses Bayesian statistics and operations research methodologies on available polling data (sourced from RealClearPolitics) to create a snapshot of the current state of the election. We use our model to determine the probabilities of which candidates are likely to win on a state by state basis in order to compute the number of Electoral College votes (or number of Senate seats) that each party is likely to secure. A distinguishing feature of the Election Analytics website is the ability to generate custom forecasts using various swing scenarios for undecided voters to show the expected outcomes based on our current snapshot.  Our data visualizations are done through Highcharts. Thanks for checking out our website! ",dataisbeautiful,0
"Better than nothing.

I've heard of the economic divide between East and West Germany is significant before, and my interest in Germany usually peaks around the time I want to order another Weihenstephaner so it isn't like its rarely known.",dataisbeautiful,0
"/u/angryexpat13, your submission was removed for violating the following rules:



&gt; A post must include a [data visualization](http://www.reddit.com/r/dataisbeautiful/wiki/index#wiki_what_is_a_data_visualization.3F).

This post has been removed.



For information regarding this and similar issues please see the [posting guidelines](https://www.reddit.com/r/dataisbeautiful/wiki/index). If you have any questions, please feel free to [message the moderators.](https://www.reddit.com/message/compose?to=/r/dataisbeautiful&amp;subject=Question regarding the removal of this submission by /u/angryexpat13&amp;message=I have a question regarding the removal of this [submission.](https://www.reddit.com/r/dataisbeautiful/comments/561l7l/tornadoes_across_the_us/?context=5\))",dataisbeautiful,0
Really disappointing the graph ends at only 52% Is this the state of America now?,dataisbeautiful,0
[removed],dataisbeautiful,0
"There would have been a few regional differences, just as north and south Germany differ but nowhere as blatant as these. 

The division had quite an impact:

Capitalism in the west, Socialism in the east, having for example an impact on agricultural lot sizes (there used to be ""community farms"" in the east, while in the west farmers owned their own land, thus smaller quantities)

Liberty to travel almost anywhere vs. restricted access to some other socialist countries. 
- There's a (west German) saying that roughly translates into ""Being called Ronny instead of being free to travel"" meaning the eastern Germans transferred their longing for  ""the west"" into naming their kids Enrico, Ronny, Chantal, etc. ",dataisbeautiful,0
Which is funny because the past ~15 years have probably been some of the most important in all of human history.,dataisbeautiful,0
[deleted],dataisbeautiful,0
"Could change the caption to ""median income by state"" and adjust Utah, and you'd be pretty close to accurate I bet.

Could probably do something pretty similar with political party alignment.",dataisbeautiful,0
If granted permission. ,dataisbeautiful,0
"This was only 26 years ago? Damn... I'm 21, I guess I just didn't realize how close this was to me. ",dataisbeautiful,0
[removed],dataisbeautiful,0
"I am a fatty and couldn't eat 2,000 calories worth of any of this stuff. 

Wine, sure. 

Does anyone know how bad a home made curry is? That's what I am eating this week.",dataisbeautiful,0
[removed],dataisbeautiful,0
You don't need to lie about when the accident occurred or with who - you just don't reveal the other person in the car paid for the ride.  It's just an acquaintance that asked for your help getting somewhere.,dataisbeautiful,0
"Source: setlist.fm
Tools: Python, Raw Density Design, Adobe Illustrator",dataisbeautiful,0
As an exchange student named Kevin here who had no knowledge of these stereotypes... Was für eine Überraschung.,dataisbeautiful,0
Sad statistics either way,dataisbeautiful,0
I found this quite visually interesting too! I'd wager a guess in saying yes.,dataisbeautiful,0
i shouldn not have watched this before going to sleep. Now my mind will depress me with thought of how I only have 60 more years to life and after that ill be gone forever..,dataisbeautiful,0
"Hi, guys I've made some data analysis, visualisation and machine-learning algorithm testing with a sample dataset crawled from overlog.gg. Hope you enjoy :) http://jsideas.net/python/2016/10/01/overwatch_eng.html",dataisbeautiful,0
maybe if you're short as shit and a woman or never leave bed,dataisbeautiful,0
I can take a wild guess as to what happened in your life in September '15.,dataisbeautiful,0
"I wonder if you could just get on a bicycle, or maybe a motorbike and keep pace with the eye. You could see all the destruction but avoid most of the actual storm.",dataisbeautiful,0
[deleted],dataisbeautiful,0
[removed],dataisbeautiful,0
"Interesting point. Though 27% still seems insanely high to me as a non-American, especially for young people.",dataisbeautiful,0
"You gotta typo on Louisiana Chicken Pasta, just a heads up, no hate bb",dataisbeautiful,0
There's no room for self-control when there are chicken wings.,dataisbeautiful,0
I really wasn't ready for an existential crisis this early on a Monday.,dataisbeautiful,0
[removed],dataisbeautiful,0
"I love how ""I'm"" and ""great"" are stacked together and Trump says them by far the most ",dataisbeautiful,0
That's the problem with stuff becoming more popular. We just have to agree to stop using products/services if they become too popular. Problem solved.,dataisbeautiful,0
Uh.. have you not seen who their investors are? ,dataisbeautiful,0
"Do you have any idea how this works? Do you have to get a monthly subscription that you sign up for in which you pay $15/day for the rest of the month regardless of rides? or simply you just ask for unlimited rides for a day, and then cancel at the end of the day so you don't have it charge you the next day? ",dataisbeautiful,0
[removed],dataisbeautiful,0
"Had an awesome as fuck history prof who told us this is because it's too new to really understand or process as history. It's not really history yet and can't be taught as such. We can theorize and talk about it, but can't study it like we can history so it's not taught in history. ",dataisbeautiful,0
Reddit lets you comment even if you didn't read the article.,dataisbeautiful,0
[deleted],dataisbeautiful,0
"&gt;safest way to plant peace for future generations

There is no way to plant peace between incompatible cultures other than avoidance. ",dataisbeautiful,0
More charts and words.  One more thing for liberals to tax.  Lets work on some other shit that we can actually control.  ,dataisbeautiful,0
[removed],dataisbeautiful,0
"American engineering schools are pretty much the same way. God bless your soul if you ever forget to include units, or worse, put the wrong units. Professors eat that shit like fine steak, any tears you bring to their office is just desert. You will *not* get your points back.

If you were lucky enough to receive a good education before college you'd never make those mistakes, but the situation here is pretty bad so some kids learn late. I had a retired military member in my first college chemistry class who had never learned about atoms. Part of me felt really bad for him because it was not going to be an easy semester for him, the other part of me was *pissed* that he was never taught something so basic.",dataisbeautiful,0
"I live in the Central Valley in California, and the whole area from Bakersfield to right below Sacramento is extremely religious and right wing conservative for the most part (there are some exceptions) because of all the agriculture in the area.",dataisbeautiful,0
"I use [Emco Ping Monitor](http://emcosoftware.com/ping-monitor). It can turn the ping data it receives into html or pdf.

EDIT: [Here is what one of the reports looks like, that I have saved](https://www.dropbox.com/s/vas4di2xge66174/Daily%20Report%20%282016.04.04%20-%2000.05.00%29.html?dl=0). It's from the ping monitor.",dataisbeautiful,0
"I like the premise behind it, and it seemed like it had decent writing and cast synergy, at least at the beginning. It was a little forced, but settled a bit pretty quick. It had a lot of promise, seemed like it had some good ideas, and an at least moderately fresh take on the genre, but it went sour pretty quick.",dataisbeautiful,0
"This looks like definitely reliable data and graphs, and I don't see any reason to doubt it, because it isn't the kind of graph-fudging I'm talking about. I'm talking about stuff like this: https://fcpp.org/sites/default/files/documents/Moore%20-%20Positive%20Impact%20of%20Human%20CO2%20Emissions.pdf#page=7&amp;zoom=auto,-99,398",dataisbeautiful,0
"Cowboy Bebop is by far the most adult, I would suggest starting there first.",dataisbeautiful,0
If I put a quarter in you will more words come out?,dataisbeautiful,0
I'm sorry no one else appreciated this joke,dataisbeautiful,0
All three are male and rhyme in Swedish. But thanks for you expert input.,dataisbeautiful,0
"14 breadsticks is 2000 calories, according to google",dataisbeautiful,0
"Snobby as RI?  Are you kidding?  We have the constant inferiority complex of being so small that we are used as a unit of measurement.  ""An ice shelf fell off of Antarctica today bigger than the state of RI.""",dataisbeautiful,0
"That's how they get you. You come for the silly traffic lights, you stay for the oppressive totalitarianism.",dataisbeautiful,0
"Should watch Doctor Who ""Heaven Sent"" in the context of this (overview [here](http://mashable.com/2015/11/28/doctor-who-heaven-sent-review/#Fs.OK9re6aqm) for the TL;DWs among you)",dataisbeautiful,0
"This was inspired by fivethirtyeight's state correlation chart: 
http://i1.wp.com/espnfivethirtyeight.files.wordpress.com/2016/10/silver-election-update-1004-1.png?quality=90&amp;strip=all&amp;w=575&amp;ssl=1",dataisbeautiful,0
"So the state is the entity that's supposed to take care of a very young child? I never said anything about gender roles, I said parent, not father or mother and I did so for a reason. Early socialization, by any account, should not include under 2. I'm glad that, should you have children, people other than yourself will raise them. ",dataisbeautiful,0
"for being ""real clear"" politics the site does not contain any polls containing a third or fourth candidate",dataisbeautiful,0
"&gt; I wish Terriers had made that list. 

Came in just to see if this got mentioned; they wrapped it up brilliantly given it got axed, but I'd love to see more.",dataisbeautiful,0
"You have observations at x = 25 and x = 26. What is the expected value at x = 25.5? We have no observations there, but from the regression line we have a good guess. That's what interpolation means.",dataisbeautiful,0
[removed],dataisbeautiful,0
Amen. I have no idea how do they have enough of a stomach to throw 3000 calories in it. I couldn't even if I go crazy on sugar.,dataisbeautiful,0
"Check it out: All 50 states ranked by which state has the highest ratio of loving to hating tweets (the map is updated in real time every day until election day, if you were ever wondering how people really feel in different states).

The site says ""A state’s “Loving” ranking is determined by the number of local tweets containing variations on the word love versus the number of local tweets containing variations of the word hate.""

It was created to promote the new film about Richard and Mildred Loving (whose 1967 Supreme Court case against the state of VA made it legal for interracial couples to be married anywhere in the US). ",dataisbeautiful,0
[removed],dataisbeautiful,0
Being a former Marine and exercising through all this helped me the most. I can't imagine living off of 1200... That's like living off of an MRE a day.,dataisbeautiful,0
"No the gun dealer count DOES NOT include 003. Our numbers ONLY include:

* 01	Dealer in Firearms Other Than Destructive Devices (Includes Gunsmiths)
* 02	Pawnbroker in Firearms Other Than Destructive Devices

It is not taken out of context",dataisbeautiful,0
*Love* the sound of heavy snow.,dataisbeautiful,0
[removed],dataisbeautiful,0
[removed],dataisbeautiful,0
Maybe they just want families to spend some time together? I think their beliefs are nutty but wanting to push quality time together is something everyone regardless of belief can definitely use. ,dataisbeautiful,0
"I guess what I meant to say is that there is such a strong religious community in Utah and Idaho (because of mormons) and the surrounding states don't see nearly the same activity, no matter the religion(s).",dataisbeautiful,0
"Roughly equivalent to 4.6 cans of [America](http://i.imgur.com/NuohBGF.jpg).

Being a heavy bourbon barrel stout, I wonder if the body/heavy malt/sweetness of the beer he drank contributed at all to his intense hangover.",dataisbeautiful,0
"As an Italian, I never understood why people would not eat a full pizza.  
Then I was in Pizza Hut in Plymouth (UK), and I discovered what is considered ""pizza"" outside of Italy...",dataisbeautiful,0
The sleep deprivation adds up fast...,dataisbeautiful,0
"there's a misconception that carbs are innately bad for you. open up any women's health magazine or watch any late night infomercial and you'll see this. THIS is the myth i'm talking about, not WELL IF YOU HAD 5000LBS OF CARBS IN ONE SITTING YOU'D DIE SO TECHNICALLY THEY ARE BAD. while you're obviously correct, i'm talking about something else completely; all you did was throw in a pedantic, straw man argument.",dataisbeautiful,0
I keep hearing about this app from foreigners but I've never seen it.,dataisbeautiful,0
Seems like BS. Only the elderly go to church here in Minnesota. Should be white instead of blue. ,dataisbeautiful,0
