body,subreddit,moderated
Now compare it to black populations and observe an amazing and unexpected coincidence.,dataisbeautiful,1
Looks cancerous. Much like our existence here.,dataisbeautiful,1
"I don't think Trump fully denies climate change, I think he just acknowledges that [there have been many predictions that failed to come true](http://climatechangepredictions.org/).

I understand that he has a quote saying that China is behind it, but he also has quotes talking about predictions not coming true, and when you put it all together it's pretty clear that he flubbed his words, in the same way that [Bernie](https://www.youtube.com/watch?v=xCHfH0WABTY) or [Obama](https://www.youtube.com/watch?v=EpGH02DtIws) or [Bush](https://www.youtube.com/watch?v=8Ux3DKxxFoM) sometimes flub their words. 

**UPVOTE THIS POST IF YOU SUPPORT EQUALITY**

**DOWNVOTE THIS POST IF YOU ARE A RACIST WHITE SUPREMACIST**",dataisbeautiful,1
"When you're standing in front of a urinal, do you hold on for dear life, or let it do its own thing?",dataisbeautiful,1
But why male models?,dataisbeautiful,1
they should euthanize instead,dataisbeautiful,1
Nevermind Thread is brigated to the oblivion already. World is not ready for the war against  islam yet. Let's try again in a couple of years.,dataisbeautiful,1
"Generalised Voter Opinions TLDR Summary for those of you who are overseas:

Blue Voter: I'm well informed by TV, Radio and Newspaper and we should vote Blue

Red Voter: I don't want the Blue guys to win how do they keep winning?!

Green Voter: Hey this guy is actually alright for a politician..

Other: The system is garbage.",dataisbeautiful,1
Palestine - Key Misery factor: Jews.,dataisbeautiful,1
...the catch is you have to find a working Nokia phone.,dataisbeautiful,1
"The data comes from Wikipedia and the chart was created with Matplotlib, you can see how in this notebook.
I filtered out special pages like Wikipedia:Administrator_intervention_against_vandalism to only compare the pages that a regular Wikipedia user sees.",dataisbeautiful,1
"So much shade, bet it feels good to know your work is appreciated!",dataisbeautiful,1
"That data is not true. There is a ton of terror attacks happening in Europe.

https://www.thereligionofpeace.com/attacks/europe-attacks.aspx",dataisbeautiful,1
inb4 some crazy SJWs start complaining about how unfair and sexist this is.,dataisbeautiful,1
"Sshhhhh, let the simpleton vent",dataisbeautiful,1
"Huff raid, racist fuck.",dataisbeautiful,1
">Then fill it up!

On the outside.",dataisbeautiful,1
"Here's a [source](http://www.bxscience.edu/ourpages/auto/2009/4/5/34767803/Pre-Columbian%20population.pdf) with high and low estimates graphed for different regions. The ""north of the Rio Grande"" (US and Canada) estimates range from 3.8M to 12.2M. I've seen other documents estimating the Mississippian cultures of the Gulf Coast, Mississippi and Ohio river vally region population of 7 million pre-contact. By the time the spanish explorers were first coming through the region, they'd been decimated by plagues, with estimated population reduction of 90%. The Wikipedia entry indicates the current consensus estimate is 100M for all of the Americas, with the majority of that in Central and South America, but still room for a significant population in North America. ",dataisbeautiful,1
Somebody visit your girl-next-door there such a tight ass! http://ur.my/212hg,dataisbeautiful,1
New Zealand should be Rugby.  Salmon.  The fuck.,dataisbeautiful,1
"Data is, indeed, beautiful.",dataisbeautiful,1
Who would want Greyscale? That shit is going to ruin Jorah Mormont. ,dataisbeautiful,1
DESIGNATED,dataisbeautiful,1
"It's interesting how these words are associated with urban communities, mainly blacks, and lack of education. We hear these new words pop up and think the person using them is ignorant. But, really they are expanding their vocabulary to include these new words. 

Then you have computer lingo that gets used in gaming that, for an outsider, looks like a totally different language. You take someone who doesn't play online games and immerse them into the chats that go on in games and they would get lost rather quickly. This type of slang is widely accepted and people aren't criticized for using it.

It's not a matter of who uses one over the other being smarter, it is a cultural divide. ",dataisbeautiful,1
Frist of all how DARE y ou acknowledge skin colors.,dataisbeautiful,1
(Yup. Its all very cyclical.)[https://www.reddit.com/r/southpark/comments/3l99mb/when_the_old_guy_said_the_last_time_pc_was_around/cv4d48t],dataisbeautiful,1
Yeah. People in Guam already know the price of milk. ,dataisbeautiful,1
Believe it or not the map with the highest correlation is the one that shows states with the [highest percentages of African Americans](http://imgur.com/a/HzRH8).,dataisbeautiful,1
"Well, here ya go.. 3 days fresh:
",dataisbeautiful,1
"Nothing that the left or the right can do about it, though.

Unemployability is about to go through the roof, and there won't be enough money to give everyone support, no matter which side of the aisle you're on.",dataisbeautiful,1
Source: Economic Innovation Group: http://eig.org/dci,dataisbeautiful,1
"Mason is the dumbest fucking name ever. At the restaurant I used to work at our managers sister would bring in her rotten bastard of a kid, named Mason, and he had the most obnoxious, high pitched cry I've ever heard, and he never stopped fucking crying. Probably because he was a spoiled bastard and if he was at the restaurant that means he wasn't at home getting his rotten bastard way.

If your name is Mason, I hate you and your dumbass special snowflake parents.",dataisbeautiful,1
what?,dataisbeautiful,1
"Because of eternal summer, irrigation and cheap illegal weather ",dataisbeautiful,1
Super fascinating. Thank you for doing this.,dataisbeautiful,1
">EU is a widelly effective and successful project.

Lol",dataisbeautiful,1
"So I'm no climate change denier and fully acknowledge that it's anthropogenic, but it's a little disingenuous to suggest there's zero economic risk in your ""if I'm wrong"" hypothetical.",dataisbeautiful,1
"If the contextual analysis the researchers carried out is decent, then endearing uses of the words would not be counted, so the comparison you're drawing doesn't make any sense.",dataisbeautiful,1
I would say most men are more agile than most women.,dataisbeautiful,1
I have a 18 inch penis. I measure from the spleen.,dataisbeautiful,1
mmmm Shake Shack,dataisbeautiful,1
This Titanic sailing vessel is literally unsinkable ,dataisbeautiful,1
"> 1-I don't like illegal aliens, criminals, or Muslims.

I don't care what you ""like"".

You claimed he doesn't generalize people, I provided a link proving that he does.

>2-he is the only choice unless your ok with corruption.

Trump is about as corrupt as you can get. He openly claims ownership of companies that he has no financial relation to, and he openly brags about scamming people out of money.

>3-I love america 

So your solution is to elect a fascist who wants to commit war crimes, which would weaken our international relations? Not to mention that our economy would tank if immigration was cut down to the levels trump wants. There is nothing good for America if trump is elected.

>I'm tired of seeing American generosity being taken advantage of around the world.

This doesn't even deserve a response. Just lol.

> Our leaders are losers.

Right, our leaders are losers. That is why we are the world's leading economic, political, and military pwoer.

Yup.

Stop blindly eating up trumps rhetoric, thanks.
",dataisbeautiful,1
No moleman?,dataisbeautiful,1
I never said anything about how difficult it was to get guns from Indiana. ,dataisbeautiful,1
Minnesota Nice,dataisbeautiful,1
I'm honestly surprised that 696969 isn't on the list!,dataisbeautiful,1
/r/storiesaboutkevin,dataisbeautiful,1
!RemindMe 24 hours,dataisbeautiful,1
"The US male/female ratio is < 1, but still no woman president.",dataisbeautiful,1
Does this mean you only had night sex 20 times In 2016,dataisbeautiful,1
"Fuck, that one mid-30s guy with Kryptonian grip strength. ",dataisbeautiful,1
"Hi, InnovateEconomy!

According to rule 3 you **must** add a separate comment stating your data source (not your site but the actual data source) and the tool you used to make the visualization. I'll grant you a 1 hour grace period to add your comment, otherwise this post will be removed.

Cheers!",dataisbeautiful,1
Except almost all Muslims hate homos.,dataisbeautiful,1
"That's also where Black Rock City is, home of Burning Man.",dataisbeautiful,1
It would look different if they realised they have to pay taxes,dataisbeautiful,1
I've graphic OP! :),dataisbeautiful,1
"Sweden is practically Gay: The Country. No surprise here, although that bar is going to rocket to the right in the next few decades. ",dataisbeautiful,1
"takes one to know one





ooooooooooh rrrrekt",dataisbeautiful,1
A TiA and KiA poster having issues with a group that tracks hate groups. Color me shocked!,dataisbeautiful,1
wat,dataisbeautiful,1
(As someone who occasionally browses r/new you are welcome)[http://m.imgur.com/gallery/v0C1jhp],dataisbeautiful,1
"A very similar crime (except this time it involved sexual violence as well) that SHOULD be in the news just as much right now. Main difference is that the victim is black (also mentally challenged) and the perpetrators are white. Guess who got their charges reduced and pled to something that would keep them out of jail. 

Sickening and rotten to the core. ",dataisbeautiful,1
"Thats the thing about Americans. They're  so fucking stupid they don't even realise they build their own cages.

Just look at Trump . Imbeciles.",dataisbeautiful,1
"I can't help but think this is kind of racist. Just replace ""native"" with ""black"" and you'll see what I mean.",dataisbeautiful,1
">A Jewish atheist

Pick one.  Also, what's wrong with Jews and Atheists?  Are you an antisemite?",dataisbeautiful,1
"[X% of Y
is always
Y% of X
then..
10% of 80 equals to  80% of 10
You can now calculate 8% of 200
As 8 + 8 = 16](http://www.meals.ga/2016/01/how-to-make-percentage-easy.html) ",dataisbeautiful,1
Preach,dataisbeautiful,1
This post clearly illustrates the rise of Islamic terrorism.... Not sure if that's the point ,dataisbeautiful,1
That Jamaica statistic seems low.,dataisbeautiful,1
Thanks boomers for destroying the Earth. GG,dataisbeautiful,1
Took a second to figure out the sarcasm here.,dataisbeautiful,1
Thank you capitalism,dataisbeautiful,1
so your a dick is what your telling me in laymans terms?,dataisbeautiful,1
This comment is perfect at showing how stupid men are,dataisbeautiful,1
"Lmao the poisoned well fallacy.

It's pretty clear you are a shit poster who reviles any criticism of your biases.",dataisbeautiful,1
Its because they have a whiter country.  More whites equals less crime.  Therefore less reasons for the police to have to shoot.,dataisbeautiful,1
"> my little pony



Kek, like you have room to talk.",dataisbeautiful,1
"I've never heard the El Niño thing before, what exactly is bullshit about it?",dataisbeautiful,1
Why? You don't like your peas touching your carrots you fucking autist?,dataisbeautiful,1
"Because one must confrint how 13% of the population is so fucking utterly violent and criminally minded, all while attempting to portray them as vuctims of white oppression. 

Hard to do.",dataisbeautiful,1
There are alot of blacks,dataisbeautiful,1
"You're getting down-voted by morons.

Fucking white people think that since they aren't actively in the KKK that they shouldn't feel the burden of centuries and centuries of piled up racist bullshit.",dataisbeautiful,1
RemindMe! 8 hours,dataisbeautiful,1
"ah, my bad. I tried submitting last Wednesday but it got removed. 

Side note: How does reddit detect reposts? You would have thought it would alert me to that post that has 3k upvotes.",dataisbeautiful,1
"Yea fuck you op, right in your pee hole.",dataisbeautiful,1
Or a map of black population,dataisbeautiful,1
I woke up just for this gif,dataisbeautiful,1
"as you can see FIRE is super effective on FOUR types while the pleb water is only effective on 3 and lightning is eating glue being super effective on only 2.

TEAM VALOR",dataisbeautiful,1
"I know what we need: A military use for nuclear power!

Wait...",dataisbeautiful,1
So salary matches qualifications. ,dataisbeautiful,1
"Chart about deaths... ""beautiful""",dataisbeautiful,1
I found The Donald!,dataisbeautiful,1
Sounds like the consequences of invading other countries.,dataisbeautiful,1
I blame the media blamers.,dataisbeautiful,1
Is there an r/dataisfuckinghideous?,dataisbeautiful,1
"See username. You don't give a fuck about me, and you know the world would be better if me and everybody like me killed themselves.",dataisbeautiful,1
"The city of Mumbai in India has a population density of 21,000/km2.",dataisbeautiful,1
You would think all people would be so intelligent in this day and age. ,dataisbeautiful,1
Making the Obama one my wallpaper. Really sweet stuff.,dataisbeautiful,1
Sorry,dataisbeautiful,1
"expect to see this in r/dataisugly in 3..2..1..
",dataisbeautiful,1
Why is there an NSFW tag?,dataisbeautiful,1
"Gosh Golly Gee Willikers DARN! Too late. What do I do now? After all, you seem to be the expert on *not* eating motor oil.",dataisbeautiful,1
https://en.wikipedia.org/wiki/Black_Belt_(U.S._region),dataisbeautiful,1
[Credit the original OP.](https://www.youtube.com/watch?v=RQrEudpUKLM),dataisbeautiful,1
Wtf is going on http://quizst.com/quizzes/can-you-guess-what-will-happen-in-season-6-of-game-of-thrones/33.html,dataisbeautiful,1
are you a stanchion?,dataisbeautiful,1
no preview available... accurate,dataisbeautiful,1
"This data originated from my own personal daily habits, collected over a period of 10 years or so.",dataisbeautiful,1
I sure as hell didn't vote for this shit,dataisbeautiful,1
"Here let me explain it in a different way since you seem to be having trouble understanding. 

I dont think mocking someones use of ""whatever you reckon"" is insulting. Not compared to about 99.9 percent of the shit you see on reddit, even our own president has said things that are 50x worse. To be somehow harping to me that im getting ANGRY for pointing out hypocrisy, that im somehow being too divisive when there are literally 100's of worse comments in this very thread--WHILE IGNORING THE ACTUAL DISCUSSION IM TRYING TO HAVE ABOUT DOUBLE STANDARDS AND RACISM--is absolutely laughable. yes, ignore all the double standards, the racism, its mocking phrases like ""whatever you reckon"" yea, thats the real problem. 

I'll take your fake moral outrage and double down, fuck your sensibilities. ",dataisbeautiful,1
"My wife had chacha's like coconuts.   
*Big and round?*    
No, the hairs.",dataisbeautiful,1
You should do regressions with poverty and racial proportions as predictors for violent crime. Then you should be able to show that race does not improve the prediction of violence once poverty is in the model.,dataisbeautiful,1
[Still pretty respectable](http://i.imgur.com/1PH0XZI.png),dataisbeautiful,1
"I did this in word, that's why it looks horrible:

http://i.imgur.com/1dEsdaA.png?1",dataisbeautiful,1
*Yarrr,dataisbeautiful,1
"Leggings are multi use them to strain things, robberies, ext. Jeans have one use AND they last multiple years longer than leggings. ",dataisbeautiful,1
"Brb, going to Iceland.",dataisbeautiful,1
"Well I suppose determining what problems are ""worse"" is a subjective argument and one that will never be won, however there are undeniable problems largely exclusive to men in this country that are at best diminished and at worst ignored. 75% of the chronically homeless are men. Divorce courts award mothers custody 83% of the time. Male suicide is 3.5 times higher than female suicide. 90% of the prison population is male. In addition, men on average receive 63% longer prison sentences than women who commit comparable crimes. Though you may disagree, there is definitely a case to be made that men may have it harder.  ",dataisbeautiful,1
I find it funny that xenophobes take such a personal interest in me. Please don't step on the flowers if you stalk my house as well.,dataisbeautiful,1
Most of the males here on reddit are below the average and are weaker then the female,dataisbeautiful,1
Jesus India... cool it with the babymaking.,dataisbeautiful,1
"I think city people just suck in general.  I come from NJ and I think if you dealt with more people from NYC, Jersey, Philly, etc. you'd see Portlanders aren't so bad lol

I spent 5 months in Ashland though too, and the people were pretty awesome.  But overall I was just impressed with the Oregon pride there.  I love that many (most?) people would happily pay slightly more for a product made or grown locally.  I love that my grocery store, hardware store, and internet provider were all consumer owned co-ops.  To me, it's a sign of a socially conscious citizenry, and it's not very common back east.

On a side note, I also love that you actually have to book campsites ahead of time in Oregon because they might be all booked, even on random weekends.  As an east coaster it blew my mind that so many people could be camping that a tent space in a state park is just not available.  I'm not even an avid camper myself, but it makes me happy to see our public lands being so fully appreciated.",dataisbeautiful,1
"> Obama had an abnormally high voter turnout in his election

Because blacks came out to vote for him because he was black.  Many didn't even know  his policies/agenda, they voted simply based on the color of his skin.  Racists fucks.",dataisbeautiful,1
"Why the fuck would goatfucking, Sharia-leaning Turkey be included within Europe data? Wipe them the fuck off this chart. ",dataisbeautiful,1
Quick call the Mod police!,dataisbeautiful,1
Military conflict? Cambodia?,dataisbeautiful,1
Hence why I buy wine that costs less than $10.,dataisbeautiful,1
"Witches Brew. Never had spiced wine before, go try it.",dataisbeautiful,1
Each spike is another Spielberg or WW2 film designed to make you never forget. ,dataisbeautiful,1
"What if it's just people mistyping ""iphone show""?",dataisbeautiful,1
My cock  have sex with there pussies all  you are next http://44t.in/y/gL4B,dataisbeautiful,1
">From 100 views to 354 is also a 354% increase.

254% increase. Percent increase formula: 100*(After - Before)/Before.",dataisbeautiful,1
When does the whole work thing come into play? ,dataisbeautiful,1
"TL;DR  

It's all porn.",dataisbeautiful,1
"l  
o  
l",dataisbeautiful,1
I know,dataisbeautiful,1
Ok cuntweiner...haha,dataisbeautiful,1
"I didn't make up any definition. I said capitalism rewards hard work, and it does. You're the one being unreasonable and claiming that as long as there is **any** work that isn't reward (even if you're not asking for a reward), then capitalism doesn't ""reward hard work."" It's an amazingly meaningless and unproductive faux point to make.",dataisbeautiful,1
Dude lol look up Alaska.  6.79 times larger than Wyoming with only a few more people. ,dataisbeautiful,1
He's on pace for 3000+ in his first term.,dataisbeautiful,1
Nobody cares for this,dataisbeautiful,1
"Is it like black people calling each other niggers? 
",dataisbeautiful,1
 this slut  everyone  watching for  find  therein  anal fuck  make  for  http://ur.my/215y5,dataisbeautiful,1
I always did have an interest in Jasonry,dataisbeautiful,1
"If these are Reddit passwords, all throwaways.",dataisbeautiful,1
https://www.reddit.com/r/dataisbeautiful/comments/4lk3x0/slug/d3o3xqy,dataisbeautiful,1
This doesn't explain why Canada has more wild chinks roaming around than China itself.,dataisbeautiful,1
You're being downvoted because people don't realize that 1 in 12 men are colorblind. This is a real problem with graphic visualizations of data that often gets overlooked because most people aren't aware of how widespread the issue is.,dataisbeautiful,1
That remains to be seen. Lol.,dataisbeautiful,1
X.AI LOOKS GREAT TO ORGANICE SCHEDULE,dataisbeautiful,1
"All my wire things run on Pure Christian Conservative Values that are supplied to us by Jesus from within the walls of my home.

All this electricity/science speak are whispers from the Union-backed Disciples of the Devil himself.",dataisbeautiful,1
/r/dataisuseless,dataisbeautiful,1
"I don't care how much I fuck up the earth, Im gonna use it, abuse it, and enjoy it in the short time I have here.",dataisbeautiful,1
No bias here.,dataisbeautiful,1
"Well don't you think that it might have to do with training and culture? If you take a brother and a sister, neither of whom ever work out, who eat the same as one another, I'm sure the sister could probably beat the shit out of her brother if she were really pissed at him. A woman who works out and builds her muscles regularly can easily whip a man who never does. 
But women are trained not to get strong. They are trained not to hurt men. They are trained to fear them and submit to them. 
Men are trained to dominate, to hurt. 
It's not about ""we have to acknowledge differences"" - this study is worthless, just propaganda for male supremacy. ""Almost all""? What the hell's the point of that? No this is just fodder for the Reddit misogynist circle jerk",dataisbeautiful,1
">Protest is a part of the system.

You're understating what they did. There were literal gun fights.",dataisbeautiful,1
"How about you guys stop whining, go to small town and build that town, like the baby boomers did.",dataisbeautiful,1
Only on reddit do you get someone asking for responses then complaining that he got them...,dataisbeautiful,1
"This is why super delegates should have all the votes, and the citizens should only vote for the President.",dataisbeautiful,1
fuck you BITCH.,dataisbeautiful,1
Constantinople of course.,dataisbeautiful,1
"Police - Kevin

Of course.",dataisbeautiful,1
"I don't think there is anything Machine Learning related on this page. It's builds a visual tree of the sentence structure, that's an algorithm for sure, but not machine learning.

A correct way to title this would be: ""Watch a Computer Algorithm Interpreting the Grammar Structure of Mark Twain.""",dataisbeautiful,1
"**So are all the houses touching each other, including the fronts and backs? Like one big glob of houses? No yards, roads, sidewalks, etc?**",dataisbeautiful,1
"Cliff's Pools specializes in swimming pool remodeling all across South Florida. We can transform your swimming pool, and give it a more modern look. We have been remodeling pools for over 29 years, and take pride in our work. Before we begin a remodeling project, we'll send a technician out to inspect your pool. We'll listen to your expectations, and work hard to meet or exceed them. We strive to be the best pool remodeling company in South Florida.",dataisbeautiful,1
How about controlling for family type? How many black vs. white violent crimes (or non-violent!) are committed by people from a family with the male and female biological parents?,dataisbeautiful,1
"Cafeterial work, Janitorial duties, Laundry, y'know, things they are used to.",dataisbeautiful,1
Remind me,dataisbeautiful,1
RIP long island,dataisbeautiful,1
"If you're willing to share with us, can you explain what you mean by ""With homosexuality comes degeneracy""? Do you have examples or statistics?",dataisbeautiful,1
These are so stupid.,dataisbeautiful,1
I love jews and gays but I can't stand muslims.  Is this allowed?,dataisbeautiful,1
"United Kingdom: Very Stable.

Interesting...",dataisbeautiful,1
"Not op, for me I'd be pissed I worked night and day and sacrificed my social life  to go above and beyond to get scholarships to cover my tuition. That after getting these scholarships, I still had to take out 40k in loans... To pay them off I moved back in with my father for 2 years and worked the first job I could get, while also busting my ass doing freelance, to pay off my debt as fast as possible.

All while my fellow students did nothing to set themselves apart, just did enough to scrape by and get Cs, didn't try and network and are serving tables and wasting their paychecks on traveling and iphones. 

I get it, it's better for the economy. But it does sting I sacrificed so much, while some dunce is getting their loans forgiven when he made nothing but horrible decisions his entire adult life. ",dataisbeautiful,1
"6'3 and only 155? Hahahah skeleton over here. You're fucking gross. Why don't you try to eat something skinny loser? You're a sack of shit. No one would wanna fuck someone with a body like your. 

But remember man I'm just trying to motivate you.",dataisbeautiful,1
"I have zero insurance because it's so ""affordable."" ",dataisbeautiful,1
It's good to know that some people are still rejecting this nonsense.,dataisbeautiful,1
Is that a reference to something?,dataisbeautiful,1
Wuuuuuuut? I literally work at a grocery store. We don't have it.,dataisbeautiful,1
"dgfhfhfdhsfdhsh
fjghfkjasgfhshds
sgdjserhyddngdsb
gmeaggsdhn
sdgdfhqqasfsafagfh",dataisbeautiful,1
"Let's see.. I skimmed the rules so, this is a visualization of Youtube eating itself from the inside, because Google / Alphabet / whatever don't know how to run an actual machine learning algorithm to save their lives. Or maybe they do, but are too embarrassed to admit their ORIGINAL mistake on this issue, which was.... guess what it was. :p",dataisbeautiful,1
