body,subreddit,moderated
"> [OC posts](http://www.reddit.com/r/dataisbeautiful/wiki/index#wiki_what_counts_as_original_content_.28oc.29.3F) must state the data source and tool(s) used in a comment.

This post has been removed. Please [contact the mods](http://www.reddit.com/message/compose?to=%2Fr%2Fdataisbeautiful) once you have posted this information in a comment and we will reinstate the post.",dataisbeautiful,1
There are more than five people that agree with you.,dataisbeautiful,1
r/thanksobama,dataisbeautiful,1
">Essential hypertension (also called primary hypertension or idiopathic hypertension) is the form of hypertension that by definition has no identifiable cause. It is the most common type of hypertension, affecting 95% of hypertensive patients,[1][2][3][4] it tends to be familial and is likely to be the consequence of an interaction between environmental and genetic factors. [wiki](https://en.wikipedia.org/wiki/Essential_hypertension)",dataisbeautiful,1
"[Feel free to share this reason as why they do it when you inevitably come across the next ""why is the e bolded"" question.](https://www.reddit.com/r/dataisbeautiful/comments/55zkha/what_2000_calories_looks_like_ny_times/d8f5eg3)",dataisbeautiful,1
">What compels you not to treat this as a problem? I couldn't care less about data trends over 40 years. Public attacks are happening weekly in Europe and it needs to be stopped. 

Prioritization.

The things that are more likely to kill you are so common, they're not even publicised.",dataisbeautiful,1
This is what I really want.,dataisbeautiful,1
"> In most other democracies

it is not a democracy if you can buy a position from the government or push a law",dataisbeautiful,1
That's great for them. Let me know when they do (they wont).,dataisbeautiful,1
"Settle down, Mercury.  Spaz.",dataisbeautiful,1
This will not please the propaganda generating schills.,dataisbeautiful,1
That's because white males are better than everybody else.,dataisbeautiful,1
TIL thx for your input.,dataisbeautiful,1
I was sure I've done this while posting. Added now. Thank you.,dataisbeautiful,1
Wow. ,dataisbeautiful,1
Cool,dataisbeautiful,1
I guess you figured it all out didn't you.  It has to behave like a sine wave because your said so.  No more need to look into the matter.,dataisbeautiful,1
"The bullshit isn't the skittle distribution count, it is that they changed out lime with green apple.  Why, why would the do that?",dataisbeautiful,1
"Compare the rates of violent crime by state with demographics and what do we learn? If it's all white, it's all right. ",dataisbeautiful,1
Yes.,dataisbeautiful,1
"Considering TwoX is cancer, not surprising ",dataisbeautiful,1
"https://tools.ietf.org/html/rfc384

explains the site codes.",dataisbeautiful,1
"### Why former Soviet states have ~~less~~ **FEWER** men than women. 

FTFY",dataisbeautiful,1
You're probably arguing with the PR team for the Obama ACA camp right now dude...,dataisbeautiful,1
"Yep, her Presidential run is over forever.",dataisbeautiful,1
"Hi, /u/pietya , your submission has been removed for violating the following rule:

>  Posts regarding American Politics, and contentious topics in American media, are only permissible on Thursdays (EDT)

This post has been removed. You can resubmit your post the next Thursday.

For information regarding this and similar issues please see the [posting guidelines](https://www.reddit.com/r/dataisbeautiful/wiki/index). If you have any questions, please feel free to [message the moderators](https://www.reddit.com/message/compose?to=%2Fr%2Fdataisbeautiful).",dataisbeautiful,1
Was this removed?,dataisbeautiful,1
"> is this a social/public health concern


It is only a social/public health concern if it disadvantages women.


Please remember [the Althouse Rule](http://althouse.blogspot.com/2005/11/scientists-remember-to-portray.html):

>  If you do scientific research into the differences between men and women, you must portray whatever you find to be true of women as superior. And when you read reports about scientific research into the differences between men and women, use the hypothesis that the scientists are following that rule. It makes reading the reports quite humorous.






",dataisbeautiful,1
"You're obviously racist, and full of shit.

Put up or shut up.",dataisbeautiful,1
Eastern America runs on Dunkin'.,dataisbeautiful,1
You're a hero.,dataisbeautiful,1
I'd like to see how this compares to Canada's closest neighbor. ,dataisbeautiful,1
"And a raucous cheer goes up from the neckbeards.  As an added bonus, by moving some of them discover half-eaten sandwiches in their flab.  
",dataisbeautiful,1
"> [OC posts](http://www.reddit.com/r/dataisbeautiful/wiki/index#wiki_what_counts_as_original_content_.28oc.29.3F) must state the data source and tool(s) used in a comment.

This post has been removed. Please [contact the mods](http://www.reddit.com/message/compose?to=%2Fr%2Fdataisbeautiful) once you have posted this information in a comment and we will reinstate the post.",dataisbeautiful,1
"Yeah, this graph would get crazy if they corrected for population.",dataisbeautiful,1
"Right, so vodafone unlimited is >250 USD a month? ",dataisbeautiful,1
So the graph makers are trying to trick the viewers into thinking that time slowed down? I guess the election season really did drag on.,dataisbeautiful,1
"> I think many people are unaware of how much we've progressed.

Of course they are. Similarly countless people are unaware of the scale of the world's problems, not nobody. The fact is making sure everyone knows about the problem is much more important that making sure everyone has some vague motivation that different people tackled different problems in the past. 

>I said I get pissed off when people say how terrible the world is, and we need more positive perspective and less doom and gloom nonsense. That's not covering up anything, and it's ridiculous to suggest that.

A more positive perspective actively decreases the chances of solving problems. To go back to the example, telling people that we'll most likely beat global warming would fuck society, do you seriously not know this? 

>Unless it's actually not terrible, than it's just accurately depicting the problem

No, it's still minimising it. Even *if* all you're doing is presenting an accurate depiction of reality (you're not) even then you'd still be minimising the chances of problems being addressed. 

>Do you see no light between ""the world is terrible"" and ""the situation is good""?

You're the one that set up that dichotomy you moron, I just responded within your parameters. I am saying that a narrative in which the world is shit is more accurate and effective than one in which the world is good. 

>Good thing people will act because we rationally discuss the problems and the potential attainable solutions to those problems then.

Genuinely don't know if this sarcasm tbh

>Good thing I didn't ""construct a narrative of humanity being historically really great"", in fact I'm doing exactly the opposite, I'm pointing out how humanity hasn't been all that great and yet we've made massive strides

Massive strides are a type of greatness mate. 



",dataisbeautiful,1
NAFTA,dataisbeautiful,1
"Haha shut up, troll.",dataisbeautiful,1
"There goes 2016 again, fucking failing in every possible way it can before 2017 gets here ",dataisbeautiful,1
No wonder they all wanted that peace loving hippy socialist f a g g o t bernier panders as their POTUS.  MY LIFE SUCKS REEEEE GIMMIE FREE SHIT!,dataisbeautiful,1
"the one thing these crazy muslims are doing is making the Israelis look like relatively calm, rational people who have known about this sort of thing for ages.",dataisbeautiful,1
/r/facebook,dataisbeautiful,1
Green lives matter ,dataisbeautiful,1
And what's fascinating is that those counties tend to vote Democratic.,dataisbeautiful,1
"I've been seeing and hearing the word ""emboldened"" an absolutely obnoxious amount lately and went to Google Trends to determine if this was a real phenomenon. The results did not surprise me.",dataisbeautiful,1
<grey during poupon,dataisbeautiful,1
Trannies are legitimately scary though. ,dataisbeautiful,1
Thanks! But I think you may mean intra-manhatten trips?,dataisbeautiful,1
"Fell asleep in junior high political science class, did we?",dataisbeautiful,1
"Any reason why a known terrorist and hate group is omitted?

https://en.wikipedia.org/wiki/Jewish_Defense_League",dataisbeautiful,1
That's actually pretty cool.,dataisbeautiful,1
"A Wise man once said, your mouth is like a shovel, and will dig your own grave, you golden sorry sack  of  Asian Santa goand",dataisbeautiful,1
"I think I just wrote the newest hit song:

imma fuck bitches whoa oh oh whoa

niggas just wanna see bitches go low

animals wiggle yo hands like whoa

rack bass burn money like diamonds solo

",dataisbeautiful,1
Thanks. When I got to this thread I was shocked no one had called this out yet (800+) comments. It only took like 5 comments on /r/weather. ,dataisbeautiful,1
Reeeeeeee cis shitlord,dataisbeautiful,1
look out  in tits  next door masturbate  for  http://url.t.aylor.de/2176b,dataisbeautiful,1
Missing No?,dataisbeautiful,1
So sad to see the word collapse for Pakistan :/,dataisbeautiful,1
Well spotted champ.,dataisbeautiful,1
"Fine, here's a better comparison, clown. Never working is the most effective way to never be injured on the job, doesn't mean it's the best option.

AKA, the same fucking thing the above guy said, just worded to appease you spewing ignorance.",dataisbeautiful,1
this would better fit in r/internetisbeautifull i think,dataisbeautiful,1
I'm just surprised the unknown bombings didn't end the world,dataisbeautiful,1
"TFW California hasnt been red in 28 years and might become red this election.

",dataisbeautiful,1
Yes...it is..,dataisbeautiful,1
How is July 4th National Caesar Salad Day?! ,dataisbeautiful,1
Iran= Kidney? What... ,dataisbeautiful,1
Sadly if you put a map of the percent of black people in a given stat the image is nearly identical,dataisbeautiful,1
"Perspective also plays a huge role in this. My wife (who is American) and I argue all the time about the definition of 'fat'. It is clearly different here; I can tell from talking to people and taking in the media here. Here, someone who I would say is (or rather, would be thought of in the UK as) definitely overweight is either average or chubby. Someone who is obese (medically and by UK standards) is large or big etc. The word 'obese' only gets thrown around when you get to the 100 pound+ overweight stage, which is a good indication of how much the American body type has changed in the last 50 years, and how much being overweight, and the definition of overweight, have changed and/or normalised. There are fat people everywhere in America, and that's just the sad reality.

Obviously, like you say it's not like every American is fat. The stats don't lie however: a shocking percentage are. Like I said though, this is an enormous problem in most western countries. America was just a few decades ahead. ",dataisbeautiful,1
"Yes! This is great! We don't need playgrounds, we can just have big piles of trash. We don't need to wast resources to purify water, any shit creek will do. And toilets? we have road side!",dataisbeautiful,1
"""Nic Cage, you're fired""",dataisbeautiful,1
"Ah, another member of the new religion: The Dietization of the White Lab Coat.

As long as enough people holding test tubes said something was true, I'll believe it!",dataisbeautiful,1
"> I think it's incredibly petty and shitty to allow a man like Donald Trump 

I don't think anyone ""allowed"" anything. People voted. Trump won. The electoral college should probably not exist, but it does.",dataisbeautiful,1
Wow! Le Bernadin was the one I had a bad experience with too. What didn't you like about it?,dataisbeautiful,1
"Wow, I've been looking for a guide to the blackest neighborhoods in NYC, thanks!! ",dataisbeautiful,1
"We get it, we get it. Fucking dumb fucking Dems should have gone with Bernie. The blame for Trump lies squarely on dipshit Dems who voted for HRC in the primary. ",dataisbeautiful,1
Looks like a strip of onion under a microscope,dataisbeautiful,1
Yup.,dataisbeautiful,1
Hispanic Catholic males and black men didn't want to vote for a woman.,dataisbeautiful,1
"Well, the timescale on the video is about 100 million years a second, but yeah. From the perspective of a human life, this is far too long to even consider. Entire civilizations will rise and fall in the space of a microsecond in this scale. An intelligent species could develop and die out in less than a millisecond.

It would be safe to say that, from the perspective of any intelligent species that end up experiencing this merger, there will be no concept that the galaxies are in the process of merging. They will either be two relatively close galaxies, or just one galaxy with odd perturbations.",dataisbeautiful,1
"It does not. Here is the orginal data set from 2010.
",dataisbeautiful,1
"> [OC posts](http://www.reddit.com/r/dataisbeautiful/wiki/index#wiki_what_counts_as_original_content_.28oc.29.3F) must state the data source and tool(s) used in a comment.

This post has been removed. Please [contact the mods](http://www.reddit.com/message/compose?to=%2Fr%2Fdataisbeautiful) once you have posted this information in a comment and we will reinstate the post.",dataisbeautiful,1
Why did Lincoln have a democrat VP?,dataisbeautiful,1
Yeah but I doubt as many women use the words slut and whore as an attempt to reclaim the words. ,dataisbeautiful,1
Why did you not end your statement with punctuation?,dataisbeautiful,1
Yes. ,dataisbeautiful,1
"SOURCE DATA:

https://ucr.fbi.gov/crime-in-the-u.s/2013/crime-in-the-u.s.-2013/offenses-known-to-law-enforcement/expanded-homicide/expanded_homicide_data_table_6_murder_race_and_sex_of_vicitm_by_race_and_sex_of_offender_2013.xls

TOOLS USED:
LibreOffice Calc",dataisbeautiful,1
TIL of Holdthemoan. Today is a good day.,dataisbeautiful,1
"If this is the first time you've seen a crappy graph with some agenda, then this must be your first time on /r/dataisbeautiful. That has been the dominant theme for three or four years now.",dataisbeautiful,1
How many widgets do you think Germany will be producing when Shariah law outlaws widgets?,dataisbeautiful,1
"Public universities used to receive lots of state funding. 

A high school diploma used to be sufficient to obtain a middle class job.

So we have more people going to schools receiving less state funding. ",dataisbeautiful,1
will liam Noah bout how common his name is?,dataisbeautiful,1
r/datagore,dataisbeautiful,1
"Where is our waste going to go?  Where are we going to buy food?  Why am I living shoulder to shouler with 7 billion people on top of a mountain, under a lake, or in a desert?

This is by far the most misleading shit I've seen here.",dataisbeautiful,1
Why do I not see Meecrob on this list?,dataisbeautiful,1
Democracy would be the perfect system if everyone was educated essentially. ,dataisbeautiful,1
"[Here's the original source for all of OP's ""OC"", including the analysis, which is directly plagiarized](http://www.internetworldstats.com/emarketing.htm)

Also, I'm sorry, but two cluttered bar graphs isn't beautiful data, and there's no way it got to 97% upvoted with 104 points within an hour when most of reddit is asleep without vote manipulation.

/u/zonination waddup ",dataisbeautiful,1
The spending should be adjusted for inflation. Once inverse correlation pops out we can paint a funny picture of hobo scientists hanging themself cause no money.,dataisbeautiful,1
watching this resulted in me reading about 15 wiki articles.,dataisbeautiful,1
"""You wouldn't clone a car!!!!"" (somebody had to say it...)",dataisbeautiful,1
I wouldn't call my self a socialist I just believe that if our money is used to jump start or bail people out its in my economic interest to have control over whatever that might be. I still believe in markets but if I give you a loan or money I expect something in return. So far we haven't gotten anything.,dataisbeautiful,1
Same in England,dataisbeautiful,1
"""more than 50 statements"".... bruh. how does that i wouldn't mind seeing which ones
",dataisbeautiful,1
"The problem is not the number of people, but the quality of those people. Through dysgenics the population of the world has become and will continue to become less intelligent over time. ",dataisbeautiful,1
"""Wat"", indeed.",dataisbeautiful,1
"These infographs aren't great, hardly ""beautiful"". The same piece of information just displyed in 4 different ways.   What is the insight I'm supposed to gain from looking at this?",dataisbeautiful,1
"Yes, but slut and whore are not terms of endearment between women.  Context is very important.",dataisbeautiful,1
Where dah watsky at,dataisbeautiful,1
"Well, would u look at that, it seems the closer you get to Mexico the more criminals are found.",dataisbeautiful,1
Lolwut,dataisbeautiful,1
you're a retard,dataisbeautiful,1
"The OC post:
Frontend: React
Backend: Python, Pandas, ScyPy
Sources: Teleport API - https://developers.teleport.org

If you have any questions, please feel free to shoot a message.",dataisbeautiful,1
"So which way should it be said? Say it nicely that Blacks count for homicides even though they only represent 12% of the population? Should we present some cupcakes when we say these stats?

Do I present cupcakes also when I say that White people have killed more Cops than Black people?",dataisbeautiful,1
Enjoy your MAGA hat and bible thumping.,dataisbeautiful,1
"More killed in a month in one city than by the police in the whole country. 

And not a peep from the BLM folks. ",dataisbeautiful,1
/e/kenm,dataisbeautiful,1
"I would say ethnic tension and tribalism are human nature. Israelis versus the Palestinians, Cherokee versus shawnee, Tibetans versus the Han,  Muslims versus everyone etc. because an individual tends to identify with their own ethnic group is not evil. Obviously being cruel to others is wrong.

As an aside, multi ethnic / pluralistic societies always fail. Rome, the ottomans etc. the US worked when there was forced assimilation as described by teddy Roosevelt",dataisbeautiful,1
"lol, cherry pick your facts asshole.

Here is the only fact that matters: Israel would not exist right now without the USA, and their would be ZERO Jews in that region too. ",dataisbeautiful,1
"A few weeks ago I thought about doing a word cloud for my long distance relationship and putting it into a xmas card 4.5 years together, 1.5 years long distance for grad school). She flew home to her parents' hometown for Thanksgiving and convinced me to drive the six hours to come visit her (she currently lives much further than that). I was so excited to see her and we planned on going to see a basketball game. As we were looking for tickets online, her computer started freezing up. She's new to Apple laptops and didn't know how to force quit any of the frozen apps. So I showed her how to do it. As I began closing her apps, her iMessage app appeared from the background and I saw her most recent texts, largely by accident, partially out of curiosity. She had been cheating on me. So I drove another six hours home that day. 2 weeks later, I'm still really sad. Anyway, some of these words in this iCloud, as generic as they probably are to relationships, made me think of her, which makes me sad. I'm not even sure why I'm posting this. ",dataisbeautiful,1
How about you delete the low quality and low effort submission?,dataisbeautiful,1
Yes,dataisbeautiful,1
"It told me ""only one person on the scale at time please"" ",dataisbeautiful,1
Gorgeous,dataisbeautiful,1
"""Homophobia"" doesn't exist. A phobia is an irrational fear. No one is afraid of homosexuals, we are simply disgusted by them.",dataisbeautiful,1
"call girls dubai 
",dataisbeautiful,1
"Annnnnd what percentage of this map is black males?? (About 8% of the population?) I'm going to guess over 50% of incarcerated males. Fuck black people, just because they clog our court system and jails; doesn't mean systematic racism exists. Systematic stupidity is what's rampant in black communities",dataisbeautiful,1
"I disagree entirely.  Just because there might be A god or gods, it doesn't mean that that being cares at all about our lives or how we act.  A prime mover may be running a computer simulation that includes us, but isn't what his universe simulator is really about.  Or may have created our universe as part of a physics experiment. There would be no reason to live differently believing such a god exists than if no god exists.   Your discussion only pertains to a personal god, which is not at at all the same thing as belief in a possible god being.",dataisbeautiful,1
"Can confirm, Maine is white as fuck.  When even the shittiest convenience stores have white clerks, there is a very strange lack of minorities afoot.",dataisbeautiful,1
"Probably more fucking dumb girls at the high school he was at.

Source: same high school. Dude's an amazing athlete, but a tool. Also a poor tipper.",dataisbeautiful,1
"> But I'd rather change the view of fellow redditors as regards to the opinion that India is a country still stuck in the 1930s.

I was thinking 1530s.",dataisbeautiful,1
"You're a fucking idiot if you think that you speak for ""we guys"" with your broad-strokes bullshit",dataisbeautiful,1
The US gives so much aid to other countries overall its amazing to me.,dataisbeautiful,1
"so hitler i can hitler screw hitler your hitler data hitler just hitler by hitler saying hitler alot hitler? hitler. 





















hitler. ",dataisbeautiful,1
"He's insulting some pussy puss, deal with it",dataisbeautiful,1
Looks like someone read story telling with data!,dataisbeautiful,1
"> ""warm-blooded"".

Lizard people need love, too!

",dataisbeautiful,1
"I expect that comment was a nice play-on words of the title, however somebody stupid likely reported it and an even stupider mod deleted it because it wasn't all ""fuzzy and nice and G-rated"".  This site is getting really bad.  Digg 2.0?",dataisbeautiful,1
"Yay let's blame the West for everything, including other people choosing to target innocent civilians!

Right on!",dataisbeautiful,1
Used Exploratory Desktop ( http://exploratory.io ) Data Source: StackLite. ( https://github.com/dgrtwo/StackLite ),dataisbeautiful,1
"When you fantasize about Donald Trump sucking Putin's cock (you know, those lonely nights in your mother's basement) does Donald Trump spit or swallow Putin's hot cum? I only ask because I know you've thought about this a lot. And if Donald Trump doesn't swallow Putin's hot cum, does Donald Trump spit it into your face? How often does this fantasy run though your mind? Are you getting horny yet?",dataisbeautiful,1
Emissions? Bullets? You should stop trying to pretend you're an intellectual and do something else. Plus the downvotes...SHEESH! Are you a black person? ,dataisbeautiful,1
Come on leave us divorced suckers at least that,dataisbeautiful,1
"fyi, I don't empathize with her the slightest bit.",dataisbeautiful,1
A scripting language generally sits behind some programming language. Scripting languages generally have less access to the computer’s native abilities since they only run on a subset of the programming language.Scripting languages are generally slower than programming languages.,dataisbeautiful,1
Traitor,dataisbeautiful,1
The healthcare system in the states is so fucking broken.  I pine for the days when I would bitch about a $40 copay.,dataisbeautiful,1
"Seriously, that was the most surprising thing. I thought the Democratic party was going to clean up this year right down the ballot. But the exact opposite happened.",dataisbeautiful,1
I'm sure you have some sources to compensate for this shit stink coming out your mouth.,dataisbeautiful,1
Kill yourself.  The afterlife is great and exists.,dataisbeautiful,1
"> People extremely involved in Snapchat seem to be incipient narcissists rather than ""fun outgoing people"".

",dataisbeautiful,1
No wonder theres so many landscaping companies,dataisbeautiful,1
"Man, people have been having a LOT of sex for the last 65 years.....",dataisbeautiful,1
"Lmao, sure you were being non biased, fucking cetnik

Srbe na vrbe always and forever the only solution to balkan peace",dataisbeautiful,1
"Wow another bullshit graph that displays nothing but the increasing technology and ability to take measurement, for millennials to all huddle around together and think that posting sarcastic comments about 'pro-science' and the icecaps melting, is somehow going to usher in environmentalism or reduced carbon emissions in India or China. 

This data is beyond useless, NASA is an absolute shit show, and all you kids going to college for atmospheric sciences and shit are wasting your time. This industry is not growing, but the Antarctic ice shelf is. Funny how these things work out when we are economically depressed in a couple years. Coal stocks will soar. China will import Australian and American coal by the container. Yawn.

Stop the circle jerc. ",dataisbeautiful,1
