body,subreddit,moderated
The same goes for this awful sub too,EnoughTrumpSpam,1
"this is fake, if you see the video, it looks full , https://youtu.be/44oLjMk_moM",EnoughTrumpSpam,1
"Well Trump would be better for the Canadian economy so yeah if it had been up to me that's who I would have chosen. I still think he's a dumbass and a terrible president.

And how is he fascist exactly?",EnoughTrumpSpam,1
"I'd rejoice, but that still means we are electing Hillary Clinton.  ",EnoughTrumpSpam,1
This thread shows what a failure this sub is. Even Sanders supporters saying this is stupid. ,EnoughTrumpSpam,1
OK Comrade.... Lets see what the next 4 years bring you. Step to me in life my friend and it would be your last steps on this green Earth. Fucking communist ,EnoughTrumpSpam,1
The Donald dindu nuffin doe ,EnoughTrumpSpam,1
"You're right. That's a logical conclusion. This isn't a sub for logic, though; this is a circlejerk for people who hate trump and everything he says regardless of its validity, hence your downvotes. ",EnoughTrumpSpam,1
I admire Obama but correct me if I'm wrong isn't he under investigation right about soon? People around the world have the right to be angry and shocked at this election's results but picking could be losing battles is ultimately just good for the winner.,EnoughTrumpSpam,1
TFW you realize enough trump spam will never come close to dominating the front page like the_donald.  Sad.,EnoughTrumpSpam,1
gg cucks you really outdid yourselves here,EnoughTrumpSpam,1
Did we watch the same debate? Hillary had her bitch face on the whole debate.,EnoughTrumpSpam,1
Lol just wait till tomorrow don't worry he will still be president and you will have to go to your safe spaces an color to get the pain away ,EnoughTrumpSpam,1
"So I'm a fuckwit for having an educated opinion here? 

And your link isn't working - but there are plenty of others showing Hilary herself saying he was her mentor, pretty close ties of you ask me.  Video here, unless of course you can claim this is fake too: http://www.snopes.com/clinton-byrd-photo-klan/
",EnoughTrumpSpam,1
Every post who replies to you gets removed. Fucking hilarious.,EnoughTrumpSpam,1
The two rancid cunts took the cash spread the lies and kept their filthy secrets for as long as they could. Maggots.,EnoughTrumpSpam,1
"THIS is fucking treason. Hang Donald Trump from his grotesque buildings. After they've been seized by the government, of course.",EnoughTrumpSpam,1
Why should i settle for an establishment candidate that has transparently been bankrolled by people that do not have the middle classes best interest at heart.,EnoughTrumpSpam,1
And how does the trump train have anything to do with this article? By clicking the link I got new info I hadn't seen and one step closer to the god emperor. Thank you guys for helping the trump movement we appreciate you. ,EnoughTrumpSpam,1
Triggered ,EnoughTrumpSpam,1
Triggred,EnoughTrumpSpam,1
Does anyone in this sub actually support any candidate or do you all just foam at the mouth and sniff each other's assholes.,EnoughTrumpSpam,1
"> All the Drumpf supporters are crying in their cereal about these protests and completely forgetting/ignoring the fact that they wanted to go to WAR if they lost.

We did? You mean like the war in street that happened when Obama one twice? 

We are the people in American that actually give a fuck about the rule of law. Nobody rioted or were violent when Obama won and none of us would have been had Shillary won. (She didn't win. We did.)


>The denial of that is astounding

We're in denial? Jesus Christ, you guys are pathetic. 

#MAGA",EnoughTrumpSpam,1
Do you even know what it is?,EnoughTrumpSpam,1
"r/EnoughTrumpSpam where dodging the draft is admirable (Bill Clinton, Muhamad Ali, Bruce Springsteen, John Wayne) unless you don't like the person... then its cowardly... but hey HRC is pro war to the max, why wouldn't her minions demand men and women send themselves to their deaths for government squabbles... ",EnoughTrumpSpam,1
"Liberals are so terrified of free speech its hilarious.


Keep poking that bear though",EnoughTrumpSpam,1
">Guys, too much shitposting is reaching the front page. Let's shitpost  twice as much, that'll show'em!

I don't like any of the candidates honestly, but reddit is in a rediculous state. Without RES to block all these spammy subs, /r/all is a clusterfuck. The internet is where maturity & civility goes to die, I guess.",EnoughTrumpSpam,1
"I started this race as staunchly Trump, but now find myself saying 'fuck it' and am just going to write-in Bernie Sanders instead--it's the only way I can sleep with myself at night",EnoughTrumpSpam,1
Every single person who pulled the lever for Trump deserves to die from lack of health coverage. They all deserve what they voted for. ,EnoughTrumpSpam,1
"I agree the context is missing. The video appears to open at the end of a small scuffle between the two groups (the guy in the black shirt appears to be pushing his way in between the two groups with his pepper spray as a 'buffer').

",EnoughTrumpSpam,1
http://sli.mg/oIWVx6,EnoughTrumpSpam,1
"They are already committing murders. The fact that the Alt-Right commit acts of violence is demonstration and proof that nonviolent negotiation has already failed. At this point, opposition to violence against the fascists is opposition to the defense of their victims.",EnoughTrumpSpam,1
Wouldn't this be a much [better photo](http://assets.bwbx.io/images/iTVKK6C4YhsM/v1/-1x-1.jpg)?,EnoughTrumpSpam,1
Some of us did :(,EnoughTrumpSpam,1
"actually it was taken down due to a similar gofundme page..

the creator of the page posted this comment and tried for the rest of the night to get them to reactivate it... The money that was raised before it was shut down was in the matter of an hour. 

>I am talking with youcaring now. They deactivated because of the similar campaign, however I am trying to explain to them that this campaign goal was to raise money exclusively by Trump supporters. I am sorry guys, trying my best to deal with them via email.",EnoughTrumpSpam,1
More qualified than hillary is was or ever will be. ,EnoughTrumpSpam,1
"From what I've heard, the individual who screamed ""GUN"" was actually with the protester.

His name is even mentioned in the podesta emails.",EnoughTrumpSpam,1
"Not gonna call you a nazi, but this place is so far up Hillary's ass they can smell her breath. Between that and posts being locked for dissenting opinions, fuck this place.
Here's a link to a thread that shows the character of the mod that locked the Jill stein post for ""brigading"": https://www.reddit.com/r/subredditcancer/comments/5my4hi/enoughtrumpspam_mods_ban_me_for_3_madeup_reasons/dc79jt1/?context=3
What is the name of this subreddit? Is it EnoughJillStein votes? Is it enough 3rdPartyCandidates. No it's fucking EnoughTrumpSpam. It is supposed to exist so the party can get together and beat Trump like a pinata so we can have some feeling of unison. All this bullshit does is alienate the fringe supporters and strengthen republican's hold on the government.",EnoughTrumpSpam,1
"It's gotta be the Russians.

Fucking Trump Russians.

**Love Trumps Russians**",EnoughTrumpSpam,1
So dumb.,EnoughTrumpSpam,1
"How many times have we seen these hate crimes play out where out turns out to be a hoax / member of the church or organization that did the deed? The answer is - tons, and tons of times. 

A google search will net you hundreds of examples of religious and minority organizations pulling stunts like that for money and attention, it isn't unreasonable to believe this is also one of those occurrences. The story here is completely nonsensical, it's incredibly hard to believe.",EnoughTrumpSpam,1
"The fact that liberals would be standing up for the rights of all Americans and not just the wealthy, white, Christian elite.",EnoughTrumpSpam,1
oh really? which numbers are you speaking about?,EnoughTrumpSpam,1
Fuck this shit guys arm yourselves. This is so egregious we need to demand they look into it or we March 10 million strong onto SF and take out the admins ourselves. They wont stop until we are purged from Reddit. Its now or never we need to act soon.,EnoughTrumpSpam,1
[Sure](https://www.youtube.com/watch?v=p4wo9nqWrwE),EnoughTrumpSpam,1
If you count a warrior as a rapist enabler that's cool,EnoughTrumpSpam,1
Gotta love revisionist history.,EnoughTrumpSpam,1
"I don't care whether you think they do or not, that's the difference.",EnoughTrumpSpam,1
"Thank you for not telling the OP to fuck off, or go fuck himself, or go die, or go kill himself. ",EnoughTrumpSpam,1
[so natural and organic that its trending on twitter](http://i.imgur.com/dhRdS88.png),EnoughTrumpSpam,1
"If you aren't anti-science, then do you acknowledge the physical differences between the races such as brain size and skull structure and the differences in intelligence quotient test performance? The physical differences alone prove that the races have evolved separately from one another and when you combine that data from the differences in intelligence quotient test performance and school performance, it becomes clear that the races do not perform the same physically or mentally. If the environment is the causing factor for the different scores and performance, then why is the data and results persistent through every country and civilization? Why is it that in every country the data is always the same, where East-Asians score higher than whites and whites score higher than Africans?

Jewish-American average intelligence quotient level - 113

Asian-American - 106

White-American - 103

Hispanic-American - 89

Black-American - 85

Sub-Saharan African - 70

Australian Aboriginal - 62

http://www.sciencedirect.com/science/article/pii/016028969290028P

http://www.amren.com/news/2013/05/debunking-the-iq-myth/

https://www1.udel.edu/educ/gottfredson/30years/Rushton-Jensen30years.pdf",EnoughTrumpSpam,1
[removed],EnoughTrumpSpam,1
"Soooo which is it? Did td get kicked off /all or are you doing the equivalent of sticking your fingers in your ears lol...

*I have no issue with Trump winning*

Cuck??

",EnoughTrumpSpam,1
"Well, i mean, south park has some solid views on the world that I agree with yeah.. I've not seen v for vendetta.. you seem pretty pissed off though.",EnoughTrumpSpam,1
not at all just morons.,EnoughTrumpSpam,1
"Can anyone point to the place in the Constitution where it says the popular vote winner wins? Or should we change the Constitution because Clinton lost, despite Clinton entering into this contest knowing full well the rules? Rules which she broke by colluding with the DNC to undermine the Sanders campaign?",EnoughTrumpSpam,1
"> anti-GLBT

Yeah, because that's creepy shit.
",EnoughTrumpSpam,1
You just compared being told mean things and being denied entrance at a party to the authority that's supposed to protect you shooting your children. Think about that.,EnoughTrumpSpam,1
"Wait, you actually think increased CO2 is a bad thing?",EnoughTrumpSpam,1
Did your mom drop you on your head as a baby?  Numerous times?,EnoughTrumpSpam,1
You're using one small minority of a larger population to stereotype the entire community. I thought this sub was against that behavior. ,EnoughTrumpSpam,1
"Walk-in from /r/all here.

How exactly is this sub helping to curb Trump spam? If anything, I now see DOUBLE the Trump spam on /all.

Much like the place you're mocking, this sub started out **kinda** funny but now it's just pointless noise.",EnoughTrumpSpam,1
Islam is a problem for Muslims? Fifty dead gays disagree,EnoughTrumpSpam,1
"What would you call flooding Europe with unskilled, uneducated people from backwards and barbaric cultures? Would you like to consult Muslim crime statistics? Do you honestly feel, based on polling done of Muslims in Europe, that they have assimilated?",EnoughTrumpSpam,1
Lol if you want to argue non-shills would value a disgustingly immature Clinton supporter's opinion be my guest.,EnoughTrumpSpam,1
Can I get a source for the $9.5 million donated to Trump? I can't find that online anywhere,EnoughTrumpSpam,1
Wow this place actually has Hitler flags and everything. This is hate page far worse than anything i have seen on reddit before. ,EnoughTrumpSpam,1
too far. pm next time your in the states please.,EnoughTrumpSpam,1
Go ahead. Alpha here. I won't cry about it. ,EnoughTrumpSpam,1
"I didn't delete my account because of you, you arrogant college dropout. And you are the one that needs to research before shooting bullshit out of your mouth.
This is the first sentence of the Wikipedia article on Social Darwinism: ""Social Darwinism is a name given to various phenomena emerging in the second half of the 19th century, trying to apply biological concepts of natural selection and survival of the fittest in human society"". 

The article draws a direct line between eugenics and this concept multiple times, here, for example: ""By the 1920s, social Darwinism found expression in the promotion of eugenics by the Chinese sociologist Pan Guangdan. When Chiang Kai-shek started the New Life movement in 1934"". 
There are also multiple sections of it's relevance in Germany of the early twentieth century. 

*You* are too fucking obtuse to use Google.",EnoughTrumpSpam,1
So salty so delicious. Poor little snowflake. Everyone who doesn't fight for your safe space is a Nazi facists white supremacist hick! Bah!!!,EnoughTrumpSpam,1
"You guys remember when she [said she was going to dedicate her time in the white house fighting cyberbullies](http://time.com/4556902/melania-trump-donald-first-lady-social-media/)?

And now this, I guess she's only fighting people that bully her. So there's that...

^and ^the ^^^fact ^^^that ^^^^T_D ^^^^and ^^^^her groper ^^^^have ^^^^^been ^^^^^bulling ^^^^^^everyone ^^^^^^they ^^^^^^disagree ^^^^^^with",EnoughTrumpSpam,1
"Trump wins""thanks for all the votes it means a lot""

Trump loses""no point in voting the system is RIGGED""",EnoughTrumpSpam,1
"No, but I want Bernie Sanders to be president, because otherwise it will just be more of the same.  The Rich getting all the money, leaving none for anyone else.",EnoughTrumpSpam,1
"You'd rather have a corrupt politician who rots the country from within, I thought the lesser evil was one who advocated for peace on the world stage, despite sounding low-class in speech. Call me a retard all you want if the personal attacks make you feel better, but there's nothing gained by them so I'll leave that to you.
 We have different priorities from the choices given, I chose a Reagan, you wanted someone more akin to a Putin. Ironic right? Cheers.",EnoughTrumpSpam,1
That's not Bernie Sanders...,EnoughTrumpSpam,1
CTR check bounced.,EnoughTrumpSpam,1
30%!,EnoughTrumpSpam,1
"Clinton has not shied away from personal attacks, hyperbole, or outright lies about the opposition. ",EnoughTrumpSpam,1
Just reality buddy. Reddit mods are basically liberal propagandists. ,EnoughTrumpSpam,1
"This is literally Trump spam. 

You guys are the same as The_Donald. Just on the other side of the spectrum. ",EnoughTrumpSpam,1
TRUMP RACIST TRUMP RACIST TRUMP RACIST TRUMP RACIST TRUMP RACIST TRUMP RACIST TRUMP RACIST TRUMP RACIST TRUMP RACIST TRUMP RACIST TRUMP RACIST TRUMP RACIST TRUMP RACIST TRUMP RACIST TRUMP RACIST TRUMP RACIST TRUMP RACIST TRUMP RACIST TRUMP RACIST TRUMP RACIST TRUMP RACIST TRUMP RACIST TRUMP RACIST TRUMP RACIST TRUMP RACIST TRUMP RACIST TRUMP RACIST TRUMP RACIST TRUMP RACIST TRUMP RACIST TRUMP RACIST TRUMP RACIST TRUMP RACIST TRUMP RACIST TRUMP RACIST TRUMP RACIST TRUMP RACIST TRUMP RACIST TRUMP RACIST TRUMP RACIST TRUMP RACIST TRUMP RACIST TRUMP RACIST TRUMP RACIST TRUMP RACIST TRUMP RACIST TRUMP RACIST TRUMP RACIST TRUMP RACIST TRUMP RACIST TRUMP RACIST TRUMP RACIST TRUMP RACIST TRUMP RACIST TRUMP RACIST TRUMP RACIST TRUMP RACIST TRUMP RACIST TRUMP RACIST TRUMP RACIST TRUMP RACIST TRUMP RACIST TRUMP RACIST TRUMP RACIST TRUMP RACIST TRUMP RACIST TRUMP RACIST TRUMP RACIST TRUMP RACIST TRUMP RACIST TRUMP RACIST TRUMP RACIST TRUMP RACIST TRUMP RACIST TRUMP RACIST TRUMP RACIST TRUMP RACIST TRUMP RACIST TRUMP RACIST TRUMP RACIST TRUMP RACIST TRUMP RACIST TRUMP RACIST TRUMP RACIST TRUMP RACIST TRUMP RACIST TRUMP RACIST TRUMP RACIST TRUMP RACIST TRUMP RACIST TRUMP RACIST TRUMP RACIST TRUMP RACIST TRUMP RACIST TRUMP RACIST TRUMP RACIST TRUMP RACIST TRUMP RACIST TRUMP RACIST TRUMP RACIST TRUMP RACIST TRUMP RACIST TRUMP RACIST TRUMP RACIST TRUMP RACIST TRUMP RACIST TRUMP RACIST TRUMP RACIST TRUMP RACIST TRUMP RACIST TRUMP RACIST TRUMP RACIST TRUMP RACIST TRUMP RACIST TRUMP RACIST TRUMP RACIST TRUMP RACIST TRUMP RACIST TRUMP RACIST TRUMP RACIST TRUMP RACIST TRUMP RACIST TRUMP RACIST TRUMP RACIST TRUMP RACIST TRUMP RACIST TRUMP RACIST TRUMP RACIST TRUMP RACIST TRUMP RACIST TRUMP RACIST TRUMP RACIST TRUMP RACIST TRUMP RACIST TRUMP RACIST TRUMP RACIST TRUMP RACIST TRUMP RACIST TRUMP RACIST TRUMP RACIST TRUMP RACIST TRUMP RACIST TRUMP RACIST TRUMP RACIST TRUMP RACIST TRUMP RACIST TRUMP RACIST TRUMP RACIST TRUMP RACIST TRUMP RACIST TRUMP RACIST TRUMP RACIST TRUMP RACIST TRUMP RACIST TRUMP RACIST TRUMP RACIST TRUMP RACIST TRUMP RACIST TRUMP RACIST TRUMP RACIST TRUMP RACIST TRUMP RACIST TRUMP RACIST TRUMP RACIST TRUMP RACIST TRUMP RACIST TRUMP RACIST TRUMP RACIST TRUMP RACIST TRUMP RACIST TRUMP RACIST TRUMP RACIST TRUMP RACIST TRUMP RACIST TRUMP RACIST TRUMP RACIST TRUMP RACIST TRUMP RACIST TRUMP RACIST TRUMP RACIST TRUMP RACIST TRUMP RACIST TRUMP RACIST TRUMP RACIST TRUMP RACIST TRUMP RACIST TRUMP RACIST TRUMP RACIST TRUMP RACIST TRUMP RACIST TRUMP RACIST TRUMP RACIST TRUMP RACIST TRUMP RACIST TRUMP RACIST TRUMP RACIST TRUMP RACIST TRUMP RACIST TRUMP RACIST TRUMP RACIST TRUMP RACIST TRUMP RACIST TRUMP RACIST TRUMP RACIST TRUMP RACIST TRUMP RACIST TRUMP RACIST TRUMP RACIST TRUMP RACIST TRUMP RACIST TRUMP RACIST TRUMP RACIST TRUMP RACIST TRUMP RACIST TRUMP RACIST TRUMP RACIST TRUMP RACIST TRUMP RACIST TRUMP RACIST TRUMP RACIST TRUMP RACIST TRUMP RACIST TRUMP RACIST TRUMP RACIST TRUMP RACIST TRUMP RACIST TRUMP RACIST TRUMP RACIST TRUMP RACIST TRUMP RACIST TRUMP RACIST TRUMP RACIST TRUMP RACIST TRUMP RACIST TRUMP RACIST TRUMP RACIST TRUMP RACIST TRUMP RACIST TRUMP RACIST TRUMP RACIST TRUMP RACIST TRUMP RACIST TRUMP RACIST TRUMP RACIST TRUMP RACIST TRUMP RACIST TRUMP RACIST TRUMP RACIST TRUMP RACIST TRUMP RACIST TRUMP RACIST TRUMP RACIST TRUMP RACIST TRUMP RACIST TRUMP RACIST TRUMP RACIST TRUMP RACIST TRUMP RACIST TRUMP RACIST TRUMP RACIST TRUMP RACIST TRUMP RACIST TRUMP RACIST TRUMP RACIST TRUMP RACIST TRUMP RACIST TRUMP RACIST TRUMP RACIST TRUMP RACIST TRUMP RACIST TRUMP RACIST TRUMP RACIST TRUMP RACIST TRUMP RACIST TRUMP RACIST TRUMP RACIST TRUMP RACIST TRUMP RACIST TRUMP RACIST TRUMP RACIST TRUMP RACIST TRUMP RACIST TRUMP RACIST TRUMP RACIST TRUMP RACIST TRUMP RACIST TRUMP RACIST TRUMP RACIST TRUMP RACIST TRUMP RACIST TRUMP RACIST TRUMP RACIST TRUMP RACIST TRUMP RACIST TRUMP RACIST TRUMP RACIST TRUMP RACIST TRUMP RACIST TRUMP RACIST TRUMP RACIST TRUMP RACIST TRUMP RACIST TRUMP RACIST TRUMP RACIST TRUMP RACIST TRUMP RACIST TRUMP RACIST TRUMP RACIST TRUMP RACIST TRUMP RACIST TRUMP RACIST TRUMP RACIST TRUMP RACIST TRUMP RACIST TRUMP RACIST TRUMP RACIST TRUMP RACIST TRUMP RACIST TRUMP RACIST TRUMP RACIST TRUMP RACIST TRUMP RACIST TRUMP RACIST TRUMP RACIST TRUMP RACIST TRUMP RACIST TRUMP RACIST TRUMP RACIST TRUMP RACIST TRUMP RACIST TRUMP RACIST TRUMP RACIST TRUMP RACIST TRUMP RACIST TRUMP RACIST TRUMP RACIST TRUMP RACIST TRUMP RACIST TRUMP RACIST TRUMP RACIST TRUMP RACIST TRUMP RACIST TRUMP RACIST TRUMP RACIST TRUMP RACIST TRUMP RACIST TRUMP RACIST TRUMP RACIST TRUMP RACIST TRUMP RACIST TRUMP RACIST TRUMP RACIST TRUMP RACIST TRUMP RACIST TRUMP RACIST TRUMP RACIST TRUMP RACIST TRUMP RACIST TRUMP RACIST TRUMP RACIST TRUMP RACIST TRUMP RACIST TRUMP RACIST TRUMP RACIST TRUMP RACIST TRUMP RACIST TRUMP RACIST TRUMP RACIST TRUMP RACIST TRUMP RACIST TRUMP RACIST TRUMP RACIST TRUMP RACIST TRUMP RACIST TRUMP RACIST TRUMP RACIST TRUMP RACIST TRUMP RACIST TRUMP RACIST TRUMP RACIST TRUMP RACIST TRUMP RACIST TRUMP RACIST TRUMP RACIST TRUMP RACIST TRUMP RACIST TRUMP RACIST TRUMP RACIST TRUMP RACIST TRUMP RACIST TRUMP RACIST TRUMP RACIST TRUMP RACIST TRUMP RACIST TRUMP RACIST TRUMP RACIST TRUMP RACIST TRUMP RACIST TRUMP RACIST TRUMP RACIST TRUMP RACIST TRUMP RACIST TRUMP RACIST TRUMP RACIST TRUMP RACIST TRUMP RACIST TRUMP RACIST TRUMP RACIST TRUMP RACIST TRUMP RACIST TRUMP RACIST TRUMP RACIST TRUMP RACIST TRUMP RACIST TRUMP RACIST TRUMP RACIST TRUMP RACIST TRUMP RACIST TRUMP RACIST TRUMP RACIST TRUMP RACIST TRUMP RACIST TRUMP RACIST TRUMP RACIST TRUMP RACIST TRUMP RACIST TRUMP RACIST TRUMP RACIST TRUMP RACIST TRUMP RACIST TRUMP RACIST TRUMP RACIST TRUMP RACIST TRUMP RACIST TRUMP RACIST TRUMP RACIST TRUMP RACIST TRUMP RACIST TRUMP RACIST TRUMP RACIST TRUMP RACIST TRUMP RACIST TRUMP RACIST TRUMP RACIST TRUMP RACIST TRUMP RACIST TRUMP RACIST TRUMP RACIST TRUMP RACIST TRUMP RACIST TRUMP RACIST TRUMP RACIST TRUMP RACIST TRUMP RACIST TRUMP RACIST TRUMP RACIST TRUMP RACIST TRUMP RACIST TRUMP RACIST TRUMP RACIST TRUMP RACIST TRUMP RACIST TRUMP RACIST TRUMP RACIST TRUMP RACIST TRUMP RACIST TRUMP RACIST TRUMP RACIST TRUMP RACIST TRUMP RACIST TRUMP RACIST TRUMP RACIST TRUMP RACIST TRUMP RACIST TRUMP RACIST TRUMP RACIST TRUMP RACIST TRUMP RACIST TRUMP RACIST TRUMP RACIST TRUMP RACIST TRUMP RACIST TRUMP RACIST TRUMP RACIST TRUMP RACIST TRUMP RACIST TRUMP RACIST TRUMP RACIST TRUMP RACIST TRUMP RACIST TRUMP RACIST TRUMP RACIST TRUMP RACIST TRUMP RACIST TRUMP RACIST TRUMP RACIST TRUMP RACIST TRUMP RACIST TRUMP RACIST TRUMP RACIST TRUMP RACIST TRUMP RACIST TRUMP RACIST TRUMP RACIST TRUMP RACIST TRUMP RACIST TRUMP RACIST TRUMP RACIST TRUMP RACIST TRUMP RACIST TRUMP RACIST TRUMP RACIST TRUMP RACIST TRUMP RACIST TRUMP RACIST TRUMP RACIST TRUMP RACIST TRUMP RACIST TRUMP RACIST TRUMP RACIST TRUMP RACIST TRUMP RACIST TRUMP RACIST TRUMP RACIST TRUMP RACIST TRUMP RACIST TRUMP RACIST TRUMP RACIST TRUMP RACIST TRUMP RACIST TRUMP RACIST TRUMP RACIST TRUMP RACIST TRUMP RACIST TRUMP RACIST TRUMP RACIST TRUMP RACIST TRUMP RACIST TRUMP RACIST TRUMP RACIST TRUMP RACIST TRUMP RACIST TRUMP RACIST TRUMP RACIST TRUMP RACIST TRUMP RACIST TRUMP RACIST TRUMP RACIST TRUMP RACIST TRUMP RACIST TRUMP RACIST TRUMP RACIST TRUMP RACIST TRUMP RACIST TRUMP RACIST TRUMP RACIST TRUMP RACIST TRUMP RACIST TRUMP RACIST TRUMP RACIST TRUMP RACIST TRUMP RACIST TRUMP RACIST TRUMP RACIST TRUMP RACIST TRUMP RACIST TRUMP RACIST TRUMP RACIST TRUMP RACIST TRUMP RACIST TRUMP RACIST TRUMP RACIST TRUMP RACIST TRUMP RACIST TRUMP RACIST TRUMP RACIST TRUMP RACIST TRUMP RACIST TRUMP RACIST TRUMP RACIST TRUMP RACIST TRUMP RACIST TRUMP RACIST TRUMP RACIST TRUMP RACIST TRUMP RACIST TRUMP RACIST TRUMP RACIST TRUMP RACIST TRUMP RACIST TRUMP RACIST TRUMP RACIST TRUMP RACIST TRUMP RACIST TRUMP RACIST TRUMP RACIST TRUMP RACIST TRUMP RACIST TRUMP RACIST TRUMP RACIST TRUMP RACIST TRUMP RACIST TRUMP RACIST TRUMP RACIST TRUMP RACIST TRUMP RACIST TRUMP RACIST TRUMP RACIST TRUMP RACIST TRUMP RACIST TRUMP RACIST TRUMP RACIST TRUMP RACIST TRUMP RACIST TRUMP RACIST TRUMP RACIST TRUMP RACIST TRUMP RACIST TRUMP RACIST TRUMP RACIST TRUMP RACIST TRUMP RACIST TRUMP RACIST TRUMP RACIST TRUMP RACIST TRUMP RACIST TRUMP RACIST TRUMP RACIST TRUMP RACIST TRUMP RACIST TRUMP RACIST TRUMP RACIST TRUMP RACIST TRUMP RACIST TRUMP RACIST TRUMP RACIST TRUMP RACIST TRUMP RACIST TRUMP RACIST TRUMP RACIST TRUMP RACIST TRUMP RACIST TRUMP RACIST TRUMP RACIST TRUMP RACIST TRUMP RACIST TRUMP RACIST TRUMP RACIST TRUMP RACIST TRUMP RACIST TRUMP RACIST TRUMP RACIST TRUMP RACIST TRUMP RACIST TRUMP RACIST TRUMP RACIST TRUMP RACIST TRUMP RACIST TRUMP RACIST TRUMP RACIST TRUMP RACIST TRUMP RACIST TRUMP RACIST TRUMP RACIST TRUMP RACIST TRUMP RACIST TRUMP RACIST TRUMP RACIST TRUMP RACIST TRUMP RACIST TRUMP RACIST TRUMP RACIST TRUMP RACIST TRUMP RACIST TRUMP RACIST TRUMP RACIST TRUMP RACIST TRUMP RACIST TRUMP RACIST TRUMP RACIST TRUMP RACIST TRUMP RACIST TRUMP RACIST TRUMP RACIST TRUMP RACIST TRUMP RACIST TRUMP RACIST TRUMP RACIST TRUMP RACIST TRUMP RACIST TRUMP RACIST TRUMP RACIST TRUMP RACIST TRUMP RACIST TRUMP RACIST TRUMP RACIST TRUMP RACIST TRUMP RACIST TRUMP RACIST TRUMP RACIST TRUMP RACIST TRUMP RACIST TRUMP RACIST TRUMP RACIST TRUMP RACIST TRUMP RACIST TRUMP RACIST TRUMP RACIST TRUMP RACIST TRUMP RACIST TRUMP RACIST TRUMP RACIST TRUMP RACIST TRUMP RACIST TRUMP RACIST TRUMP RACIST TRUMP RACIST TRUMP RACIST TRUMP RACIST TRUMP RACIST TRUMP RACIST TRUMP RACIST TRUMP RACIST TRUMP RACIST TRUMP RACIST TRUMP RACIST TRUMP RACIST TRUMP RACIST TRUMP RACIST TRUMP RACIST TRUMP RACIST TRUMP RACIST TRUMP RACIST TRUMP RACIST TRUMP RACIST TRUMP RACIST TRUMP RACIST TRUMP RACIST TRUMP RACIST TRUMP RACIST TRUMP RACIST TRUMP RACIST TRUMP RACIST TRUMP RACIST TRUMP RACIST TRUMP RACIST TRUMP RACIST TRUMP RACIST TRUMP RACIST TRUMP RACIST TRUMP RACIST TRUMP RACIST TRUMP RACIST TRUMP RACIST TRUMP RACIST TRUMP RACIST TRUMP RACIST TRUMP RACIST TRUMP RACIST TRUMP RACIST TRUMP RACIST TRUMP RACIST TRUMP RACIST TRUMP RACIST TRUMP RACIST TRUMP RACIST TRUMP RACIST TRUMP RACIST TRUMP RACIST ,EnoughTrumpSpam,1
