body,subreddit,moderated
Paranoia much?,EnoughTrumpSpam,0
"&gt;How do you think Hitler got voted in? 

Everyone who downvoted me and thinks Hitler was voted into power, please, raise your hand. Go ahead, I can't see you. Raise your hand.

Hand raised? Good.

Let me tell you something.

**HITLER WAS NOT VOTED INTO POWER.** He always received a minority of votes in fair elections. He had previously been arrested for treason for attempting a coup d'etat with only a few thousand followers. Hitler never had even half the democratic popularity Trump has. The socialists and communists were **far** more popular. Hitler was not the Trump of the elections he was in. He was the Jill Stein. Hitler seized power via underhanded means once his party got a few seats in government for receiving a small minority of votes. He tricked Hindenburg into giving him emergency powers (yes, just like in Star Wars) which he then abused to obtain absolute control. Remember hearing about the whole ""night of the long knives""? Yea that was because everyone fucking hated Hitler so he killed some of them to instill fear in the rest.

I don't remember Donald Trump ever attempting a coup and going to jail for treason, writing a manifesto about his ethnic superiority, or threatening to take over Canada because Americans deserve more land, or commiting genocide in Vietnam or Afghanistan as revenge for America's losses there.

So, all of you can go ahead and downvote me and go on thinking Donald Trump is the next Pol Pot (maybe I'm being too optimistic with assuming you all know who that is), but frankly I think a lot of you need to *go brush up on your history* before you go around thinking donald the fucking joke trump is anything like motherfucking hitler or mao. jesus christ.

&gt; People cant judge evil peoples atrocities until they give them power to show them

Hitler wrote a book 6 years before even gaining a minority of votes where he talks about aryans being the master race that needs to enslave all other races and kill all the jews. Donald saying blacks kill blacks and lets bring back stop n frisk and lets deport muslims is bad, yes, but on the same level as Hitler? Has Donald trump talked about enslaving the chinese and killing all the mexicans?",EnoughTrumpSpam,0
"Nobody who is actively working to get Donald Trump elected can possibly be interested in justice on any level, period.",EnoughTrumpSpam,0
[deleted],EnoughTrumpSpam,0
"The billion dollar loss is known about, I think more people are interested in the tax side of things though, which wasn't in the book as far as I am aware.",EnoughTrumpSpam,0
The video on that says it's a prank in the end.,EnoughTrumpSpam,0
"She's beautiful, they're just bitter they'll never be able to touch a woman like her with consent, lol, at least not without paying for it.  400lb basement dwellers with mommy issues.  

Wouldn't be surprised if the_dickheads are nearly 100% of the content on /r/justneckbeardthings, /r/niceguys, and the cringe subs haha.  ",EnoughTrumpSpam,0
[removed],EnoughTrumpSpam,0
I have the biggest supporters,EnoughTrumpSpam,0
Trump's policies are objectively terrible and will crater the economy and national security according to most experts. I'm American but I'm not going to be fooled by a lying strongman bully.,EnoughTrumpSpam,0
"Context shows I do. He got downvoted for saying ""bruh"". 


America is being ripped apart by a giant douche and turd sandwich. Southpark hit this election right in the head and most of you people posting in these threads can't be open minded enough to see the complete fuck show happening before your eyes.",EnoughTrumpSpam,0
As a 9th level CTR bureaucrat I actually get paid in rare double-OC pepes (original creator's original creations). ,EnoughTrumpSpam,0
Ah ok I really like the colors lol.,EnoughTrumpSpam,0
"He's Paris Hilton without her talent, charm, or business savvy.",EnoughTrumpSpam,0
"Actually, from the document it seems like she was. I could totally envision that. ",EnoughTrumpSpam,0
"Alternatively, they wouldn't authorize overtime.",EnoughTrumpSpam,0
I'd also suggest changing r/politics to r/leftwing or r/opeds,EnoughTrumpSpam,0
"An act doesn't have to be illegal to be wrong. If the best defense you have is that what you did isn't technically illegal, you're not exactly on solid moral ground.

Furthermore, stop comparing Trump to small business owners. He has never struggled or risked as most of them have.",EnoughTrumpSpam,0
[deleted],EnoughTrumpSpam,0
7 of those 8 tactics made up everything he said during the debate,EnoughTrumpSpam,0
[removed],EnoughTrumpSpam,0
Putin probably sent him underage protitutes when he was over there for the Mrs. Universe pageant and had the hotel room wired.,EnoughTrumpSpam,0
This is so fucking accurate,EnoughTrumpSpam,0
"If there is one guy who deserves to get one of those Star Wars cameos, it is Patton.",EnoughTrumpSpam,0
They're allowed to *think* it's about the rights of states. But it was specifically about their right to own slaves.,EnoughTrumpSpam,0
"Dear Ohio,

 https://media0.giphy.com/media/veAy5UOhBdS3C/giphy.gif",EnoughTrumpSpam,0
"well, to be fair, he skated from paying taxes legally...


...by losing 900 million dollars in one year.",EnoughTrumpSpam,0
Ouch,EnoughTrumpSpam,0
Are you trying to  put Hillary down for NOT tweeting at 3 AM? Fuck you people are dense. It's GOOD that she didn't personally tweet at 3 AM. She has better things to do unlike Mr. Orange. ,EnoughTrumpSpam,0
"Because that worked so well for the Nazis... even if we win, it could just be kicking the can down the road. A considerable percentage of the electorate supports Trump, they won't disappear when the election is over.",EnoughTrumpSpam,0
"Force isn't always at the end of a gun, coercion works just as well.

That's a matter of perspective, and past that a matter of biology. Your view is that it's not a baby and thus totally fine to terminate until it's actually born? Even if it's the day before her expected delivery date? If not then at what point does it become ok to kill?",EnoughTrumpSpam,0
[deleted],EnoughTrumpSpam,0
"Fuck, just do a simple ceasar shift and that should be good enough.",EnoughTrumpSpam,0
"""I am bigly smart.""",EnoughTrumpSpam,0
[deleted],EnoughTrumpSpam,0
That and fat cats and socialists don't mix well.,EnoughTrumpSpam,0
There has to be specific triggers. Automod would basically be posting after almost every comment. ,EnoughTrumpSpam,0
"""I mean, this guy's a real jerk""",EnoughTrumpSpam,0
"Ho-lee shiz-nit! This is phenomenal! So much win! 

&gt; I think playing the woman card at the end will backfire on her.

BWAHAHAHAHAHAHAHAHAHA!!!

&gt;Trump's constant interrupting of her made him look pretty bad, especially in the beginning. Hillary's tactic the entire time was just smile and laugh and act smug about everything, which unfortunately makes her seem more ""Presidential"" because it looks like she's keeping her cool and Donald wasn't. Donald also rambled a lot on various issues instead of concisely attacking Hillary like she did to him. She had several very specific criticisms of him prepared and it seemed like he didn't have as much prepared about her.

Poor trumpette's got a grasp of the obvious. whatever will they do?

&gt;Hillary accomplished one thing:
She won a debate

FECK! I can go on, but why? No wonder they nuked the whole thread! This is vintage! We must archive it for posterity!",EnoughTrumpSpam,0
"So what you're telling me is that Trump has actually regressed in his views, and has thus literally made negative progress in the last few years instead?

Because those would also be the facts. He may have been first, but he's the only one of the two to move backwards, which you're conveniently ignoring.",EnoughTrumpSpam,0
[deleted],EnoughTrumpSpam,0
What do you mean?,EnoughTrumpSpam,0
"&gt;"" By the way, we're WAY over time, and I have other clients to help. Have a nice weekend.""

Sure, Jan. Of course that's the way you want to spin it now.",EnoughTrumpSpam,0
It's really just /r/Hillaryforpresident,EnoughTrumpSpam,0
"The nowcast has Clinton at 340, so it's very possible. Clinton is also likely to outpreform her polls due to things like ground game and that late undecideds break towards what they feel is the safer option, usually.",EnoughTrumpSpam,0
[removed],EnoughTrumpSpam,0
"Sorry for the shitty layout lmao I couldn't find an app on my phone that makes it look nice.

Basically the dude posted in the_doofus 5 months ago, and has been posting since then, but only 2 weeks ago claimed that he was going from Bernie to Trump. Then a week later he said Clinton to Trump... now he's gone back to Bernie to Trump... I wonder what's next?",EnoughTrumpSpam,0
I think Trump and the right do that on their own. Maddow just broadcasts it.,EnoughTrumpSpam,0
"Fuck them.  If they are able to be swayed to vote for Donald Trump despite Trump being polar opposite on everything Bernie stands for,  they were just voting for a white guy anyway.  I'm so sick of the Sanders supporters acting like we need to hold their fucking hands,  roll out the red carpet and buy them a seafood dinner in order for them to consider Clinton.  

",EnoughTrumpSpam,0
Hard to believe this isn't the onion. ,EnoughTrumpSpam,0
Don't business regularly do business in a way to minimize taxes?  ,EnoughTrumpSpam,0
[IT'S HAPPENING!!!](http://i.imgur.com/7drHiqr.gif),EnoughTrumpSpam,0
No.  That's not what you're doing.  You're being disrespectful.,EnoughTrumpSpam,0
[deleted],EnoughTrumpSpam,0
[deleted],EnoughTrumpSpam,0
SJW... rearrange the letters... JWS... add an E... JEWS... OMG!,EnoughTrumpSpam,0
[deleted],EnoughTrumpSpam,0
[deleted],EnoughTrumpSpam,0
[removed],EnoughTrumpSpam,0
"One of my favourite things about the NYT article is how it addressed this exact point in advance:

&gt; In an interview on Wednesday, Mr. Mitnick said he could not divulge details of Mr. Trumpâ€™s finances without Mr. Trumpâ€™s consent. But he did talk about Mr. Trumpâ€™s approaches to taxes, and he contrasted Fred Trumpâ€™s attention to detail with what he described as Mr. Trumpâ€™s brash and undisciplined style. He recalled, for example, that when Donald and Ivana Trump came in each year to sign their tax forms, it was almost always Ivana who asked more questions.

&gt; But if Mr. Trump lacked a sophisticated understanding of the tax code, and if he rarely showed any interest in the details behind various tax strategies, Mr. Mitnick said he clearly grasped the critical role taxes would play in helping him build wealth. â€œHe knew we could use the tax code to protect him,â€ Mr. Mitnick said.

TL;DR: Trump doesn't understand the tax laws.",EnoughTrumpSpam,0
"I mean, generally outside advice comes from a professional who knows something about the topic. Like an Engineer called into to be a consultant on the design challenges of a bridge. Or a Baker being called in to give an estimate on wedding catering costs. Generally, they know something relating to the topic, and aren't just outsiders with no experience. ",EnoughTrumpSpam,0
Record!,EnoughTrumpSpam,0
[deleted],EnoughTrumpSpam,0
"Yeah...

That's the difference between someone who listens to the advice of others, and someone who doesn't. Her people laid out a plan on how to get Trump to flip out, and it worked. His people tried to get him to stay on target, and he ignored them. ",EnoughTrumpSpam,0
My god you're right.,EnoughTrumpSpam,0
He is used to this type of behavior getting the media to move on. It's not working. Everything he is doing this time is being treated as part of the meltdown.,EnoughTrumpSpam,0
But it was on truepundit.com. That's called research.,EnoughTrumpSpam,0
I'll start: 'I'm too smart to pay taxes',EnoughTrumpSpam,0
"Haha, who cares who sent it? The point is she isn't tweeting about revenge and porn, but instead policy. Some of us are more interested in how the candidates plan to run the country rather than the reality show popularity contest Trump seems to think he is participating in.

And if we are talking popularity contest, [I have some bad news for you...](http://fivethirtyeight.com/features/trump-is-more-unpopular-than-clinton-is-and-that-matters/)",EnoughTrumpSpam,0
"Let me guess, you fancy yourself a wordsmith? You don't have anything left to say so you are clinging to me using the same word twice. Bravo. You are impressive. No, really, you are.",EnoughTrumpSpam,0
"I look at it as the first derivative of the polls model. It shows acceleration rather than velocity, to put it one way. ",EnoughTrumpSpam,0
"&gt; the ghost of Magic Johnson

Someone should probably tell him to knock off all that being alive he's been doing lately...",EnoughTrumpSpam,0
"Why would he learn, his son is very good with the cyber.",EnoughTrumpSpam,0
"I don't hate trump. But I really dislike people in real life who are big trump supporters. 

So many say racial things but then use his platform as a shield or something. It's amazing man and what's even more amazing is how dominated it is by white males who seem to hate Mexicans and say other dumb shit all of sudden ",EnoughTrumpSpam,0
"These are the kinds of people that blow up federal buildings and shoot deputies serving warrants.  

",EnoughTrumpSpam,0
"It's even more hilarious now. One Top post right now claims that Trump leaked the tax stuff himself, another states that it's illegally obtained and they must be sued. How they can say either one of those two things is ridiculous, but the doublethink they show by supporting BOTH viewpoints is absolutely hilarious.",EnoughTrumpSpam,0
[Somebody did!](https://twitter.com/ringer/status/780632599500763136),EnoughTrumpSpam,0
no that's actually putin,EnoughTrumpSpam,0
AKA the Sargon method.,EnoughTrumpSpam,0
"Because the only legitimate news source is one that's obviously left, right? How about this; anything not listed here. https://mediabiasfactcheck.com/right/

And 

https://mediabiasfactcheck.com/left

I merely asked for a news source that wasn't from the obviously biased medias I listed that /r/politics seems to love. Take the dildo out your ass. ",EnoughTrumpSpam,0
It was a dumb joke in poor taste. But it is better if he was joking.,EnoughTrumpSpam,0
The white black guy,EnoughTrumpSpam,0
"No doubt but,

Source?",EnoughTrumpSpam,0
"There are a number of ways an unstable person who won't even agree to remove nuclear weapons from the table, could escalate and trigger a serious war that would result more casualties than Bush caused in Iraq.",EnoughTrumpSpam,0
Yes it is. Your sex is what you are born with. Gender is an entirely different matter.,EnoughTrumpSpam,0
"As a socialist, you're a shit socialist. Unless you meant to put ""National"" first.",EnoughTrumpSpam,0
if your banned can you still view the sub? ,EnoughTrumpSpam,0
The reaction has been Luke warm at best. A lot of die hards are actually okay with the statement. But yea there's a handful that were never changing their minds anyways....and this will appeal to them. ,EnoughTrumpSpam,0
My body is ready. ,EnoughTrumpSpam,0
I hope he stomps on a lightyear-long stretch of all the sharpest Lego Bricks and his muscles spasm from the pain so hard that his body flies into the air and falls onto more bricks and then his body spasms again onto more bricks and so on until he dies and is just a skeleton on a pile of Lego BricksðŸ’€,EnoughTrumpSpam,0
I'm glad you were not alive to spit on Vietnam Vets.  ,EnoughTrumpSpam,0
"Alderaan was a haven of rebel sympathisers. They willingly cooperated and even supplied bodies and ships to the terrorist rebel alliance.

Two billion lives, most of whom were rebels anyway to save a galaxy.",EnoughTrumpSpam,0
"market is in a bubble regardless...

best to get out no matter who wins. ",EnoughTrumpSpam,0
"Because defeating the Soviets was seen as the bigger priority, rather like toppling Assad or Ghadaffi was seen as the top priority in Syria and Libya respectively, which led the Obama administration to lend support to groups that have been absorbed by ISIS. 

Sure, you can say Reagan lacked foresight, but he's hardly unique in this.",EnoughTrumpSpam,0
[deleted],EnoughTrumpSpam,0
Why isn't anyone calling poor Sean Hannity? :(,EnoughTrumpSpam,0
"Which supporters, and where's the proof?",EnoughTrumpSpam,0
He must be losing his fuckungbmind right now. His ego must be thrashing the little shred of humanity that man has. I love watching The_Donald go into complete panic mode.,EnoughTrumpSpam,0
I just hope more millennials will see that.,EnoughTrumpSpam,0
And it's so incredibly typical isn't it?,EnoughTrumpSpam,0
Blue in Texas isn't good enough. #MakeAlabamaBlueAgain,EnoughTrumpSpam,0
"Yeah, I have to stick to r politics in lecture and I can't get my meme quota there.",EnoughTrumpSpam,0
"Why would they care that he followed the law, they are well aware of  his business ups and downs, and everything else about him, yet still support him over Hillary.

Would anything that anyone said convert you to the right? 

Then why the fuck do you think it's odd when the right won't swing left based on articles about things everyone already could have fucking guessed. 

Based on the law, he doesn't owe taxes. You can rest assured the IRS would fuck him up hard if he did. Don't like it? Tough shit. ",EnoughTrumpSpam,0
[deleted],EnoughTrumpSpam,0
[deleted],EnoughTrumpSpam,0
How do we know? ,EnoughTrumpSpam,0
sadly no,EnoughTrumpSpam,0
It's hard to tell if they're trolling or they're actually that retarded.,EnoughTrumpSpam,0
"I am not an apologist for their attitudes or behavior, but I do hope they learn to see differently.     
This area has a deep vein of racism. It was a sundowner community, for one.    
When I moved here, my sweetheart took me to visit the cemetery where her sister's buried. Not too far from her grave was a KKK section.   
My stepkids went to school with the former Grand Dragon's children.      

There are good people (and assholes: source, me) here who do not think this way. Unfortunately the others sometimes have stronger voices, and know they have an audience.
",EnoughTrumpSpam,0
"The Trump Scampaign will have a early unbeatable response for this:



""BUT HILLARY""",EnoughTrumpSpam,0
And New Mexico looks blue. Is that normal?,EnoughTrumpSpam,0
I'm inclined to assume he has nothing to say buts sees value in peddling conspiracies.,EnoughTrumpSpam,0
"""The pics Hillary doesn't want you to see!""",EnoughTrumpSpam,0
No that's for his wives,EnoughTrumpSpam,0
"There was a post last night where they were literally begging for him to do something.

So low energy.",EnoughTrumpSpam,0
"No, it was just one example. Jesus Christ, I was looking for answers not a god damn argument over semantics. Someone fucking correct me or fuck off if you have nothing else to say.",EnoughTrumpSpam,0
This man check mates you all the time.,EnoughTrumpSpam,0
"Don't focus on large scale corruption, what ever you do.",EnoughTrumpSpam,0
_LOCK HIM UP_ ,EnoughTrumpSpam,0
Legal gay weed.,EnoughTrumpSpam,0
The madman!,EnoughTrumpSpam,0
"1995 was in the midst of the height of the 90's economic boom under Clinton too, you had to try real hard to lose money in NY real estate during that time.",EnoughTrumpSpam,0
This subreddit is almost as sensationalist as /r/thedonald itself. Where's the meltdown? I see one tweet.,EnoughTrumpSpam,0
My father was a Wallace supporter. I have his Birch Society Blue Book on my dining table. I hear you. He would be turning over in his grave to see how this new generation of white nationalist are turning out. ,EnoughTrumpSpam,0
$100 &gt; - $900 million,EnoughTrumpSpam,0
"Honestly? I think this is why ""Brexit"" won in my country, even though most of the electorate didn't really understand what they were supposed to be voting for. Because to the uninformed bystander ""exit"" just SOUNDS so much more active and revolutionary than ""remain"", and the image that was painted of the EU as this vaguely fascist entity was enough to sway the average person, combined with the deprivation and right-wing media constantly, CEASELESSLY droning on about immigration for as long as I have been alive. 

In reality, Brexit will, at best, probably do jack shit for these people. Weâ€™ll still be under a Conservative government and austerity will continue. The only difference is that we will have ostracized most of our key allies on the world stage, thrown the country into social turmoil and taken away the government's obligation to follow any European regulations. This is the government which is literally, as we speak, attempting to â€œredefineâ€ the Human Rights act after all- something that will be all too easy without the EU watching us.

But none of that matters. Because anything will do at this point, and you can bet the alt-right is all too happy to fill that void. And you can bet as things inevitably get worse and worse as a result, the good old snake-oil salesman will offer yet more easy â€œsolutionsâ€ as it goes mainstream- which it already has, to be frank.

I genuinely fear for the state of my country. ",EnoughTrumpSpam,0
Thanks,EnoughTrumpSpam,0
"Clinton is part of ETS confirmed.

Imagine your future president, shitposting alongside you on the road to election.",EnoughTrumpSpam,0
"A congresswoman defended a presidential nominee's slut-shaming and insisting that people should watch porn at 5 am.

Stop the ride, mommy, I'm scared.",EnoughTrumpSpam,0
I was just about to post this.  Sounds like the old Trump is back for good!,EnoughTrumpSpam,0
"[Death to the False Emperor! Death to Heretics!](http://i.imgur.com/VIBnMzL.png)

^(Do I need to clarify that this is a joke and I don't support assassination or murder?)",EnoughTrumpSpam,0
"In this day and age conspiracy theory is taken just as seriously as actual possibility. Trump could say a 20% difference was rigged by China, and his supporters would believe it",EnoughTrumpSpam,0
*snorts coke*,EnoughTrumpSpam,0
Sturmabteilung uniform?,EnoughTrumpSpam,0
Sad!,EnoughTrumpSpam,0
But Trump's not even an outsider! A billionaire who brags about buying politicians and taking advantage of tax loopholes and trade deals is literally the kind of person Bernie was yelling about for years!,EnoughTrumpSpam,0
"He'll work it into the answer to another question. ""Speaking of police brutality, you know Bill Clinton, and I hate to bring this up, folks . . .""",EnoughTrumpSpam,0
"My issue with her was always the dumb points she'd make and a lot of her dog whistle language, but the gaffes (""I can see Russia"" etc.) didn't bug me so much. With Palin I feel like there's reasoning there which I find dumb (like say Ken Ham), but at least she's got some sort of conclusion and some sort of underlying point she's communicating. With Trump that structure doesn't even exist.",EnoughTrumpSpam,0
"They do the same thing to Michelle Obama. Their candidate is humiliated daily by strong women, so they desperately try to discredit them by calling them ""transgender."" Funnily enough, it doesn't work.",EnoughTrumpSpam,0
Having due process for everyone is an important reason this is a modern first world country. Even fucking spies get that treatment (I was watching Bridge of Spies recently and am still on that high). ,EnoughTrumpSpam,0
[deleted],EnoughTrumpSpam,0
"I was gonna title it ""Sean Hanitty Deaf?"" at first, but I decided to use a turn of phrase rather than equate the blind and deaf to Sean Hanitty's narrow sighted perspective and ignorant stupidity ",EnoughTrumpSpam,0
"If you think Obama is more right-wing than Bush you're literally divorced from reality.

He's the liberal anti-christ compared to the Republicans.",EnoughTrumpSpam,0
King's characters are never *that* stupid. That'd just be unbelievable.,EnoughTrumpSpam,0
I meant Philly not NYC but those have contributed also,EnoughTrumpSpam,0
Mei on offense works every time.,EnoughTrumpSpam,0
DAE Wermacht innocent?,EnoughTrumpSpam,0
Source?,EnoughTrumpSpam,0
"I know I cheated on you, America. Didn't help pay the mortgage. I know I gave all my business to those grubbing Mexicans and conniving Chinese to make my ties and gold plated golf tees. But, honey, honey, I will change. You'll see.",EnoughTrumpSpam,0
I'm surprised they are that good with their cyber. ,EnoughTrumpSpam,0
"Only in 2016, when it was cool. ",EnoughTrumpSpam,0
"I've been saying since like, March, that Virginia would be an awful state for Trump. He's just toxic in Northern Virginia, the most important swing area of the state. Rubio carried the region by a huge margin. A lot of volunteers and activists are sitting the presidential race out, myself included. The internal polls are showing a complete massacre up here. And the most prominent NoVA Republican, Congresswoman Barbara Comstock, isn't endorsing Trump. She's still campaigning with a Rubio sticker on her car. 

So yeah, even if Trump finds a vast untapped reserve of white working class voters (he isn't), that wouldn't make up for his huge underperformance with center-right suburban voters. That goes for a lot of states. ",EnoughTrumpSpam,0
[deleted],EnoughTrumpSpam,0
Still way too close for comfort. http://registertovote.org/,EnoughTrumpSpam,0
I like how people who speak loudest about eugenics are the type that really wouldn't be worth saving.,EnoughTrumpSpam,0
I'm not feeling it. Amphetamines don't make you racist.,EnoughTrumpSpam,0
"I mean, that's something, but yeah, might not want to use People's World as a source.",EnoughTrumpSpam,0
"They get the bully pulpit, and ideally, they get the political goodwill of the hundreds of congressmen they worked with over their several decades in office to work out a decent compromise.

After that's expended (if it was ever there), they can sit and spin.",EnoughTrumpSpam,0
