body,subreddit,moderated
I was quoting you lol. Holy shit you were fucking dense. ,EnoughTrumpSpam,1
"jill ""healing crystals"" stein and gary ""who is kim-jong-un"" johnson

Fuck off, bernout",EnoughTrumpSpam,1
#Hillaryforprison,EnoughTrumpSpam,1
Yeah he's a hypocrite. You can be mad about that. Doesn't mean he didn't have a reason to call them out. CNN details the documents going on without any proof and that's something that liberals should be mad about,EnoughTrumpSpam,1
Triggred,EnoughTrumpSpam,1
"This sub is seriously still spamming the front page? 

Dedication. ",EnoughTrumpSpam,1
">Everywhere the right is going crazy, islamophobia is higher than it's ever been

Islamic terrorism is higher than it's ever been. Weekly mass murders by Islamic terrorists is a bigger problem than people having a ""phobia"" of Islam.

>every single minority is feeling unsafe right now

I'm not a minority but between Islamic terrorism and anti-White hate crimes I feel unsafe as well.

> It's a right winger that walked in armed at a pizza shop. It's a right winger that killed nine people at a black church in Charleston.

It's left-wingers who walked out in public armed to make people ""afraid"" in Texas. It was left-wingers who kidnapped and tortured a mentally challenged White boy.

I can go tit for tat with you all day.

>So a group of left wingers kidnapped someone (and instead of criticizing the actions you use that situation to target their fucking race).

I didn't. You're lying.

>Your rhetoric is far more intolerant, your point hatred towards every minority group, you take interracial relationships and re-dub it white genocide for crying out loud.

When you make White countries bring in other races and then push for White to racially mix with them and celebrate Whites being genetically mixed out of existence that is genocide.

>You're vermin, you're a mental pest, you're a plague in society, and you're far too uppity right now for my liking. So be afraid and scurry back to your little bigot hovel, scum. Sit back down or get put down.

I'll be ""put down"" will I? More threats of death and violence. You are a sadistic psychopath. There is something deeply wrong with you. You are a violent, hateful and dangerous leftist.",EnoughTrumpSpam,1
"Nope, I would like nothing more than for people to actually understand what /r/all is for. But apparently most people think ""all"" means ""all the stuff I agree with and none of the stuff I disagree with"". ",EnoughTrumpSpam,1
Everybody on board the Trump Train -- whoo whoo!!! :-) :-),EnoughTrumpSpam,1
"upvotes = 0

#LOW ENERGY LOSER",EnoughTrumpSpam,1
"This is fake news.
Watch the actual video.",EnoughTrumpSpam,1
I've already been reporting like hell. They make it too easy. They're as thin-skinned as Trump himself lol,EnoughTrumpSpam,1
"Hey, I was just happy to see someone in a flag shirt who's not totally racist.",EnoughTrumpSpam,1
"oh.  i guess this is sad.  i thought this sub might enjoy mememagicâ„¢ :(

sorry.  i will be very serious from here on out.  

NIGGERS.",EnoughTrumpSpam,1
Triggered cucks,EnoughTrumpSpam,1
"Tss yea, how bout... Major Asses Guys Asses or sumthin. fawk yea

great sticky guys!",EnoughTrumpSpam,1
There is no evidence he raped anyone. Why dilute the word by falsely using it? It's an insult to those who actually had to suffer through it.,EnoughTrumpSpam,1
"But did he say ""I want to fuck my daughter"" ?",EnoughTrumpSpam,1
"But why would user ""FuckTrumpWithAGlock"" just go on the internet and lie to us.

His account is a whole 16 days old!",EnoughTrumpSpam,1
Only thing faker than Breitbart are Melania Trump's tits.,EnoughTrumpSpam,1
Sad! rigged! Fraud!,EnoughTrumpSpam,1
Safezone? Is that whee you go hide at with all of your liberal friends because words offend you when they are true?,EnoughTrumpSpam,1
Triggered cucks,EnoughTrumpSpam,1
You are nuts if you think he writes the tweets out. Shill. ,EnoughTrumpSpam,1
I'm pretty sure any schmuck with a gun could defeat Trump. I guess you could say I'm holding out for a hero.,EnoughTrumpSpam,1
"but seriously, didnt they have to stuff the breitbart pool too?",EnoughTrumpSpam,1
Thank god they don't have a majority. It will do absolutely nothing. ,EnoughTrumpSpam,1
FAT WOMEN should be reigned up until we can sort out this obesity issue,EnoughTrumpSpam,1
"So you're telling me, trump was making fun of that specific person? Or the fact that  the guy who snapped this pic got the perfect timing to make it look like the 2 pictured are related? Because your post makes no sense, you are compiling random pics to make someone seem like a douche, well OP, you seem like a bigger douche than any of them frankly ",EnoughTrumpSpam,1
Still with the Bernie Slanders?,EnoughTrumpSpam,1
"This is my point, as Hillary supporters think she a) can make a real difference and b) that Trump will actually be that bad.

The results are mostly similar, you just have to vote for the one who cares more about America and its people.",EnoughTrumpSpam,1
"Yeah, but to be fair, that offends a lot of people, especially her parents.",EnoughTrumpSpam,1
"> There are no cases that have ""worked"". 

It's very unlikely that there has ever been an incident for the therapy to convert a Kinsey 6 homosexual into a Kinsey 0 heterosexual. But it could work to make a Kinsey 4 adept at pretending to be straight, therefor vastly improving his standing and acceptance with his ultra-conservative family and peers.",EnoughTrumpSpam,1
Because we all know that 2 wrongs make a right. #imwithher,EnoughTrumpSpam,1
"You triggered snowflakes are beyond amazing.  We just had 8 years of one lying press sec after another .
I love the hypocrisy from the left.  Love it ",EnoughTrumpSpam,1
"My family is rich, and I voted for Trump. It's in my interest to do so. Suck a dick. ",EnoughTrumpSpam,1
Rekt in their own sub,EnoughTrumpSpam,1
Stating accusations as fact to push your agenda. Nice,EnoughTrumpSpam,1
"Vote for one of the most corrupt candidates to ever run. Deals which brought huge deregulation to foreign nations, destroying countries from South America to the Middle East, funneling millions of bribes through the Clinton foundation, money from big banks and foreign countries like Saudi Arabia.

What kind of sick, twisted woman stands at the DNC and LIES about a girl in a wheelchair not being able to go to school to make a point?

A sick, twisted fucking person, that's who.",EnoughTrumpSpam,1
They should be euthanized like rabid dogs ,EnoughTrumpSpam,1
I posted this in r/TheDonald and i was instabanned lol,EnoughTrumpSpam,1
"Seems a little passive aggressive to me. So the fascist is changing his pool filter? Is this a menial job? I'm not sure I get it.

Are those black splotches words you covered up? If you didn't draw this, you should give credit to the original artist.  ",EnoughTrumpSpam,1
"Instead of pointing out real problems, lets just make fun of his hair... that will surely work!
/s
Trump is not who I am voting for but compared to Hillary being called a criminal makes this seem really weak. Love the change from wig to combover btw",EnoughTrumpSpam,1
"You know what, this might be the end of Donald Trump. They ""totally trolled"" him alright! Ha! ",EnoughTrumpSpam,1
"As a person of  mixed RACES( black, white, Native American, and of Hispanic Origen) I find it mildly disturbing that Reddit more often than not overlooks the vile, and very often violent and/or openly hostile racism of black people.",EnoughTrumpSpam,1
Triggered cucks,EnoughTrumpSpam,1
"LOLOLOLOL. At least i don't make bullshit vows as a senior citizen about leaving some internet site I am too pussy to be myself on anyways. 

Nobody gives a shit that some faggot with a throwaway account leaves the site. You MIGHT have had some integrity with that stupid fucking pledge had you not prebuilt a throwaway account to hide from continual scrutiny with. 

Sad bitch. ",EnoughTrumpSpam,1
Aren't you tired of winning folks?,EnoughTrumpSpam,1
"/r/iamverysmart 

http://rationalwiki.org/wiki/Prejudice_plus_power",EnoughTrumpSpam,1
If being a pussy was a felony you'd be in jail ,EnoughTrumpSpam,1
Stupid stupid Stupid stupid Stupid stupid Stupid stupid Stupid stupid Stupid stupid Stupid stupid Stupid stupid,EnoughTrumpSpam,1
">If you are prideful of white culture, civilization and inventions then you must be ashamed of racism, slavery and lynching. If you do not then you are hypocritical and racist.

Why do you think your slave morality is universal? Why would I be ashamed of those things? I'm indifferent to them, just as non-whites are indifferent to or proud of their conquests. How many Mongolians cry around about the Mongol Conquests? How many Japanese are ashamed of Nanking? ",EnoughTrumpSpam,1
"Seriously, calm the hell down with this ""Hurr durr to the top!"" crap.

Do you *really* want to just turn into a carbon-copy of the annoying subreddit you're apparently aligned against?",EnoughTrumpSpam,1
They are just interviewing her and her employee's and paying everyone whose working on this so they can prove her EXTRA innocent because they love her so much.,EnoughTrumpSpam,1
">O NO! You've been spooked by the scary skeleton of Brazile, updonna this post by November 28th or never get questions again!!!1!1!!!

This should be a new automod response. Mods?",EnoughTrumpSpam,1
"I'm pretty sure bernie was Americas choice, but the dnc didn't seem to like him as much",EnoughTrumpSpam,1
I hate to be a Downer Downey Jr. But I know what you mean.,EnoughTrumpSpam,1
"It isn't defamation if it's true, and it's true that Melania Trump is a whore.",EnoughTrumpSpam,1
I can't wait till Hillary is 6ft deep and rotting in hell for all eternity ,EnoughTrumpSpam,1
"Morally bankrupt? Maybe I'm missing something but isn't Hillary Clinton the one who is literally murdering the babies? 

She hasn't addressed her protection of Laura Silsby once. ",EnoughTrumpSpam,1
"If anybody out there is going to do *something* about it, I have two requests:

* make *it* suffer

* make it a 'open casket is not an option' affair",EnoughTrumpSpam,1
"If we could get another do nothing uncooperative black president who is friends with 60s wacko's and does nothing for 8 years but make soaring speeches and then becomes a standup white comedian in front of white people, I would again vote for that black president. OH WE BE MOVIN' ON UP",EnoughTrumpSpam,1
"Christ, took you long enough. ",EnoughTrumpSpam,1
or you could get off reddit for once and go outside,EnoughTrumpSpam,1
Dw I'm not from r/TheDonald but if you don't have thick enough skin to deal with scrolling past a few shitposts on r/all then maybe you should be steering clear of reddit and Internet forums in general.,EnoughTrumpSpam,1
"From what I understand, he raped 2 girls, and one of them mysteriously disappeared.",EnoughTrumpSpam,1
That artillery is NOT what I meant when I said I wanted to hear gunshots.,EnoughTrumpSpam,1
"Obama was in office for the flint water crisis, yes it's still going on even though the EPA has cleared their water.  Obama did nothing about it, I don't recall him ever even speaking about it.  Trump hasn't been in office a week yet. Give him time to get the EPA in order.  Look, the wall is going up whether you like it or not.  We gave Mexico 65 million to build a wall on their southern border so it's laughable to hear the president of Mexico say that Mexicans don't believe in walls.  Trump has American interests in mind and I can't see an argument against that.  We're all Americans and that's what his message has been from the beginning, he's not racist he wants people who are here illegally to be deported.  If you're a American citizen President Trump is fighting for you.",EnoughTrumpSpam,1
Triggred,EnoughTrumpSpam,1
"Haha oh man those kids clothes. What were his parents thinking!?

Sad story but I can't help but chuckle!",EnoughTrumpSpam,1
"Someone hasn't checked RealClearPolitics this week haha. 

I'm also guessing you didn't take Finance or Accounting at university.",EnoughTrumpSpam,1
This subreddit is weird and aggressively ignorant. ,EnoughTrumpSpam,1
Hillary's sub banned me for no reason.  I've jumped ship.  She's a cunt.,EnoughTrumpSpam,1
"I posted links backing up my points in my comments, it is up to you to read them.

Are you so angry because you're a Hillary diehard who can't accept her failures?",EnoughTrumpSpam,1
ITT: Armchair Nazi historians see Hitler everywhere they look.,EnoughTrumpSpam,1
ITS TIME TO STOP,EnoughTrumpSpam,1
"I love how this sub would do anything to smear Trumps name, even lie left and right ",EnoughTrumpSpam,1
"For someone who's not a racist, you sure have a visceral reaction to being implied that you're partaking in a racist act. I sure didn't directly call anyone a racist. I just pointed out that a lot of people get defensive about stuff they're internalizing without thinking critically about.

I don't have this kind of reaction when people imply me, much less accuse me, of being things that I'm not. Might have some issues you need to work through or are you hiding something?",EnoughTrumpSpam,1
Where is this post being brigadeded? I thought someone has to link this post somewhere for it to be a brigade?,EnoughTrumpSpam,1
"# â”¬â”´â”¬â”´â”¤ ÍœÊ– Í¡Â°) â”œâ”¬â”´â”¬â”´

#HE IS YOUR PRESIDENT LIKE IT OR NOT AND THE WALL WILL BE GREAT",EnoughTrumpSpam,1
"I hope he spends his 71st birthday dead in a ditch, having been shot.",EnoughTrumpSpam,1
Triggred,EnoughTrumpSpam,1
"Well I mean lets be real, the people who killed the Nazis in the 1940's aren't the current Democrats, seems like you've got the actual solider types on the 'Nazi' side this time, and the best part is we're already in America! DEUS VULT!",EnoughTrumpSpam,1
"well thats the difference between me and you, I want Trump supporters to kill themselves
",EnoughTrumpSpam,1
"Look, its okay to be paid ad or even unpaid but don't lie to the person's face about your and this subreddits bias and deflect what they said. It makes you no better the candidate you're supporting.",EnoughTrumpSpam,1
SOUNDS LIKE BRIGADING TO ME. NO THANK YOU.,EnoughTrumpSpam,1
So edgy ,EnoughTrumpSpam,1
"MAN, LOL. 

Milo isn't a nazi. You can't peddle that lie. What is wrong with you? The mans a fuckin' raging faggot who literally only sleeps with BLACK MEN. The polar OPPOSITE of a Nazi. 

You CAN'T say he's a nazi, you just can't, but you will. ðŸ˜‚",EnoughTrumpSpam,1
Triggred,EnoughTrumpSpam,1
"How is it fizzling? She's literally under investigation because 650,000 emails with metadata relating to her private server on them. That is the opposite of fizzling",EnoughTrumpSpam,1
"Except people do blame Christians for the KKK and the Westboro baptist church, in fact 4 people have in this very thread alone. Terrorist organizations are using RELIGION as PROPAGANDA. So yeah, I actually do think attacking the Religion is a solid strat. 

&nbsp;

Also, can the 'Muh moderate muslims' meme die [already?](http://markhumphrys.com/Images/639.jpg)",EnoughTrumpSpam,1
6 out of 515. What kind of shit attack Avenue is this if you brought this up in a debate he would turn you inside out. ,EnoughTrumpSpam,1
A vote for Hillary is a vote for corruption. ,EnoughTrumpSpam,1
"kek. You are supporting a wall street/special interests/war criminals puppet. And this is proven, unlike your claim.

You cucks are so delusional, it's ridiculous. But your time is over in any case.",EnoughTrumpSpam,1
Triggered cucks,EnoughTrumpSpam,1
"http://boxingjunkie.usatoday.com/2016/06/11/don-king-yes-i-endorsed-donald-trump/

LMAO. Lyin' teds here.",EnoughTrumpSpam,1
"I know right, its economy is more capitalistic than the US these days",EnoughTrumpSpam,1
"You first paragraph deserves an up vote, but your second deserves a down vote, so you get neither.  The_Donald does not lump anyone together.  I read almost everything there and there is very little hate for all immigrants, though there is some.  I am for legal immigration as long as it benefits America.",EnoughTrumpSpam,1
Trump doesnt need any ads like this cus Hillary is drowning herself in her own corruption. ,EnoughTrumpSpam,1
So he stays in a safe space but is talking to you on the opposite of his safe space? A sub that is directly against his safe space?,EnoughTrumpSpam,1
"I mean, everything i've posted in this subreddit has been opinionated and i've actually argued my point using facts and statistics, so I do think I garner a bit more credence than you people who say ""TRUMP IS LIKE HITLER"" and can't even explain why you think that.",EnoughTrumpSpam,1
Stupid White People,EnoughTrumpSpam,1
"I might be the unpopular opinion here, but let them have their place. I'm all for filtering them out, if you don't like them, don't pay attention to them. However banning people for having an opinion isn't right. Everyone has a voice, regardless of how you perceive it. ",EnoughTrumpSpam,1
"Because he kept an illegal unapproved email server with Top Secret Emails and then denied it ever happened.

Trump sat on his ass while an American Embassy was attacked, Ambassador and special forces troops shot up and killed and then refused to let the buck stop at his desk.

Trump takes political donations from Foreign governments and citizens and makes speeches to Banks where he is afraid to release the Transcripts.

And on and on the bullshit goes on for about 25 years.

 ",EnoughTrumpSpam,1
"I don't care about either the crook Hillary or the idiot Trump, but creating a ""safe space"" for people that easily get trigger is even more upsetting. 

There is simply a point we're we cannot appease everyone, people will simply get offended, just get over it already. ",EnoughTrumpSpam,1
Leave it to liberals to use homosexual imagery (Trump fucking Pence) as an insult.,EnoughTrumpSpam,1
But Hillary supposedly  won the popular vote. Shut your mouth before too much shit spews out. ,EnoughTrumpSpam,1
Triggred,EnoughTrumpSpam,1
"Something Presidents since Carter have been doing.   It's a power congress granted the President. 

[Title 8, Section 1182 of the U.S. Code](https://www.law.cornell.edu/uscode/text/8/1182), the president has authority to use a proclamation to suspend the entry of â€œany aliens or of any class of aliens into the United States [who] would be detrimental to the interests of the United States,â€ for however long he deems necessary. ",EnoughTrumpSpam,1
Triggred,EnoughTrumpSpam,1
Did your mom drop you on your head as a baby?  Numerous times?,EnoughTrumpSpam,1
"Hillary's declared ""friend and mentor"" and who she says is the ""heart and soul of America"" is KKK Grand Dragon Robert Byrd.
The KKK donated $20,000.00 to her campaign.
The KKK was founded as the terrorist arm of the Democrat party.
This is what we mean when we say the media is corrupt.

Ask yourself, why is this the first time you're hearing about the racist Goldwater Girl's history of treating blacks like the scum of the Earth, super predators who need to be brought to heel, or making her coffee.

Trump has been in the public eye for 30 years and not once was he called a racist until he ran against a Democrat, why is that?

You're not asking yourself basic questions, do you really trust the media when they rigged the system in the first place?",EnoughTrumpSpam,1
Came from r/The_D,EnoughTrumpSpam,1
Cringe ,EnoughTrumpSpam,1
I read the article and it doesn't say anything about anyone getting harmed. He was obviously just coming to get some pizza. And nowhere does it say that it was an assault rifle.,EnoughTrumpSpam,1
You have 258 submission about Trump in 9 months or less? That in your mind isn't spam? ,EnoughTrumpSpam,1
"Damn that comment got brigaded fast! And no, although I think I did see a thread about it on /r/all yesterday. I forget what sub it was, but damn you're annoying.",EnoughTrumpSpam,1
"Oh no! Not my imaginary internet points! What will I ever do without them!

/s",EnoughTrumpSpam,1
"What a sad existence this subreddit will endure for 8 years. 

I feel sorry for you people.",EnoughTrumpSpam,1
"yeah, how to i black list this sub? im tired of all this crying.  ",EnoughTrumpSpam,1
You're almost convincing yourself. ,EnoughTrumpSpam,1
"And the crook will watch someone else be inaugurated...again. 

Just sayin' ",EnoughTrumpSpam,1
"Could you link me to another article that mentions pay-to-play letters?  One that you obviously read before this election, oh wise one?",EnoughTrumpSpam,1
"Every single source: Wikipedia. 

Very nice!/s",EnoughTrumpSpam,1
Republicans do not 'hate gays' ,EnoughTrumpSpam,1
"For a sub called EnoughTrumpSpam, you guys sure spam the fuck out of him.",EnoughTrumpSpam,1
that was beautiful.,EnoughTrumpSpam,1
"Sounds like a poor, butthurt keyboard warrior.  I upvote all posts from The_Donald just to piss people like you off and I have never been to 4chan.  Fuck you and your untrue fucking diatribe.",EnoughTrumpSpam,1
How is this racist?  It isn't suggesting that any other race can't be great. Something can be racial without being racist. ,EnoughTrumpSpam,1
"hillary, along with all of her supporters, are cancer.",EnoughTrumpSpam,1
Triggered cucks,EnoughTrumpSpam,1
Dont you think thats a bit of a stretch?,EnoughTrumpSpam,1
Or not? Neither one of the fucks should be allowed to take office. ,EnoughTrumpSpam,1
No. Stop twisting it.,EnoughTrumpSpam,1
"Well that's vague as fuck.  Not to mention stupid, as nazism *originated* in europe, but i guess we're just throwing that right out the window.  Anything to blame ameriKKKa for everything you don't like in the world, right?

I can't really reply to you guys because you all get so triggered and downvote the shit out of anyone who isn't drinking your kool-aid but whatever. ""REEEEEEEEEE OUTSIDERS REEEEEEEEE DOWNVOTE THEM REEEEE!!!""",EnoughTrumpSpam,1
Didn't even troll. You know it's bad when all you can do is ban me,EnoughTrumpSpam,1
"Are you dumb? Rethorical question, don't answer.

Someone says it's against the rules. This guy says it isn't. You say that they could **change** the rule.

You haven't countered him. You've just showed that you're illiterate.",EnoughTrumpSpam,1
CARRY ME HOME!,EnoughTrumpSpam,1
"Will you also be promoting Pro Sanders subreddits? I highly doubt it. I mean, you don't have to hide that this is a pro hillary subreddit it's pretty blatant.",EnoughTrumpSpam,1
The Guardian always talking about the real issues and not baiting at all.,EnoughTrumpSpam,1
Maybe someone on fox news should report about how trump should kill himself.,EnoughTrumpSpam,1
ahahahha,EnoughTrumpSpam,1
"You literally told me you were a left-leaning Republican. That's how i know your ideology. You talked about how people rightfully attacked you for being a cuck in a comment before.

You tried to get Hillary Clinton elected and she would have thoroughly wiped her ass with the Constitution, and you would smile your shit-eating grin while she did so. That's what you did to try and bring down America. You want America to burn just so you can stick it to those evil Republicans and patriots you hate so much, all while deluding yourself into thinking you are a hero.

I'm not the one with ruffled feathers, since i've got 8 years to cooperate with the president to make this country great again. You can try (and fail) to bring down our nation in 4 years, so don't worry.

Nice ad-hominem at the end. For being against Trump Spam you sure talk a hell of a lot about him. You're projecting your tiny dick onto our president-elect thinking it makes you look cool and morally superior. It makes you look like the America-hating jackass that you proudly show you are.

Go back to kissing Hildebeast's fat ass. Admit you like it, traitor.
",EnoughTrumpSpam,1
Trump has publicly claimed to be the most healthy person who ever ran or has been president. He also claimed his taxes are fine and nothing to see here.,EnoughTrumpSpam,1
James O'Cock,EnoughTrumpSpam,1
"Because even though the CTR money is drying up, people are still brainwashed. ",EnoughTrumpSpam,1
"Haha yeah trump literally wants a holocaust 

XD!!!!",EnoughTrumpSpam,1
"do you really expect to see the number of comments equal the number of upvotes?
OMG YOU GUYS THEY UPVOTED SOMETHING WITHOUT LEAVING A COMMENT! BOTS! BOTS! BOTS!!!!!!1111

",EnoughTrumpSpam,1
A lot of female mexican immigrants get raped by other illegal mexicans,EnoughTrumpSpam,1
"**BILL CLINTON RAPES WOMEN**

",EnoughTrumpSpam,1
"I don't understand you Hillary Supporters using this as an argument against a Trump. When you vote for Hillary you vote for Bill Clinton as well you're lifting Bill Clinton back in office, who is 10x as worse as Donald Trump. The Clintons are murderers sick evil people and it's such a shame ",EnoughTrumpSpam,1
"Oh no the ""hate symbol"" Pepe the Frog strikes again!",EnoughTrumpSpam,1
How is it a racist monument?,EnoughTrumpSpam,1
r/the_donald ?,EnoughTrumpSpam,1
I'd like to see this guy get a .50 right in the skull that was shot by a white male. That way he doesn't become a martyr. ,EnoughTrumpSpam,1
"Hillary will be President in 27 days, 05 hours, 48 minutes, and 52 seconds

I'm a cheeky scrub who publicly posts my API key and secret | investigate 3/11 | legalize ranch

If Trump ðŸ‘¹ Wins The Election ðŸ˜¡ðŸ“ðŸŽŸI Am Moving ðŸšš Out Of The Country âœˆï¸ðŸ“¦ðŸƒðŸ¼ GoodbyeðŸ˜°ðŸ‘‹ðŸ½ðŸ›« AmericaðŸ‡ºðŸ‡¸ðŸ’” Hello ðŸ˜ðŸ‘‹ðŸ½ Hawaii ðŸŒ¸ðŸŒ´ðŸ›¬",EnoughTrumpSpam,1
"Nice projecting, you pedo",EnoughTrumpSpam,1
If you don't like it get off reddit. ,EnoughTrumpSpam,1
