body,subreddit,moderated
TRUMP RACIST TRUMP RACIST TRUMP RACIST TRUMP RACIST TRUMP RACIST TRUMP RACIST TRUMP RACIST TRUMP RACIST TRUMP RACIST TRUMP RACIST TRUMP RACIST TRUMP RACIST TRUMP RACIST TRUMP RACIST TRUMP RACIST TRUMP RACIST TRUMP RACIST TRUMP RACIST TRUMP RACIST TRUMP RACIST TRUMP RACIST TRUMP RACIST TRUMP RACIST TRUMP RACIST TRUMP RACIST TRUMP RACIST TRUMP RACIST TRUMP RACIST TRUMP RACIST TRUMP RACIST TRUMP RACIST TRUMP RACIST TRUMP RACIST TRUMP RACIST TRUMP RACIST TRUMP RACIST TRUMP RACIST TRUMP RACIST TRUMP RACIST TRUMP RACIST TRUMP RACIST TRUMP RACIST TRUMP RACIST TRUMP RACIST TRUMP RACIST TRUMP RACIST TRUMP RACIST TRUMP RACIST TRUMP RACIST TRUMP RACIST TRUMP RACIST TRUMP RACIST TRUMP RACIST TRUMP RACIST TRUMP RACIST TRUMP RACIST TRUMP RACIST TRUMP RACIST TRUMP RACIST TRUMP RACIST TRUMP RACIST TRUMP RACIST TRUMP RACIST TRUMP RACIST TRUMP RACIST TRUMP RACIST TRUMP RACIST TRUMP RACIST TRUMP RACIST TRUMP RACIST TRUMP RACIST TRUMP RACIST TRUMP RACIST TRUMP RACIST TRUMP RACIST TRUMP RACIST TRUMP RACIST TRUMP RACIST TRUMP RACIST TRUMP RACIST TRUMP RACIST TRUMP RACIST TRUMP RACIST TRUMP RACIST TRUMP RACIST TRUMP RACIST TRUMP RACIST TRUMP RACIST TRUMP RACIST TRUMP RACIST TRUMP RACIST TRUMP RACIST TRUMP RACIST TRUMP RACIST TRUMP RACIST TRUMP RACIST TRUMP RACIST TRUMP RACIST TRUMP RACIST TRUMP RACIST TRUMP RACIST TRUMP RACIST TRUMP RACIST TRUMP RACIST TRUMP RACIST TRUMP RACIST TRUMP RACIST TRUMP RACIST TRUMP RACIST TRUMP RACIST TRUMP RACIST TRUMP RACIST TRUMP RACIST TRUMP RACIST TRUMP RACIST TRUMP RACIST TRUMP RACIST TRUMP RACIST TRUMP RACIST TRUMP RACIST TRUMP RACIST TRUMP RACIST TRUMP RACIST TRUMP RACIST TRUMP RACIST TRUMP RACIST TRUMP RACIST TRUMP RACIST TRUMP RACIST TRUMP RACIST TRUMP RACIST TRUMP RACIST TRUMP RACIST TRUMP RACIST TRUMP RACIST TRUMP RACIST TRUMP RACIST TRUMP RACIST TRUMP RACIST TRUMP RACIST TRUMP RACIST TRUMP RACIST TRUMP RACIST TRUMP RACIST TRUMP RACIST TRUMP RACIST TRUMP RACIST TRUMP RACIST TRUMP RACIST TRUMP RACIST TRUMP RACIST TRUMP RACIST TRUMP RACIST TRUMP RACIST TRUMP RACIST TRUMP RACIST TRUMP RACIST TRUMP RACIST TRUMP RACIST TRUMP RACIST TRUMP RACIST TRUMP RACIST TRUMP RACIST TRUMP RACIST TRUMP RACIST TRUMP RACIST TRUMP RACIST TRUMP RACIST TRUMP RACIST TRUMP RACIST TRUMP RACIST TRUMP RACIST TRUMP RACIST TRUMP RACIST TRUMP RACIST TRUMP RACIST TRUMP RACIST TRUMP RACIST TRUMP RACIST TRUMP RACIST TRUMP RACIST TRUMP RACIST TRUMP RACIST TRUMP RACIST TRUMP RACIST TRUMP RACIST TRUMP RACIST TRUMP RACIST TRUMP RACIST TRUMP RACIST TRUMP RACIST TRUMP RACIST TRUMP RACIST TRUMP RACIST TRUMP RACIST TRUMP RACIST TRUMP RACIST TRUMP RACIST TRUMP RACIST TRUMP RACIST TRUMP RACIST TRUMP RACIST TRUMP RACIST TRUMP RACIST TRUMP RACIST TRUMP RACIST TRUMP RACIST TRUMP RACIST TRUMP RACIST TRUMP RACIST TRUMP RACIST TRUMP RACIST TRUMP RACIST TRUMP RACIST TRUMP RACIST TRUMP RACIST TRUMP RACIST TRUMP RACIST TRUMP RACIST TRUMP RACIST TRUMP RACIST TRUMP RACIST TRUMP RACIST TRUMP RACIST TRUMP RACIST TRUMP RACIST TRUMP RACIST TRUMP RACIST TRUMP RACIST TRUMP RACIST TRUMP RACIST TRUMP RACIST TRUMP RACIST TRUMP RACIST TRUMP RACIST TRUMP RACIST TRUMP RACIST TRUMP RACIST TRUMP RACIST TRUMP RACIST TRUMP RACIST TRUMP RACIST TRUMP RACIST TRUMP RACIST TRUMP RACIST TRUMP RACIST TRUMP RACIST TRUMP RACIST TRUMP RACIST TRUMP RACIST TRUMP RACIST TRUMP RACIST TRUMP RACIST TRUMP RACIST TRUMP RACIST TRUMP RACIST TRUMP RACIST TRUMP RACIST TRUMP RACIST TRUMP RACIST TRUMP RACIST TRUMP RACIST TRUMP RACIST TRUMP RACIST TRUMP RACIST TRUMP RACIST TRUMP RACIST TRUMP RACIST TRUMP RACIST TRUMP RACIST TRUMP RACIST TRUMP RACIST TRUMP RACIST TRUMP RACIST TRUMP RACIST TRUMP RACIST TRUMP RACIST TRUMP RACIST TRUMP RACIST TRUMP RACIST TRUMP RACIST TRUMP RACIST TRUMP RACIST TRUMP RACIST TRUMP RACIST TRUMP RACIST TRUMP RACIST TRUMP RACIST TRUMP RACIST TRUMP RACIST TRUMP RACIST TRUMP RACIST TRUMP RACIST TRUMP RACIST TRUMP RACIST TRUMP RACIST TRUMP RACIST TRUMP RACIST TRUMP RACIST TRUMP RACIST TRUMP RACIST TRUMP RACIST TRUMP RACIST TRUMP RACIST TRUMP RACIST TRUMP RACIST TRUMP RACIST TRUMP RACIST TRUMP RACIST TRUMP RACIST TRUMP RACIST TRUMP RACIST TRUMP RACIST TRUMP RACIST TRUMP RACIST TRUMP RACIST TRUMP RACIST TRUMP RACIST TRUMP RACIST TRUMP RACIST TRUMP RACIST TRUMP RACIST TRUMP RACIST TRUMP RACIST TRUMP RACIST TRUMP RACIST TRUMP RACIST TRUMP RACIST TRUMP RACIST TRUMP RACIST TRUMP RACIST TRUMP RACIST TRUMP RACIST TRUMP RACIST TRUMP RACIST TRUMP RACIST TRUMP RACIST TRUMP RACIST TRUMP RACIST TRUMP RACIST TRUMP RACIST TRUMP RACIST TRUMP RACIST TRUMP RACIST TRUMP RACIST TRUMP RACIST TRUMP RACIST TRUMP RACIST TRUMP RACIST TRUMP RACIST TRUMP RACIST TRUMP RACIST TRUMP RACIST TRUMP RACIST TRUMP RACIST TRUMP RACIST TRUMP RACIST TRUMP RACIST TRUMP RACIST TRUMP RACIST TRUMP RACIST TRUMP RACIST TRUMP RACIST TRUMP RACIST TRUMP RACIST TRUMP RACIST TRUMP RACIST TRUMP RACIST TRUMP RACIST TRUMP RACIST TRUMP RACIST TRUMP RACIST TRUMP RACIST TRUMP RACIST TRUMP RACIST TRUMP RACIST TRUMP RACIST TRUMP RACIST TRUMP RACIST TRUMP RACIST TRUMP RACIST TRUMP RACIST TRUMP RACIST TRUMP RACIST TRUMP RACIST TRUMP RACIST TRUMP RACIST TRUMP RACIST TRUMP RACIST TRUMP RACIST TRUMP RACIST TRUMP RACIST TRUMP RACIST TRUMP RACIST TRUMP RACIST TRUMP RACIST TRUMP RACIST TRUMP RACIST TRUMP RACIST TRUMP RACIST TRUMP RACIST TRUMP RACIST TRUMP RACIST TRUMP RACIST TRUMP RACIST TRUMP RACIST TRUMP RACIST TRUMP RACIST TRUMP RACIST TRUMP RACIST TRUMP RACIST TRUMP RACIST TRUMP RACIST TRUMP RACIST TRUMP RACIST TRUMP RACIST TRUMP RACIST TRUMP RACIST TRUMP RACIST TRUMP RACIST TRUMP RACIST TRUMP RACIST TRUMP RACIST TRUMP RACIST TRUMP RACIST TRUMP RACIST TRUMP RACIST TRUMP RACIST TRUMP RACIST TRUMP RACIST TRUMP RACIST TRUMP RACIST TRUMP RACIST TRUMP RACIST TRUMP RACIST TRUMP RACIST TRUMP RACIST TRUMP RACIST TRUMP RACIST TRUMP RACIST TRUMP RACIST TRUMP RACIST TRUMP RACIST TRUMP RACIST TRUMP RACIST TRUMP RACIST TRUMP RACIST TRUMP RACIST TRUMP RACIST TRUMP RACIST TRUMP RACIST TRUMP RACIST TRUMP RACIST TRUMP RACIST TRUMP RACIST TRUMP RACIST TRUMP RACIST TRUMP RACIST TRUMP RACIST TRUMP RACIST TRUMP RACIST TRUMP RACIST TRUMP RACIST TRUMP RACIST TRUMP RACIST TRUMP RACIST TRUMP RACIST TRUMP RACIST TRUMP RACIST TRUMP RACIST TRUMP RACIST TRUMP RACIST TRUMP RACIST TRUMP RACIST TRUMP RACIST TRUMP RACIST TRUMP RACIST TRUMP RACIST TRUMP RACIST TRUMP RACIST TRUMP RACIST TRUMP RACIST TRUMP RACIST TRUMP RACIST TRUMP RACIST TRUMP RACIST TRUMP RACIST TRUMP RACIST TRUMP RACIST TRUMP RACIST TRUMP RACIST TRUMP RACIST TRUMP RACIST TRUMP RACIST TRUMP RACIST TRUMP RACIST TRUMP RACIST TRUMP RACIST TRUMP RACIST TRUMP RACIST TRUMP RACIST TRUMP RACIST TRUMP RACIST TRUMP RACIST TRUMP RACIST TRUMP RACIST TRUMP RACIST TRUMP RACIST TRUMP RACIST TRUMP RACIST TRUMP RACIST TRUMP RACIST TRUMP RACIST TRUMP RACIST TRUMP RACIST TRUMP RACIST TRUMP RACIST TRUMP RACIST TRUMP RACIST TRUMP RACIST TRUMP RACIST TRUMP RACIST TRUMP RACIST TRUMP RACIST TRUMP RACIST TRUMP RACIST TRUMP RACIST TRUMP RACIST TRUMP RACIST TRUMP RACIST TRUMP RACIST TRUMP RACIST TRUMP RACIST TRUMP RACIST TRUMP RACIST TRUMP RACIST TRUMP RACIST TRUMP RACIST TRUMP RACIST TRUMP RACIST TRUMP RACIST TRUMP RACIST TRUMP RACIST TRUMP RACIST TRUMP RACIST TRUMP RACIST TRUMP RACIST TRUMP RACIST TRUMP RACIST TRUMP RACIST TRUMP RACIST TRUMP RACIST TRUMP RACIST TRUMP RACIST TRUMP RACIST TRUMP RACIST TRUMP RACIST TRUMP RACIST TRUMP RACIST TRUMP RACIST TRUMP RACIST TRUMP RACIST TRUMP RACIST TRUMP RACIST TRUMP RACIST TRUMP RACIST TRUMP RACIST TRUMP RACIST TRUMP RACIST TRUMP RACIST TRUMP RACIST TRUMP RACIST TRUMP RACIST TRUMP RACIST TRUMP RACIST TRUMP RACIST TRUMP RACIST TRUMP RACIST TRUMP RACIST TRUMP RACIST TRUMP RACIST TRUMP RACIST TRUMP RACIST TRUMP RACIST TRUMP RACIST TRUMP RACIST TRUMP RACIST TRUMP RACIST TRUMP RACIST TRUMP RACIST TRUMP RACIST TRUMP RACIST TRUMP RACIST TRUMP RACIST TRUMP RACIST TRUMP RACIST TRUMP RACIST TRUMP RACIST TRUMP RACIST TRUMP RACIST TRUMP RACIST TRUMP RACIST TRUMP RACIST TRUMP RACIST TRUMP RACIST TRUMP RACIST TRUMP RACIST TRUMP RACIST TRUMP RACIST TRUMP RACIST TRUMP RACIST TRUMP RACIST TRUMP RACIST TRUMP RACIST TRUMP RACIST TRUMP RACIST TRUMP RACIST TRUMP RACIST TRUMP RACIST TRUMP RACIST TRUMP RACIST TRUMP RACIST TRUMP RACIST TRUMP RACIST TRUMP RACIST TRUMP RACIST TRUMP RACIST TRUMP RACIST TRUMP RACIST TRUMP RACIST TRUMP RACIST TRUMP RACIST TRUMP RACIST TRUMP RACIST TRUMP RACIST TRUMP RACIST TRUMP RACIST TRUMP RACIST TRUMP RACIST TRUMP RACIST TRUMP RACIST TRUMP RACIST TRUMP RACIST TRUMP RACIST TRUMP RACIST TRUMP RACIST TRUMP RACIST TRUMP RACIST TRUMP RACIST TRUMP RACIST TRUMP RACIST TRUMP RACIST TRUMP RACIST TRUMP RACIST TRUMP RACIST TRUMP RACIST TRUMP RACIST TRUMP RACIST TRUMP RACIST TRUMP RACIST TRUMP RACIST TRUMP RACIST TRUMP RACIST TRUMP RACIST TRUMP RACIST TRUMP RACIST TRUMP RACIST TRUMP RACIST TRUMP RACIST TRUMP RACIST TRUMP RACIST TRUMP RACIST TRUMP RACIST TRUMP RACIST TRUMP RACIST TRUMP RACIST TRUMP RACIST TRUMP RACIST TRUMP RACIST TRUMP RACIST TRUMP RACIST TRUMP RACIST TRUMP RACIST TRUMP RACIST TRUMP RACIST TRUMP RACIST TRUMP RACIST TRUMP RACIST TRUMP RACIST TRUMP RACIST TRUMP RACIST TRUMP RACIST TRUMP RACIST TRUMP RACIST TRUMP RACIST TRUMP RACIST TRUMP RACIST TRUMP RACIST TRUMP RACIST TRUMP RACIST TRUMP RACIST TRUMP RACIST TRUMP RACIST TRUMP RACIST TRUMP RACIST TRUMP RACIST TRUMP RACIST TRUMP RACIST TRUMP RACIST TRUMP RACIST TRUMP RACIST TRUMP RACIST TRUMP RACIST TRUMP RACIST TRUMP RACIST TRUMP RACIST TRUMP RACIST TRUMP RACIST TRUMP RACIST TRUMP RACIST TRUMP RACIST TRUMP RACIST TRUMP RACIST TRUMP RACIST TRUMP RACIST TRUMP RACIST TRUMP RACIST TRUMP RACIST TRUMP RACIST TRUMP RACIST TRUMP RACIST TRUMP RACIST TRUMP RACIST TRUMP RACIST TRUMP RACIST TRUMP RACIST TRUMP RACIST TRUMP RACIST TRUMP RACIST TRUMP RACIST TRUMP RACIST TRUMP RACIST TRUMP RACIST TRUMP RACIST TRUMP RACIST TRUMP RACIST TRUMP RACIST TRUMP RACIST TRUMP RACIST TRUMP RACIST TRUMP RACIST TRUMP RACIST TRUMP RACIST TRUMP RACIST TRUMP RACIST TRUMP RACIST TRUMP RACIST TRUMP RACIST TRUMP RACIST TRUMP RACIST TRUMP RACIST TRUMP RACIST TRUMP RACIST TRUMP RACIST TRUMP RACIST TRUMP RACIST TRUMP RACIST TRUMP RACIST TRUMP RACIST ,EnoughTrumpSpam,1
"The most recent polling shows that over half of America believes Trump or Johnson is a better choice than Clinton.

I'm fully aware that ETS isn't going to ""fall"" for ""military-worshipping crap"" like suggesting the overwhelming majority of military officers aren't delusional.  Fortunately, it's a smug little echo chamber which does not reflect the views of the country.  ",EnoughTrumpSpam,1
"Hillary will be President in 27 days, 05 hours, 51 minutes, and 41 seconds

I'm a cheeky scrub who publicly posts my API key and secret | investigate 3/11 | legalize ranch

If Trump ðŸ‘¹ Wins The Election ðŸ˜¡ðŸ“ðŸŽŸI Am Moving ðŸšš Out Of The Country âœˆï¸ðŸ“¦ðŸƒðŸ¼ GoodbyeðŸ˜°ðŸ‘‹ðŸ½ðŸ›« AmericaðŸ‡ºðŸ‡¸ðŸ’” Hello ðŸ˜ðŸ‘‹ðŸ½ Hawaii ðŸŒ¸ðŸŒ´ðŸ›¬",EnoughTrumpSpam,1
[Here's another one.](https://images.encyclopediadramatica.se/7/7f/Garrison_hitler.jpg),EnoughTrumpSpam,1
"Just an FYI, but you're an asshole.",EnoughTrumpSpam,1
Lol stay salty Dave,EnoughTrumpSpam,1
Since when is Trump or any of his supporters against immigration? They're against illegal immigration.,EnoughTrumpSpam,1
Triggred,EnoughTrumpSpam,1
"Maybe people make alternate accounts because they are afraid of SJW doxxing affecting their real life.

/tinfoil hat",EnoughTrumpSpam,1
"Yeah reddit finally got around to ""updating"" their algorithm",EnoughTrumpSpam,1
Hahaha apparently according to this guy its worse to say mean things about the enemy than literally arm them with weapons ...,EnoughTrumpSpam,1
"oh no!
not racism!

think of the niggers and faggots!",EnoughTrumpSpam,1
Just go to r/asktrumpsupporters ,EnoughTrumpSpam,1
https://streamable.com/7g8i,EnoughTrumpSpam,1
I am LITERALLY shaking right now!! This man is LITERALLY HITLER!! Will I literally be deported for literally just being a female!?!!?,EnoughTrumpSpam,1
I would've introduced my hard-toe boots to his Nazi balls.,EnoughTrumpSpam,1
wow. must be a big family for all those letters. ,EnoughTrumpSpam,1
"Lmao you are the ones with people like trigglypuff who want to ban ""hate speech"". We are pro first amendment.",EnoughTrumpSpam,1
yeah he could just follow hillary's example with her clinton foundation. she sure seems to have streamlined the corruption business. you are making predictions while we have tangible facts that hillary is corrupt. the irony is amazing. ,EnoughTrumpSpam,1
It's true. He is ,EnoughTrumpSpam,1
"Still no evidence, still no ban. Because it's not happening and you're all just triggered liberal retards.",EnoughTrumpSpam,1
"Joke's on you. Your ""candidate"" will be dealing with an indictment and everyone on the Trump train will be laughing their asses off saying, ""We told you so!"".",EnoughTrumpSpam,1
"I think you need to learn how to read first. Secondly I think you need to find a good caretaker for yourself. As I told you, it is OK to be retarded, you have plenty of folks to spend time with",EnoughTrumpSpam,1
Triggered cucks,EnoughTrumpSpam,1
"All of you who downvoted this, explain yourself. ",EnoughTrumpSpam,1
R/asktrumpsupporters ,EnoughTrumpSpam,1
"when i look at who i want to support, i look at the people against them. whos against trump ? a rapist, and illegal immigrants. ",EnoughTrumpSpam,1
TRUMP RACIST TRUMP RACIST TRUMP RACIST TRUMP RACIST TRUMP RACIST TRUMP RACIST TRUMP RACIST TRUMP RACIST TRUMP RACIST TRUMP RACIST TRUMP RACIST TRUMP RACIST TRUMP RACIST TRUMP RACIST TRUMP RACIST TRUMP RACIST TRUMP RACIST TRUMP RACIST TRUMP RACIST TRUMP RACIST TRUMP RACIST TRUMP RACIST TRUMP RACIST TRUMP RACIST TRUMP RACIST TRUMP RACIST TRUMP RACIST TRUMP RACIST TRUMP RACIST TRUMP RACIST TRUMP RACIST TRUMP RACIST TRUMP RACIST TRUMP RACIST TRUMP RACIST TRUMP RACIST TRUMP RACIST TRUMP RACIST TRUMP RACIST TRUMP RACIST TRUMP RACIST TRUMP RACIST TRUMP RACIST TRUMP RACIST TRUMP RACIST TRUMP RACIST TRUMP RACIST TRUMP RACIST TRUMP RACIST TRUMP RACIST TRUMP RACIST TRUMP RACIST TRUMP RACIST TRUMP RACIST TRUMP RACIST TRUMP RACIST TRUMP RACIST TRUMP RACIST TRUMP RACIST TRUMP RACIST TRUMP RACIST TRUMP RACIST TRUMP RACIST TRUMP RACIST TRUMP RACIST TRUMP RACIST TRUMP RACIST TRUMP RACIST TRUMP RACIST TRUMP RACIST TRUMP RACIST TRUMP RACIST TRUMP RACIST TRUMP RACIST TRUMP RACIST TRUMP RACIST TRUMP RACIST TRUMP RACIST TRUMP RACIST TRUMP RACIST TRUMP RACIST TRUMP RACIST TRUMP RACIST TRUMP RACIST TRUMP RACIST TRUMP RACIST TRUMP RACIST TRUMP RACIST TRUMP RACIST TRUMP RACIST TRUMP RACIST TRUMP RACIST TRUMP RACIST TRUMP RACIST TRUMP RACIST TRUMP RACIST TRUMP RACIST TRUMP RACIST TRUMP RACIST TRUMP RACIST TRUMP RACIST TRUMP RACIST TRUMP RACIST TRUMP RACIST TRUMP RACIST TRUMP RACIST TRUMP RACIST TRUMP RACIST TRUMP RACIST TRUMP RACIST TRUMP RACIST TRUMP RACIST TRUMP RACIST TRUMP RACIST TRUMP RACIST TRUMP RACIST TRUMP RACIST TRUMP RACIST TRUMP RACIST TRUMP RACIST TRUMP RACIST TRUMP RACIST TRUMP RACIST TRUMP RACIST TRUMP RACIST TRUMP RACIST TRUMP RACIST TRUMP RACIST TRUMP RACIST TRUMP RACIST TRUMP RACIST TRUMP RACIST TRUMP RACIST TRUMP RACIST TRUMP RACIST TRUMP RACIST TRUMP RACIST TRUMP RACIST TRUMP RACIST TRUMP RACIST TRUMP RACIST TRUMP RACIST TRUMP RACIST TRUMP RACIST TRUMP RACIST TRUMP RACIST TRUMP RACIST TRUMP RACIST TRUMP RACIST TRUMP RACIST TRUMP RACIST TRUMP RACIST TRUMP RACIST TRUMP RACIST TRUMP RACIST TRUMP RACIST TRUMP RACIST TRUMP RACIST TRUMP RACIST TRUMP RACIST TRUMP RACIST TRUMP RACIST TRUMP RACIST TRUMP RACIST TRUMP RACIST TRUMP RACIST TRUMP RACIST TRUMP RACIST TRUMP RACIST TRUMP RACIST TRUMP RACIST TRUMP RACIST TRUMP RACIST TRUMP RACIST TRUMP RACIST TRUMP RACIST TRUMP RACIST TRUMP RACIST TRUMP RACIST TRUMP RACIST TRUMP RACIST TRUMP RACIST TRUMP RACIST TRUMP RACIST TRUMP RACIST TRUMP RACIST TRUMP RACIST TRUMP RACIST TRUMP RACIST TRUMP RACIST TRUMP RACIST TRUMP RACIST TRUMP RACIST TRUMP RACIST TRUMP RACIST TRUMP RACIST TRUMP RACIST TRUMP RACIST TRUMP RACIST TRUMP RACIST TRUMP RACIST TRUMP RACIST TRUMP RACIST TRUMP RACIST TRUMP RACIST TRUMP RACIST TRUMP RACIST TRUMP RACIST TRUMP RACIST TRUMP RACIST TRUMP RACIST TRUMP RACIST TRUMP RACIST TRUMP RACIST TRUMP RACIST TRUMP RACIST TRUMP RACIST TRUMP RACIST TRUMP RACIST TRUMP RACIST TRUMP RACIST TRUMP RACIST TRUMP RACIST TRUMP RACIST TRUMP RACIST TRUMP RACIST TRUMP RACIST TRUMP RACIST TRUMP RACIST TRUMP RACIST TRUMP RACIST TRUMP RACIST TRUMP RACIST TRUMP RACIST TRUMP RACIST TRUMP RACIST TRUMP RACIST TRUMP RACIST TRUMP RACIST TRUMP RACIST TRUMP RACIST TRUMP RACIST TRUMP RACIST TRUMP RACIST TRUMP RACIST TRUMP RACIST TRUMP RACIST TRUMP RACIST TRUMP RACIST TRUMP RACIST TRUMP RACIST TRUMP RACIST TRUMP RACIST TRUMP RACIST TRUMP RACIST TRUMP RACIST TRUMP RACIST TRUMP RACIST TRUMP RACIST TRUMP RACIST TRUMP RACIST TRUMP RACIST TRUMP RACIST TRUMP RACIST TRUMP RACIST TRUMP RACIST TRUMP RACIST TRUMP RACIST TRUMP RACIST TRUMP RACIST TRUMP RACIST TRUMP RACIST TRUMP RACIST TRUMP RACIST TRUMP RACIST TRUMP RACIST TRUMP RACIST TRUMP RACIST TRUMP RACIST TRUMP RACIST TRUMP RACIST TRUMP RACIST TRUMP RACIST TRUMP RACIST TRUMP RACIST TRUMP RACIST TRUMP RACIST TRUMP RACIST TRUMP RACIST TRUMP RACIST TRUMP RACIST TRUMP RACIST TRUMP RACIST TRUMP RACIST TRUMP RACIST TRUMP RACIST TRUMP RACIST TRUMP RACIST TRUMP RACIST TRUMP RACIST TRUMP RACIST TRUMP RACIST TRUMP RACIST TRUMP RACIST TRUMP RACIST TRUMP RACIST TRUMP RACIST TRUMP RACIST TRUMP RACIST TRUMP RACIST TRUMP RACIST TRUMP RACIST TRUMP RACIST TRUMP RACIST TRUMP RACIST TRUMP RACIST TRUMP RACIST TRUMP RACIST TRUMP RACIST TRUMP RACIST TRUMP RACIST TRUMP RACIST TRUMP RACIST TRUMP RACIST TRUMP RACIST TRUMP RACIST TRUMP RACIST TRUMP RACIST TRUMP RACIST TRUMP RACIST TRUMP RACIST TRUMP RACIST TRUMP RACIST TRUMP RACIST TRUMP RACIST TRUMP RACIST TRUMP RACIST TRUMP RACIST TRUMP RACIST TRUMP RACIST TRUMP RACIST TRUMP RACIST TRUMP RACIST TRUMP RACIST TRUMP RACIST TRUMP RACIST TRUMP RACIST TRUMP RACIST TRUMP RACIST TRUMP RACIST TRUMP RACIST TRUMP RACIST TRUMP RACIST TRUMP RACIST TRUMP RACIST TRUMP RACIST TRUMP RACIST TRUMP RACIST TRUMP RACIST TRUMP RACIST TRUMP RACIST TRUMP RACIST TRUMP RACIST TRUMP RACIST TRUMP RACIST TRUMP RACIST TRUMP RACIST TRUMP RACIST TRUMP RACIST TRUMP RACIST TRUMP RACIST TRUMP RACIST TRUMP RACIST TRUMP RACIST TRUMP RACIST TRUMP RACIST TRUMP RACIST TRUMP RACIST TRUMP RACIST TRUMP RACIST TRUMP RACIST TRUMP RACIST TRUMP RACIST TRUMP RACIST TRUMP RACIST TRUMP RACIST TRUMP RACIST TRUMP RACIST TRUMP RACIST TRUMP RACIST TRUMP RACIST TRUMP RACIST TRUMP RACIST TRUMP RACIST TRUMP RACIST TRUMP RACIST TRUMP RACIST TRUMP RACIST TRUMP RACIST TRUMP RACIST TRUMP RACIST TRUMP RACIST TRUMP RACIST TRUMP RACIST TRUMP RACIST TRUMP RACIST TRUMP RACIST TRUMP RACIST TRUMP RACIST TRUMP RACIST TRUMP RACIST TRUMP RACIST TRUMP RACIST TRUMP RACIST TRUMP RACIST TRUMP RACIST TRUMP RACIST TRUMP RACIST TRUMP RACIST TRUMP RACIST TRUMP RACIST TRUMP RACIST TRUMP RACIST TRUMP RACIST TRUMP RACIST TRUMP RACIST TRUMP RACIST TRUMP RACIST TRUMP RACIST TRUMP RACIST TRUMP RACIST TRUMP RACIST TRUMP RACIST TRUMP RACIST TRUMP RACIST TRUMP RACIST TRUMP RACIST TRUMP RACIST TRUMP RACIST TRUMP RACIST TRUMP RACIST TRUMP RACIST TRUMP RACIST TRUMP RACIST TRUMP RACIST TRUMP RACIST TRUMP RACIST TRUMP RACIST TRUMP RACIST TRUMP RACIST TRUMP RACIST TRUMP RACIST TRUMP RACIST TRUMP RACIST TRUMP RACIST TRUMP RACIST TRUMP RACIST TRUMP RACIST TRUMP RACIST TRUMP RACIST TRUMP RACIST TRUMP RACIST TRUMP RACIST TRUMP RACIST TRUMP RACIST TRUMP RACIST TRUMP RACIST TRUMP RACIST TRUMP RACIST TRUMP RACIST TRUMP RACIST TRUMP RACIST TRUMP RACIST TRUMP RACIST TRUMP RACIST TRUMP RACIST TRUMP RACIST TRUMP RACIST TRUMP RACIST TRUMP RACIST TRUMP RACIST TRUMP RACIST TRUMP RACIST TRUMP RACIST TRUMP RACIST TRUMP RACIST TRUMP RACIST TRUMP RACIST TRUMP RACIST TRUMP RACIST TRUMP RACIST TRUMP RACIST TRUMP RACIST TRUMP RACIST TRUMP RACIST TRUMP RACIST TRUMP RACIST TRUMP RACIST TRUMP RACIST TRUMP RACIST TRUMP RACIST TRUMP RACIST TRUMP RACIST TRUMP RACIST TRUMP RACIST TRUMP RACIST TRUMP RACIST TRUMP RACIST TRUMP RACIST TRUMP RACIST TRUMP RACIST TRUMP RACIST TRUMP RACIST TRUMP RACIST TRUMP RACIST TRUMP RACIST TRUMP RACIST TRUMP RACIST TRUMP RACIST TRUMP RACIST TRUMP RACIST TRUMP RACIST TRUMP RACIST TRUMP RACIST TRUMP RACIST TRUMP RACIST TRUMP RACIST TRUMP RACIST TRUMP RACIST TRUMP RACIST TRUMP RACIST TRUMP RACIST TRUMP RACIST TRUMP RACIST TRUMP RACIST TRUMP RACIST TRUMP RACIST TRUMP RACIST TRUMP RACIST TRUMP RACIST TRUMP RACIST TRUMP RACIST TRUMP RACIST TRUMP RACIST TRUMP RACIST TRUMP RACIST TRUMP RACIST TRUMP RACIST TRUMP RACIST TRUMP RACIST TRUMP RACIST TRUMP RACIST TRUMP RACIST TRUMP RACIST TRUMP RACIST TRUMP RACIST TRUMP RACIST TRUMP RACIST TRUMP RACIST TRUMP RACIST TRUMP RACIST TRUMP RACIST TRUMP RACIST TRUMP RACIST TRUMP RACIST TRUMP RACIST TRUMP RACIST TRUMP RACIST TRUMP RACIST TRUMP RACIST TRUMP RACIST TRUMP RACIST TRUMP RACIST TRUMP RACIST TRUMP RACIST TRUMP RACIST TRUMP RACIST TRUMP RACIST TRUMP RACIST TRUMP RACIST TRUMP RACIST TRUMP RACIST TRUMP RACIST TRUMP RACIST TRUMP RACIST TRUMP RACIST TRUMP RACIST TRUMP RACIST TRUMP RACIST TRUMP RACIST TRUMP RACIST TRUMP RACIST TRUMP RACIST TRUMP RACIST TRUMP RACIST TRUMP RACIST TRUMP RACIST TRUMP RACIST TRUMP RACIST TRUMP RACIST TRUMP RACIST TRUMP RACIST TRUMP RACIST TRUMP RACIST TRUMP RACIST TRUMP RACIST TRUMP RACIST TRUMP RACIST TRUMP RACIST TRUMP RACIST TRUMP RACIST TRUMP RACIST TRUMP RACIST TRUMP RACIST TRUMP RACIST TRUMP RACIST TRUMP RACIST TRUMP RACIST TRUMP RACIST TRUMP RACIST TRUMP RACIST TRUMP RACIST TRUMP RACIST TRUMP RACIST TRUMP RACIST TRUMP RACIST TRUMP RACIST TRUMP RACIST TRUMP RACIST TRUMP RACIST TRUMP RACIST TRUMP RACIST TRUMP RACIST TRUMP RACIST TRUMP RACIST TRUMP RACIST TRUMP RACIST TRUMP RACIST TRUMP RACIST TRUMP RACIST TRUMP RACIST TRUMP RACIST TRUMP RACIST TRUMP RACIST TRUMP RACIST TRUMP RACIST TRUMP RACIST TRUMP RACIST TRUMP RACIST TRUMP RACIST TRUMP RACIST TRUMP RACIST TRUMP RACIST TRUMP RACIST TRUMP RACIST TRUMP RACIST TRUMP RACIST TRUMP RACIST TRUMP RACIST TRUMP RACIST TRUMP RACIST TRUMP RACIST TRUMP RACIST TRUMP RACIST TRUMP RACIST TRUMP RACIST TRUMP RACIST TRUMP RACIST TRUMP RACIST TRUMP RACIST TRUMP RACIST TRUMP RACIST TRUMP RACIST TRUMP RACIST TRUMP RACIST TRUMP RACIST TRUMP RACIST TRUMP RACIST TRUMP RACIST TRUMP RACIST TRUMP RACIST TRUMP RACIST TRUMP RACIST TRUMP RACIST TRUMP RACIST TRUMP RACIST TRUMP RACIST TRUMP RACIST TRUMP RACIST TRUMP RACIST TRUMP RACIST TRUMP RACIST TRUMP RACIST TRUMP RACIST TRUMP RACIST TRUMP RACIST TRUMP RACIST TRUMP RACIST TRUMP RACIST TRUMP RACIST TRUMP RACIST TRUMP RACIST TRUMP RACIST TRUMP RACIST TRUMP RACIST TRUMP RACIST TRUMP RACIST TRUMP RACIST TRUMP RACIST TRUMP RACIST TRUMP RACIST TRUMP RACIST TRUMP RACIST TRUMP RACIST TRUMP RACIST TRUMP RACIST TRUMP RACIST TRUMP RACIST TRUMP RACIST TRUMP RACIST TRUMP RACIST TRUMP RACIST TRUMP RACIST TRUMP RACIST TRUMP RACIST TRUMP RACIST TRUMP RACIST TRUMP RACIST TRUMP RACIST TRUMP RACIST TRUMP RACIST TRUMP RACIST TRUMP RACIST TRUMP RACIST TRUMP RACIST TRUMP RACIST TRUMP RACIST TRUMP RACIST TRUMP RACIST TRUMP RACIST TRUMP RACIST TRUMP RACIST TRUMP RACIST TRUMP RACIST TRUMP RACIST TRUMP RACIST TRUMP RACIST TRUMP RACIST TRUMP RACIST TRUMP RACIST TRUMP RACIST TRUMP RACIST TRUMP RACIST TRUMP RACIST TRUMP RACIST TRUMP RACIST TRUMP RACIST TRUMP RACIST TRUMP RACIST TRUMP RACIST TRUMP RACIST TRUMP RACIST TRUMP RACIST TRUMP RACIST TRUMP RACIST TRUMP RACIST TRUMP RACIST TRUMP RACIST TRUMP RACIST ,EnoughTrumpSpam,1
"Couldn't agree more. Hillary was corrupt, no doubt. I don't think many argued against it, but most politicians are, especially experienced ones. Doesnt make them bad politicians, it just makes them greedy. 

The thing is, is that Trump doesn't have ANY experience so he just keeps making mistake after mistake. Yet he's going to lead your country... I hope the Trump supporters realize how shameful this looks. The train hasn't even derailed yet.",EnoughTrumpSpam,1
What they deserve is the same fate that all fascists deserve. ,EnoughTrumpSpam,1
this is something an ignorant person would think,EnoughTrumpSpam,1
Oh shit the Guccifer leaks just proved that banks paid the Clinton foundation to receive TARP funding. How do we spin this guys help,EnoughTrumpSpam,1
No Trump fan but how is Hillary not a crook?,EnoughTrumpSpam,1
Leave it to liberals to find any excuse they can to rationalize their hate speech.,EnoughTrumpSpam,1
">Muslim attacks OSU

this sub

>Whatabout this event tho!!!

Seriously as a Canadian I feel sorry for you Americans with Trump but god damn this post is terrible and just absolutely just spitting in the face of the Americans that died at OSU today. Just my two cents.",EnoughTrumpSpam,1
Triggred,EnoughTrumpSpam,1
"Being a rich white man basically makes you a God in America. If I ever get a girl pregnant, I will ask her to abort anything with a Y chromosome. Better yet, I'm just not going to bring any children into this world. ",EnoughTrumpSpam,1
"Yeah, and imagine if Clinton was objectively guilty of treason, perjury, obstruction of justice, and accepting bribes from foreign nations, but was never charged because of a secret deal with the Attorney General.

Oh wait.",EnoughTrumpSpam,1
"Bahahahahahahahaaaaaaaaaa.

Oh man, I am shaking with ***dread***.

Seriously, the verdict is out. Anyone vaguely associated with publishing this hilarious piece of troll fiction already has their reputation forever tarnished. The actual troll who wrote it is already in talks with a lawyer to prove he wrote it in order to bring a libel suit against buzzfeed.

If you really think this is real, you are so delusional it must be hard to cross the street without encountering purple dinosaurs.",EnoughTrumpSpam,1
"Also, since when was politics supposed to be fair? You put a moron like Guiliani up as a surrogate and you're liable for what comes out of his mouth. It's not our job to clean up after you.",EnoughTrumpSpam,0
Trump would actually be the second President who divorced and remarried...the first was Ronald Reagan!,EnoughTrumpSpam,0
