body,subreddit,moderated
"Why does anyone need to make 4m a year.  What does the average person earn in their lifetime? 2.5-5m?  

You're right I don't earn 4m a year I earn absolute shit and I work my ass off for it.  I'm not a Communist or a Marxist.  I grew up around people with large sums of money and I saw nothing but miserable people who worked for their parents company and hated it.  This sum doesn't make people happy and what are you doing in your life that requires such an extravagant living?",explainlikeimfive,1
Economics,explainlikeimfive,1
Why do some people think there's an ELI5 for everything?,explainlikeimfive,1
"It's really simple. Mommy & Daddy just  need a good night's sleep. Every night. That means you have to go to bed on time, without arguing. Also, you're not allowed to climb into Mommy & Daddy's bed in the middle of the night because you might wake them. Just in case, we're gonna lock the door so you can't disturb us. If you come crying in the middle of the night screaming and pounding on the door, you'll be an only child forever. Now go to bed.",explainlikeimfive,1
"That's the whole reason sex feels good. We weren't always smart enough to mate solely for reproduction, but we knew sex felt good so we did it anyway. We get hungry so we eat, thirsty so we drink, pain keeps us from hurting our bodies and we get horny so we have sex. Very little thought necessary.",explainlikeimfive,1
Hell cheap ones do if you buy the shit for it,explainlikeimfive,1
"Just remember this 

India = bad 

Pakistan = good 

Pakistan has been victim of India's terrorism for decades now. They don't even spare the school kids here in Pakistan ",explainlikeimfive,1
[Here](http://www.preposterousuniverse.com/blog/2010/02/22/energy-is-not-conserved/) is a blog post by cosmologist Sean Carroll. He answers your question there.,explainlikeimfive,1
Wait. Sex leads to kids?,explainlikeimfive,1
It's not removed. I can see he called you a pussy. ,explainlikeimfive,1
"When the civilized Europeans can get a space program that can keep pace with those dirty death penalty having Americans, Chinese, and Russians come talk to me. Until your Civilization really isn't as advanced as you think it is.",explainlikeimfive,1
"disgusting, keep your pro-murder propaganda off this science subreddit ",explainlikeimfive,1
Reply biology,explainlikeimfive,1
"ELI5 answer:

You know how mommy's time is more important than yours? So is the doctor's time. ",explainlikeimfive,1
This documentary is an excellent source: https://m.youtube.com/watch?v=bFFxEjaMyu8,explainlikeimfive,1
"It should be called the stupidity tax instead of the death tax, because only stupid people who do not plan are the ones who pay it.",explainlikeimfive,1
"Yep, this is the post that made me unsubscribe. What was the fucking point of this. Oh my god.",explainlikeimfive,1
"Nuclear is my girlfriends reaction when I go out drinking with my mates, thermonuclear is her reaction when I go with my ex girlfriend. ",explainlikeimfive,1
"Hi /u/Darknessborn,

I've ran a search for your question and detected it is a commonly asked question, so I've
                 marked this question as repost. It will still be visible in the subreddit nonetheless.

**You can see previous similar questions [here](https://www.reddit.com/r/explainlikeimfive/search?q=title%3A%28string+theory%29&restrict_sr=on&sort=relevance&t=all).**

*[Why we allow reposts](https://www.reddit.com/r/explainlikeimfive/wiki/reposts#wiki_why_we_allow_reposts) | [How to filter out reposts permanently](https://www.reddit.com/r/explainlikeimfive/wiki/reposts#wiki_how_to_filter_reposts)*

---

**This search was performed automatically using keywords from your submission**.
*Please [contact the moderators of this subreddit](https://www.reddit.com/message/compose/?to=/r/explainlikeimfive) if you believe your question is different from the others.*
",explainlikeimfive,1
"Surely thats a question about something that may not be an actual thing?  ELI 5 is meant to be a simple explanation of a set of facts, not a question asking if it is a fact. An ELI5 would be ""ants have civil wars,,,,, why is that?""",explainlikeimfive,1
It just seems like it contradicts itself. If you believe in God but not ghosts. Than you can't believe in the Holy Spirit. ,explainlikeimfive,1
Hi guys!!!  Check out this hilarious video -- HOT GIRL FARTS IN THE CAR -- LOL Lol lol.   https://m.youtube.com/watch?v=9zbSJFlXetI ,explainlikeimfive,1
Biology,explainlikeimfive,1
Other,explainlikeimfive,1
Biology ,explainlikeimfive,1
biology,explainlikeimfive,1
The dude with the flute?,explainlikeimfive,1
"If you are ever near Baltimore, MD, go to the Museum of Industry.  They have an answer to your question in the form of working machines that are still operated for the benefit of visitors.  ",explainlikeimfive,1
"That's a valid concern. But people in the states love to cry racism on everything. Having to bring ID to vote is not an issue, I don't know any minorities without ID and yet white people love to claim to defend minorities because 'minorities are poor'. 

Seriously, do you know any one without ID? If UK brought in these laws would you say 'well now my black friend can't vote?' 

It's a lie liberals say and it's very racist. ",explainlikeimfive,1
"Can we get an AMA for the guy behind Temple OS?

https://youtu.be/oCXER2BSR8o",explainlikeimfive,1
"So, AC and DC is a New Jersey that recently visited Washington, DC this was not one of my d&d subs.",explainlikeimfive,1
"Your post reminded me of a pretty good video I saw where the guy explained every bit of publication before computer era. 

[Here it is for you. ](https://youtu.be/O-XrRQf7BPM) ",explainlikeimfive,1
Perhaps it's because we were restrained by cords for so many years we are just now taking advantage of the walk and talk. ,explainlikeimfive,1
"When you light a piece of paper it gives off a lot of heat and a little light, right? But you can't just snap your fingers and get that paper to ignite. It requires an initial energy bump to climb to a high enough temperature to ignite in that fashion. So we use something that has a much lower ""chemical activation energy"" - the little toothed wheel scraping iron filings and lighting the butane of our lighter, or the different chemicals in a match that ignite when exposed to friction - to get us that extra bump.

Well, nuclear activation energy is a LOT higher. It requires a HUGE amount of pressure and temperature to start the fission (where heavy atoms are split apart) process, with different amounts required for different types of atoms. So you have to build a bomb around the core radioactive part of the bomb, and that outer bomb layer blasts the inside bomb layer inward with enough force and power to deliver that nuclear ""activation energy"". 

It's even harder when you're talking fusion bombs (where light atoms are combined). Then you need a fission bomb as the ""outer"" layer to deliver enough energy to squeeze and heat the hydrogen enough to start fusing. ",explainlikeimfive,1
"Monkeys. Typewriters. Shakespeare. 

Yes, it's possible, but the likelihood? ""When pigs fly"". 

",explainlikeimfive,1
"It is your choice. The government just imposes additional consequences on it.

Everyone should wear a seat belt. However, I personally disagree with it being against the law to choose not to. The justifications for seat belt laws, many of which are already appearing in the comments, could be used to justify the government coercing you into doing just about anything it deems safer/healthier. Dietary restrictions, exercise requirements, regular health inspections, etc. All good things to choose to do voluntarily, but a scary amount of power for the government to wield over you. Not to mention yet another excuse to increase your taxes.",explainlikeimfive,1
Don't happen to me but when it does to my wife and she says someone walked over her grave I just look out the back garden and reassure her that no one's out there,explainlikeimfive,1
I was at the casino last night and there was a woman with Alzheimers next to her husband sitting at the blackjack table. Her husband was playing the hands for her. She told me that she didn't know what was going on but she was having fun. ,explainlikeimfive,1
"When we were Hunter Gatherers famines never happened - the worst that could happen was that we had to walk a long way that day to reach food.

Yet we settled down and became sedentary and expected the food to come to us. Ofttimes that happens - yet when it does not we sit and wait for a long time any even starve to death. It is a larger scale version of going hungry because you will not walk to the Pizza joint that is not delivering tonight for whatever reason.

Sadly indeed we have become like plants rooted into the earth around us. And if sunlight and water and nutriments do not flow to our specific spot then again like plants we wither and die.",explainlikeimfive,1
"Your brain plays music?  Mine is just a constant loop of ""need to make more money, need to make more money.  .  . ""  Wish I could figure out how to change the station.",explainlikeimfive,1
"Is it weird that before even reading this, I experienced one and then read it and clicked it?",explainlikeimfive,1
Mods: on phone can't flair :(,explainlikeimfive,1
"From a personal perspective, a smoke after a hearty meal alleviates the unpleasant feeling of being too full. It helps the food settle down.

On a slightly different note, a cig and a coffee in the morning make me poop, so I don't have to worry about it when I'm at work later.",explainlikeimfive,1
"My chickens are the literal opposite of this. They run up like a dog whenever they see me. They hate getting touched though. Ducks are the real scared ones. They never let me get close to them. Also they stay up too late and fight each other over water.

Chickens being stupid really is a blessing",explainlikeimfive,1
Biology,explainlikeimfive,1
Those are called chemtrails. They are harmful chemicals in the gaseous state that are so harmful possibly deadly.,explainlikeimfive,1
Had the chance to attend a talk by one at my school. Didn't go cos of a philosophy essay. Fkn regrets,explainlikeimfive,1
Here in South Carolina we have 89/91/93 except for select stations that carry 97/102/111 being close to race tracks and drag strips,explainlikeimfive,1
Your rules are fucking retarded ,explainlikeimfive,1
Where does 'schizo = multiple personalities' come from?,explainlikeimfive,1
"culture
",explainlikeimfive,1
"Hi /u/ytysilversun,

I've ran a search for your question and detected it is a commonly asked question, so I've
                 marked this question as repost. It will still be visible in the subreddit nonetheless.

**You can see previous similar questions [here](https://www.reddit.com/r/explainlikeimfive/search?q=title%3A%28eyes+dark%29&restrict_sr=on&sort=relevance&t=all).**

*[Why we allow reposts](https://www.reddit.com/r/explainlikeimfive/wiki/reposts#wiki_why_we_allow_reposts) | [How to filter out reposts permanently](https://www.reddit.com/r/explainlikeimfive/wiki/reposts#wiki_how_to_filter_reposts)*

---

**This search was performed automatically using keywords from your submission**.
*Please [contact the moderators of this subreddit](https://www.reddit.com/message/compose/?to=/r/explainlikeimfive) if you believe your question is different from the others.*
",explainlikeimfive,1
"Back before electric stoves, young men used to wake up early to chop firewood for the household to use at the beginning of the day. This was referred to as the morning wood, since it was usually used up before noon, when more firewood would be chopped to prepare the midday meal.",explainlikeimfive,1
"Yeah we come to TIL to learn things, and if you don't care about weird facts to the point where you consider those who do ""nerds"" then why the fuck are you even here?",explainlikeimfive,1
"Estrogen. It's a hormone mainly for women. The body starts pumping it out like crazy during puberty. It signals the body depositing fats among other things. It's it tells the body to deposit fat tissue in the breasts, butt, and thigh (mostly) the breasts are obvious but as to why the butt, my theory is that because women typically have stronger lower body in comparison to men. The reason this is mainly a female issue is because men don't really have much estrogen. Men have SOME but it stays constant through out their entire lives. But men do have another hormone called testosterone that's more dominant than estrogen. It's what gives men rapid lisle development, hair growth, deeper voice, and all the other male characteristics you can think of including some psychological, like dominance, anger, violence, and feeling as if they're the protector. But when the male body is low on testosterone (diet, exercise, age affect it) the estrogen in the body takes more of an effect. That's why obese men developed breasts and can even lactate. ",explainlikeimfive,1
biology ,explainlikeimfive,1
Other,explainlikeimfive,1
Culture,explainlikeimfive,1
Biology,explainlikeimfive,1
Yea i havent been hugged in years. So i guess i have nothing to contribute here. I did really enjoy hgging and squezing my ex.  She just liked getting fucked though. Not much of a cuddler or hugger .  Fuck i loved holding her. But she just wanted my dick. Had to let her go. God she was annoying too. ,explainlikeimfive,1
The little black spots are blood cells! ,explainlikeimfive,1
"This is called a loaded question.  Is not allowed.  Explanations for concepts people don't understand is what this place is for, not trying to change your mind about whether something has an ""ounce of truth"". ",explainlikeimfive,1
"As a diver, I've learned a lot about how the volume of a gas is affected by pressure, and I think some of it might be applicable here. Let me explain how it works for a diver with a breath of air in their lungs:

Let's say you have 6 liters of air, that air being made up of a billion individual molecules of gases like Oxygen, Nitrogen, and others. Now you start diving. 

As you dive, there will be more and more weight pressing down on you, and compacting any air that was previously at surface pressure. So, if you're holding your breath (**DON'T HOLD YOUR BREATH WHILE DIVING**), you'd still have that billion molecules in there, but you'd steadily be decreasing the volume those molecules took up. At around 10m depth, you'll have enough water pressure above you to double the pressure that you're used to experiencing - and when the pressure doubles, the volume halves. So, that billion molecules is now only taking up 3 liters of space. (Which, neither here nor there, is why you don't hold your breath under water, if you surface too quickly with lungs full of air, that air could expand and pop you.)

Interestingly, this is a logarithmic progression - so when you get to 2 atmospheres, the volume is 1/2 of what it was; at 3 atmospheres, 1/3; at 4, 1/4; etc...For the sake of this conversation, this matters because the vast majority of volume fluctuation takes place closer to the initial pressure state. As such, it doesn't take the drastic pressure changes one experiences diving under water to feel substantial portions of these effects in pressurized environments - think of your ears popping on a plane or as you drive up a mountain. 

I had a sliding glass window replaced this summer (mower-related, shame-inducing), and, in the process of replacing the single pane of the double pane that I broke, the installer said that he'd do his best to get as much of the air out as possible, but achieving a perfect vacuum was really hard to achieve...which may have been his way of pre-justifying the obnoxious spot of condensation that haunts the center of it now...but does point to the fact that achieving a perfect vacuum is a challenge when you're opening up an otherwise closed system. 

So, think about e.g. a knee surgery. These are areas that aren't generally exposed to any air, being in the body, where everything is pretty much wet. Even doing your best to vacuum the air up on your way out of whatever surgery is being performed, there are almost certain to be a few bubbles of gas that get trapped, right? (I have no source, here, just guessing). Knowing what we know about how pressure affects volume, even at small pressures, and assuming that there are some bubbles trapped in those surgically repaired areas, I'd wager that the majority of what these people are feeling is the expansion of those tiny bubbles.

I was diving with a guy once who had what turned out to be a very small cavity in his tooth. He said that it felt kinda funny on the way down, but started to throb painfully on the way up. We'd gone to 30m, and at 10m he was becoming disoriented, the pain was so intense. When we got to the top he was literally screaming, and couldn't figure out what the issue was. His dentist, also a diver, later explained that pressurized air had been jammed into the cavity at 4x normal pressure while we were down there, and as we surfaced, that air expanded at a rate exceeding that by which it could escape from the cavity - causing massive pressure on the nerve. 

I hope someone actually scientific answers, though, this is cross-application of knowledge, and that's always suspect...",explainlikeimfive,1
biology,explainlikeimfive,1
Technology,explainlikeimfive,1
He probably jerks if to porn too much. Tell him to quit that stuff and it'll come back.,explainlikeimfive,1
Story of my life ,explainlikeimfive,1
Fun fact: The most arbitrary numbers end in 0 or 5.  If something ends with a different digit it is almost certainly the result of some calculation and is not chosen arbitrarily at all.,explainlikeimfive,1
"So things like this wont' happen so often...

https://assets.goodstatic.com/s3/magazine/assets/562119/original/Screen_Shot_2016-09-08_at_4.07.03_PM.png=s750x1300
",explainlikeimfive,1
"it won't but Trump's supporters and Trump aren't based in reality. More immigrants are leaving then entering, and those here are so ingrained into the economy that we'd suffer another recession if we were to actually kick them out.",explainlikeimfive,1
"I got suspended one time for being in a fight (where I got destroyed and had a black eye), parents didn't care so went shopping for the day. Nice ",explainlikeimfive,1
You mean the line that's prone to itch? ,explainlikeimfive,1
Other,explainlikeimfive,1
Other,explainlikeimfive,1
Technology ,explainlikeimfive,1
Is it similar to those cases when people collectively chose/vote for the worse option because individually they see the others doing the same?,explainlikeimfive,1
Biology,explainlikeimfive,1
"I guess this subreddit wished well when they removed my suggestion to see a certain Youtube channel which speaks exactly about you want to know.

So instead of posting the direct link as I did, I will just suggest that you go to Youtube and find a clip ""13 Misconceptions About Global Warming"" on a channel called ""Veritasium"".

Thank you Reddit people for making out lives easier! I haven't felt so controlled since I was in the primary school. Good that someone is taking care of that. Thank you! Thank you!",explainlikeimfive,1
Biology,explainlikeimfive,1
"Its generally calculated by weight. If you have a father that weighs 410 Pounds, and the mother is around 370, toss in a few kids around 211 and 190, you get a total of 1,181 pounds. The State government then multiplies that by .5 giving you 590.5. That means that once a month the family receives $590.50 in food assistance.",explainlikeimfive,1
I'm the first to admit I'm no expert but I'm fairly sure it's because they're able to infuse it with PURE EVIL.,explainlikeimfive,1
Also to 'Mind your P's and Q's is a reference to when pints and quarts were served in taverns. ,explainlikeimfive,1
Other,explainlikeimfive,1
"Ah, see, there are rules here, and calling people an idiot breaks the first rule. aloha.",explainlikeimfive,1
"Do I smoke after sex? I don't know. I never checked. 
",explainlikeimfive,1
"God created. God is the source. 

Grow and strengthen your faith and you'll understand more, like the same way you'd study books/texts to know more.",explainlikeimfive,1
Other,explainlikeimfive,1
Followup question: Why does my alarm wake me up so effectively? Is it actually someone's job to formulate the *best* alarms possible?,explainlikeimfive,1
"I'll answer your question later... I'm supposed to be playing Game Of War, but this one player keeps kicking my ass.",explainlikeimfive,1
Mathematics ,explainlikeimfive,1
"Blah, blah, blah. Go fuck yourself!",explainlikeimfive,1
having a discussion about something isnt illegal. anyways thats a roleplaying subreddit just like all the other ones that talk about illegal activities. just people roleplaying,explainlikeimfive,1
Diego cost-er ,explainlikeimfive,1
Technology,explainlikeimfive,1
"Its probably skin cancer, which is one of the most deadly types of cancer... Im sorry to have to be the one to break the bad news :(",explainlikeimfive,1
"Reddit isn't really the place to go for this, it's community is pretty transphobic overall. But /u/spilgram16 's answer is pretty good.",explainlikeimfive,1
"My guess is that the top is air tight. The pressure above the openings is less then the ambient air pressure. In layman terms for the water to flow out air needs to come in, however the water is preventing air from coming in. You could actually make the tank 10m high before you would create a vacuum.",explainlikeimfive,1
No American kids really are mostly dumb fucks. ,explainlikeimfive,1
It's a contraption for cleaning floors. With attachments it can clean many other surface as well. ,explainlikeimfive,1
"Because your body is starting to consume itself so you're no longer ""hungry"".  It's the whole basis of weight loss, controlled stretches of your body consuming its fat for energy.  ",explainlikeimfive,1
"After sex? Friction. A meal? Only if you're a fire-eater. I know, this will be removed.",explainlikeimfive,1
"Plot twist: Bobby is literally a dangerous sociopath who has been caught red-handed in the act of attempting to murder his sister and his ""mommy"" and ""daddy"" are the psych ward nurses who have to deal with him.

And when Bobby writes in his journal that ""mommy"" and ""daddy"" are threatening to kill him... well... do you really think a homicidal sociopath would tell the truth about that? Or wouldn't deserve to be executed?",explainlikeimfive,1
"I'm going to guess that the character is some foreign language character. Not everything is in English. Chinese, Arabic, and a ton of other character sets are out there. Your computer doesn't know or care. It just shows what it should. If it is a character it doesn't know it might estimate the closest thing or down load a font or something.  It also could be that the troll living in your monitor has a sharpie and is doing some troll graffiti or something. ",explainlikeimfive,1
"A sudden loss in altitude would be equivalent to falling, which when avoided results in longer life.

A sudden increase in altitude doesn't really have an evolutionary equivalent.",explainlikeimfive,1
You weight a person before and after physical activity,explainlikeimfive,1
"I experience this with coffee. Some of them smell so sweet and nice, like French roast, but they all taste bitter. ",explainlikeimfive,1
Another interesting phenomenon is that people with blue eyes can see in the dark 4% better give or take. ,explainlikeimfive,1
">It depends on the context

No it doesn't, faggot.",explainlikeimfive,1
"Mildly related - Ladybug that managed to hang onto our plane most of the way from Toronto to Sudbury. 

https://flic.kr/p/MHwyT9
https://flic.kr/p/Md2CCP",explainlikeimfive,1
"Some people are weak little bitches, and some people aren't. It's truly that simple. 

It's all about willpower. ",explainlikeimfive,1
Did you mean to post this in r/funny?,explainlikeimfive,1
You ever been in a room full of really stupid people?,explainlikeimfive,1
"They still don't know what they're talking about, but fit the narratives into their theories. ",explainlikeimfive,1
So? It could still spark a good discussion on why 99% of large companies are public. You're a fucking retard.,explainlikeimfive,1
">Well, who gets to decide what is objectively true or false?

... so... **you have no fucking clue what the term ""objective"" means**.

Glad we got that settled.",explainlikeimfive,1
After reading all these comments I've decided to remove my uterus and never have a baby cause this is some scary shit. ,explainlikeimfive,1
"Great question, but this sub is not sticking to its roots and explain like we are 5. [I miss answers like this.](https://www.reddit.com/r/explainlikeimfive/comments/1kfc4k/comment/cboccma)",explainlikeimfive,1
"This is a really good podcast with general information about exercising when pregnant. It addresses the abdominal muscle issue and others: 

http://www.stitcher.com/s?eid=40909764&refid=asa",explainlikeimfive,1
I'm surprised nobody linked the actual behind the scenes for the raptor suits (unless hidden behind a hyperlink).  https://www.youtube.com/watch?v=jAzQr3Ml0UI,explainlikeimfive,1
"I can't. The people here have done well. I don't know why I was born with a penis. I don't invite why I've always felt that I'm a girl/woman. I wish that things were different. Science, though, is pretty clear so far. If a psychiatrist tries to fix my gut feeling, they will contribute to my pain. If an endocrinologist and a surgeon try to fix my body, they will contribute to my happiness. I'm a woman, so far as anyone who understands this stuff knows. It's hard! But it's a lot better than being dead. ",explainlikeimfive,1
Wait this is so cool! How do you achieve it?,explainlikeimfive,1
