body,subreddit,moderated
"👌👀👌👀👌👀👌👀👌👀 good shit go౦ԁ sHit👌 thats ✔ some good👌👌shit right👌👌there👌👌👌 right✔there ✔✔if i do ƽaү so my self 💯 i say so 💯 thats what im talking about right there right there (chorus: ʳᶦᵍʰᵗ ᵗʰᵉʳᵉ) mMMMMᎷМ💯 👌👌 👌НO0ОଠOOOOOОଠଠOoooᵒᵒᵒᵒᵒᵒᵒᵒᵒ👌 👌👌 👌 💯 👌 👀 👀 👀 👌👌Good shitsauce me the FUCK up 🍕🍅🍕🍅🍕🍅🍕🍅🍕🍅 cheesy shit cheesy sHit🍕 thats ✔ some cheesy🍕🍕shit right🍕🍕th 🍕 ere🍕🍕🍕 right✔there ✔✔if i do ƽaү so my selｆ 🍴 i say so 🍴 thats what im talking about right there right there (chorus: ʳᶦᵍʰᵗ ᵗʰᵉʳᵉ) mMMMMᎷМ🍴 🍕🍕 🍕НO0ОଠＯOOＯOОଠଠOoooᵒᵒᵒᵒᵒᵒᵒᵒᵒ🍕 🍕🍕 🍕 🍴 🍕 🍅🍅🍅 🍕🍕Cheesy shit 👌🎩👓🎩👍🎩👓🎩👍🎩 euphoric logic !euphoric loGic👌 thats ✔ some euphoric👌💻 logic right👌💻there👌👍👌 Carl 🔭 Sagan🌌💫if i do ƽaү so gentlemen 💯 i say so 💯 thats euPhoric logic right there Richard 📒 Dawkins🎩 (chorus: socrates died for this shit) mMMMMᎷМ💯 👌👓👌НO0ОଠOOOOOОଠଠOoooᵒᵒᵒᵒᵒᵒᵒᵒᵒ👌 👌🎩 👌 💯 👌 👓🎩🎩🎩 👍👌euphoric logic slam me the FUCK uP 👌👀👌👀👌👀👌👀👌👀 john cena JOhN cEna👌 john ✔ cena john👌👌cena john👌👌cena👌👌👌 john✔cena ✔✔u can't see me if I do ƽaү so my self 💯 i say so 💯 thats what im talking about right there right there (chorus: ʳᶦᵍʰᵗ ᵗʰᵉʳᵉ) mMMMMᎷМ💯 👌👌 👌НO0ОଠOOOOOОଠଠOoooᵒᵒᵒᵒᵒᵒᵒᵒᵒ👌 👌👌 👌 💯 👌 👀 👀 👀 👌👌John ceNa POTENTIALLY sign me the FUCK up 👋👀👋👀👋👀👋👀👋👀 average shit modera̷̶te sHit 👋 thats some ALright 👋👋shit right 👋👋 th 👋 ere 👋👋👋 right 🆗 there 🆗 if i do ƽaү so my selｆ🆗 i say so 🆗 that could be what im talking about right there right there (chorus: ʳᶦᵍʰᵗ ᵗʰᵉʳᵉ) mMMMMᎷМ 🆗 👋 👋👋НO0ОଠＯOOＯOОଠଠOoooᵒᵒᵒᵒᵒᵒᵒᵒᵒ 👋 👋👋 👋 🆗 👋 👀 👀 👀 👋👋Not outstanding shit 👌👽👌👽👌👽 ayy lmao ayyy lmao good lmao👌 thats ✔ some ayyy👌👌lamayo right👌👌there👌👌👌 right✔there ✔✔if i do LMAO so my self 💯 i ayyy so 💯 thats what im probing about right there right there (chorus: ʳᶦᵍʰᵗ ᵗʰᵉʳᵉ) mMMMMᎷМ💯 👌👌 👌AAAYYYYyyyyYYYYYyyyyyyʸʸʸʸʸʸʸʸ👌 👌👌 👌 💯 👌 👽👽👽👌👌ayy lmao 🐸♊️🐸♊️🐸♊️🐸♊️🐸♊️ good memes go౦ԁ mEmes🐸 thats 🔫🔫some good🐸🐸memes right🐸🐸th 🐸 ere🐸🐸🐸 right🔫there 🔫🔫if i do ƽaү so my selｆ ❓❗️👟👟❓❗️ i say so ❓❗️👟👟❓❗️ thats what im talking about right there right there (chorus: ʳᶦᵍʰᵗ ᵗʰᵉʳᵉ) mMMMMᎷМ❓❗️👟👟❓❗️ 🐸🐸 🐸НO0ОଠＯOOＯOОଠଠOoooᵒᵒᵒᵒᵒᵒᵒᵒᵒ🐸 🐸🐸 🐸 ❓❗️👟👟❓❗️ 🐸 ♊️ ♊️ ♊️🐸🐸Good memes 💩🐃💩🐃💩🐃💩🐃💩🐃 bull shit bull sHit💩 thats ✖️ some bull💩💩shit right💩💩th 💩 ere💩💩💩 right✖️there ✖️✖️if i do ƽaү so my selｆ ‼️ i say so ‼️ thats what im talking about right there right there (chorus: ʳᶦᵍʰᵗ ᵗʰᵉʳᵉ) mMMMMᎷМ‼️ 💩💩 💩HO0ОଠＯOOＯOОଠଠOoooᵒᵒᵒᵒᵒᵒᵒᵒᵒ💩 💩💩 💩 ‼️ 💩 🐃 🐃 🐃 💩💩Bull shit do NOT sign me the FUCK up 👎👀👎👀👎👀👎👀👎👀 bad shit ba̷̶ ԁ sHit 👎 thats ❌ some bad 👎👎shit right 👎👎 th 👎 ere 👎👎👎 right ❌ there ❌ ❌ if i do ƽaү so my selｆ🚫 i say so 🚫 thats not what im talking about right there right there (chorus: ʳᶦᵍʰᵗ ᵗʰᵉʳᵉ) mMMMMᎷМ 🚫 👎 👎👎НO0ОଠＯOOＯOОଠଠOoooᵒᵒᵒᵒᵒᵒᵒᵒᵒ 👎 👎👎 👎 🚫 👎 👀 👀 👀 👎👎Bad shit 👌👀👌👀👌👀👌👀👌👀 good shitposting go౦ԁ sHitpOsting👌 thats ✔ some good👌👌shitposting right👌👌there👌👌👌 right✔there ✔✔if i do ƽaү so my self 💯 i say so 💯 thats what im talking about right there right there (chorus: ʳᶦᵍʰᵗ ᵗʰᵉʳᵉ) mMMMMᎷМ💯 👌👌 👌НO0ОଠOOOOOОଠଠOoooᵒᵒᵒᵒᵒᵒᵒᵒᵒ👌 👌👌 👌 💯 👌 👀 👀 👀 👌👌Good shitposting wife me the FUCK up 👭👀👭👀👭👀👭👀👭👀 gay shit gⓐy sHit👭 thats 💍 some gay👭👭shit right👭👭th 👭 ere👭👭👭 right💍there 💍💍if i do ƽaү so my selｆ 💒 i say so 💒 thats what im talking about right there right there (chorus: ʳᶦᵍʰᵗ ᵗʰᵉʳᵉ) mMMMMᎷМ💒 👭👭 👭НO0ОଠＯOOＯOОଠଠOoooᵒᵒᵒᵒᵒᵒᵒᵒᵒ👭 👭👭 👭 💒 👭 👀 👀 👀 👭👭Gay shit 🎃👻🎃👻🎃👻👻👻🎃👻 spooky shit spooky sHit🎃 thats ✔ some spooky🎃🎃shit right🎃🎃th 🎃 ere🎃🎃🎃 right✔there ✔✔if i do ƽaү so my selｆ 💯 i say so 💯 thats what im talking about right there right there (chorus: ʳᶦᵍʰᵗ ᵗʰᵉʳᵉ) mMMMMᎷМ💯 🎃🎃 🎃НO0ОଠＯOOＯOОଠଠOoooᵒᵒᵒᵒᵒᵒᵒᵒᵒ🎃 🎃 🎃 🎃 💯 🎃 👻👻 👻 🎃🎃spooky shit 🎃👻🎃👻🎃👻👻👻🎃👻 spooky shit spooky sHit🎃 thats ✔ some spooky🎃🎃shit right🎃🎃th 🎃 ere🎃🎃🎃 right✔there ✔✔if i do ƽaү so my selｆ 💯 i say so 💯 thats what im talking about right there right there (chorus: ʳᶦᵍʰᵗ ᵗʰᵉʳᵉ) mMMMMᎷМ💯 🎃🎃 🎃НO0ОଠＯOOＯOОଠଠOoooᵒᵒᵒᵒᵒᵒᵒᵒᵒ🎃 🎃 🎃 🎃 💯 🎃 👻👻 👻 🎃🎃spooky shit 🎃👻🎃👻🎃👻👻👻🎃👻 spooky shit spooky sHit🎃 thats ✔ some spooky🎃🎃shit right🎃🎃th 🎃 ere🎃🎃🎃 right✔there ✔✔if i do ƽaү so my selｆ 💯 i say so 💯 thats what im talking about right there right there (chorus: ʳᶦᵍʰᵗ ᵗʰᵉʳᵉ) mMMMMᎷМ💯 🎃🎃 🎃НO0ОଠＯOOＯOОଠଠOoooᵒᵒᵒᵒᵒᵒᵒᵒᵒ🎃 🎃 🎃 🎃 💯 🎃 👻👻 👻 🎃🎃spooky shit 🎃👻🎃👻🎃👻👻👻🎃👻 spooky shit spooky sHit🎃 thats ✔ some spooky🎃🎃shit right🎃🎃th 🎃 ere🎃🎃🎃 right✔there ✔✔if i do ƽaү so my selｆ 💯 i say so 💯 thats what im talking about right there right there (chorus: ʳᶦᵍʰᵗ ᵗʰᵉʳᵉ) mMMMMᎷМ💯 🎃🎃 🎃НO0ОଠＯOOＯOОଠଠOoooᵒᵒᵒᵒᵒᵒᵒᵒᵒ🎃 🎃 🎃 🎃 💯 🎃 👻👻 👻 🎃🎃spooky shit 💦💖💦💖💦💖💦💖💦💖 good cummies go౦ԁ cUmmIes💦 thats ✔ some good💦💦cummies right💦💦there💦💦💦 right✔there ✔✔if my 👪daddy👪 say so him self 😽 i say so 💯 thats what hes talking about right there right there (chorus: ʳᶦᵍʰᵗ ᵗʰᵉʳᵉ) mMMMMМ💯 💦💦 💦НO0ОଠOOOOOОଠଠOoooᵒᵒᵒᵒᵒᵒᵒᵒᵒ💦 💦💦 💦 💯 💦 💖 💖 💖 💦💦Good cummies~ friendzone me the FUCK up ❤️😍❤️😍❤️😍❤️😍❤️ m'lady shit m'lady sHit❤️ thats ✔ some m'lady 😍😍shit right❤️❤️there😍😍😍 right✔there ✔✔if i do ƽaү so my self 🙇 i say so 🙇 thats what im talking about right there right there (chorus: ʳᶦᵍʰᵗ ᵗʰᵉʳᵉ) mMMMMᎷМ🙇 😍😍😍НO0ОଠOOOOOОଠଠOoooᵒᵒᵒᵒᵒᵒᵒᵒᵒ😍😍😍😍 🙇 😍 ❤️ ❤️ ❤️ 😍 ❤️ M'lady shit friendzone me the FUCK up ❤️😍❤️😍❤️😍❤️😍❤️ m'lady shit m'lady sHit❤️ thats ✔ some m'lady 😍😍shit right❤️❤️there😍😍😍 right✔there ✔✔if i do ƽaү so my self 🙇 i say so 🙇 thats what im talking about right there right there (chorus: ʳᶦᵍʰᵗ ᵗʰᵉʳᵉ) mMMMMᎷМ🙇 😍😍😍НO0ОଠOOOOOОଠଠOoooᵒᵒᵒᵒᵒᵒᵒᵒᵒ😍😍😍😍 🙇 😍 ❤️ ❤️ ❤️ 😍 ❤️ M'lady shit friendzone me the FUCK up ❤️😍❤️😍❤️😍❤️😍❤️ m'lady shit m'lady sHit❤️ thats ✔ some m'lady 😍😍shit right❤️❤️there😍😍😍 right✔there ✔✔if i do ƽaү so my self 🙇 i say so 🙇 thats what im talking about right there right there (chorus: ʳᶦᵍʰᵗ ᵗʰᵉʳᵉ) mMMMMᎷМ🙇 😍😍😍НO0ОଠOOOOOОଠଠOoooᵒᵒᵒᵒᵒᵒᵒᵒᵒ😍😍😍😍 🙇 😍 ❤️ ❤️ ❤️ 😍 ❤️ M'lady shit 👴📅👴📅👴📅👴📅👴📅 old shit 0ld sHit👴 thats 💾 some old👴👴shit right👴👴th 👴 ere👴👴👴 right💾there 💾💾if i do ƽaү so my selｆ 🕙 i say so 🕥 thats what im talking about right there right there (chorus: ʳᶦᵍʰᵗ ᵗʰᵉʳᵉ) mMMMMᎷМ🕔 👴👴 👴НO0ОଠＯOOＯOОଠଠOoooᵒᵒᵒᵒᵒᵒᵒᵒᵒ👴 👴👴 👴 🕣 👴 📅 📅 📅 👴👴Old shit 👌🏿🍆👌🏿🍆👌🏿🍆👌🏿🍆👌🏿🍆 good dick go౦ԁ dIck👌🏿 thats ✔ some good👌🏿👌🏿dick right👌🏿👌🏿there👌🏿👌🏿👌🏿 right✔there ✔✔if i do ƽaү so my self 💯 i say so 💯 thats what im talking about right there right there (chorus: ʳᶦᵍʰᵗ ᵗʰᵉʳᵉ) mMMMMᎷМ💯 👌🏿👌🏿 👌🏿НO0ОଠOOOOOОଠଠOoooᵒᵒᵒᵒᵒᵒᵒᵒᵒ👌🏿👌🏿👌🏿👌🏿 💯 👌🏿 🍆🍆🍆 👌🏿👌🏿Good dick 💉🔪 💉🔪💉🔪edgy shit edgY sHit 🔪thats 🔫some edgy💉💉 shit right 🔪th🔪 ere💉💉💉 right there 🚬🚬if i do ƽaү so my selｆ 🔫i say so 🔫 thats what im talking about right there right there (chorus: ʳᶦᵍʰᵗ ᵗʰᵉʳᵉ) mMMMMᎷМ🔫 🔪🔪🔪НO0ОଠＯOOＯOОଠଠOoooᵒᵒᵒᵒᵒᵒᵒᵒᵒ🔪🔪🔪 🔫 💉💉 🔪🔪 Edgy shit 👌🌃👀👌🌃👀👌🌃👀👌🌃👀👌🌃👀 cool pic co౦l pIC👌 🌃🌃🌃thats ✔ some cool👌🌃🌃👌pic right👌🌃👌there👌🌃👌🌃👌 right✔there ✔🌃✔if i do ƽaү so 🌃🌃my self 💯 i say so 💯 thats what im talking about right 🌃there right there (chorus:cool pic ) mMMMMᎷМ💯 👌👌 🌃 🌃👌НO0ОଠOOOOOОଠଠOoooᵒᵒᵒᵒᵒᵒᵒᵒᵒ👌 👌🌃🌃👌 👌 💯 👌🌃 👀 🌃👀🌃 👀 👌👌Cool pic 👌👀👌👀👌👀👌👀👌👀 neato stuff neat౦ stuff👌 thats ✔ some neato👌👌stuff right👌👌there👌👌👌 right✔there ✔✔if i do ƽaү so my self 💯 i say so 💯 thats what im talking about right there right there (chorus: ʳᶦᵍʰᵗ ᵗʰᵉʳᵉ) mMMMMᎷМ💯 👌👌 👌НO0ОଠOOOOOОଠଠOoooᵒᵒᵒᵒᵒᵒᵒᵒᵒ👌 👌👌 👌 💯 👌 👀 👀 👀 👌👌neato stuff 🔝👀🔝👀🔝👀🔝👀🔝👀 up votes uP voTes 🔝thats ✔ some up 🔝🔝 votes front 🔝🔝page 🔝🔝🔝right✔there ✔✔if i do vote so my self 🆙 I vote so 🆙 thats what im talking about front page front page (chorus: ᶠʳᵒᶰᵗ ᵖᵃᵍᵉ) mMMMMᎷМ🆙 🔝🔝🔝 НO0ОଠOOOOOОଠଠOoooᵒᵒᵒᵒᵒᵒᵒᵒᵒ🔝 🔝🔝 🔝 🆙 🔝 👀 👀 👀 🔝🔝 Up vote

",explainlikeimfive,1
"Because you're attracted to her, so your body produces hormones when you smell or touch her to get you to fuck.  This gives you boners.",explainlikeimfive,1
"If I'm wrong please correct me. My theory is people had cockerels and when they made their unique noise early in the morning, that was what woke them up. I don't know it's just a guess.",explainlikeimfive,1
"Explain like you are 5? Ok. Dark Matter and Dark Energy is a 5 year old grade science fair project thesis of major scientists created in order to avoid the ""I DO NOT KNOW OR HAVE A CLUE"" answer. 

Basically they have zero evidence of it, also they there is absolute zero honesty about it. The thesis basically is there so the model for the big-bang does not fall and break into 95 pieces. Actually dark matter and dark energy account  for 95% of the universe, so in order to save a failing theory they invent this insane thesis and by doing so they boxed themselves into the category of science fiction. Next time a smartarse big-banger scientist tries to lecture you, you can safely reply: ""stfu man, you don't even know what 95% of the universe is... stfu please!""  And I will continue saying thesis, an be grateful for that, because it is not even worth of being called that.

So basically Dark Matter (note the capital letters, gravity doesn't get to be ""Gravity"" or strong force ""Strong Force"") is a bandaid to keep the Big Bang (again those uppercase letters of emphasis) from going into the trash can, where it belongs.",explainlikeimfive,1
Other,explainlikeimfive,1
"This design is basically a way of suggesting that you or someone you know personally, tell a certain female counterpart that she is a ""Lam""",explainlikeimfive,1
"I an the only person I know of who has eczema in my ears. It's awful. The urge to constantly dig in my ears, scratching away the dead skin, is impossible to resist. It gets so bad, if I don't scratch, my hearing is affected. I have chronic ear infections. When I am under a lot of stress or sick, it spreads out of my ears and across my face.

At first I was self conscious about how frequently I scratch my ears. Now I've suffered so long I don't give a crap. I just itch when I need to itch, politeness be damned. I tried steroid cream for awhile, and it did help, but it was so thick and oily that it would drain down my ears and clog my hearing.

Eczema sucks. I absolutely hate it.",explainlikeimfive,1
"The blog ""wait but why"" has an excellent post on this: http://waitbutwhy.com/2016/03/cryonics.html",explainlikeimfive,1
"Two words, upper decking.",explainlikeimfive,1
Does anyone ever offer a simple explanation in this sub anymore?  It's simple.  I'm rich and donate to your campaign.  Let me do what I want.  I will make promises and take money and do nothing.  A company comes in and actually does stuff that might take my free money away.  We must stop them from using the free market that my bought and paid for politicians says is good.  Sheesh. ,explainlikeimfive,1
All the down comments but I was being dead ass serious. They said some shit a it magnetic poles etc. ,explainlikeimfive,1
"You can get blue and black motherboards (the biggest board inside a PC or laptop) for quite cheap as well, just fyi. Smaller boards like the Arduino are blue as well.",explainlikeimfive,1
[deleted],explainlikeimfive,0
"The natural sleep cycle runs for about 3 hours with a set of different stages during this time. 

It's normally best to wake up in 3 hour intervals when taking naps (but we don't really have that much time to take a nap for 3 hours in a day).  

Waking up in the middle of a sleep cycle (say 1.5 hours) will make you feel groggy and not fully rested. 

Powernaps are better because they stop you from going into deep sleep; thus not making you groggy when you wake up. 

Generally, when taking a nap, you should wake up after 1 hour MAXIMUM if you don't want to feel like shit when you wake up. ",explainlikeimfive,0
"There are actually more that 2 groups, but I wanted to keep it simple.",explainlikeimfive,0
Why aren't drivers required to wear helmets like motorcycle riders? ,explainlikeimfive,0
"What does manual have anything to do with it? Normally, a petrol car gets it's best gas mileage at around 1750RPM-2500RPM; so, if his car was sitting at 3000RPM, it likely is a little too high for optimal gas mileage, so adding another gear (unless the difference is too much, like dropping it to 1500RPM) will get you better gas mileage.",explainlikeimfive,0
[deleted],explainlikeimfive,0
"The middle east is fucked because of us. If you think the US is righteous or just in any if this you're an idiot, we're as much to blame for that chaos as anyone else. The middle east is fucked because other countries like the US fuck it up to get at its oil. 

Of course they're savages, but are we really better? We killed more people than the Taliban could ever hope to. Just because the US has better technology doesn't mean it's not savage. ",explainlikeimfive,0
"It's fine to get a degree, GREAT even, as long as the degree is something useful. 

[STEM](https://en.wikipedia.org/wiki/Science,_technology,_engineering,_and_mathematics), in general. But only the basis sciences like biology, physics, and chemistry if you want to teach highschool or if you're smart enough to go get a PHD.   Technology if you pick something that isn't going to compete with the millions in India and China.  Realize that math is golden, but you're going to take it to some other field and make a killing. Engineering is almost always legit and hard as hell. 

Business if you have a bit of money to launch a business or the connections to run a business. 

More people should get better degrees. 

Entering the trades is a much better path than getting a worthless degree, most of the time. ",explainlikeimfive,0
"To expound on this, sound = vibrating air.   Since helium is lighter, it vibrates differently.  Since your vocal chords have the muscle memory of exerting effort on air in a certain way, it does what it usually does; the helium just reacts differently than oxygen does.",explainlikeimfive,0
[deleted],explainlikeimfive,0
"Clearly your lamp doesn't *only* emit UV light. Apparently it also emits the near-UV violet light, which they didn't think was a huge problem.",explainlikeimfive,0
[deleted],explainlikeimfive,0
"Actually, there are steps that we as a species can take to curb climate change. Sure, it's a lot easier to just deny responsibility for what happens to this world. Actually taking action would require shared sacrifice to achieve a common goal for the sake of future generations *shudder*. ",explainlikeimfive,0
"Interesting, I remember seeing somewhere about lizards being able to restore body parts, i think?

Thanks for the reply!",explainlikeimfive,0
[removed],explainlikeimfive,0
"""This is an Aspen.  You can it is an Aspen Tree because of the way it is.""",explainlikeimfive,0
It's science - you should never be content to take one person's word,explainlikeimfive,0
"Right, but that cost shouldnt necessarily fall on the employer alone. We have an organization for dealing with things that are for the benefit of everyone and it's called the government",explainlikeimfive,0
"In a city the water main could have a build up on the sides of the pipe. The construction shakes the pipe sligthly and the released build up comes out nearby pipes.
",explainlikeimfive,0
"No it is not. Most VPN or TOR ips are already flagged and will give you a captcha. After a couple attempts the ips that are not already flagged will be disabled and flagged.

Lets say the will try to bruteforce a 8 character passwords with capitals and numbers. This is not a secure password, it could be cracked in minutes when cracking the md5 or sha1 offline. There are 62^8 possible passwords, lets say you only need to try 50% before getting the right password. That is still 1.09E^14 tries. There are only 4.3E^9 IPv4 addresses. That would mean they would have to guess 25.0000 passwords with EVERY SINGLE IPv4 address in the world to crack a shitty password.

Brute forcing passwords online is just not an effective way to gain access to a single account.  ",explainlikeimfive,0
"Michael Crichton, is that you?   You're supposed to be dead!",explainlikeimfive,0
[deleted],explainlikeimfive,0
...did he kill anyone with it?,explainlikeimfive,0
"http://www.politico.eu/article/eu-sets-guidelines-for-telecom-subsidies/

???",explainlikeimfive,0
PVT Johnson didn't return from battle? KIA = 1 ,explainlikeimfive,0
"Substantially less popular is Antacid Music, which is just low notes on a tuba played while you make a wincing face.",explainlikeimfive,0
"You may find it interesting to read up on the ""Fourth Estate"" The following link is but one example: https://en.wikipedia.org/wiki/Fourth_branch_of_government

The first amendment to the US Constitution is there to ensure the freedom of the press, but just as freedom of speech is not absolute, freedom of the press is not either.

When the opinions of a media organization are reported as fact rather than as an opinion, a line has been crossed.

You may be surprised to learn that there are laws and rules governing what they can and cannot do, and if compromised impartiality can make it that much easier for those laws and rules to be violated.",explainlikeimfive,0
"Well I thought this was self evident from merely *looking* at people drag racing, but you have two cars that start at the same spot and try to get to a predetermined spot some way off in a straight line. You do this by accelerating as fast as possible. 

",explainlikeimfive,0
"Flatheads also don't strip as easily as other screws, at least in my experiences, and they can be opened by things hat really aren't screwdrivers. That's just what I can think of now though ",explainlikeimfive,0
"It's called fluorescence. When UV light strikes something fluorescent, some of that light is absorbed, but some is emitted at a lower frequency/energy, and this is what you see. ",explainlikeimfive,0
I think the Jonah one did happen but there are stories in it known as parables that He made to teach lessons to his followers.,explainlikeimfive,0
"&gt; The only thing that scientists agree on is that CO2 does cause warming.

The other thing that they have consensus on is that almost all of it is caused by humans. ",explainlikeimfive,0
feel free to search past posts,explainlikeimfive,0
"Modern art is, as homeboi808 put it, just people expressing certain feelings or perspectives. There are lots of unusual pieces that come to mind, each with some sort of backstory behind it.

For art GCSE, a group of us went to the Tate Modern in London to see some of the art that was there. One of the most unusual pieces was a canvas that was simply black - nothing else about it. It was literally just a black canvas. Yet one of the main interpretations about it is that it represents the emptiness one might feel in their soul from time to time.

It doesn't just have to be paintings or sculptures: one artist laid out a massive sheet of music and let pigeons do their business all over it. The next day, she had an orchestra play the music that the pigeons had made and it was actually incredible. So next time you see modern art, think about what the story behind it is.",explainlikeimfive,0
"Yes but a frog doesn't spontaneously generate, it must restart it's evolution from single cell microorganism to eukaryote to multi-cellular to invertebrate to vertebrate.  That's why some ponds never have frogs, they are still evolving to that level of complexity, it takes thousands or millions of years.",explainlikeimfive,0
"Just so you know, ELI5 doesn't mean 'explain so a five year old could understand'. It says this in the sidebar.",explainlikeimfive,0
"On average, Hungarians are paid approx. 1/2 of what Americans are paid.  Thus, the cost of living, rent, food, utilities, is lower.  

Seattle is a booming economy with lots of techy people making buttloads of money.  Thus, ISPs can charge more because they know you need internet, and they know you can afford it.  There *are* alternatives, e.g. Wave Broadband, CondoInternet, CenturyLink DSL, but it's up to you to decide if the change is worth it.  

",explainlikeimfive,0
[removed],explainlikeimfive,0
That's quite logical,explainlikeimfive,0
[removed],explainlikeimfive,0
"Less than 350 is ideal. 

Over 400 is more accurately described as the level at which it is believed that switching over to non-carbon producing sourcing will still cause warming. 

Until 400 and it's arguable that the environment alone could reverse it eventually, and the worst of the warming will be mitigated. 

Over 400 and warming is going to happen even if we shut down all industry now. 

So this is the tipping point where large-scale carbon capture and mitigation technologies have to be developed on top of a large scale move away from carbon sources. 

The higher the concentration gets the faster we need to move away and the larger scale (and costlier) the carbon capture technology has to be. ",explainlikeimfive,0
"Yes methane is much worse. So we should limit our methane emissions. How do we do that? On a personal level, reduce our beef consumption because cows release methane while they grow and fatten up.",explainlikeimfive,0
[deleted],explainlikeimfive,0
"Your submission has been removed for the following reason(s):

ELI5 is for questions with objective explanations.

Straightforward answers or facts 

* Recommended subreddit(s): /r/answers

---

*Please refer to our [detailed rules](http://www.reddit.com/r/explainlikeimfive/about/rules)*.",explainlikeimfive,0
[deleted],explainlikeimfive,0
If you re-read my post that is exactly the point I'm making. The winter constellations are not above the horizon at night. ,explainlikeimfive,0
"I'd not say that they contain ""more moisture"", but that more of that moisture has condensed to (opaque or refractive) droplets per unit volume.

The total number of H2O molecules per cubic meter may not change at all, but as the water condenses the cloud darkens.

Of course the water must condense to fall as rain, so the two are inexorably linked.",explainlikeimfive,0
I know that you have to be eighteen to use a cardboard compactor at Walmart; you have to eighteen to use a fryer at Taco Bell.,explainlikeimfive,0
