body,subreddit,moderated
As a Scotsman I'm really confused as to the 'british' r as it is rolled in a Scots accent but not in the English.,explainlikeimfive,0
"Judging from your history of removed posts on this sub, you clearly haven't read the rules.

You keep posting on subjects that you clearly have an opinion on, or even as a means of expressing that opinion - that's not what ELI5 is for.

",explainlikeimfive,0
"As a consumer, you are not constantly (24/7) writing stuff onto your ssd.  ",explainlikeimfive,0
Bridesmaids' dresses aren't supposed to look good. They are supposed to look bad so the bride stands out.,explainlikeimfive,0
"Remember that AI is still programmed by people. If they want to make a super-intelligent AI and it just shuts itself down, they'll change the code so that it doesn't do that next time.",explainlikeimfive,0
"But by that logic shouldn't diffusers make noises?
Yet we see diffusers being utilized to reduce noise.",explainlikeimfive,0
[removed],explainlikeimfive,0
"As alcohol is absorbed by your mouth, throat, lungs, and intestines, it does not chemically change and it is not digested. As this blood moves through your lungs, a predictable amount will pass through the lungs membranes and into the lungs themselves.",explainlikeimfive,0
"Your title is one of the main points that disproves the wage gap. Also, women are being hired more than before as they are generally getting better education. Men might work more hours - but women are smarter and getting ""better"" jobs.


*hey downvoters - how am I wrong?",explainlikeimfive,0
"Let's be honest the other side of the spectrum with ""in 20 years we will be extinct"" needs to be quiet too.",explainlikeimfive,0
"It is scattered, because there are different ""degrees"" of skepticism. You can deny that the climate is changing. Or, you can deny that we are causing it to change. Or, you can deny that the change will be catastophic. Or, you can deny that we can prevent the catastrophies, so may as well eat, drink, and be merry. Since there is no one definitive way to claim that it's a hoax, it gets very confusing and inconsistent. 


",explainlikeimfive,0
"All joking and stereotypes aside, how awesome would that be?? A world where every on said ""nah we don't need guns anymore"" and traded them all in for gardens and sustainable energy? I know it's a silly hippy fantasy but you can't tell me that wouldn't be nice. ",explainlikeimfive,0
I was serchin f'ya. I lived in Providence for 5 years. They put R's on the end of everything. Soder. Ideer. ,explainlikeimfive,0
"It's not possible to be completely immune. Anything people can build, other people can break. Generally, for military purposes the goal is to make breaking your communications so difficult or time consuming that by the time you get the information it is no longer useful. One of the ways to help secure communications you mentioned is changing frequencies. Doing this often enough means that the enemy only hears portions of your communications. Bluetooth is a really sophisticated way of switching frequencies where the switches happen extremely fast and extremely often. Since only the paired devices should know the pattern anyone intercepting gets just a tiny bit of information. Military radios are capable of doing something similar but on a much grander scale. Lower tech solutions include intentional obscurity and code. Intentional obscurity is basically what you see drug dealers do. Instead of saying ""I have 3 grams of coke""  you say ""I have what you need"". Someone listening in has to guess at the specifics. That's only really useful if you are looking at very short term need for secrecy. A unit radioing ""in position"" immediately before commencing a raid for example. Coded language is just the same thing but more formalized. ",explainlikeimfive,0
[removed],explainlikeimfive,0
Brine shrimp (artemia).,explainlikeimfive,0
"Has she ever told you what the pet-raising simulator is? If so, do you remember the title?",explainlikeimfive,0
"I can't speak for what your teachers taught you, but I can say for certain that my Japanese teachers (who were in fact Japanese) never pronounced a hard R in my entire time studying.

Like I said, it's not that there's no L or R, but that they have something in between of the two, like how their only F sounds comes from an H.

I'm Filipino, if that means anything.",explainlikeimfive,0
"Planes generate lift from the movement of air over (and under) their wings. Therefore, in order to have any lift at all, they must be moving with respect to the air.

Rockets on the other hand, generate lift from Newton's Third Law of Motion (any action has an equal and opposite reaction). By propelling mass out with a certain momentum, the rocket gains the equal momentum in the other direction.

It should (I hope) be clear that the most efficient use of energy for a rocket is to propel itself straight up, while a plane needs to propel itself horizontally before it can propel itself vertically.",explainlikeimfive,0
"This only happens on screens with strobing (backlight goes dark when the image is updated, creates illusion of additional smoothness) or a screens PWM controlled brightness. Neither is very common. Most LCDs will appear solid on all types of cameras.",explainlikeimfive,0
"Oh weird. I had no idea that changed your IP address, I always assumed it stayed the same. Thanks!",explainlikeimfive,0
"I'm looking at it purely being an authortarian or libertarian thing not just what people actully think, its about the government. Whether something is authortarian or the opposite is dictated by whether it contributes to govenment control and bettering the state or if it gives people more power and freedoms. 




Gun control is simply the government regulating or controlling something that is key to standing up to a tyranical government, this is authortarian. However allowing the PEOPLE to have the FREEDOM of having guns to protect themselves from government is by logic a libertarian idea. 





When you are talking about the ""right to live"", you are simply just talking about one person killing another. Murder. This isn't to do with the government killing someone, this is the government not taking away particular weapons, which is authortarian as it empowers the state and regulates people socially. 






The reasons why people such as the republicans are FOR gun control is because they're traditionalists. Most of their voters simply like guns, guns are deeply embedded into US culture. The polititians themselves probably also just like guns and simply aren't extreme enough to attack their own people anyway so it doesn't give the state an advantage. The reason why most ""liberals"" want gun control is because most ""liberals"" aren't traditionalists, because most ""liberals"" are young and are also not super extremeists so see the trade off between having protection against the state and not having the freedom to bare arms as a good one. Just because liberals support an authortarian idea doesn't make the idea liberal not does it make the ""liberals"" authortarian. ",explainlikeimfive,0
So one in captivity that's fed regularly can technically grow indefinitely? ,explainlikeimfive,0
"Would that not be false advertising since they are now being sold with ""Purifies Air!"" on the box ?",explainlikeimfive,0
"Your submission has been removed for the following reason(s):

From a quick google search 

https://t-pin.us/product/tpin-original-lapel-pin/ - is what it derives from and has become a bit of a meme.



---

*Please refer to our [detailed rules](http://www.reddit.com/r/explainlikeimfive/about/rules)*.",explainlikeimfive,0
"You're comparing the wrong things.

The aspect ratio and resolution of video is like the sampling rate and bit depth of audio, (which *do* have standards).

In terms of loudness for each TV show and movie, there is essentially a maximum level they can have but it's more complicated than that. 

Real sounds that happen in the world around you are at all sorts of different levels. Some TV shows and movies try to replicate that because it sounds more natural. Some on the other hand just want your attention. So they used audio compression. 

Audio compression is like a penguin that stands next to your stereo. He has a set of headphones and listens to your audio just before it gets to you. You pick a certain level and tell the penguin, if the audio is about to exceed some level, turn it down so that it doesn't and then turn it back up when it gets quiet again.

The result is a audio stream that has very little variation in the level. The problem is if you take the whole thing and then bring it up towards the max level of the system, you end up with an audio stream that while technically is within the limits, it *sounds* louder to human ears because more of the signal is up at that higher level compared to other TV shows and natural sounds. 

It's basically a trick TV commercials use to get your attention. 


",explainlikeimfive,0
"Visualize a graph that displays a function f(x), which is displayed as a curve. Differentiation is finding the slope of that curve. Integration is finding the area under that curve.",explainlikeimfive,0
CO2 increases have had exponential effects. And they have been worse than the worst-case models so far. ,explainlikeimfive,0
[deleted],explainlikeimfive,0
"&gt; The noise and vibration of the car's engine create a monotonous sound and vibration that allow a baby to relax

So could a cradle design use those features?",explainlikeimfive,0
[removed],explainlikeimfive,0
The marine corps (for example) has a job called combat camera. Their job is to follow troops around and take cool photos (or videos) when they are deployed. ,explainlikeimfive,0
That's not true. A tension headache is usually caused by strain of the eye muscles. How is that either too much or too little blood? ,explainlikeimfive,0
"Haha yeah that's true... I was at the MOMA actually last month and going through the paintings of people like Van Gogh, Klimt, Chagal, Hopper, Pollock...that was really intense.. 
Anyway, I admire nowadays work its quality is somewhere else that's all... ",explainlikeimfive,0
[deleted],explainlikeimfive,0
"Yes I should've said lower than atmospheric, my mistake. I understand better what you mean now. Bubbling (assumedly) atmospheric air would keep co2 higher than zero. I guess my follow up question (because I don't know a ton about this) is does algae usually photosynthetically consume co2 at a rate faster than it can dissolve into water from the atmosphere? Additionally you mentioned doing all this in ""cooling towers"". Is that just where the aeration occurs and then the water is funneled outside the tower? Or does all of this happen in the tower? If that's the case would it somehow be clear to expose the algae to sunlight? 

Separate question - I had no idea aeration would cool the water. Why is this?

*just for some context I'm currently working towards my masters and my project involves aerating water to oxygenate it (or bubbling through n2 to remove oxygen), but my focus is in wetland biogeochemistry not algae or anything really oceanography related.

On that note don't feel obligated to answer any of this. I'm just distracting myself from writing my thesis and I've had a few drinks ",explainlikeimfive,0
"Because they are soldiers of The United States of America, they are literally fighting for our country ",explainlikeimfive,0
I think tjw facehuggers are dragonfly babies,explainlikeimfive,0
and make the scientists pay for it!,explainlikeimfive,0
Photomate/MC checking in.  Arghhh!,explainlikeimfive,0
Thank you so much for helping me out!,explainlikeimfive,0
Oh yeah that red dot is amazing.,explainlikeimfive,0
[removed],explainlikeimfive,0
"Sorry, ran over a 4 year old and had to get the hell out of there, but yea, safe and productive so I'm not just sitting around staring at a road. I actually thinks it's healthy to close your eyes for 10-15 minutes while driving due to eye strain. It's somewhere out there in a medical journal I'm sure. ",explainlikeimfive,0
"I'm no scientist, but this is a broad question in my opinion. I'd say it's different for everyone, but for me, the sound is calming. It's kind of how the ocean is calming to some, so they listen to the sounds of waves. It also might be something someone has connected to something calm like sleeping, so everytime they hear white noise, they think of how calming it is. I dunno, that's just my 2 cents.",explainlikeimfive,0
"In the next five decades the ocean will rise 6"".
",explainlikeimfive,0
"Wow, I didn't know actual deniers still existed.  I thought you morons all moved on to disputing the fact that it's caused by man now.",explainlikeimfive,0
[deleted],explainlikeimfive,0
"You might have to be a bit more specific about the context here.  There's a few significant genres that have taken the name.

You'd got [Acid Rock](https://en.wikipedia.org/wiki/Acid_rock) which is a late-60s offshoot of psychedelic rock that's more deeply psychedellic.

Then you've got [Acid House](https://en.wikipedia.org/wiki/Acid_house) and the related acid techno &amp; acid trance subgenres of electronic dance music in the late 80s and early 90s that are based around the [morphing, bubbling, squelching sounds of the TB-303 synthesizer](https://youtu.be/Enyny7vXGi4?t=21).

You've also got the mostly unrelated [acid jazz](https://en.wikipedia.org/wiki/Acid_jazz) electronica movement which was based around turntablism, sampling &amp; chilled out grooves.

Then you have [Acid Music](http://www.magix-audio.com/us/acid/) (formerly Sony Acid) - a piece of software that allows you to create music on the PC (commonly known as DAW or Digital Audio Workstation software).

",explainlikeimfive,0
"It is absolutely possible to learn good handwriting.  But considering writing by hand is nearly 100% obsolete as a skill, and most people write by hand very infrequently, most people don't develop the skill at all, and most people don't care either.
",explainlikeimfive,0
"Your submission has been removed for the following reason(s):

ELI5 is for questions with objective explanations.

Subjective or speculative replies 



---

*Please refer to our [detailed rules](http://www.reddit.com/r/explainlikeimfive/about/rules)*.",explainlikeimfive,0
"like a fart!
",explainlikeimfive,0
Yes but if you scan it in sufficiently high resolution then open it on a computer you may see the patterns again.,explainlikeimfive,0
Politics,explainlikeimfive,0
"Who is stupid, the ones who have to resettle or those who built far enough away from the ocean?",explainlikeimfive,0
"Conflicting research, hopefully some concrete studies come out in the future, that's why it's such a debated topic. I only stated what my experience has been in the field through my own observation and analysis over the last three years. ",explainlikeimfive,0
"&gt;How is this prevented?

By having a lot of people who can see what other people are doing. Paying off one person in each step of the voting process is not enough to make any meaningful impact. At most it appears as a statistical anomaly, which may or may not be enough to warrant an 'investigation'.

Voting policies also vary from state to state in terms of the requirements and information needed. You don't just 'corrupt the voting system'. To really corrupt our first world voting system, you need to disrupt on a local level in many, many states.

Plus there will always be a money trail you can follow if there is corruption and somebody is being paid off, but these sort of things have to be caught by people who manage the financing and budgets of these people/companies.

Rich, powerful people are not inherently bad. Just as much as some rich people may try to undermine our democratic system, there are just as many rich people with genuine incentives to see a fair process. Also as long as we can keep as much people working on each level of the voting process, the likelihood of corruption 'sneaking' through the system is largely unfounded.",explainlikeimfive,0
"They should have, imo, erected a second barrier around his bar and the 3 other businesses on the wrong side of the street. It wouldn't hurt the main barrier, and if the secondary wall fails, at least they tried.",explainlikeimfive,0
"Cannot be reconciled with wisdom justice and love. 


Cannot be reconciled with wisdom justice and love. ",explainlikeimfive,0
"A washing machine is commonly referred to as a ""washer"", while a drying machine is commonly referred to as a ""dryer"". You'll see adverts for washer/dryer combinations all over the appliance ads. 

We call them dryers, we call them washers. We rarely call one a machine and the other an actor. ",explainlikeimfive,0
[removed],explainlikeimfive,0
[deleted],explainlikeimfive,0
"GoPro cameras are designed to be small and fit into protective cases and mounts. They are designed to handle shock and movement without problems.

They are not the only cameras that can do this, but if you are looking for some way to record yourself riding a dirt bike down a rocky trail then GoPro will have everything you need and it will all work together.",explainlikeimfive,0
"Credit card readers are basically tiny modems. To get one, you also need to contract with the credit card company, paying them a certain amount for each transaction. 

So, for instance, a credit card company might charge ten cents per card you run, plus 1% of the bill above 5 dollars.

This leads to two direct possibilities.  The first is that they don't have a line in a convenient place for the machine.  The second is that they are a low margin business or have enough of a cash business that they don't feel like paying the card company.

And, of course, it's possible that they run a cash business for convenience / underreporting of tax purposes",explainlikeimfive,0
"The only thing that can save our butts is incredible technological development, unless we make significant carbon reductions now. Having said that, there are incredible changes happening in the energy sector with solar panels and wind making incredible advances.
I take some comfort from the singularity sub when it comes to this issue. Some of them say that carbon will be a nonissue in 15 of 20 years when we sick artificial intelligence on it.",explainlikeimfive,0
"The six scenarios where the 2-health minion die only count two hits against that minion. There's no third phantom hit after two hits. In order to account for that in the math, I multiply by 1 after there have been two hits since we know there's a 100% chance the missiles won't hit the dead minion.

Perhaps a better way of listing it out would have been like this:

1. XX
2. XOX
3. XOOX
4. OXX
5. OXOX
6. OOXX

Since we only care about whether there are two Xs, we don't really need to calculate anything beyond that.

In any case, the math comes out the same:

1. 1/9 chance of hitting X twice in a row off the bat (1/3 * 1/3)
2. 2/27 chance of hitting X, missing X, hitting X (1/3  * 2/3 * 1/3)
3. 4/81 chance of hitting X, missing X, missing X, hitting X (1/3 * 2/3 * 2/3 * 1/3)
4. 2/27 chance of missing X, hitting X, hitting X (2/3 * 1/3 * 1/3)
5. 4/81 chance of missing X, hitting X, missing X, hitting X (2/3 * 1/3 * 2/3 * 1/3)
6. 4/81 chance of missing X, missing X, hitting X, hitting X (2/3 * 2/3 * 1/3 * 1/3)",explainlikeimfive,0
Thanks dude,explainlikeimfive,0
"Interestingly, because of this, a lot of Taiwanese consider themselves to be 'true patriotic Chinese' as opposed to the communist mainland China.",explainlikeimfive,0
I love that solider near the end kicking rocks down the mountain towards his homies as the narrator talks about the trek being hazardous.  ,explainlikeimfive,0
"That's true, and if they hit the good guys then it's a tragic accident causing collateral damage. If the other side's strike goes wrong, then it's an atrocity/war crime.",explainlikeimfive,0
"Sound is vibrating air molecules.  Humans can hear vibrations from (about) as low as 20 times per second to 20,000 times per second (a.k.a. 20Hz to 20kHz).  Long story short, headphones (and all speakers for that matter) sound different because of how well they can produce these frequencies.

Slightly longer story, it's hard to produce a vibration of 20 times per second at the same time as 20,000 times per second, not to mention all the ones in between.  Different drivers (the part of the headphone that makes the sound) have different designs influence their abilities to reproduce these frequencies.

Then there are intentional designs.  For example, professional headphones (such as [Sony MDR-7506](https://www.amazon.com/Sony-MDR7506-Professional-Diaphragm-Headphone/dp/B000AJIF4E)) are made to take your sound and portray it accurately.  Conversely, Bose headphones are designed to emphasize more pleasing frequencies, which make your music sound ""better,"" as opposed to ""accurate.""

Source: B.A. in music technology, audiophile &amp; studio engineer.",explainlikeimfive,0
"Built up pressure. Thats really it. Store the pressure. Release the pressure. Stuff gets compressed. The more pressure you can store, the stronger the compression. 

Look into this thing called hydraulic fluid. It's designed to work in extremely high pressured environments. ",explainlikeimfive,0
"Not 100% accurate. If the commander dies the highest enlisted soldier (in the army it is a first segeant if a company, and a command sergeant major if battalion) will take over daily operations.

Every officer down to the lowest ranked officer technically  ""out ranks"" even the highest enlisted soldier. But you definitely want your most experianced man during these times.

This is when a battle is ongoing. Once they get back, upper brass will shuffle a new commander in.",explainlikeimfive,0
The motion passes,explainlikeimfive,0
[removed],explainlikeimfive,0
[removed],explainlikeimfive,0
[deleted],explainlikeimfive,0
That would be awesome. I gotta see if I can get one on ebay or something. I didn't know they exist. That would be the perfect father's day gift. ,explainlikeimfive,0
You should pitch movie ideas.  I'd watch that movie.,explainlikeimfive,0
"I agree; the my house had mostly flathead screws when I moved in, but every time I take one out to fix something I throw it out and replace it with Phillips or torx screws. ",explainlikeimfive,0
[deleted],explainlikeimfive,0
there is no *right part of asia*.,explainlikeimfive,0
"There is a fundamental difference in mechanics and scale of modern automation. There is also the difference that the jobs displaced by past technological improvements allowed for people to take other types of jobs. This is much less the case now.

Really though, the issue is *not* that automation will take our jobs. That is actually a great thing for society. It means we will all have more free time to pursue our own desires. The real issue is that our economic system is not well adapted to having a high percentage of the population unemployed. We will have to overcome the archaic ideology that every individual must labor to earn the right to live if we want to progress.",explainlikeimfive,0
"1. I doubt that you represent all south-easterners.
2. It's a very common observation. Tom Scott, who also has this pronunciation, made [a video about this](https://www.youtube.com/watch?v=ld3A3QCpXd4).
3. You call it a ""speech impediment"", I call it an ""allophone"".
4. I have myself known plenty of people who roll their Rs, and not as an affect.
5. It's not common in England, but not completely unheard of either.

Yes, I am from the UK.",explainlikeimfive,0
Do you know what ocean acidification or glacial melt is?,explainlikeimfive,0
 You make it sound so simple I regret not having done this years ago,explainlikeimfive,0
"If you take a wet white t shirt and try and look at your hand while holding the shirt 5 inches above your hand, you just see shirt. If you drape the wet white t shirt over you hand, you see more of the colors and details of your hand.

This happens because the shirt basically ""blurs"" the light going through it, so if you want to reduce the blur effect then you put the shirt closer to what you're trying to see.

This is also basically why if you have bad eye sight, you can move closer to an object to see it better. Same idea.",explainlikeimfive,0
[deleted],explainlikeimfive,0
But cold blooded just means that they take on the temperature of their surroundings. Not that their blood is actually cold ,explainlikeimfive,0
"And the Nazi said Jews weren't real humans and the disabled they murdered first weren't ""viable"" humans or productive in society. They said society was uplifted cutting their dead weight with euthanasia.  Eugenics.",explainlikeimfive,0
Chocalate-covered coffee beans are awesome though.,explainlikeimfive,0
More like Wimpod.,explainlikeimfive,0
"The act of filing bankruptcy serves many purposes, including protection from debtors. The ""default position"" is that the company is going under, but then the argument goes that if you can get it back and running then you can return _something more than zero_ to those who are owed money by said organization.  So...thats better than going under to all parties (employees, lenders, suppliers, etc...).  So...as long as you can demonstrate that you're fucked and that without bankruptcy relief you'd cease to exist then you can get bankruptcy.

The ones that don't continue to operate are the ones where there is no clear path out of bankruptcy.  For example, if the company filing bankruptcy had no customers then it would seem unlikely that a restructuring of debt would result in a healthy company capable of returning at least something to lenders or suppliers, or one that could pay its employees.",explainlikeimfive,0
