body,subreddit,moderated
"I'm pretty sure that's still ""evolution"". ",explainlikeimfive,1
Biology,explainlikeimfive,1
Biology,explainlikeimfive,1
Culture,explainlikeimfive,1
"Your submission has been removed for the following reason(s):

ELI5 is for explanations of complex concepts, not for asking for opinions. Your question may be better suited for /r/AskReddit, /r/ChangeMyView, or /r/OffMyChest.  Whichever sub you choose to post on, make sure to read its rules.

This question does not really fit with ELP5, try one of the other subs.



---

*Please refer to our [detailed rules](http://www.reddit.com/r/explainlikeimfive/about/rules)*.",explainlikeimfive,1
"YES, asking the real questions here. 

I've never seen the knockoffs, just found enough stores in the city that don't give a fuck & sell kinder products anyways. They're just SO damn good. Try Kinder Bueno when you have a chance. You're welcome ;)",explainlikeimfive,1
"You're literally looking at it's existence, so you can go ahead and give up on that first part.",explainlikeimfive,1
"Well AC is rock, and DC is roll, so really its all preference",explainlikeimfive,1
Wait....Mr. President-Elect??? ,explainlikeimfive,1
"We start out human, no gender.   At a certain point in development the gap in your pelvis either grows inwards or outwards and gender is determined.

Dont give women credit as some necessary start to humanity.  We all start as human, not one gender or the other, and each gender is just as important to our survival as the other.",explainlikeimfive,1
Looks like you're gonna have to.,explainlikeimfive,1
Apple lobbied harder?,explainlikeimfive,1
"God damn it, I know where my tongue is, I know i'm breathing, I can hear my heart, I'm salivating, and there's no comfortable place to put anything.

I hate you OP.",explainlikeimfive,1
Same reason you do things your told not to do. ,explainlikeimfive,1
Also now certain items that are everyday items (sharing cream etc)  are gimmicked into this Amazon pantry so they can force you to buy more items AND pay a fee for the privilege.  ,explainlikeimfive,1
DAE hate the post office?,explainlikeimfive,1
"I just wanted to point out that it's very dangerous to take tylenol with alcohol. 

The ELI5 version of that is that Tylenol is normally turned into certain compounds, which can safely be taken care of. However, alcohol promotes another enzyme which turns tylenol into something which can damage your liver and kidneys

",explainlikeimfive,1
Honestly because the leaks show that the Clinton campaign is deeply colluding with the media to the point if they attack her they hurt themselves.,explainlikeimfive,1
Am I the only one who has no idea what this eye rubbing shit is about? I can't get mine to work. ,explainlikeimfive,1
"My grandmother, Gibby, died in November of last year after suffering from Alzheimer's for 14 years. 

She died once she became unable to swallow. The awful hospice company kept her alive for almost a week just by swabbing her gums with a moist q-tip. Apparently that's all the moisture you need to survive.

Seeing her like that made me hope that when it's my time to go euthanasia is an option.  
",explainlikeimfive,1
Other,explainlikeimfive,1
It just feels right. Idk why I always do but I just feel smoking after sex is just full filing.,explainlikeimfive,1
"i might be wrong, but i think it mainly hurts because you aren't expecting it. if you prepare yourself for something, even if it's just the intention of biting your tongue, it won't hurt as much because it won't come as a surprise and i think there's something about how your body is incapable intentionally hurt itself, though that part i'm not a hundred percent sure of. there's probably a more scientific explanation for this but that's all i got.",explainlikeimfive,1
Does the little parrot want a nut?,explainlikeimfive,1
Chemistry,explainlikeimfive,1
"""Do you smoke after sex?""

""Don't know, never looked.""",explainlikeimfive,1
"They are unemployed, some are paid protesters paid by community organizers linked to george soros. Welfare recipients worried about losing their entitlements. Illegal aliens worried about being deported. And lazy bum college age kids still living with their parents who think the government should give them everything for free.",explainlikeimfive,1
"As a newly expecting father, I have no idea why I clicked this thread. 0_0

Wake me in 10 months. ",explainlikeimfive,1
Chemistry ,explainlikeimfive,1
It's a closed fist being violently rammed up your eager little behind with a punching motion,explainlikeimfive,1
I think you are literally five. ,explainlikeimfive,1
Biology,explainlikeimfive,1
Worst and doughnuts do not go into the same sentence except if to say that it doesn't go in the same sentence.,explainlikeimfive,1
Because they have no lives. ,explainlikeimfive,1
"FWIW, this is why women whose nipples were showing were referred to as having their ""high beams on"" back in the day - because the floor high beam switch was the shape of an erect nipple. ",explainlikeimfive,1
"Sweden, Denmark and many of the European countries redditors like to praise use a school voucher system to encourage competition. They are also right to work. Lmfao pick and choose what you want to copy right?",explainlikeimfive,1
"It's a naive view of politics that says people at the extreme right and left aren't very different & tend towards authoritarianism to pursue their goals.  It's mostly used to rationalize being in the ""center"" and supporting the status quo.",explainlikeimfive,1
"Stop it, there has been a dozen posts on this today. Open any of them and the first thing you will see is that swearing is a very very tiny portion of people that actually do. Most people have ticks or words that are common or plain, but not very funny in a movie. ",explainlikeimfive,1
I was suspended once for visiting an adult website at school by accident. We had a scavenger hunt in our computers class and we had to search the Internet for certain things. I ended up accidentally visiting an adult website and I never even realized it until a few days later when I was called into the office and suspended.   Being suspended was the best time of my life haha. ,explainlikeimfive,1
Physics ,explainlikeimfive,1
Look Johnny... School might teach you a lot but what it doesn't teach you is that time doesn't exist. ,explainlikeimfive,1
Well you are a fucking asshole.  That must be a liberal phenomena.,explainlikeimfive,1
"Not a god damn thing, kid.

The [temperature record is basically useless](https://wattsupwiththat.files.wordpress.com/2009/05/surfacestationsreport_spring09.pdf) and this fearmongering ""end of days"" crap has been going on for decades and has NEVER manifested itself.  The very minor effect CO2 has on weather is not even worth mentioning.

The reason everyone thinks it's getting hotter is because local temperatures in cities is increasing due to more cement, more cars, more AC's, etc. that all produce heat and create a *localized* warming effect.  Any temperature measurements that aren't taken out in the uninhabited woods miles away from any roads or civilization do not accurately reflect the aggregate global temperature as humans only inhabit a [very small area](http://2.bp.blogspot.com/-do99S8xbr5A/Ugloe5JYeLI/AAAAAAAAE0E/iod_S22RWN8/s1600/New+Zealand.jpg) relative to the vast uninhabited (by humans) land.

Global warming is a way for people in power to influence people and make them do whatever they want in the name of ""stopping global warming"".

Don't believe me?  Fine.  You sign me the deed to your house that becomes valid in 20 years and I'll give you $100 today.  The world's gonna end, right? So $100 is better than nothing, right?  I'll enjoy my real estate billions in 20 years.",explainlikeimfive,1
My grandpa had alzheimer's and it was so frustrating not to be able to do anything for him except take care of him. He died in his sleep so not sure what really happened I was really young at the time :( I remember he also started seeing things that were not there so scary,explainlikeimfive,1
"Eggs in the uk are just on the shelf, some people do put them in the fridge when they get home but most people just leave them on he side in an egg basket or in the carton. ",explainlikeimfive,1
Other,explainlikeimfive,1
Physics,explainlikeimfive,1
"Its funny you say this. Because i too have found copies of myself in not so far areas actually, but far. I live in sacramento and two hours away in a place called Oakland i came to find my exact twin. Not genetically of course. But samw Haight same hair same skin complexion and same weight about",explainlikeimfive,1
Well first you take the first 1 and divide it by the width of the sun. Take the second 1 and multiply it by the square root of the median population of the US (separated by states). Then you take the 2 and drown it in tears and failure because your dad never loved you. And then you solve for X. ,explainlikeimfive,1
"I have jukebox turrets syndrome, I sing out random songs, or one word or sound I hear triggers a song that I am forced to sing.",explainlikeimfive,1
"Economics
",explainlikeimfive,1
"https://www.youtube.com/watch?v=MTY1Kje0yLg

Sums up a lot on gravity in a very visual way",explainlikeimfive,1
This is why I have a Guinea pig. ,explainlikeimfive,1
"I don't know why it happens, but if you want to see what happens when it happens, you can look at this: https://www.youtube.com/watch?v=DFKTznUgZto",explainlikeimfive,1
My allergies turn me into a mouth breather every now and then *sad face*.,explainlikeimfive,1
biology,explainlikeimfive,1
I had the chickenpox when I was 29 and it almost killed me. The blisters got under my eyelids in my mouth and nose and in my esophagus. They were all over my body including under my fingernails. I spent two weeks in the hospital and ended up with terrible scars. It was probably the worst experience of my life.,explainlikeimfive,1
TIL that when you are from Philadelphia this doesn't rhyme no matter how many times you say it ,explainlikeimfive,1
"Removing dead skin is necessary so it makes sense your body set up a reward system for doing it. 

Source: idk it's midnight that's my best guess.",explainlikeimfive,1
Technology,explainlikeimfive,1
"By my own admission, I didn't know and care about it just as much as you care about configuring a SonicWall router or using Cython. But thanks for the info anyhow.",explainlikeimfive,1
Technology ,explainlikeimfive,1
Culture,explainlikeimfive,1
physics,explainlikeimfive,1
I bet r/AskHistorians would have a good answer to this,explainlikeimfive,1
"Um, so us ladies have some variation, and selection of course! Haha! J/k! Interesting question though!",explainlikeimfive,1
"When I visited Thailand the were a lot. I asked, it seems it is very common vocational training in Asia. So it would make sense that first generation immigrants would focus on work they can do well. ",explainlikeimfive,1
Biology,explainlikeimfive,1
"Was in an abusive relationship with an ex that used to gaslight. For a year and a half, I felt like I was going crazy. Would say awful, hurtful things, then when I would bring them up later would deny ever saying them.  I ended up using the recorder on my phone to record our conversations and play them back because I was going insane having someone deny things I knew to be true. It fucks with your sense of reality.",explainlikeimfive,1
"See an allergist - get weekly injections to desensitize the body to the allergens.



My son had great success.",explainlikeimfive,1
"Racism does not exist at the level you probably think it does. Most of your perception is tainted the agenda-driven false narrative spewing Left and complicit/colluding media who use the charge of racism to denigrate anyone and everyone who does not believe the way they believe. Charges of racism is used by the minorities to excuse their anti-social behavioral patterns, like car-jackings and home invasions. They actually tried to get a law passed to prevent police from chasing them if they flee and now they're even going so far as to have our govt do away with police officers altogether. Can you imagine the hell that would unfold if minorities ceased to be chased and arrested for their crimes? Grow up. Study after study has shown that by far the segment of the population that is most racist is the segment that cries racism the most often. Blacks. They are the worst when it comes to racism against other races. Black males have often attacked white males if those white males are seen with a black woman. Never heard of such a thing before? That's because the media is hiding these crimes from you. They're hiding all of the black crimes from Americans. You have no idea how bad it is because the complicit msm refuses to tell you how bad it is. Have you any idea how often crowds/gangs of blacks have swept in and attacked white diners, shoppers, beach goers in this country since Obama has been prez? No, I guess you don't, again, the media has been hiding all of these stories from you. Get a gun and don't turn your back on them for a single second. ",explainlikeimfive,1
"It's just an evolved social cue, kind of arbitrary like yawning. Displays frustration. ",explainlikeimfive,1
I was given a very large old rooster with a broken beak. I'd come home in the evening and this 40lb bird would only charge you from the rear. Getting hit with the talons behind the knees is a shock the first time. He would never charge you from the front or if you were looking at him. Cleared my rural yard of snakes etc. Finally attacked my very young daughter and took 3 running hits from a .357 ,explainlikeimfive,1
Chemistry,explainlikeimfive,1
"My school only did in-school suspension. It was essentially an all day, solitary detention. And it sucked.",explainlikeimfive,1
biology,explainlikeimfive,1
Full of vaccinations.,explainlikeimfive,1
You're basing this on a maximum sample size of four individuals?,explainlikeimfive,1
"I dunno, If I went to MARS and caught a virus, I would say to myself that shit was living on MARS.",explainlikeimfive,1
Other,explainlikeimfive,1
"Your tongue closes off the airway to your mouth while it is open and your brain says for ""you"" to breath  in from nostrils.  Simple air pressure. 

 Now, I am no scientist but I did stay at a holiday in last night. ",explainlikeimfive,1
"Gender is an imaginary label people and society put on other people to categorize them easier. 

You have a penis, so you *should* be a male, wear blue, don't cry, etc..

Genders are just vapid stereotypes. 

You're whatever sex you are and after that you're just a person. Gender is bullshit. ",explainlikeimfive,1
"Excuse me while I face palm at your lack of self awareness.  I brought it up once, that's it.  You're the only one who won't stop talking about it.  Here's an idea, stop replying to me about something I couldn't care less about and the matter will be resolved.  If you hadn't pointed out my choice of example in the first place, your one sided discussion on the topic wouldn't have occurred.

In other words, **drop it**.",explainlikeimfive,1
Other,explainlikeimfive,1
Do people still have CAPTCHA parties? Where you get around a computer and just figure out CAPTCHAs together.,explainlikeimfive,1
"""A Texas medical researcher is raising concerns...""

""Peter Hotez, Baylor College researcher, says...""

",explainlikeimfive,1
"Explain like you are 5? Ok. Dark Matter and Dark Energy are a 5 year old grade science fair project thesis of major scientists created in order to avoid the ""I DO NOT KNOW OR HAVE A CLUE"" answer.
Basically they have zero evidence of it, also they there is absolute zero honesty about it. The thesis basically is there so the model for the big-bang does not fall and break into 95 pieces. Actually dark matter and dark energy account for 95% of the universe, so in order to save a failing theory they invent this insane thesis and by doing so they boxed themselves into the category of science fiction. Next time a smartarse big-banger scientist tries to lecture you, you can safely reply: ""stfu man, you don't even know what 95% of the universe is... stfu please!"" And I will continue saying thesis, an be grateful for that, because it is not even worth of being called that.
So basically Dark Matter (note the capital letters, gravity doesn't get to be ""Gravity"" or strong force ""Strong Force"") is a bandaid to keep the Big Bang (again those uppercase letters of emphasis) from going into the trash can, where it belongs.",explainlikeimfive,1
"Sounds like a minor panic attack. Mine are a little worse and usually involve shortness of breath. 

^^^^^^^AUTOMOD ^^^^^^^AUTOMOD ^^^^^^^AUTOMOD ^^^^^^^AUTOMOD ^^^^^^^AUTOMOD.",explainlikeimfive,1
biology,explainlikeimfive,1
"When I was in school the first time I got suspended (middle school, for getting into a fight with a known bully who was also suspended for the same reason) I was told it was for a few of reasons. 

One was because, as a non-black student in a school of mostly black students, I would be an easy to locate target for his friends until it blew over. Grudges never really lasted that long in my middle school. 

Two was because it was supposed to be a wake-up call for me since I was having issues controlling myself when someone harassed me (not trying to sound like I was a little badass. I wasn't, it was just a rough period in my life and I didn't handle it very well).

And three was more for the other kid than me, he had already been suspended several times that year and was close to failing again because of it, so he needed to learn to straighten up or risk being held back again. Spoiler alert: it didn't work.

Most other suspensions worthy things in my schools were handled with in school suspension, teaching lessons without the stupidity of costing the child their education.",explainlikeimfive,1
">> As soon as you give it to a website, you do not own it anymore.

SO wrong. I see the site has removed your account, but in this case an angry letter from your attorney (probably $100) will work miracles.

>> As soon as you give it to a website, you do not own it anymore.

Fucking idiot.",explainlikeimfive,1
"I've been told by several doctors that my daughters dark circles could be attributed to genetics, allergies, lack of sleep or dehydration or any combination of those.",explainlikeimfive,1
"So why then are the wealthy and well educated not ballooning too?  They have the MOST money and the EASIEST access to food so by your logic they should be astronomically fat.

But they aren't, it's mostly poor people, that buy sugary foods.

The difference is WHAT you eat.  People are fat as shit because poor uneducated women start feeding them mountain dew from the nipple cup at age 4 and let 9th graders weight 300 lbs and instead of getting them on a proper diet they kindly ask them to eat fewer poptarts",explainlikeimfive,1
"Not only that, but you are literally Hitler. I mean, at least we can agree on that, right? 

Probably need this ----> /s",explainlikeimfive,1
"Male here. Just want to first say that I have a lactation fetish with my wife. That being said, I certainly can taste the difference when she eats healthy and when she does not. The texture becomes a little more ""fatty"" and less sweet when she is not eating in a healthy manner. So, I can tell the difference, but haven't submitted samples to a lab to confirm. Just my opinion...",explainlikeimfive,1
Was this posted by an actual 5 year old,explainlikeimfive,1
Engineering ,explainlikeimfive,1
Other,explainlikeimfive,1
I think people on the high end of the spectrum get treated unfairly as a result of neurotypicals being unable or unwilling to distinguish between them and the low-functioning Austistics. I legitimately feel bad for people like my best friend who get picked on like that because some asshole thinks that autism means they are unhuman,explainlikeimfive,1
"I was a Mormon missionary in England and ended up working with another missionary who spoke Chinese (I don't), if we ever ended up in a Chinese family's house they'd always ask us if we wanted a drink. Rude to say no, but we would say that we don't drink tea since that was always what they'd offer. So they'd just bring us the boiling hot water from making tea for a drink, nothing better in the middle of summer.",explainlikeimfive,1
"I lost a grandmother to this disease 6 years ago, and currently my other grandma is full-blown (8yrs since being diagnosed). It's a terrible, terrible disease that no-one should ever endure on either end. ",explainlikeimfive,1
Because people are retarded and don't realize that by protesting him you give him exactly what he wants. If everyone ignored him and just let him spout his nonsense that would be the worst thing that could happen to him. But no everyone has to virtue signal about how good of a person they are by protesting everything they disagree with.,explainlikeimfive,1
Dark matter is a reoccurring item through out the final Fantasy series. Upon using 1 dark matter you inflict 9999 damage onto an enemy (maximum amount of damage pre limit break),explainlikeimfive,1
"I'd like to see this chart with only girls between 100 and 130 lbs considered.  As an American going to Hungary, me and my military buddies didn't call Budapest ""Booty Fest"" for nothing.  Every girl there is stacked!!  Only they're all skinny!  God what a wonderful place...",explainlikeimfive,1
Culture,explainlikeimfive,1
I just put my hands down and fucking rip it like a Greyhound with his balls tied up like a bull,explainlikeimfive,1
[PBS Space Time did a great video that describes this and more using unicorns and monkeys being sucked into black holes] (https://youtu.be/vNaEBbFbvcY) ,explainlikeimfive,1
biology,explainlikeimfive,1
Culture,explainlikeimfive,1
Technology ,explainlikeimfive,1
Engineering,explainlikeimfive,1
Players who prefer inverted are confirmed communists,explainlikeimfive,1
Bro you can buy a kinder egg in World Market (pending on where you live) they have a kinder egg sister treat called Yowzies(?) also that have cool thing regarding global animal conservation inside ,explainlikeimfive,1
it's just a tradition. we're humans after all.,explainlikeimfive,1
I was a wrestler and was back in the mat six weeks after babies 1&2. They tighten back up pretty quickly with use. ,explainlikeimfive,1
technology,explainlikeimfive,1
Trump...err I mean...this hypothetical president would resign.,explainlikeimfive,1
"Liberals actually score higher on [psychological tests that measure ""openness to experience.""](http://www.psych.nyu.edu/jost/Carney,%20Jost,%20&%20Gosling%20(2008)%20The%20secret%20lives%20of%20liberals%20.pdf). [News covering the study](https://www.washingtonpost.com/opinions/liberals-and-conservatives-dont-just-vote-differently-they-think-differently/2012/04/12/gIQAzb1kDT_story.html?utm_term=.f36296200fd2).",explainlikeimfive,1
">  (Do your homework. I don't actually know anything about these organizations):

But how??? If I stick your post title into google and the answer isn't displayed on screen until the 4th result. Should I read that but not the first 3, how does this work. ",explainlikeimfive,1
😂,explainlikeimfive,1
"Ex-formulator at Mu$cleTech here---niacin flush (https://www.reddit.com/r/explainlikeimfive/comments/2sbfyy/eli5_what_happens_during_a_niacin_flush_is_it/) was dosed at 10-15X daily req so ppl would 'know/see the supp was working.""",explainlikeimfive,1
Signed pieces of paper,explainlikeimfive,1
Fuckin nerd,explainlikeimfive,1
Just threatened me though. ,explainlikeimfive,1
"Incinerated, or burnt in an open pit fire usually.  I've seen some large bonfires of marijuana before.  ",explainlikeimfive,1
Well the VP is confirmed as an inside man,explainlikeimfive,1
Ever hear of the pied piper?,explainlikeimfive,1
"I have tried to study about this, my overall feeling is that, no explanation really makes a lot of sense and it sounds like scientists are just making things up to explain the brain when they don't understand either.   😄😄😄",explainlikeimfive,1
Technology,explainlikeimfive,1
Shut the fuck up ,explainlikeimfive,1
"Because it's a different language, mate?",explainlikeimfive,1
"You're missing 'place'.

This is my work place, shortened  to this is my work when multiple locations are listed.

",explainlikeimfive,1
"This actually happens to me quite a bit (roughly 3-5 times a month). When I was younger I was pretty concerned about thinking I had some weird condition or super powers maybe, but I found out it's actually nothing that complex at all. After doing some sleep studies and being monitored a few times I've learned that what's happening is your actually falling asleep but your mind isn't on the same page as your body, so your mind just thinks your closing your eyes for a minute, but you fall asleep and once you enter REM sleep your mind forgets about it until your about to wake up then it tries to piece together what happened really fast and as a result of this you feel that dizzy, almost confused sensation for a few moments when you wake. ",explainlikeimfive,1
"based on the news post earlier 62% of Americans do not have even $1000 in savings, Mayb those under 30 will generally not have enough money to attempt to scam out of.",explainlikeimfive,1
Other,explainlikeimfive,1
"This is by far one of the best articles that I've ever read in my life, and talks about the neurological we explanation of itching, totally worth a read

http://www.newyorker.com/magazine/2008/06/30/the-itch",explainlikeimfive,1
Culture ,explainlikeimfive,1
