body,subreddit,moderated
No thanks!,gonewild,1
As a [26M] you are way hotter now then you were when you were younger and you're only gunna get hotter. Your sexy af,gonewild,1
Gorgeous view,gonewild,1
Gorgeous,gonewild,1
Amazingly beautiful and incredibly sexy lady ,gonewild,1
"Prof Swampie needs to have you come to after school tutoring at his apartment; so you can work on your F- grade, and see how hard you want to raise it to a C.",gonewild,1
I would love to turn you into my personal little cum slut fuck toy. ,gonewild,1
Whore,gonewild,1
I want your mouth sucking on my breast.,gonewild,1
Gorgeous,gonewild,1
"Very nice! You've got such a tight, sweet body :)",gonewild,1
"I think he got arrested for peeing on a little girls bike....No just kidding, it was a little boys bike",gonewild,1
"I probably live no where near you, but we could chat on kik. I've got a few posts up if they interest you.",gonewild,1
Mmmhmm! I can definitely work with that!,gonewild,1
Thank you! ☺️,gonewild,1
Link in comments for more,gonewild,1
Damn those are some awesome pants,gonewild,1
I'd like you to wear stockings while I use you.,gonewild,1
"Show u my hard luv!
Kik me at pleazureu62",gonewild,1
Kik - nicoledrianxoxo,gonewild,1
Can I Play ? Like to lick from the top down ;),gonewild,1
Still leaves a lot of room for speculation. The DSM-5 is hundreds of pages,gonewild,1
I'll up vote that every time. ,gonewild,1
Delicious!,gonewild,1
Love to find out ;),gonewild,1
Yeah its nice and hairy :) x,gonewild,1
Your tits look amazing in that shot. Would definitely motorboat ,gonewild,1
"I love, LOVE, being bitten ;p",gonewild,1
https://imgur.com/gallery/r2yQy,gonewild,1
That would be a pleasure!,gonewild,1
pm'me if you want to snapchat ,gonewild,1
"If your picture isn't edited.   Your left leg is fucked right up. 
And I didn't tell a stranger that their crotch looks like bad photoshop.   I told a stranger their bad photoshop on their crotch looked like bad photoshop.
You defensive response leads me to believe that you have something to hide. 
If you had really read into my response. It wasn't said to be negative.  
It was said to be body positive.
You're incredibly sexy. 
And you're right, lighting can cause some strange effects.   
That's not due to lighting though.",gonewild,1
Do you want a cookie for being a skanky whore? Tell us all about how your father raped you.,gonewild,1
You definitely make it better!,gonewild,1
"Hi fellas! I hope you enjoy! <3 There is much, much more on my subreddit!

/r/Peach_e_Keen",gonewild,1
"Small tits have their charm, I prefer this way, percet size for my mouth and hands :D  hope to see more of you soon girl!",gonewild,1
thank you,gonewild,1
Sexy butt,gonewild,1
Fuck off,gonewild,1
Beautiful! Woww😇,gonewild,1
His loss for being a douchebag. You are gorgeous! Very sexy!,gonewild,1
Thanks for being so sweet (:,gonewild,1
God I just wish I could get fucked right,gonewild,1
please verify for more!,gonewild,1
Most versions. Radio versions aren't real songs.,gonewild,1
Gorgeous,gonewild,1
"You forgot to say, ""Sir."" That's a paddlin'!",gonewild,1
"Fucking gross, keep working you nasty bitch.",gonewild,1
I'd be more interested than the cat is. ,gonewild,1
"Pm me to find out what I would do to that ""little"" booty ;)",gonewild,1
Funny thing...looking at you has made me very much ready to pop. ;),gonewild,1
Kitchener,gonewild,1
Mind if I join?,gonewild,1
Reckon i could hit it from here... should i try?,gonewild,1
Lucky daddy,gonewild,1
Added you on kik,gonewild,1
Sluts drink what they're told. ,gonewild,1
I'd like to help you out of those panties for starters ,gonewild,1
Haha good to know!,gonewild,1
Fucking-a those are impressive as hell.  WOW!,gonewild,1
"That clit is a big turn on, would suck it till you moan wet.",gonewild,1
Delicious ,gonewild,1
Stunning ,gonewild,1
Your body is so perfect. I wished you posted more. More of your breasts and feet too.,gonewild,1
If only Trump saw this might change his mind on the ban haha. You look fucking amazing :D,gonewild,1
Does it feel like grinding away on my face? ,gonewild,1
yes :),gonewild,1
Wish I was taking those pics ;),gonewild,1
Itching basic about your beauty! 😍,gonewild,1
Simply stunning,gonewild,1
What state are you in? I'll begin knocking on every dorm room now to find you 😍,gonewild,1
r/Europegonewild ,gonewild,1
Nope. Try r/gonemild,gonewild,1
I'm a girl :0,gonewild,1
aww!! perfect ass!! ,gonewild,1
wow where have u been all my life. add me on snapchat. fly1444,gonewild,1
Total package.,gonewild,1
"Would love a face down, ass up cheek spread!",gonewild,1
"I like it, A LOT :3",gonewild,1
"Please remember to gender-tag ([f], [m], [?] or [cd]) your posts (rule #6 in the sidebar). Untagged posts generate reports and get filtered - titles cannot be edited so it is best to delete and resubmit. Thanks!

If you have problems reposting a valid picture try verifying your email address with reddit at https://www.reddit.com/prefs/update/ ",gonewild,1
I think your resolution is to do anal. And I'll oblige you ,gonewild,1
You are absolutely more than welcome beautiful lady!,gonewild,1
Alright I won't do it again then. First and last post,gonewild,1
Ridiculous.,gonewild,1
lol as long as you are from massachusetts :P,gonewild,1
"Not being discovered per se, but rather the liberating feeling of putting it out there without any specific details as to who I am, where I live, etc. ",gonewild,1
http://popcorn-boxx.tumblr.com/,gonewild,1
Gorgeous! So damn sexy!,gonewild,1
Sweet gorgeous and delicious,gonewild,1
Your toes!🙌,gonewild,1
LIIIICCCCCKK,gonewild,1
For sure!,gonewild,1
Absofuckinglutly gorgeous,gonewild,1
"now that's just not fair. Cause I'd love to, but i can't. now I'm sad :(
",gonewild,1
[would love to see more stuff of her](http://www.modelsusa.life/?p=12),gonewild,1
what does the collar mean? I see every naked girl on the internet wearing that one these days,gonewild,1
"just wow
",gonewild,1
do you share your snapchat?,gonewild,1
"Please remember to gender-tag ([f], [m], [?] or [cd]) your posts (rule #6 in the sidebar). Untagged posts get auto-filtered, so you should delete and resubmit. Danka

If you have problems reposting a valid picture try verifying your email address with reddit at https://www.reddit.com/prefs/update/ ",gonewild,1
"Is that Mia? If so, won't tell anybody;)",gonewild,1
Please play with us do you have a kik https://m.imgur.com/a/JXJIW,gonewild,1
Happy Birthday gorgeous,gonewild,1
I just want the snapchat 😉,gonewild,1
When you find this 'real' cock make sure you post it ,gonewild,1
"Properly, like you've never managed to do",gonewild,1
They definitely deserve to be free,gonewild,1
Snapchat! ,gonewild,1
"The last thing Murica Rednecks need are crotch fireworks!  :). :) ..... It could get bad. 


And more power to you for bringing skittles into our naked time. Whatever makes you happy :).  But can we please pick out the yellow ones?",gonewild,1
"I hope you realize this is some fat hairy homo that's catfishing you all lol 

https://www.tineye.com/search/1cdf8059f74346d18c6b425418cd6040f8d6239b/",gonewild,1
"You didn't get a single upvote on part one, what makes you think anyone wants this?",gonewild,1
"Red,  I'm still madly in love with you. I love your snatch patch. It looks fantastic!  Your body looks like you may have lost 8-10 lbs. Did you. Thx for sharing Red. Cheers!",gonewild,1
Wow,gonewild,1
Id love to if you had kik,gonewild,1
I wish I were there with you...,gonewild,1
Very sexy! Gorgeous pussy!,gonewild,1
[panties! Glorious panties!] (http://stream1.gifsoup.com/view5/2058342/panties-glorious-panties-o.gif),gonewild,1
No she's not ? Lol look at her other posts. It's just the angle of the photo and the tendons being weird ,gonewild,1
That mouth looks like a wonderful place for a cock,gonewild,1
Interested :),gonewild,1
Sweet gorgeous perfection ,gonewild,1
Looking sexy in that flannel!,gonewild,1
I think I want to shove things up your cunt. I'll start with my tongue.,gonewild,1
I apparently have the wrong friends on snapchat.,gonewild,1
Just pm me how you want it :),gonewild,1
I've got some of my wife,gonewild,1
Agreed. Peeeeefect,gonewild,1
KiK - PulpVictory,gonewild,1
Love your sexy one-piece swimsuit!,gonewild,1
Why would anyone be mean. thanks for the look at what you get to experience. I don't see any part of her that i would not put in my mouth.. (hope that is not to risque),gonewild,0
"What a tease! One of the sexiest pics I've ever seen on here. Love the hair, the freckles are adorably sexy, and the sideboob has me craving more. ",gonewild,0
"Great, When can I dive in ?",gonewild,0
It's finally here!,gonewild,0
Thank you. ,gonewild,0
[removed],gonewild,0
"Very, very nice pussy.",gonewild,0
"Naughty, I love it🍆",gonewild,0
Looks like a perfect rod to ride!!,gonewild,0
Whatever may be the reason..THanks for posting..do post more..:),gonewild,0
"Hell no, keep the nighty on...spread your legs and tease",gonewild,0
Could be my wife's twin! Stunning!,gonewild,0
Happy birthday! It's painful waiting to see more of you ! ,gonewild,0
Nice body...firm boobs...,gonewild,0
Oh my. You look so sexy. Allow me to help you with your problem. That okay? ,gonewild,0
"normally i would say with, but without looks way better. ",gonewild,0
I would love to give you all the attention your heart desires.,gonewild,0
[removed],gonewild,0
like where are your ancestors from? Germany anything from Europe? latin America? Africa? ,gonewild,0
http://i.imgur.com/kxWei6m.jpg,gonewild,0
Damn hot,gonewild,0
I'd love to help. Might have to pull on your hair though. ,gonewild,0
"What's rent like in your neighbourhood? Whatever the cost, seems worth it for the view!! ",gonewild,0
Beautiful butt. Yay. ,gonewild,0
"Absolutely gorgeous, would love to Join you ;)",gonewild,0
Spread them cheeks baby!!,gonewild,0
I love to plug my tongue in your ass,gonewild,0
What would you like ?,gonewild,0
"In your case I suggest all days are for being naked, wild &amp; peachy",gonewild,0
"Beautiful body, hot sexy ass too",gonewild,0
[deleted],gonewild,0
"This was a stolen image the last time you posted it, and it still is a stolen image. ",gonewild,0
Very sexy,gonewild,0
thanks :D,gonewild,0
Gorgeous,gonewild,0
Damn! Only a slightly open mouth would've made this better.,gonewild,0
I could stare at that body all day,gonewild,0
Was I in it?,gonewild,0
Bambi looking sexy. ,gonewild,0
"I have the boring guy version of that shirt, lol. Did you get it from the tour they had with Kool and the Gang? It was dope.",gonewild,0
[deleted],gonewild,0
I'll have to post another album showing off my halloween panties when i get them. ,gonewild,0
[deleted],gonewild,0
Very cute titts,gonewild,0
I see your sweet little pussy😍! I wonder what it tastes like. ,gonewild,0
[removed],gonewild,0
Oh yeah! all of you!,gonewild,0
You definitely won't have this problem very often. Not by what I see.,gonewild,0
No but I'm a YUGE Leafs fan and watched!!,gonewild,0
"Thanks, you too!",gonewild,0
Ill clean ur room for u if i can help out with step 1 ,gonewild,0
"Please, amazing pic",gonewild,0
lol..   well i'm kind of imagining this pepe straddling my face right now...   but i know what your saying..    ;),gonewild,0
[deleted],gonewild,0
Fuuuuuuuu that simp! :drool:,gonewild,0
Fuck yes!!!!!!!! That's hot as fuck!!,gonewild,0
Yummy. What size are they?,gonewild,0
how far does it feel?,gonewild,0
=Awesomeness looking great babe keep that phone busy taking pics,gonewild,0
"It's the squeeze at the end that really gets me, that looks like a lot of fun to do!",gonewild,0
"I would like to schedule one, his loss ",gonewild,0
"No way, I'll have to go sometime!
Love the single piercing",gonewild,0
DAYUM!! That cucumber got violated! In a good way.,gonewild,0
Good lord. That lip bite is killing me! ,gonewild,0
Wow😻,gonewild,0
I love seeing you filled up like that.,gonewild,0
This thread just keeps getting better and better.,gonewild,0
I look forward to more if it happens :),gonewild,0
Oh! Interesting observation!,gonewild,0
You have a purty mouth... ,gonewild,0
Hello kitty,gonewild,0
[deleted],gonewild,0
Perfection!!!,gonewild,0
"Your sexy, we need a back view",gonewild,0
hot as fuck,gonewild,0
"You need 4 things for a Grand Slam, tsk.",gonewild,0
Delicious,gonewild,0
"I think you very well may just have the best ass on Reddit, in addition to the rest of your body which is amazing

[it seriously had me like](https://www.youtube.com/watch?v=95SYdjRVCR0
)

",gonewild,0
Great view ! Like to do more that look ;),gonewild,0
Certified delicious,gonewild,0
Mmm so hot. Let's play together. ,gonewild,0
Can you help with my laundry?,gonewild,0
[deleted],gonewild,0
The best movie I seen ,gonewild,0
Pre or post toothbrush?,gonewild,0
"Your body is phenomenal, and love the bush! Thanks for sharing :-)",gonewild,0
[deleted],gonewild,0
Damn you're sexy!,gonewild,0
"Love the way your mouth is begging for a hard, hot, cock",gonewild,0
beautiful face!!! ,gonewild,0
Love your bush!,gonewild,0
"God, that was really hot.",gonewild,0
  ,gonewild,0
[deleted],gonewild,0
damn you look good! hot figure! and that smirk on your face is to die for! ;),gonewild,0
You can have my hands and anything else you want,gonewild,0
"Wao, great,",gonewild,0
Your so welcome!,gonewild,0
Just grind? ,gonewild,0
Softer from the inside?,gonewild,0
Not going to argue with you,gonewild,0
Well hello there and happy birthday! ,gonewild,0
more of your glorious ass please!!!!!,gonewild,0
I'd gladly volunteer to help you out,gonewild,0
Oh wow great look! Would you spread ur cheeks for us,gonewild,0
Glitter is the herpes of the craft world. ,gonewild,0
I'll give you two hands.,gonewild,0
You could leave them in my face ,gonewild,0
What dreams are made of,gonewild,0
Wow that body tho 😍,gonewild,0
:D,gonewild,0
 Not much beats this photo,gonewild,0
Thanks for sharing :),gonewild,0
Amazing ,gonewild,0
"holy hell, you are wonderfully sexy!
",gonewild,0
Great tits... ,gonewild,0
Quality ignored. Girl appreciated.,gonewild,0
[deleted],gonewild,0
Sexy asf!! Show More?,gonewild,0
Super,gonewild,0
Only inappropriate if you didn't share with the bar ;),gonewild,0
No pics of you cleaning your room?,gonewild,0
Holy shit. So fucking hot.,gonewild,0
[removed],gonewild,0
"A fit blonde chick in fitness gear being deepthroated by husband, gif would be appreciated!",gonewild,0
Someone needs spanked for showing off,gonewild,0
Okay:)-,gonewild,0
Holy shit your pussy looks so incredibly tight...damn.,gonewild,0
You look so innocent and tight..,gonewild,0
Oh like some Foxy Cleopatra!?,gonewild,0
"&gt; The first rule about r/gonewild18 is TELL EVERYONE ABOUT r/gonewild18.

Man, I wish people would've told me about that sub sooner!",gonewild,0
"Any guy would be lucky to have you, amazing body ;)",gonewild,0
Wowzers. ,gonewild,0
Oh my! You look fun!,gonewild,0
oh,gonewild,0
I'd rather fall asleep inside of you ,gonewild,0
[deleted],gonewild,0
Great... just after taking a bath now I see this... 😶🤗,gonewild,0
[deleted],gonewild,0
"With a mouth like that, you'll get any guy you want.",gonewild,0
I think it will look great in any,gonewild,0
Amazing body thank you for posting can't wait to see more! ,gonewild,0
God damn that's a thing of beauty...,gonewild,0
Wow you look fucking amazing ,gonewild,0
Yummy,gonewild,0
Hot hot hot,gonewild,0
Them buns need a glazing ,gonewild,0
"Sexxy Slut!!,I wanna fuck!",gonewild,0
Sit on my face.,gonewild,0
You're one of the most beautiful woman on reddit. ,gonewild,0
I can't believe you've done this,gonewild,0
Fucking hot,gonewild,0
Gorgeous body baby,gonewild,0
"Nice pics, but does anyone know why sometimes images from imgur.com get displayed on the reddit comments and sometimes they don't?",gonewild,0
I like the patch.  You have a fantastic looking pussy!,gonewild,0
I wouldn't  kick you out of bed for eating crackers,gonewild,0
Have fun....you'll be just fine :),gonewild,0
I want to fuck you bad,gonewild,0
Wow...just wow!,gonewild,0
[deleted],gonewild,0
Nice lips! Yum!,gonewild,0
you're absolutely beautiful! thanks for sharing :),gonewild,0
Stop playing with my dick emotions ,gonewild,0
[deleted],gonewild,0
Still looking Hot in cheap lingerie! Hope He sees this.,gonewild,0
"Wow, I want to (f)uck so bad",gonewild,0
Anything of your incredible body especially that sweet ass,gonewild,0
"Can't see it from this pic.... but, if it makes you feel better about yourself, then absolutely. ",gonewild,0
[removed],gonewild,0
[deleted],gonewild,0
Absolutely fucking perfect. ,gonewild,0
You look great,gonewild,0
I have the same suction cup dildo! It's SO great isn't it? You're really sexy by the way! :),gonewild,0
Don't have to ask me twice. Let's wrap those tits around my cock. ,gonewild,0
( . )( . ) &lt;3,gonewild,0
#YES,gonewild,0
[deleted],gonewild,0
"Nonono fuck me
",gonewild,0
Love puffy nipples!!!!!!,gonewild,0
"Makes me wish I was at that lake, you're goddamn stunning! ",gonewild,0
That body and user name makes me want to science the shit out of you...  I love it lol.,gonewild,0
That's a great looking ass. Spankalicious ,gonewild,0
"I'd like to use you in your panties, is that the same?",gonewild,0
Total awesomeness!,gonewild,0
Absofreakinlutely ,gonewild,0
Oh I definitely missed ya! Welcome back(:,gonewild,0
[deleted],gonewild,0
I'd love to spend a lazy afternoon lounging around with you,gonewild,0
"Nice,",gonewild,0
"very good girl, deserves a gem",gonewild,0
Sexy.  Love the panties,gonewild,0
"I will, please more",gonewild,0
dat hourglass.,gonewild,0
That would be fun.  :3,gonewild,0
Wow I can't resist that sweet look...you have got me long and hard...,gonewild,0
I didn't know that I did before I saw this picture!,gonewild,0
That's a Cubs shirt!,gonewild,0
Sweet gorgeous perfection,gonewild,0
Looking good. ,gonewild,0
Wow... you are hot as hell! The pure sight of your tits makes my pants explode! Gorgeous!!!!,gonewild,0
I'll comment on your gorgeous behind all day long then ;),gonewild,0
Simply perfect!,gonewild,0
"My tongue doesn't *need* guidance, but it's still nice to have in the dark...",gonewild,0
Squats and deadlifts and hip thrusts. My ass is my strongest muscles!,gonewild,0
I'm definitely a fan,gonewild,0
JUST came.,gonewild,0
Wow. Just... stunning ,gonewild,0
me please :p,gonewild,0
Gota love Mrs.Gault. just wish it was longer...,gonewild,0
Crikey that's bonza,gonewild,0
I really want to eat that ,gonewild,0
jump on ;),gonewild,0
More please!,gonewild,0
Fatty??,gonewild,0
Fffffffffuck ,gonewild,0
Sexy in and out of your clothes,gonewild,0
"I'm unsure how flattering this will sound coming out, but you've got the kind of body warlords in the early days of civilization would demand whenever they conquered a nation. ""Bring me Amadani, the great beauty!"" the Khans would say. ",gonewild,0
[deleted],gonewild,0
social experiment. But i need someone to star in it,gonewild,0
those are some grade a tits,gonewild,0
Indeed,gonewild,0
[deleted],gonewild,0
[deleted],gonewild,0
"Love those sexy panties, they show off your perfect ass and pussy perfectly ;)",gonewild,0
That is lovely and deserves a round of applause!,gonewild,0
Is that a rhetorical question?,gonewild,0
Mommy looks good !,gonewild,0
Damn sexy! Id love to taste that gorgeous pussy.,gonewild,0
Impressive. And yet so sexy ,gonewild,0
[deleted],gonewild,0
Beautiful tight body ,gonewild,0
Really pretty fucking amazing,gonewild,0
I would love one :) I've never actually gotten a tribute ,gonewild,0
You look great either way :) ,gonewild,0
"I believe the movie line that best fits is ""My God, it's full of stars.""",gonewild,0
Can't get much better than that. Beautiful,gonewild,0
I want to pull on those pig tails while I fuck you up your sexy ass,gonewild,0
Perfect pussy lips,gonewild,0
hey beauty :),gonewild,0
[deleted],gonewild,0
You look like you'd be a good little girl for me.,gonewild,0
Tease please,gonewild,0
"Well Miss Jesica, I Will need to asses the back as well in order to form a complete judgement..",gonewild,0
So. Insanely. Hot. ,gonewild,0
Lol no I haven't. But thank you xo,gonewild,0
Hot hot please keep posting 🍆💥🍆,gonewild,0
[deleted],gonewild,0
[deleted],gonewild,0
You body is incredible! You need to do a photo shoot to celebrate brady's return next week. ,gonewild,0
Hot as fuck,gonewild,0
r/braceyourselfforsexiness maybe?,gonewild,0
"Amazing body, I love your pussy",gonewild,0
Drive a nice car and look younger than you really are - that's what works for me.,gonewild,0
Haha thanks! ,gonewild,0
"Pretty hot, but such a short vid.

Translation: More please.",gonewild,0
Love that sexy ass ;),gonewild,0
[deleted],gonewild,0
Uhh... fuck yeah? :),gonewild,0
I think I want to see what's under those panties,gonewild,0
wow r those real?,gonewild,0
I'm into that ass. Looking forward to more of it (and you!).,gonewild,0
I would make a meal of you,gonewild,0
That cucumber is definitely a pickle now.,gonewild,0
"Yes, the answer is always yes ;)",gonewild,0
"OMFG those nipples are out of this world, I could play with those for hours xx 

This is an outstanding post, your ass looks amazing 😆",gonewild,0
"Perfection, nice ",gonewild,0
Hot damn!!  I'm hard!!,gonewild,0
[deleted],gonewild,0
"Holy Shit.

... This is life-changing.",gonewild,0
I can't wait for your next post! ;),gonewild,0
Not a chance ,gonewild,0
Wow what a sight to wake up to this morning! You are absolutely stunning... thank you,gonewild,0
"Happy birthday, birthday buddy! You were born on my 18th birthday... and now I feel like a total creep. ",gonewild,0
"Whoever told you that, listen to tyen again.",gonewild,0
Outstanding. Thank you. ,gonewild,0
Glad you're ok xx,gonewild,0
Beautiful :),gonewild,0
"You certainly would not want to show up the twenty somethings, that would dream of looking so good, gorgeous lady! ",gonewild,0
"Nope. The smaller the band, the bigger the cup has to be to compensate the same size boob. If I was a 38 band I'd be a D. I'm a 30 band.",gonewild,0
"Yes, please.",gonewild,0
You look delicious,gonewild,0
"Everyone is sick of seeing this exact same cock pic, loser",gonewild,0
To each Thier own I always say :),gonewild,0
Fuck that's sexy,gonewild,0
Yes please. Can I taste it?,gonewild,0
"Jesus, this is probably an odd compliment, but your tongue got me hard instantly. Your mouth is perfect.",gonewild,0
Gorgeous,gonewild,0
Verified!  Your flair should update in a few minutes.  Please leave this ^post ^^up!,gonewild,0
i would love to! you're sexy!,gonewild,0
Perky and big? Your boobs are just amazing *cry*,gonewild,0
[removed],gonewild,0
"Wow, nice tits. ",gonewild,0
Love to see more!,gonewild,0
[deleted],gonewild,0
Made my heart skip a beat.  Beautiful.,gonewild,0
"She's the super car of women's 

Wish she was my woman

😍😍😍",gonewild,0
[removed],gonewild,0
You deserved it.,gonewild,0
"Mmm what a sexy ass, I hope you can be persuaded to post that video... ;)",gonewild,0
Leave your pussy swollen ,gonewild,0
They are a great size and shape,gonewild,0
You should celebrate very day. 🤓,gonewild,0
What a body! Wish we could use that hotel room properly. ,gonewild,0
[deleted],gonewild,0
My dream girl!,gonewild,0
Oh snap,gonewild,0
Beautiful. Love the bush too.  ,gonewild,0
Would always hold you by the throat while we fucked,gonewild,0
"Hi - mod here - this was auto spam filtered because it was posted before and you do not have the ~verified~ flair.  Please do a verification post to help confirm this is you.

Directions: http://www.reddit.com/r/gonewild/wiki/faq#wiki_verification   

Nudetorial (w/ pictures!): http://redd.it/1r93ig ",gonewild,0
"Wow.Gorgeous body.Those tits are awesome.I LUV your skin tone too.
Come work for me and you can wear any necklace you wish, and nothing else.",gonewild,0
Depends on the weather. Or was that more of a rhetorical question? I can never tell.,gonewild,0
thanks! :),gonewild,0
You should defiantly invest in a butt plug  ,gonewild,0
[deleted],gonewild,0
No fail here whatsoever,gonewild,0
"Yes, I do believe I would enjoy more of this.",gonewild,0
"Yes it is, but it's what's on the inside that shines here 😋",gonewild,0
is that your phone number?,gonewild,0
You can find ready and willing tits on /r/TributeMe ,gonewild,0
Sexy body!,gonewild,0
https://eroshare.com/izlx6exh,gonewild,0
"Good girl
",gonewild,0
[deleted],gonewild,0
Dead link.  :-(,gonewild,0
holy hell. are those real?,gonewild,0
[deleted],gonewild,0
There is now. Enjoy!,gonewild,0
"I would love too, any time any way!",gonewild,0
[deleted],gonewild,0
that's hot.,gonewild,0
"Love the post, but if you wake him up the right way, I'm sure he will be happy about it!",gonewild,0
"Now I can dream, you are amazing ",gonewild,0
That is a fact. Mine would be deep in there ,gonewild,0
"Don't listen to this guy. He doesn't know what he's talking about.

",gonewild,0
I'd mmm only here to enjoy and I enjoy you immensely ,gonewild,0
Nothing seems to be working out just fine,gonewild,0
[removed],gonewild,0
Oh wow killer body! Need to see more please,gonewild,0
OH MY GOD,gonewild,0
[removed],gonewild,0
"Front and center 6'4"" M/21/SoCal/muscular/lil brown and ready",gonewild,0
Beautiful. ,gonewild,0
You. Are. Perfect,gonewild,0
Perfect body,gonewild,0
"You would probably love me, playing with boobs and nipples is my favorite past time! Though with you it might be sexual torture ;)",gonewild,0
That's how I'd like to start my Sunday..,gonewild,0
