body,subreddit,moderated
This isn't public at all. ,gonewild,1
"You could wear a burlap sack for all I care, you're fine AF.",gonewild,1
[All I could think about](http://forgifs.com/gallery/d/197549-2/Dirty-bus-seat.gif),gonewild,1
"Well, we could watch a movie at the same time. You could have handfuls of boobs and skittles :)",gonewild,1
I think Incan see why it's his favorite. ,gonewild,1
Pretty fucking flexible,gonewild,1
Certified HOT HOT HOT,gonewild,1
It's beautiful.  Oddly enough I have a heart on too. 🍆,gonewild,1
I can tell you're gorgeous just from these tease pics. ,gonewild,1
On my cock,gonewild,1
Thats a dude,gonewild,1
"Yum, would love to suck those for you
",gonewild,1
It will be for 1 hour ,gonewild,1
That gape!,gonewild,1
Sure wish that was my cock!,gonewild,1
"awww, you're too beautiful to be shy",gonewild,1
I'd squirt on em.,gonewild,1
I definitely would love to eat your cookie! ,gonewild,1
:),gonewild,1
"I don't know, you tell me.",gonewild,1
Wow gorgeous,gonewild,1
All of the sweet messages I get! Someone even offered to buy me a toy! I've never owned a vibrator before... :3 kind of embarrassing,gonewild,1
naturally you should!,gonewild,1
so disgusting,gonewild,1
First with my tongue and then cock ,gonewild,1
ty dear!,gonewild,1
Certified delicious!,gonewild,1
Care for a second glazing?,gonewild,1
Oky fill me up a bucket of water and I'll give it a go.,gonewild,1
Please start posting at /r/ghostnipples ,gonewild,1
Haha thanks! ,gonewild,1
Every times somebody say [booty](https://www.youtube.com/watch?v=GbdflriheIM).,gonewild,1
Kik me; pleazureu62,gonewild,1
I think so too,gonewild,1
I am. where r u in wisc?,gonewild,1
[╥﹏╥](https://67.media.tumblr.com/d83156ceb0693bca9f05f71223c4e584/tumblr_o765u8M97W1vu768lo1_500.gif),gonewild,1
Mother Sucker you're sexy!,gonewild,1
That's not the only thing that is perfect,gonewild,1
Agreed! X10,gonewild,1
What did we miss out on? ,gonewild,1
You have the cutest arrangement of freckles I think I've ever seen.,gonewild,1
I have a title for you.  Sweet gorgeous and delicious,gonewild,1
hey...are you indian?...wanna kik?,gonewild,1
As you wish....,gonewild,1
😘😘,gonewild,1
a lot of ugly pussies in there tbh.  Yours is spectacular.,gonewild,1
"Hoes everywhere 

*<¦^ ] ",gonewild,1
"i didn't think id like nipple piercings, but wow you changed my mind",gonewild,1
"Please gender tag your posts (example -- [f], [m], [?] or [cd] -- rule #6 in the r/gonewild sidebar). Untagged posts generate reports and get filtered - titles cannot be edited so it is best to delete and resubmit. Danka

If you have problems reposting a valid picture try verifying your email address with reddit at https://www.reddit.com/prefs/update/ ",gonewild,1
"Please remember to gender-tag ([f], [m], [?] or [cd]) your posts (rule #6 in the sidebar). We can't add a tag afterwards - please delete and resubmit. Danka

If you have problems reposting a valid picture try verifying your email address with reddit at https://www.reddit.com/prefs/update/ ",gonewild,1
Kiks johndoeboy716,gonewild,1
I could fill it more ,gonewild,1
Wish that ass view was mine while you mount me ;),gonewild,1
I'd hit it ;),gonewild,1
Big Shiny Gender tag anyone? Read the fucking rules before posting.,gonewild,1
Thank you!(:,gonewild,1
"Jesus christ, those legs are so beautiful !!!",gonewild,1
"Hello! I have the video info! 
Just wanted to let you know the video is over 2 minutes.
*$25 for one video
*$40 for two videos

If interested please send the payment to-

Adumond@riverfrontmediaproductions.com

AND please be sure to check ""send to friends and family!!""

Thank You for your interest!! <3",gonewild,1
gorgeous tits m'lady,gonewild,1
156cm of heaven <3 ,gonewild,1
"Your ass, my tongue...for hours!
",gonewild,1
Sweet!  You ever had a tongue bath? :P,gonewild,1
http://youtu.be/jvTpEoi0tzE,gonewild,1
OK yes that angle looks great... But... I want to complement the photographer cause those are nicely shot.👌,gonewild,1
"That's probably a psychological issue you should have checked out. There's a name for it, but I don't remember what.",gonewild,1
I'm pretty sure the mods will make you repost with nudity in your verification post. Just a fair warning since I've seen it said many many times.,gonewild,1
We were just posting for fun.. don't care to go through the verified stuff.. and i kinda thought the title would indicate a guy and girl. ,gonewild,1
Love to see that in person ;),gonewild,1
anything for the queen,gonewild,1
Does he have an ass plug in while fucking u? ,gonewild,1
you have one of the greatest sets of nipples I have ever seen.,gonewild,1
Simply beautiful. The smile and the tits ;),gonewild,1
Amazingly beautiful ,gonewild,1
r/gonewildplus,gonewild,1
this is PM,gonewild,1
That IS a cum shot!  Amazing. Thanks for sharing!,gonewild,1
Yes that is the best. So much you can do when posed like that.,gonewild,1
This is what TAs are for?,gonewild,1
mouth ,gonewild,1
"Corporal punishment doesn't work.

https://www.psychologytoday.com/blog/feeling-our-way/201401/punishment-doesnt-work",gonewild,1
Absolutely gorgeous,gonewild,1
"
[I dont like it ! I love it !](http://www.gobrickhome.us/best-ph0t0s-ktty-prry-must-want-ee-1-5/)
",gonewild,1
"I don't think you understand how reddit works, sweetie. If you post a photo on reddit, other people can look at it and make comments on it. In fact, that's *exactly* what reddit is designed for. If you don't want negative comments on your asshole, don't post it online. ",gonewild,1
Artsy! Love the reflection...Pretty cold there?,gonewild,1
Me right now: http://www.youthareawesome.com/wp-content/uploads/2012/06/I-Volunteer.jpg,gonewild,1
Sure I'll help out of those clothes and into bed ,gonewild,1
Would love to hear you on [/r/gonewildaudio](http://www.reddit.com/r/gonewildaudio). You are very beautiful!  Please keep sharing! ,gonewild,1
http://writingworkshops14.files.wordpress.com/2014/04/2.gif,gonewild,1
"of course..

.. you post on reddit, where you a legion of humans worshiping that delicious body :P",gonewild,1
Wish I was a fly on the wall for that show. Dayum!,gonewild,1
holy crap its like a forest,gonewild,1
I like those piercings! And you're going commando? You might be up to some trouble...,gonewild,1
Mouth watering delicious perfection!,gonewild,1
"Please remember to gender-tag ([f], [m], [?] or [cd]) your posts (rule #6 in the sidebar). Untagged posts get auto-filtered, so you should delete and resubmit. Cheers

If you have problems reposting a valid picture try verifying your email address with reddit at https://www.reddit.com/prefs/update/ ",gonewild,1
Whoa! Those are really low prices for cheap undies! How do you like them? Have you tried their bras?,gonewild,1
"Help me fund them, and I promise you'll see them!",gonewild,1
"Your post has been rated: **8.5/10**

*Curious why you got this score?  Send this account a message with a link to the picture and I'll tell you.*",gonewild,1
Beautiful  cute and gorgeous;),gonewild,1
That rear pussy 😍😍,gonewild,1
Save A-ko 2k16. ,gonewild,1
woow nice body i love it !!,gonewild,1
"It blatant, but I would love to fuck that ass!",gonewild,1
nah,gonewild,1
I'd like to vote to see more. ,gonewild,1
Holy hell you are gorgeous!,gonewild,1
"https://scontent-iad3-1.xx.fbcdn.net/v/t1.0-9/fr/cp0/e15/q65/1933880_991688814234862_9005824741402741566_n.jpg?efg=eyJpIjoidCJ9&oh=154bdcc48a2e312b49f99d9f62a81f26&oe=579D2510


Not spam. It's a picture that says ""feed me and tell me I'm pretty.""  I had just saw it when flipping over to gw. Coincidence. .... I think not. Have a great day gorgeous!!",gonewild,1
"Hey, you finished that photo set too soon. Don't leave me hanging!",gonewild,1
Above an 8? Nope,gonewild,1
I adore your collar! :3,gonewild,1
Yes pls,gonewild,1
"GOD DAMN those thighs and that ass! I want to die from suffocation between those cheeks, be revived to suffocate again between those thighs!! [Holy shit!](http://gph.is/1qVcH0w)",gonewild,1
Amazing girl. PM me if you wana talk dirty,gonewild,1
[I got what you need.]( https://imgflip.com/readImage?iid=16884232),gonewild,1
What i would give to give you my seed,gonewild,1
"What snuck out? What are we talking about here? This subreddit is for posting nudes, can you please not post blank pictures! Thanks ",gonewild,1
That is one gorgeous looking pussy! 👅,gonewild,1
You should come play on kik. I'll show you how that little might shirt drives me crazy. Would love to see more of that perfect body. Privateentry. ,gonewild,1
"Does your ""wife"" know you are posting these?",gonewild,1
Nice and big... Just the way I like them. ,gonewild,1
Not even a chance.,gonewild,1
Can you take my dick in your tight pussy? ,gonewild,1
"I hate to break it to you all, but this is a repost.

[Proof](https://www.google.co.uk/search?tbs=sbi:AMhZZisNvNq7NQ797VJvcNuFODLaMGtntRsDRqIZmXH-Ug8R7WSuezjC6L4s7tkF5JO3Phufa0pS3xVNv4m4V-IMs_1oTpuPUhiXpmzEmBFBdNbx_1SKvxRJjnorAFH5xx60dwp2YpWy7icD0wWaSqycSveb-_1LbCWYZavwt-ORnfMPnN-zj7p11gVMYSqGYHKGMm6lAVEsFc8Tlg_1mYxmCqRcKMGqWbX8Je85tftr7DhJ5fhtOf-WEvBZqG5Kq58B6wjL7kywLYLWCrxxJAGIXZuyQzsOXetNGffdKjgtl0EJ0BC1qpOCgfa5-mFfAscg3HMXgKeRWxOQBXDBwyRvqw8KtK4lBnsMKOTGENIbvoAl-woqp-0lUqkpT7I70WjDOYSuAUlanumS55F_1s9siLCQGMr6MqeNfYMiqfklHsDFd6sQgiVCf6HT1Sh_1NTf3kO0LU2O7Jk-ZTODmSXIHXfxGqFlcWTf4lp3TcPn3qzuI6fufrL64O_1bxbdwkNXzG4W4E7uajuVbr98dVsLM_126bqvL6itrstgX1zR4D_1dDq6RFLWgktLyRfGBNWshdVer9dxMKzksujXLH49N-j-j_1ejwUVQZxKHQEksYn8UhzN7bTMTKx4TeNOe22rLfEvs4NLbD-uJBo7Vzh0FQ_1HsSxO8CwlQi3hk9HaiC3BTO80Y3kcxzv2lAgN6vSmBy32XzKu3b3bdjI-UxqByjIzLli9YNArassy8JpxZvzb-hmyA7VMHvJiKAx4TLtHs8nkeCmk6vTzhOTcxkRRtQ1lzNjeM0AZkS3-If63BAChoqYpiy_12dzxuY03aZkvrmUqO5LpHZ-sgRUr2fnuLysyImepQ56Osx1LXcRRs2dR2xYXyYYO7lb0HMwzcW0uUSsQB0OEpGnxwaMPrrhr-HMqa6cs499ko5DvJ0V0s3fXmwmvmDdy0DGdx6gwVkSUPk4esPTQSS5dQkrKTxaDG76fdMBk2itmEL-IK2bOsjSzXvWa7ybHCAEsyEyY3hIZgu4ivMdNRGLWYTAnrxcX5Q3vDci3D7Gige9yiaMvsvLNWnw4fAODA5VSeST3wTW7sD7s-ZSfV45r4V9TBkZDED8Ftjhs2YVgffZv4XE4kofOOhITi-SWi28sNevzkXjgQ6DCEF2yV-7yiehXKPsS6nxqiBn1SvBe5hNweaKhG4OPwwEQG0lDBClxLko0SGRvR2xhx-HtEbSj4UwCvCUpWD6_10i6KfkBydC9rO2DQ09LBr4DE-WCb5A7a9u8AYl8E5BCc3K-B1dRdmS2pstCUZPb4m6es4AHKHLiXfqyyCanmz3H_1BXsu7qLtWCTTYD7ON82Qf1xENhQ5mYnsm-A-AqdphcAWgRfh6s0PtsNCAyZcw_1AtLvu0woEKFPnvSSzz3M3oc9hj3KJkB_1UlitSy4Awf-ESb-_1J_1hw1RmBcOnwQruy2GCbhxT8iJbM0nw_10TEzDGW9u9tv8MzRAs1a-vnK59JA9L3eFCH4CZEDCkQhqj9ImE8ReCpUZ4626he4Is5K9UAyATH3a3rZm8CW1RhMXs5UXbOqK7vzYvah-d9mNY1OmPQzS2sOhDX0PqYI_1uzRORClyWZRnOGJx3l0y)

How I know:

The account sent me a message:

https://imgur.com/jAZhslg.jpg

Well for one, I had recently posted pics to some fitness subreddits, but on the other hand, I know to be skeptical of compliments over the Internet.",gonewild,1
http://24.media.tumblr.com/tumblr_lvy0dkoLWa1r5cbu6o1_500.gif,gonewild,1
Ahan Next post will be your Fvrt,gonewild,1
I would love to give you my opinion next time. Your man is lucky. ,gonewild,1
Mother of god!,gonewild,1
more here - http://imgur.com/a/JJ6r3,gonewild,1
Perfect view and position,gonewild,1
Yes,gonewild,1
Either way works ,gonewild,1
Depends. Do you like girls?,gonewild,1
Really can't blame ya,gonewild,1
"Yes, very much! 😍",gonewild,1
Sweet gorgeous perfection,gonewild,1
Those two words are my weakness.,gonewild,1
Ain't showing up here either ,gonewild,1
Nice aim,gonewild,1
I really hate Hobby Lobby. I can't believe anyone would want to shop there. But after looking at your photos. I totally want to visit Hobby Lobby and loiter in the aisles.,gonewild,1
All 3??,gonewild,1
That lip-bite should be registered as a deadly weapon.,gonewild,1
Lucky toy,gonewild,1
I'll have seconds please,gonewild,1
I agree ;),gonewild,1
"Pm for pm? 
http://imgur.com/u3VA6zr
Your absolutely beautiful  ",gonewild,1
🔥🔥🔥🔥🔥,gonewild,1
http://imgur.com/lTOU7Ke,gonewild,1
Those curves are incredible 😵😵,gonewild,1
"Yum, hold it just like that while I lick it",gonewild,1
I have a warm mouth,gonewild,1
Perhaps. We'll see as this is my first post.,gonewild,1
"Your last pic broke me up, need heal!",gonewild,1
"[Rock that dad bod](https://youtu.be/5E5hpURyMbY) 

Yes, I see the irony in posting a video from a church on this sub.. but it's pretty funny/cringey! ",gonewild,1
"Hi fellas! I hope you enjoy! <3 There is much, much more on my subreddit!

/r/Peach_e_Keen",gonewild,1
Yea actually!,gonewild,1
"She was like any other girl, only more so...

http://thoughtcatalog.com/emily-oconnell/2015/07/im-not-like-other-girls-because-other-girls-dont-exist/
",gonewild,1
Sure kik me: Gizmoneil ,gonewild,1
Don't listen to haters. Classy of classy.,gonewild,1
"713-297-1267
231-676-1176",gonewild,1
Hot body ,gonewild,1
You've always got me up! Thanks again for fulfilling my request earlier sweet cheeks 😉 ,gonewild,1
password?,gonewild,1
...Can I get a kiss too pleasee?,gonewild,1
So you are into Child porn? Because that girl on the picture is not more than 16 years old... ,gonewild,1
"quickly install Snapchat right now haha

",gonewild,1
WANT,gonewild,1
Glad this showed up twice now!,gonewild,1
I think this post is straight up the first time I've ever seen your teeth. ,gonewild,1
I think I can help you a bit,gonewild,1
"If you guys want more exclusive content, visit my subreddit, /r/Shakespeareangirlf",gonewild,1
Room for a lil bit of me?,gonewild,1
Absofuckinglutly mouth watering delicious!,gonewild,1
"Smiles the hottest part of the pic, even with that soaked puss",gonewild,1
Snapchat? ,gonewild,1
sure you got it what kind?  As long as you keep showing that ass of yours.,gonewild,1
And a gorgeous reflection,gonewild,1
Shit idk. She took her post down though. Kinda funny if you think about it. Put up all those post of you finger banging yourself and can't take some lite trolling.,gonewild,1
dibs,gonewild,1
mmm so sexy ;),gonewild,1
I would love to until I play with your sweet hairy pussy,gonewild,1
That would include me. ,gonewild,1
You definitely have us horny all times of the day!,gonewild,1
Only to heighten your pleasure,gonewild,1
A nice cock.  See my previous post,gonewild,1
Just simply stunning,gonewild,1
Mmm ;),gonewild,1
One of the nicest pussys I've seen,gonewild,1
Your call ;),gonewild,1
I'm sure you'll be seeing it soon ;),gonewild,1
"I wouldn't. I could find better things to spend $20,000 on than superficial things like fake tits and a tummy tuck.

Perhaps a college fund for one of my 3 children? Or a really memorable family vacation?",gonewild,1
New Zealand and you've just cut the rest of the flag off? Or the beautiful green and pleasant land of my fathers,gonewild,1
Hey all. Was bored and made a website for YogaPants. I would like your feedback on what I should add to it. http://www.yogafap.com/,gonewild,1
http://i.imgur.com/0A9VP9L.png,gonewild,1
The cigarette ruined it. ,gonewild,1
"Oh no, this is just a few pics from last night. We have some other post from then to(:",gonewild,1
You do it quite well. You might also check out /r/schoolgirlsgonewild,gonewild,1
You have those gd hips.,gonewild,1
I would love to dump as many loads in you as i could. Need to see more ass because thats where i would unload in you,gonewild,1
Lol fatty,gonewild,1
"Damn, wish I was him. Any way for me to see some more, 😜",gonewild,1
"I would nerf that so hard, there would be no Emergency Escape from my Ult",gonewild,1
Thanks!,gonewild,1
Hot and sexy pics. You always bare down there?,gonewild,1
Never let a relationship come between us again! ,gonewild,1
"Love the last part. 
",gonewild,1
Holy fucking shit.,gonewild,1
sure!,gonewild,1
Can my 🍆 💦 all over them?,gonewild,1
I would love to pull it out with my teeth!,gonewild,1
1,gonewild,1
"Please
Write 
Me
",gonewild,1
Stay in bed and get horny💦,gonewild,1
"I'd love to! Hard, deep, and all day long sound good to you? ;)",gonewild,1
PM your kik,gonewild,1
God fucking abuse me. I'd love that ,gonewild,1
I'll tug on yours if you tug on mine 😁,gonewild,1
Wow... are you on snapchat?,gonewild,1
nah,gonewild,1
You definitely make it look good ,gonewild,1
wow,gonewild,1
I bet you are just as sweet!,gonewild,1
More like full palm it then fuck it ,gonewild,1
[would love to see more stuff of her](http://www.oilflush.life/2017/01/26/1/),gonewild,1
I want you to spread them legs and let me eat that pussy,gonewild,1
"I am interested. I love to subscribe to your snapchat too,  if that's ever becomes an option. Thanks. :) 
",gonewild,1
That tight little asshole of course ,gonewild,1
Thx all for your comments! :) I'm glad you like it ,gonewild,1
"[It's getting HOT in here](http://66.media.tumblr.com/bf11f967f32f93500e6d5168d40d8b21/tumblr_mvp31gkDMe1rtbisno3_r1_250.gif), the dragon said. Less polygon than the original but quite as hot.",gonewild,1
"please post more of that beautiful face ! <3
",gonewild,1
Don't ever stop! 😍,gonewild,1
"Hello! I have the video info! 
Just wanted to let you know the video is over 2 minutes.
*$25 for one video
*$40 for two videos

If interested please send the payment to-

Adumond@riverfrontmediaproductions.com

AND please be sure to check ""send to friends and family!!""

Thank You for your interest!! <3",gonewild,1
All 3 would make me three time more happier... :),gonewild,1
Hello my lovely? How are you?,gonewild,1
Good morning to you as well from south of the border!,gonewild,1
[Me too](https://i.reddituploads.com/748e3ed25aa14b69a5c83e8c4d0fc9b0?fit=max&h=1536&w=1536&s=e789cad9c88520a4a8987003e58b581e),gonewild,1
Omg I must be strong and sexy XD,gonewild,1
❤🍑,gonewild,1
What's it like to have such a great body to play with??,gonewild,1
Nah,gonewild,1
Stunning,gonewild,1
"Wow, would kill to hear a audio of that!",gonewild,1
"Honestly just about every part. Look closely at it, it has a really weird look to it Cuz she has assisted a bunch of shit. Look at her old pics, some of the recent ones are crazy obvious. She almost looks like a cartoon in some of them. Look at her nips in this picture, i mean it's a weak example i guess but they literally look like they were cut n pasted there from someone else's picture or something. Maybe she used Photoshop to reduce the size cuz she's self conscious I'm not sure but just take a good look at the picture n them look at other pictures, it doesn't look even remotely natural",gonewild,1
I think I saw you at the library. ,gonewild,1
INCREDIBLE.,gonewild,1
one day she will booty spread.....one day....,gonewild,1
My dick would be honored,gonewild,1
"Love love love!
",gonewild,1
Are you in Omaha?,gonewild,1
Nope! Never even been to Pennsylvania.,gonewild,1
Mouth watering delicious perfection!,gonewild,1
"I'm here...Buffalo, one night only for work. ",gonewild,1
Amazing pussy! So damn hot!,gonewild,1
OoOo..,gonewild,1
Foxy! ,gonewild,1
I would not complain if I got snowed in for a few days with you...,gonewild,1
Those smelly holes need to be covered in cum,gonewild,1
Perfect view and position of perfection!,gonewild,1
Fucking gorgeous ❤️❤️check kik?,gonewild,1
"That sounds really hot, actually;)",gonewild,1
It's like your areola got sunburnt,gonewild,1
thank u so much!,gonewild,1
Am I not allowed to get people's opinions on my body didn't ask for weight classification ,gonewild,1
My cock could abuse that whole so much better than your fingers. ,gonewild,1
Yes I am ,gonewild,1
Will you show us more of your pussy?,gonewild,1
Fake: http://www.debonairblog.com/blog/2012/10/_twelfth_batch_of_awesome.html,gonewild,1
I want to spank that ass so hard! 👋,gonewild,1
Were you really? What have you written for?,gonewild,1
"Young lady, where have you been?  You have absolutely no reason to feel self-conscience but I would love to work with you. What is it about a beautiful young lady in only open zipped jeans that causes men to get wood?",gonewild,1
I saw your boner. God damn is it small!,gonewild,1
Yes please sexy,gonewild,1
It looks like you wiped your ass with poison ivy.,gonewild,1
Let me finish what u started ,gonewild,1
Pm me and I'll show you;),gonewild,1
Very much so,gonewild,1
Fucking delicious ,gonewild,1
Where were girls like you when i was 18. Make a mans mouth water.,gonewild,1
"Please remember to gender-tag ([f], [m], [?] or [cd]) your posts (rule #6 in the sidebar). Untagged posts generate reports and get filtered - titles cannot be edited so it is best to delete and resubmit. Thanks!

If you have problems reposting a valid picture try verifying your email address with reddit at https://www.reddit.com/prefs/update/ ",gonewild,1
I'll take the compliment! :),gonewild,1
Holy hell...yes more!!!!  Good Lord yes please!,gonewild,1
I can verify you ;),gonewild,1
I've gone naked outside,gonewild,1
That's a tough one. I'd go for whichever made you the wettest ;) although I just love your seductive smirk and lip bite 😈😛,gonewild,1
I can hardly remembering being one.,gonewild,1
"
[I like the shape of her](http://www.gobrickhomes.us/best-ph0t0s-ktty-prry-must-want-ee-5-5/)
",gonewild,1
Mission accomplished!  Lovey nips you have my dear. ,gonewild,1
Maybe because your such a shameless cock hungry slut,gonewild,1
How much do you charge? ;),gonewild,1
Damn girl let me get that snapchat name,gonewild,1
Why aren't you fucking them,gonewild,1
"i think the lyrics in this sum it up pretty well:

https://www.youtube.com/watch?v=B97e2XXxKdM",gonewild,1
Pm me,gonewild,1
"You look angry, like you just woke up, and sexy AS FUCK. Unfortunately I see you're probably not in the US.",gonewild,1
I would go everywhere too ;),gonewild,1
"so does my dick. want to trade?
",gonewild,1
R u on kik or skype?,gonewild,1
:) You're welcome!,gonewild,1
You da bomb,gonewild,1
"Handing out treats early, I see. ",gonewild,1
That puckered hole looks like a big bullseye!,gonewild,1
"That sigh going like... ""Okay, let's do this"". That was amazing.",gonewild,1
Gladly,gonewild,1
Mouth watering delicious delight,gonewild,1
Goddamn I'd love to meet your sexy married ass!!!,gonewild,1
Simply devine,gonewild,1
We will do one. In the mean time our Snapchat is ok21154,gonewild,1
"What's your snapchat user name?
",gonewild,1
Verify?,gonewild,1
Still have it? You'd be constantly getting it.,gonewild,1
well..to be honest...lunch was always my favorite..so what's for dinner? ;),gonewild,1
All I see is a basic ass white girl face & body lol. Nothing special. Move along. ,gonewild,1
"Beautiful!  You should post this over at /r/goneerotic too.  I mean, since your such a karma whore. ;)",gonewild,1
Found a nude on the beach ,gonewild,1
"Id love to add you on Kik, I've a few pics of my own ;]",gonewild,1
asshole...good form of birth control ,gonewild,1
Why stop posting your sweet delicious body?,gonewild,1
What about fucking in the little dress?😛,gonewild,1
That is temptation hill at best. Mound might be better.,gonewild,1
Such a beauty,gonewild,1
"One showing camel toe in the one-piece from this picture, please. Hope your day is going well so far : )",gonewild,1
"With a body like that in the room, it'd have to be a sinful life, I know I couldn't resist the temptation that is that beautiful body ",gonewild,1
I would fuck you and cover you with a my huge load where ever you want it. https://eroshare.com/7znrfxm5 tell me where you'd want it sweetheart ,gonewild,1
Didnt realize it said male. There a ton of other subs to post this in dude. Your prob going to get picked on for having a pencil fick and your chubby fyi. Just want you toxget positive feedback from good looking women,gonewild,1
They are absolutely spectacular,gonewild,1
Love it! Hope there's a second time :),gonewild,1
32B??,gonewild,1
Whats CD ? What tag should i use? F ?,gonewild,1
Daaaaaamn... so hot! Gorgeous! Amazing tits and beautiful pussy!,gonewild,1
That is one hot pussy!,gonewild,1
I mean...damn,gonewild,1
Just not with anyone who isn't her husband ;),gonewild,1
Gorgeous,gonewild,1
"HELLO DEAR I SEE U ARE USING THE SHEETS AND LINENS I GOT U FOR YOUR BIRTHDAY THATS MY GIRL

-XOXO GRAN",gonewild,1
Fucking fantASStic!,gonewild,1
I would love to eat you out!,gonewild,1
Hope it's not your last!,gonewild,1
Gorgeous,gonewild,1
"VISIT US OFTEN, PLEASE!  YOU HAVE A BEAUTIFUL BODY. CHEERS!",gonewild,1
"hey, hey,
I dare to post here for the first time. be gentle and tell me what you think ...
thanks
fiver",gonewild,1
I bet your farts smell amazing as hell,gonewild,1
Clean your house,gonewild,1
"Thank you, I like to think so, she's definitely the one",gonewild,1
https://youtu.be/nTCAu14N_WM ⬅ This. This is me on gw. Lol. ,gonewild,1
Either would do just fine !,gonewild,1
To love getting fucked in the ass ,gonewild,1
Delicious ,gonewild,1
"Destroy you!
",gonewild,1
Hell yea,gonewild,1
Would they like a lick as well?,gonewild,1
Do you have Kik ? Pm me ,gonewild,1
First my tongue and then cock!,gonewild,1
Not at all!,gonewild,1
That's always a good thing! ,gonewild,1
Sexy AND smart? (username) What more could a guy ask for??,gonewild,1
🤘🏽,gonewild,1
Damn baby wanna snapchat?,gonewild,1
Happy Cake Day gorgeous ,gonewild,1
Thank you!,gonewild,1
What a fine morning it would be to wake up next to you,gonewild,1
YUMMILICIOUS,gonewild,1
I'd love to see more. Got a snapchat?,gonewild,1
no,gonewild,1
I like Arby's too. ,gonewild,1
Ur very beautiful and I'm a white male 30 do u have kik,gonewild,1
only if you are lucky :P,gonewild,1
"You start very strong, pretty eyes, good body, beautiful lips ...",gonewild,1
Tits 🍒,gonewild,1
Hard to ignore gorgeous perfection,gonewild,1
Simply stunning,gonewild,1
http://giphy.com/gifs/saturday-night-live-jim-carrey-snl40-344jgRBhEgMaQ,gonewild,1
"Come sit on me 
https://i.imgur.com/0WV6UoV.jpg",gonewild,1
"ok, lets go ;) kik or snapchat?",gonewild,1
Pure gorgeous perfection ,gonewild,1
