body,subreddit,moderated
Those panties are so sexy on you.  Would love to see more of them.  Maybe a front view or a spread view.  Pregnant is very sexy,gonewild,0
[removed],gonewild,0
[deleted],gonewild,0
[deleted],gonewild,0
[deleted],gonewild,0
I would love to feel it pulsing around my shaft.,gonewild,0
Yay for the new 📱!,gonewild,0
[deleted],gonewild,0
[removed],gonewild,0
That picture's so clear it could be in a biology book,gonewild,0
[removed],gonewild,0
[removed],gonewild,0
Well my cock certainly thinks so! Goddamn!,gonewild,0
Aw thanks :),gonewild,0
"Oiled, spread and anticipatory. Slurp. ;)",gonewild,0
[deleted],gonewild,0
Wonderful! Great smile. Beautiful figure,gonewild,0
I have been hoping you'd post this as a video for so long now. Thank you so much! &lt;3 so hot,gonewild,0
Only if I can bury my face in your backside. ,gonewild,0
I love it !,gonewild,0
"Wao, super sexy",gonewild,0
Very beautiful body!,gonewild,0
"Take off or keep on whatever you want, but always leave thigh-highs and heels!",gonewild,0
Need some help with your current task? Happy to lend a hand/mouth/cock ;),gonewild,0
You look absolutely fantastic. Looks like everyone's in the position they need to be in.,gonewild,0
"&gt; For dating, 1-on-1, soulmates, friends, and hook-ups please go to /r/r4r.

This sub is for exhibitionism, not hook-ups.  City mentions lead to reports/spam filtering",gonewild,0
Oh my! 😍,gonewild,0
Damn this pics are hot. Love the nipple piercing,gonewild,0
Same perfect ass,gonewild,0
"its actually a bite mark

i bruise very easily so even light biting makes for some impressive reminders ;)",gonewild,0
Dont Send u r ass on reedit !!,gonewild,0
"I'd love to feel you on a Saturday, or any other day for that matter",gonewild,0
Stunning,gonewild,0
You've got me drooling...,gonewild,0
"Chillin' out, maxin, relaxin' all cool and shootin' some b ball outsida school...",gonewild,0
I think you're right,gonewild,0
My boys are doing to the chiefs what I'd like to do to you.,gonewild,0
"That is one very nice looking pussy. And I've seen a lot of pussies, I'm pretty much what you would call a pussy expert",gonewild,0
Lovely rack,gonewild,0
"By all means, c'mon over to /r/gonewild18 for more birthday wishes!",gonewild,0
That looks awesome. I'd lick on it,gonewild,0
So much yes! Very sexy! ,gonewild,0
[removed],gonewild,0
[deleted],gonewild,0
[deleted],gonewild,0
Very beautiful,gonewild,0
May the best team win!  Cheers! ,gonewild,0
Thanks!:),gonewild,0
"Love those nipples, other nipples should be envious of those nipples ",gonewild,0
I'd love to - you're just my type,gonewild,0
"Blue is my favorite color, you are amazing",gonewild,0
"I would lick your pussy and those feet... oh my god, I would love to suck your toes and massage your feet!",gonewild,0
Has anyone been asking to see your boobs? I'd love to!,gonewild,0
Tell me about it.,gonewild,0
[deleted],gonewild,0
"You could share that everyday, it won't ever get old &lt;3",gonewild,0
You're wish is my command ,gonewild,0
I'd love to.,gonewild,0
r/datbuttfromthefront,gonewild,0
Would you like to be big spoon or little spoon? :P,gonewild,0
"I definitely considered using them in a joke costume this year, I was thinking like a slutty hippy girl, maybe give whoever sees them a bit of a surprise!",gonewild,0
[removed],gonewild,0
Fucking gorgeous,gonewild,0
Perfect mom tits. 10/10.  Would jerk to again,gonewild,0
"Super sexy,",gonewild,0
Your socks rock!,gonewild,0
A gorgeous lady with a body like yours definitely should never be alone. ,gonewild,0
[removed],gonewild,0
Love the boobies.,gonewild,0
Flatterer 😘,gonewild,0
thanks,gonewild,0
Thank you :) :) ,gonewild,0
im hard now :),gonewild,0
I've got something a bit bigger that I think you would love to have in there...,gonewild,0
"Beautiful body, hope you plan on showing more 😉",gonewild,0
I also happen to like you naked too,gonewild,0
Damn sexy. Let me replace that dildo with my cock ,gonewild,0
thanks,gonewild,0
I can help you with that. ,gonewild,0
Hope you pass your test! ,gonewild,0
That is one meaty pussy.,gonewild,0
[removed],gonewild,0
yum,gonewild,0
"Nope! All you really need in life is a big freaking sword to slay your enemies. That is the surest way to becoming the most legendary swordsman, or swordswomen, in all the lands. Eventually, a king or duke will give you a sizable tract of land to place your castle on, and after that is built, you can then hold the swankiest feasts in the kingdom. You've obviously given this a lot of thought.",gonewild,0
Shame. Wonder what I can do to get it up again,gonewild,0
"YES, perfect little titties ",gonewild,0
[deleted],gonewild,0
"moar moar moar please 

you melted my heart 

you are a goddess 

=-) ",gonewild,0
Banging album!,gonewild,0
Your body is perfect!,gonewild,0
bored? lets have some fun together...,gonewild,0
Beautiful body. Lovely simp. ,gonewild,0
what he said  ,gonewild,0
What I'd give to give you a good ducking😉,gonewild,0
This video right here is why we should thank Al Gore for inventing the internet. Absolutely insanely sexy. ,gonewild,0
Well thats too bad.  Sexy pic!,gonewild,0
Just simply a beautiful body. Thank you for sharing.,gonewild,0
"I would love to play with them, til you beg me for something else 😊",gonewild,0
Now I don't feel like doing homework either!,gonewild,0
Oh love that angle keep them cumin....,gonewild,0
Of course you may. :),gonewild,0
Ugh sorry they're all backwards! I'm in the dark :( it's late here.,gonewild,0
Begging to oblige!!,gonewild,0
Be gentle? Maybe that's howd i would start off but it wouldnt end gentle. ,gonewild,0
[removed],gonewild,0
[deleted],gonewild,0
I got some Popsicles and pudding.,gonewild,0
"Thanks for lettin' us get a *Pikachu*. Maybe if you keep rubbing you'll *Squirtle* little. Can't see your face, but as for your body I'll *Raichu* 10 out of 10. I mean damn, where did you get such a *Paras*-exy tits like that? It's really fun to og-*Golem*. I want to put them my *Meowth*.  
  
There's a *Lickitung* pun in there somewhere, too but I couldn't figure it out.",gonewild,0
Oh my....perfect ,gonewild,0
[deleted],gonewild,0
Absolutely wonderful ;),gonewild,0
Oh please don't make me wait that long....a girl with a tail is such a turn on. Love a bit of kitten play. Drop me a pm... ;-),gonewild,0
Fantastic ass ;) I'd love spank it hard and pound you from behind all night,gonewild,0
"Four atm, Four atm, some people say that I have 5 because I have an om (ॐ) in my hands, I mean if my hands get together (like this🙏) you will be able to see the ॐ.",gonewild,0
You will find all of the tributes you seek on /r/TributeMe ,gonewild,0
Once agin the quality if the girls on reddit has just improved. Stunning ,gonewild,0
"Yeah, shaving is for pussies! 
Wait, no, I mean... ah dammit.

I love it. Wish more women realized how prickly little just shaven hairs are. It's like some women want to trick me into thinking they're pre-puberty for some reason",gonewild,0
"Well you went and did the only two things that could have made me more attracted to you, dyed your hair and wore a choker.

My inner teen angst lord is coming out.",gonewild,0
relax you are really sexy,gonewild,0
Your r looks like the Pi symbol. ,gonewild,0
I would love to be balls deep inside you.,gonewild,0
"What I wouldn't give to kiss my way down that amazing body... you'd be squirming, moaning, pulling my hair, gripping the sheets ;)",gonewild,0
I love how beautiful and tasty your lips look the rest is just the icing on the cake. ,gonewild,0
I'll help ease your frustration ,gonewild,0
Of course!,gonewild,0
Hott,gonewild,0
Im wich hole?,gonewild,0
Thanks! They don't usually have an age bracket for me! I'm not going against any 20 somethings!!,gonewild,0
I would love if someone did like a short JOI video in thigh highs and playing with themselves. It's hot being told what to do. Bonus points for being brunette :),gonewild,0
"Happy birthday. Will sure follow ur future posts. If u take requests, i would love to see ur butt-hole :)",gonewild,0
"Hmm, I like the way you think ;)",gonewild,0
You look incredible! You've gotten me rock hard and I'd love to PM you😘,gonewild,0
"Happy birthday and enjoy your day.  words of advice, live life to the fullest cuz one day your here and next your gone. hatters are always gonna hate. And if you ask me the word hate is over used and people underestimate its power. Your smile could light up a room btw ",gonewild,0
White on white on white. And if you invite me over; white in white. ;),gonewild,0
The answer is yes!,gonewild,0
[deleted],gonewild,0
"Aw, too kind of you to say :)",gonewild,0
Awesome,gonewild,0
;),gonewild,0
"Lick that pussy slow and deep until you were dripping across my lips, tease you right until you're about to climax and then run my tip across your lips until you're begging me to let you finish. ",gonewild,0
[deleted],gonewild,0
Maybe soon ,gonewild,0
[deleted],gonewild,0
"Too fuckin good, my mouth is watering......and my cock is hard",gonewild,0
Extra credit deserved,gonewild,0
you have great boobs.  Love to see more,gonewild,0
Hey there 😍,gonewild,0
Nice.. love the tape... ever use rope?,gonewild,0
Jesus. effing. Christ. :0,gonewild,0
Pretty and tasty!,gonewild,0
And a very happy birthday to you! Can't wait for more!,gonewild,0
[deleted],gonewild,0
If accompanied you we'd wake your parents,gonewild,0
Not trying to be filthy but pregnant woman are incredibly sexy its not a fetish but for real there I is just a glow about it,gonewild,0
