body,subreddit,moderated
"So you are joking me? You LOVE the species. But in the end you are left like nothing. We should not sacrifice for the monkeys no more, they seduce you to think and live in that way: conceptional god, morals, the law to punish the murders. It's not the world has to be, it's the evil-conciousness that like it to be. The real and true will of lord(not god), is just to clear the maggots and stop regeneration, which is blend by the tricky monkeys. We, aware of this, have to make it happen: regenesis.",legaladvice,1
"Cops can ask, but if they have no evidence of a crime in progress they need to either find one or frame you for one before they can arrest you. The 5th amendment guarantees you the right to remain silent, even after they put you under arrest they cannot compel you (legally) to answer questions you do not want to answer.

Using the 5th amendment is in no way any admission of guilt. 

However, cops will break the law whenever it is convenient, framing you is standard operating procedure. America has more people in prison than any other modern nation. More people in solitary than France, Germany, England and Australia combined have in prison. Cops now take more than criminals using civil forfeiture laws to steal property without any crimes having been committed.

The law can theoretically protect you if you know your rights, but all cops are crooks. Don't piss them off and let your lawyer work it out afterwards.

They WILL shoot you. The WILL frame you. They WILL use intimidation. They WILL retaliate. They are almost never held to any accountability. Cops are indicted at nearly 0%, while same court indicts non-cops at nearly 100%.

America is a police state. Know the law, don't be stupid, and never trust a cop.

To the mods who like to ban me every time I talk shit about cops- check out the headline in New Hampshire THIS MORNING, where a gang of cops kick the crap out of some guy who made them chase him. On camera. None of those cops made any attempt to stop their fellow officers from delivering a vicious, bloody assault on a compliant captor. 

Ban away.",legaladvice,1
"I generally think of sex as something that women own. If we take it without their permission, we are stealing, and they don't like that.

- I might be a little crazy...",legaladvice,1
Wait so in done instances if another animal is on your property damaging it or killing your live stock you are within your right to kill it.,legaladvice,1
I think we all know that the only way to legally keep money that doesn't belong to you is to be the police. (aka Civil forfeiture),legaladvice,1
"Not only illegal (because stealing) but also VERY creepy, and will probably have another angle of the theft looked at if caught.",legaladvice,1
"..................Jesus fucking christ. 

Die in a car wreck.",legaladvice,1
"This is extortion,  conversion, and trespass to chattel. Your driveway is not your property. They are basically blocking egress on public property. It is an issue to take up with the city and with the company. ",legaladvice,1
"What a fantastic response from a ""quality contributor"".",legaladvice,1
Guessing your dead dad was a POS just like his son. I hope you have to pay this fine and the interest. Funny you and your loser brother have to move into daddy's house. You can't find a job in Oregon loser?,legaladvice,1
It would definitely be a conflict of interest. You would probably be able to argue for unfair representation and you should contact the Bar Association. I bet they would love to hear about this.,legaladvice,1
Burn the place down,legaladvice,1
Might be the more I laughed.,legaladvice,1
"... Didn't like GW, Moving back with Trump? ",legaladvice,1
Jakob is a no good nigger loving jew,legaladvice,1
"Sorry, not really contributing, but are eagle feathers really protected by law?  I've never heard of this before.  I'm really interested.",legaladvice,1
You are honestly a terrible person... You will have to live with this the rest of your life. May god have mercy on your poor soul.,legaladvice,1
Yes.It's all your fault. You should kill yourself to avoid the legal trouble.,legaladvice,1
"OP is refusing to keep the child support office updated with his address, as he is required to do so.  He is trying to dodge child support.  ",legaladvice,1
"In other, non legal advice, this is law is somehow stupid even though I understand why it's justified to be in place.",legaladvice,1
"The advice is get your sorry ass to the police, confess and lie in the bed you made. ",legaladvice,1
Please tell us what bank this is so we know not to use it ever!!!,legaladvice,1
I don't like litter bugs either ,legaladvice,1
Place an Acme brand trampoline on your side of the tree which will inevitably bounce him and your liability back to the other side of the fence.,legaladvice,1
Jesus is pretty popular down there.,legaladvice,1
"Trained the same as OP's department apparently.  Maybe you have a lot more free time to look into these type of things, we don't.  Regardless of how you think other departments should operate, hers obviously operates like mine and many others.  ",legaladvice,1
or just put together some small nail strips and leave them in the yard and they can call the tow truck themselves.,legaladvice,1
"This is definitely illegal. That's like saying ""I won't hire a Muslim for personal safety reasons (Islamophobia).""

This should also get into the news when it is appropriate to do so.",legaladvice,1
"Sadly, your expectations are way, way too high haha",legaladvice,1
"Amazon has no duty to provide the option for one time use codes, incorrectly stating that it can't be done isn't actionable.",legaladvice,1
Line them up down the center of the road and make a slalom course?,legaladvice,1
"Enjoy your weekend, Bernie.",legaladvice,1
"Story time.  I was 21 years old dating an 20 year old girl.  She drove into Manhattan to see me and we spent 20 minutes looking for a spot.  Finally, we found one and she started to parallel park... Except she didn't do a good job and kept making attempt after attempt at it.  I got out and tried to help her but she kept doing the thing where she turns the wheel after she started moving instead of before.

After her fifth attempt, she zooms off leaving me in the parking apace.  Her reasoning was that she wanted to come around the block again.  This made no sense as she didn't need to do that to reset from scratch.  Meanwhile, of course, someone else sees this parking spot with me standing in it and immediately attempts to take it.  I yell that my GF is right behind him and he ignores me and starts to back up.  I tell him I am not moving.  He still ignores me.  He then hits me with his car.  It was nothing but a nudge and didn't knock me down but I immediately punched my fist down on his trunk.

He came out of his car and started yelling at me.  A cop car happened to come by at that moment.  He told them that I had hit his car with my fist denting it and I refused to leave HIS parking space.  I then mentioned to the cops that he had used his car to nudge me out of the way.  The cop immediately told him that he was clearly in the wrong and to leave asap.  My GF got the space, but i honestly couldn't date her for much longer after that.  The fact that she left me and the spot we had searched so long to find, to drive around the block instead of just resetting the car (it was a 2 lane not busy road), made no sense.

Sorry.. this doesn't really help you OP.   You just brought back memories.",legaladvice,1
"I'd like an update at the end of this saga, please.",legaladvice,1
">  so someone who failed the exam re-applied as Black and was hired then eventually fired for lying.

That is messed up. ",legaladvice,1
"Shit sorry man, can't imagine a how maddening that must be! That's straight racism, I would talk to my local journalists and have the town in an uproar. Make that witch move her ass.",legaladvice,1
If you are in the U.S. then the prison has to provide medication prescribed. If they are not cooperating then you will need to sue. Your local ACLU might be able to help or refer you to someone that can. ,legaladvice,1
American workers have no rights even in liberal California. So even though it seems grossly unfair and unreasonable what your employer did they can discipline you for refusing to work further hours or a different shift. The only obligation is that they properly pay you for all time worked. If Americans weren't such lemmings maybe they would have basic rights at work instead of being quasi slaves. ,legaladvice,1
"You didn't ask a legal question or post your location, so you don't seem to be great at following directions.",legaladvice,1
"Are you being serious right now?

I just can't explain how stupid you are. ",legaladvice,1
"Don't worry about it. Let the cops know she used your name, and any news stuff will drop off in a couple of months. No one gives a shit about you in the wider world. 
",legaladvice,1
"i sure did she was about to light that can on fire and i shot the can and watched her burn like a mother fucking marshmallow because she was going to burn me and my house and my cats

case dismissed",legaladvice,1
"Depends on the state i would assume... But most states have a 3-4 year ""Window"" so these kinds of things dont happen.

In NY.  a 15 yr old can date a 18 year old without any legal ramifications 
 at 16 yr old can date a 19 yr old.  

Because if it was cut and dry 18 or not, every other 18 yr old male would be in prison for statutory rape.",legaladvice,1
"Hold on - does she have a list of the things you allegedly stole from her? And does she have documentation of her purchase and ownership of said items?
And what is her argument of theft? 
From everything you've written in this post you have a great case, a shitty lawyer and an unreliable persecutor. 
Are you from Texas? Is she from Texas? Are either of you from this town or city? How does she have the upper hand on you?
What are you not telling us?
Are there any stories in the local paper or notices from the courthouse?
If you want real help you have to provide thorough details. 
And quite frankly, unless you have an ironclad case & a reliable law team (which it sounds like you don't, from your description) I don't know if it's helpful for you to be bitching in such vague terms in such a public venue. ",legaladvice,1
"First off that's a personal conversation which if the phone is in your name and you didn't share the texts ,aka she screen shotted by force, then she broke your privacy. If she has contacted the police I recommend going to the station and talking with them. Do not call since it honestly makes you look less serious about it. ",legaladvice,1
You can sell the animal actually if you trap it on your property,legaladvice,1
Anyone who does this is a traitor and should have their throat slit.,legaladvice,1
"Why are you making this so damn difficult??  

Was the person a guest, a rent paying tenant, a lease signing tenant, a couch surfer, an AirB&B guest, a short term rental guest like a hotel, an ex lover???  
   
How did the person come to be inside your house???",legaladvice,1
"Not legal advice

If by any chance you sue in small claims and the date falls during the trip. Please post an update :D",legaladvice,1
You need to ram this down the throat of the bank and possibly the police department. I'm rooting for you! ,legaladvice,1
The NSA doesn't typically charge for covert bug installations.,legaladvice,1
!remindme 3 weeks,legaladvice,1
"I spoke with corporate and they flipped out and said they need proof. So I went to another car shop and the guy said never go to Monro cause they rip people off all the time. He said he would have done it for $80. He said he'll fax corporate that the price was unreasonable. 

Do you think this will get me anywhere?",legaladvice,1
Fewer*,legaladvice,1
Who is the Bird Law specialist? ,legaladvice,1
"Id say fuck it and let ur dong fly all over that facebook lol if it were me, jus say f'em",legaladvice,1
only people not actually from new jersey call it joisy....,legaladvice,1
"No, you were stupid and these are the consequences.",legaladvice,1
I'm not here to solve others financial problems.,legaladvice,1
"Well, that's not any better; we know perfectly well the capacity for human suffering, and there'd be literally no way to manufacture or test new pharmaceuticals if we weren't able to explore ideas with mice and dogs. 

These animals are treated kindly and with a HUGE amount of respect and understanding by the vets who perform this work. Without the sacrifices of mice and rats, we would have almost zero understanding of how to treat cancer, and the same goes for dogs, guinea pigs, and pigs. It's a regrettable cost of doing this research, and I do not think you would be as ok with the idea of banning animal testing if you understood why is is performed.

Humans are TERRIBLE test subjects. We lie, we cheat, we grow slowly, we reproduce slowly, and it's very difficult to give us cancer or disease in a controlled fashion. Mice, on the other hand, breed and grow quickly, so we can test things much faster and thereby identify dead ends and bad ideas all the quicker. If you reserved testing for human subjects, it would take YEARS to get a full idea of how a drug worked. ",legaladvice,1
This could be your mealticket to riches which I am pretty sure you're on track to never achieve otherwise.,legaladvice,1
"I fixed it 10m ago, your post is irrelevant and unhelpful.",legaladvice,1
"You have to put a legal disclaimer in your book saying that this book is a work of fiction based upon factual events and my beliefs, opinions, and life experiences.  Names, events, and details are purely coincidental and is not intended to harm anyone.  I know of an author who wrote a very accurate tell all book, but had a nice legal disclaimer suggesting that the work was fiction.",legaladvice,1
"Man that is such BS.  This is why I for one am a huge supporter of Open Carry. Sadly we don't have that right here in Canada....

Sometimes you just can't rely on the corrupt legal system and gotta fend for yourself. Sad reality. ",legaladvice,1
and fill it with water!,legaladvice,1
clearly a millenial,legaladvice,1
They abandoned their cones in the middle of the road. Why would you get in trouble for moving them?,legaladvice,1
"Look, it's a cop trying to be a lawyer.",legaladvice,1
"You would be surprised. Go through and add up all the items that might be stealable in a worst case scenario like OP's, and then assign a value for replacement costs. It adds up quickly. ",legaladvice,1
"Man, you're dense",legaladvice,1
Clearly,legaladvice,1
"Jacub is a no good spic loving nazi and deserves to eat a black girl ass, heil Obama,",legaladvice,1
Sry hit the wrong button on my phone,legaladvice,1
I am sorry but thats not kratom probably is doing something alot more expensive..i got a one year supply for $400....sooo how the fuck he have that much cash out and not have a stock pile....guarentee it is noz kratom. ,legaladvice,1
"Her reaction was pretty on point with a 'grocer'. 

If your pup/owner has no vest or paperwork that states otherwise, she has that right to ask you to leave. 
If he wants to use that pup as a therapy dog, he needs to carry the proper ID/paperwork saying so. ",legaladvice,1
Understatement of the day.,legaladvice,1
"I work in a bank. This is the fault of the mortgage company, and you'll likely get nowhere with the bank. From the bank's perspective, a check made out to multiple parties who are listed on separate lines with no 'and'  or '&' present means any listed party has full access to the funds. The bank only needed her signature to legally cash it. The mortgage company should not have listed the names as they did. ",legaladvice,1
"Ok thanks that makes sense.

As a related and completely 1000% HYPOTHETICAL question that this made me think of (ACTUALLY REALLY TRUTHFULLY EARNESTLY HYPOTHETICAL IM NOT GOING TO DO THIS), is it legal to have sex with a 17 year old girl if I'm a 21 year old male? I can't even decide if I feel comfortable with that but I'd like to know the law in case I encounter an unusually mature 17 y/o chick who comes onto me at some point in the future. Thanks again!",legaladvice,1
Couldn't a handmade receipt be found? ;),legaladvice,1
"Check to see if there is a student legal service. They are typically funded through the school, but are independent. ",legaladvice,1
I have 9 points on my ny state license. Lived in the city so sold my car got out of this rat traps every where. They just want your money. After I got a ticket in 2014 insurance company wanted $400 a month. fuck that. ,legaladvice,1
It's Vyntage.,legaladvice,1
"Reporting to OSHA won't get him money, probably get him fired.",legaladvice,1
"What was ""completely wrong"" exactly?",legaladvice,1
"I don't care if your state and your neighboring states are stuck in the 15th century. If you think a piece of paper that any 6 year old can print on a laser printer means anything then it callls a few things in question. 

http://fox17online.com/2015/04/03/police-can-now-see-if-you-have-insurance-before-they-even-pull-you-over/",legaladvice,1
"\>Ableism

*yark*

\>POC racism

You know that his use of ""broke ass niggas"" is an AAVE or AAVE-derived sentence that means ""people who don't have much money"". ",legaladvice,1
"Posession, in the case of a dog, is 9/10 of the law. 

Steal it back if possible.",legaladvice,1
"I understand the need for privacy and I hope my comment doesn't break any rules. I live in northern Illinois, not far from Rockford. While I do not own a horse myself, I have done part-time work at stables around the area in the past and plan to do so again in the future. I also have a family friend who boards not to far from here, in the northern part of the state.

If there is any chance that this stable could be one that I or my family friend could be in contact with, would you please PM me the name? I will not contact them nor will share the information with anyone except with the friend if I discover at any point her horse is there.

Thank you. I'm so sorry you're going through this. I hope you have a positive outcome at the end of this.",legaladvice,1
FUCK OFF!!!!,legaladvice,1
"Molotov, Chuck.    Finnish resistance fighters used the name for their improvised incendiaries as an insult to the Russian foreign minister.

I admit that the growing squalid encampments around my neighborhood, coupled with the garbage, drugs, violence, and crime that they inevitably draw, tempts me to arson as well.

It looks like the OP has access to the building roof.  Run a hose, mount a sprinkler, set a timer.",legaladvice,1
"I won't treat her with RSO oil for now but just CBD oil so it's more understandable. But if im not currently working, could I have my occupation be listed at an Uber/Lyft driver and then have half the joint bank account in my possession after divorce?",legaladvice,1
"I don't have any true input on this matter,  I just feel for you and hope you get this sorted.  Upvoting for visibility.  ",legaladvice,1
Go pick your car up and let the other party take the other guy to small claims for selling something that wasn't his to sell? ,legaladvice,1
"I am very cautious when it comes to doctors who perform surgery on reproductive organs. My mom had a friend who was killed due to negligence after some operation that she had before she was to have a hysterectomy. He'd cauterized something on the way out and knowingly left her bleeding internally and sent her home. Her two year old tried waking her up in the morning and when her husband woke up too he realized she was cold and had passed away.

This same doctor (no longer practicing I assume) had done a hysterectomy on my mom some years earlier. My mom is the one who'd mentioned the name of the doctor to her friend simply because it was one she knew. Before my mom's surgery she made a joke asking if he could take out her appendix too while he was at it. The surgery ended up being 2 1/2 hours or so longer and when my dad asked why, the nurse said the doctor had a hard time finding her appendix. I have no idea if her appendix was even removed or what happened. Freaks me out though.",legaladvice,1
"That's to report suspected tax fraud, which is unknown and probably not the case here, so your smartass response does no good because I wouldn't be the person that falsely accuses someone of wronging the government just to get payback. That kind of stuff comes out on its own eventually. I'm looking more into something that I could use, yknow, general guidelines for running a business out of your apartment that must be followed, yknow? ",legaladvice,1
I really don't care if they have contempt for me. I just want my sister back.,legaladvice,1
"Eh, they gotta get their revenue somehow. Pensions and salaries, let alone cell site stimulators and other 4th amendment shredding devices, won't pay for themselves. I wonder if chicago pd have a quota, like the lapd, and a host of other departments? I mean I'm sure they practice theft under the guise of civil asset forfeiture, but that's another ossue.",legaladvice,1
"This is kind of like when you lived with your parents and any one could enter any bedroom though people were expected to knock when the door was closed and respect the privacy lock. 

If you weren't in the bed room I don't see what the issue of was. If this annoys you, leave. ",legaladvice,1
"So if you didn't do anything wrong why did you resist when they grabbed your arm?
You wanted to play hard and they played hard too.",legaladvice,1
"Whoops. Sorry, :)",legaladvice,1
Uncredentialed pseudo-lawyer,legaladvice,1
"I'm not a lawyer but I am a musician and I've written and signed a few contracts myself, and I've read over the sections on payments/royalties and it seems fine to me, but don't take my word as final, as I said im just a musician, ill look over it later.",legaladvice,1
"Just curious, why do you think your bf would do that? Is your dog in bad health & suffering?",legaladvice,1
Request permission to play Surfin' Bird for the dude as he is laughed out of court.,legaladvice,1
I feel like this is a situation where the 2nd Amendment is applicable. If they're threatening to sue before they're under any kind of duress I hate to think what would happen if they were hungry and drunk. Speak softly and carry a big stick is pretty decent advice.,legaladvice,1
Lmao at this being the most downvoted comment.,legaladvice,1
I could a imagine an overzealous meter maid comes and clamps the train.,legaladvice,1
I've seen a lawyer change the locks on the house while the person was at work and leave all of their belongings outside. But that does seem a little extreme. ,legaladvice,1
"> 3\. NP Links. These are required by reddit for links to other reddit sections. Failure to do so leads to the possibility of the subreddit getting punished for brigading. All links to anything in the reddit.com domain should be to np.reddit.com, not www.np.reddit.com.

I have to enforce np. linking in the subs I mod so as a result I have become very familiar with admin statements on this issue, and it's worth pointing out that np. links are not actually required by the admins. I personally believe it shows good faith toward the spirit of the reddit rules so of course I recommend it for any subreddit that links to other parts of reddit, however it is not actually a hard rule and the feature is unsupported by the dev team at the current time. RES supports it, but the np.reddit.com domain was originally intended to be the Nepalese language version of the website, the ""no participation"" usage is something that evolved from the reddit userbase.",legaladvice,1
"Your boyfriend should of asked the officer if he has a warrant to search the car and if not, then no he can not search the car.",legaladvice,1
"No, they have a duty to go to reasonable means to maintain safety. They cannot leave wet floors, glass splinters or shoddily soldered shelves around. But if someone slips because the idiot in front of them dropped a banana in front of them, a shitty kid kicked a football around inside of the store or some idiot climbed the shelves and brought them down, that's not on Target, it's on those who actually committed those idiotic acts.

You literally told them to sue Target going on no verifiable negligence on Target's part. You literally told OP to sue Target and let the jury decide. You can get discovery outside of the court room. ""Well, Target **could** be liable. Just sue them and let the jury see the evidence and decide for themselves.""

And I wasn't aware of the fact that you're **psychic**. Oh, great one, I bow down to you. Clearly, there's not any chances of Target handing over the surveillance tapes, even if they prove Target did nothing wrong. Clearly.

I'm done talking to someone who has no place giving out legal advice.",legaladvice,1
"I know this isn't advice but my cousin and her fiance were the first people on scene (if this is the accident I'm sure it is, highway 3 just east of Pincher). It might be helpful to everyone for them to be able to sit together in the meantime, my cousin held the youngest of the girls the whole time the ambulance was on the way, pm me if you would like me to get my cousins contact info for you or if you would just like to talk",legaladvice,1
I also have a question about the ethics of  baby shaking...,legaladvice,1
"Obviously the answer is for your son to shoot the step-dad. He'll solve the threatening issue and buold credibility for his future rap career!

Win-win",legaladvice,1
">We are furious with the doctor

That's like being furious with the furniture when I stub my toe. ",legaladvice,1
