body,subreddit,moderated
"after listening to the youtube video I have to ask a simple question. Do you think this man is stable? If you answered no to this question, call the police! You can wait till he goes to work again, the next time he beats your neighbor, or you can do it right now and potentially save her life and her children and most likely yourself! He is not going to leave on Saturday and you are enabling him to continuously beat the shit out of his wife. Controlling, abusive people do not simply walk away. Do something! If he starts beating her and you can hear it immediately call 911, he will go to jail and wont be able to return! What do you think will happen if he goes to far and kills her? Do you think he'll just ginergly walk away with the kids and your family as witnesses?",legaladvice,1
!RemindMe 4 weeks,legaladvice,1
"The OP 100% has a right to take his car.  
This is a civil matter.  The tow company cant hold his car hostage and can later sue him if they think they are right.
Obviously the tow company will lose the lawsuit.  ",legaladvice,1
"Don't scare OP. What OP does is his business. I merely stated that with that money he is set for life and cash is good everywhere. Buy food, things you need Nothing wrong with having some cash in your wallet. Spend it left and right like regular people. Best advice from me to OP is to just put that cash away and use it for small things and just be a normal citizen. ",legaladvice,1
"If his crime wasn't homosexual in nature you most likely have nothing to worry about with your son.  Most pedophiles are heterosexual.  
Look out for your daughters!",legaladvice,1
"IANAL, but curious about your likely bogus story, what's the job?",legaladvice,1
Go get help and be a fucking father.,legaladvice,1
"Any school workers asking for this information from kids is a pedophile.  
Ignore these sickos.  ",legaladvice,1
"My advice is to let them make this into an official issued policy. Hope that it gets approved. Follow the rules, all the while launching a large discrimination suit against the company. Take your settlement and go work for someone else who isn't a piece of shit.",legaladvice,1
They should ban football helmets then. Or if the don't maybe you could get a motorcycle helmet that looks like a football helmet,legaladvice,1
"He's going to get
De De Deported",legaladvice,1
Be glad you dont live in a country where they would cut off your hand,legaladvice,1
"Go find a new job. Why did you even agree to those conditions? I would have made them restore vacation and seniority, and write a check for back pay for the two months I was gone.",legaladvice,1
"I mean why wouldn't your first thought be to call the police station?

Why were you waiting for the police officer to notice you, that is what your horn is for.

Just be nice, it's your property. I'm sure they won't have a problem with it and they are the only ones who can do anything about it not us. ",legaladvice,1
"The elephant in the room that no one is mentioning (because evidently you're the only one in these comments who runs a business), is that if every other employee has to wait for every last person on shift show up before they can get anything done...

Then you're a really, really shitty businessperson and you have absolutely no idea what you're doing.

--source:  I own a couple of very successful business in which an employee being three minutes late is never an issue, because I know what the fuck I'm doing.",legaladvice,1
"Cross the damn border. People are giving really good advice right now that sounds great on paper because it's the law. I used to think the same. The law and the way it's actually applied are two different things. 

In reality, you just need to satisfy to the CBP officer that you are a US citizen., If you are a US citizen then you can cross. In fact, if you are a US citizen, they have to allow you to cross. 

As crazy as this sounds, just two weeks ago I took a friend to San Diego from Baja. He told me he had a passport, halfway through the 5 hour jounrey he told me it was expired. As we were waiting in line in the car, he handed me a photocopy of his expired passport. I was thinking oh sh*t. This is gonna be a real problem. It wasn't. The CBP officer didn't even bat an eye. It was just a routine crossing. The funny thing is that this friend has told me that he once crossed with nothing, no ID whatsoever. I wouldn't have believed him if we didn't have such an easy time crossing with a bad photocopy of an expired US passport. I know some of you will downvote this because it is such an incredibly unbelievable story, but it really happened at the Tecate crossing. 

I've got another friend who crosses every few weeks and he has used his driver's license on several occasions. I know he did this for sure because he had applied for a passport and had to turn in his old passport and passport card. 

I have another person who I am helping to get her and her daughter passport cards. The daughter was born in Mexico and is 14 years old. The mother has had to enter the US but only has an old California ID card. I know that she has crossed the border with just that. She was not detained at all. They entered her ID card into the system and let her enter. She is half Japanese so she doesn't even look ""American""..whatever that means. 

I live in a interesting community in Baja that has many US citizens and most of them DO NOT have passports. They cross the border with their California ID or driver's licenses all the time. None of them have been detained. ",legaladvice,1
"it doesn't really matter, I have incorporated my body and have patented my blood under that corporation. ",legaladvice,1
Psh everyone knows the dollars aren't real unless they're gold fringed,legaladvice,1
This is now my most liked post by a lot. My only regret is that I have but one inside joke to give to this forum.... unless someone starts posting about trees.,legaladvice,1
Social experiment gone wrong!,legaladvice,1
"Bruh, your mother and brother are stupid a'f. I want an update lol. Maybe even a video when you slap him with the papers. Like slap him with it. Literally ",legaladvice,1
"Here's me in front of 30,000 people at soundset playing guitar to some rap. https://www.youtube.com/watch?v=6S6HdXckLg0",legaladvice,1
How's that going to show on an ETNAC check? ,legaladvice,1
"It remains true.  Each year there's about 30,000 people - just inside LA County - who ignore their red light camera ticket.  If the LA County Superior court suddenly changes its policy (of not reporting ignored camera tickets to the DMV), then there will be a deluge of license suspensions and huge lines at the courthouses.  And all that commotion will make it into the news, for sure.

Is the court likely to change their policy?  No.  Because they are plenty busy dealing with important stuff like murderers and robbers and think, correctly, that they should minimize their involvement in a scheme that is about issuing huge fines to people who roll a right turn at 3 mph.

Some notes of caution:  The ability to ignore is confirmed only in LA County, and only on red light camera tickets.  Plus, if you contact the court (in person or on its website), you lose your ability to ignore that ticket.  ",legaladvice,1
"I don't think anything other than that isn't proof of intersource between the two individuals. I am merely pointing out that we don't know the details in full. I would think legaladvice would know you can get pregnant without being ejaculated into, all you need is the sperm. I am not taking sides merely pointing out the lack of evidence is actually pretty strong.



http://www.uptownmagazine.com/2014/02/woman-used-sperm-oral-sex-get-pregnant-get-child-support/
",legaladvice,1
"Two step process.   
1. buy and put up sign; Trespassers will be shot.
2. Shoot trespassers.
Problem ends after the first one.  The rest get the message. ",legaladvice,1
*IANAL,legaladvice,1
"Wow guy. Your step niece deserves some prison time for this shit. Who the Fuck is 14 and has a 20 year old boyfriend, and has unprotected sex all at the same time. Why didn't her parents do ANYTHING about the boyfriend before anything formed between the two of them? ",legaladvice,1
This is not necessarily true.,legaladvice,1
Remove the name of the street please. ,legaladvice,1
Please dumpster them.,legaladvice,1
">This is not the sub for you to try to prove your....theories....

It's not my theory. It's a fact. Watch the youtube video ""Podestas, Pizza and Pedos"", NSFW, obviously. It's long, but the part I mentioned is in there. Then, research Sasha Lord, the guest of honor. Is that doxxing? She's a local DC personality, with everything out in public.

This is directly related to the original post. Here's a [breakdown](https://steemit.com/personsofinterest/@ausbitbank/persons-of-interest-james-achilles-alefantis-aka-jimmycomet-at-comet-ping-pong) of some of the information that led to the doxxing.

I strongly disagree with the witchhunt that ensued; and had nothing to do with it. However, don't throw the baby out with the bathwater. I'm fairly certain that the person who did the doxxing was trying to discredit all of this research. Again, my comments are directly related to the original post. If you are going to attack me, at least know what you are talking about.",legaladvice,1
7 whole fingers and 3 half ones just so we are clear.,legaladvice,1
But were Mr. Allen's requests legitimate? Could he really get another public defender?,legaladvice,1
">4 counts of conspiracy to posses a controlled substance with intent to distribute, 3 counts of conspiracy to commit murder, and 5 counts of money laundering

Ya okay",legaladvice,1
"It must suck to be named Sarah Silverman.


I would not open the package.  Throw it right in the garbage.

You could possibly get a restraining order.  It is a somewhat involved process that requires evidence and may cost some money.",legaladvice,1
Oh jeez please don't let the nerds of this subreddit talk you outo of a pizza. Literally nothing will hapoen.,legaladvice,1
"Have you tried the ""Chewbacca"" defense?",legaladvice,1
"Goat meat is pretty good...

Sorry, had to say it.",legaladvice,1
Are you her dad?,legaladvice,1
"Okay, so then what the fuck do you do? Just fucking sit there? There has to be some way for you to not get held hostage by protesters?

It should be, if it already isn't, a highly punishable offense to block public roads in such a fashion that the people you're blocking cannot just turn around and go another way. I've seen videos of these people circling around cars. What the fuck is your recourse there? Leave your car and walk? Obviously that's not an option because your car would be left vacant on a public road.

It is absolute bullshit that this is a thing and there needs to be some reasonable response for the victims other than just to sit there until they disperse whenever they god damn well please just because they feel self-righteously empowered by their misguided bullshit ideologies.

/rant",legaladvice,1
Contact your local newspaper. Media pressure could help.,legaladvice,1
"Im going to have to side with your husband on this you are trying to amputate part of your Childs body without his consent. While there are no laws against its ethically horrific and I would consider it genital mutilation, rape and child abuse. It is not your body to start cutting pieces off it is his and only his your husband is trying to protect his son you are trying to mutilate your child for a religion. Also speaking of religion your child has no religion because he is a child with no comprehension of theology let him make his own mind up about what religion he chooses.",legaladvice,1
If that plate belongs to the person that did the damage then so be it.  If anything it'll help find the guy. ,legaladvice,1
"Knew your dumb ass would be from my area (Silicon Valley). Have to be for a scheme that dumb. Here's your license plate number: EZ-1353. Don't be a moron, you can't be committing crimes when you're that easy to track dumb dumb. Also your name is Kenneth Boscow Wong and this is your GitHub: https://github.com/kennethboscowong 

PEACE.",legaladvice,1
"I would say get a lawyer imo. I have no exp w this type of situation, i just think that when it gets to ""he said, she said"" you need someone who can call their bluffs and cut thru the BS.

A traffic lawyer has prob had this case settle 100s of times alrdy and will be a able to guide you.

I would also recomm installing a dash cam (forward & rear) for the future.

Good luck mate, fuck heads dont know how to use the ramps here anyway, rain or shine.",legaladvice,1
What religious organization requires money to join and has race requirements for membership? ,legaladvice,1
"Try complaining about them on social media. Mention Home Depot is where you hired the contractor. A lot of companies have staff to specifically handle these situations and can often bypass usual channels. 

Who knows, maybe enough people have already complained that Home Depot can pressure the contractor to make good. It's a long shot but doesn't hurt to try. ",legaladvice,1
"An attorney named Richard Wills has a very helpful page called Washington Probate Litigation. Even though litigation will likely not be an outcome here. 

Washington recently passed a statute that addresses what happens to a tenants personal property and their tenancy when a tenant dies. An Oregon attorney can determine if there is an equivalent law in Oregon. 

I'm so sorry to hear of your loss. Taking good care of yourself right now is really important. There's nothing that can't wait if you need time to grieve first. 

",legaladvice,1
"Yeah, people here can explain evictions, land lords, and traffic law, and little else. ",legaladvice,1
Is that what I did?,legaladvice,1
Sue,legaladvice,1
Id hack that sprinkler headand anything else you care to do on your side of the property. ,legaladvice,1
"I didn't realize this place was so hostile. Attorneys, right?

I didn't PM you for legal advice. I PM'd you to convince you that my problem is very real and to please stop publicly assuming I'm a troll.

 ",legaladvice,1
Don't have an answer but this whole story is infuriating. ,legaladvice,1
And as an adult that's his choice to make regarding legal/criminal penalties (are those different?). Passive aggressive relative calling the police is an absurd suggestion.,legaladvice,1
">I can't help but feel overwhelmed with the thought of my son, having this new man as his Father...

That's what happens when you leave a woman pregnant. Other men step up. I bet your ex felt pretty overwhelmed when you left, too.

>I feel like changing his name, is like me giving up my fight and allowing them to fully be a family together, with me, forever forced to the outside. It sounds so selfish, doesn't it?

You are *not* a member of *their* family. You are on the outside. Your determination to interfere to the point you won't ""allow them to be fully a family together"" does indeed sound awfully selfish. 

Look, suppose someday you marry a woman with a very young child and decide to raise that child as your own. Now, how would *you* feel about her ex popping up and petulantly insisting he has some right to insert *his* name into your new family? 

I bet you'd take a rather dim view of that.

If you *now* want to be a part of the child's life, its incumbent on you to find a way to do so in a way that doesn't antagonize and disrupt that child's family any more than you already have.

Stop making this all about what's best for *you* or you're going to find yourself cut out of the picture entirely.",legaladvice,1
"I have no legal advice, I just wanted to say I'm sorry for your loss. I lost my mom when I was 18 and it was horrible. ",legaladvice,0
"The HOA has insurance too on the Condo Units, you pay it as part of your condo fee, ask for their insurer carrier and file a claim with them as well.",legaladvice,0
Appreciate the response. That's what I figured. You live and you learn! ,legaladvice,0
"Your wages are going to be garnished; you can't stop that. They gave you some options to avoid this, but it doesn't sound like you made this a priority- not judging you here, this stuff is incredibly depressing and people tend to ignore it until it explodes.

Start here. http://www.consumerfinance.gov/students/

Call the CFPB and ask a ton of questions. You don't have a complaint, but they are able to provide free, non judgmental advice. You may also want to take this to the r/ studentloans sub.",legaladvice,0
He either can live on 50% on my mother's dime or get 50% of the sale of the house. I think his thought is to live off the first option until the second one is enforced.,legaladvice,0
[deleted],legaladvice,0
"I don't think you need any legal advice. You just need to ask them kindly to stop. They have no idea they're doing anything to upset you. If you ask them nicely to please move and they tell you no or say yes then keep doing it despite *continued efforts to ask them to stop* the contact your landlord. Always always always talk to people before consulting lawyers. Not only is attempting to resolve it via positive confrontation the mature thing to do, in most cases you are required to have done so in order to successfully sue. But, you're miles and months away from a lawsuit currently, which is good news! ",legaladvice,0
"Is there a certain type of lawyer I should contact?
I have never done so, and really wouldn't know where to start. Other than googling ""smashed home lawyer.""",legaladvice,0
"&gt; Is settling early a bad idea? 

You betcha.

This is more of a 'get a lawyer' than you can imagine. ",legaladvice,0
"You should thank the judge for doing you a favor.  She rejected your guilty plea to give you the opportunity to negotiate with the prosecutor to get diversion or a reduced charge.

",legaladvice,0
"It's an annoyingly complex issue you can read up on here:

http://broadbandnow.com/report/apartment-landlords-holding-internet-hostage/

Technically it's not allowed, but apartment owners found a way around the current FCC rules. A cursory search didn't turn up any Alabama-specific laws governing ISP contracts with landlords.

You're stuck paying the fee, since it's on your lease. Best you could do is pay more for better internet. You could look at getting DSL since it runs over existing phone lines, or see if you have directional access to a microwave-based ISP; you'd need a clear line-of-site to their towers and the ability to hang basically a satellite dish outside your apartment. Lastly, if you can find a wireless carrier that offers true unlimited data, you could use tethering. ",legaladvice,0
A penalty like you paid taxes late and they accessed a penalty and you paid it? That happens to millions of people it's not a big deal.,legaladvice,0
"We don't do Argentinian law. However, assuming Argentina has tenant protections then yes, there should be a reason and there should be an opportunity to correct (fix the reason) or appeal (argue against the reason). However, if you're on a month to month lease, your landlord may just be ending your tenancy -- your landlord is not obligated to rent to you forever (presumably). 

Unfortunately, I can't be of more help because I have no idea what the laws in Argentina are like. You may want to post in /r/argentina. 

You should definitely call your landlord and ask about the letter. Ask why they sent it and if there's anything you can do. Worst case, you should be able to rent a storage place for a few months to put your things in while you sort things out and get your money released by the judge. ",legaladvice,0
"I'll see if I can find one

The gym I went to was 24/7. The new one is not.

I'll see if they can do that, I spoke w someone today at the new gym but they said that I would have to follow the cancellation policy. 

Can they transfer my info like that even though they aren't affiliated with each other, like it's a completely different company ",legaladvice,0
At first my mom want our lawyer to go to court for her for like $100 but I dont know if you can do that or not.,legaladvice,0
"It's just standard with my insurance, but I am in Australia, not America, so practices may be different. That said it couldn't hurt to ask him to check. If it's bundled in he might not even be aware of it. ",legaladvice,0
[deleted],legaladvice,0
"That's the big question.  I don't believe these items are mentioned in the will, but could be wrong.  ",legaladvice,0
Sounds to me that they think you where high on something and not drunk and decided to throw you a bone. I bet they deliberately ignored you having the xanax. ,legaladvice,0
"Perfect. Thank you 
",legaladvice,0
"Thats pretty much what we told him last time we saw him. His mom started yelling at my wife about how she needs to let her and her son spend time with my step-son, that he doesnt need to go to school(pre-school) so he can spend time with them instead. My wife called them out on them dropping him off 90minutes late without saying anything. They got mad and called the cops, who told them to leave since they had no rights. 

All this with a child who has a behavioral/developmental delay and socio-emotional issues that he gets therapy for. 

Sounds like I/We need to lay out the ground rules for this guy, and make it clear the road he wants to travel down will likely not work in his favor, or at least complicate his goals. But he is to dense to realize what we would be telling him probably.
",legaladvice,0
"He was literally responding to a poster asking if he had measures in case they get violent/don't take no for an answer. OP was simply responding that he did. 

You're reading waaay too far into the response, and making a lot of assumptions. 

Could OP drop off emergency supplies? Yes. But he'd be creating an even bigger problem for himself once his idiot neighbors come to rely on him for emergencies. 

Should firearms be a last resort? Absolutely. Are two potentially violent idiots during a natural disaster (i.e police/emergency services unable to respond about removing said idiots) a perfect storm for a last resort? Quite possibly. 

I'm not one to advocate violence for stupid reasons, but I think having ample home defense in this case is more than prudent. ",legaladvice,0
That adds an extra layer of weirdness,legaladvice,0
"Planning ahead is a good thing. Like Napalmenator suggested, your MIL can put a provision in her will as to what she wants to have happen. That is not binding, but it's good evidence for you if someone challenged you taking Apple. 

If the state gets involved, you will need to be able to pass a home study and appropriate background checks. One thing you could do is get certified now as a foster home. That would speed the process considerably if MIL were to pass and the state gets involved. 

You need to figure out now if dad's rights were terminated. I suggest talking to a lawyer in your area to get your ducks in a row. ",legaladvice,0
"Whatever you do,  don't go to court and Make the argument that you ""couldn't have been too bad"" because he didn't stick around to stop you from driving home. ",legaladvice,0
She could probably seek the audio recordings of her phone calls to the bank's customer service line.,legaladvice,0
"Ah, I see. Sorry for jumping down your throat a bit. I can see how it could be seen that way, though I think the parents described in the OP are at an extreme end of behavior.",legaladvice,0
"You may want to consult with a traffic ticket attorney. You're looking at least a $200 retainer for something like this. Alternatively, you can take your chances with the mercy of the court. What is your driving record like? Any moving violations in the past 7 years? ",legaladvice,0
[removed],legaladvice,0
because you cheated or abusive right? OP I think maybe you need to see someone for these issues you have. ,legaladvice,0
"&gt; but there's not much in there.

Define ""not much.""  You'd be better served having separate accounts until it gets sorted out.  Why should any of her $$, regardless of amount, be at risk?",legaladvice,0
"We don't play much of ""what if"" around here.",legaladvice,0
Probably. That's usually how a class action lawsuit works.,legaladvice,0
[deleted],legaladvice,0
Since forever.,legaladvice,0
"Thats kinda what i was thinking. 

I honestly found it odd he gave me a new lease to be honest.",legaladvice,0
"Why not remove the drugs from your home, bury them and tell him where to find them?",legaladvice,0
"that's not how it works. You signed a contract to pay X and haven't paid X. If you get sued ""but I paid 97%!!"" isn't going to work as a defense.",legaladvice,0
"I think so, but I'm not sure.  But best case scenario, perhaps the lawyer can contact the bookstore and tell them what happened and convince them to not report it?  (If the kid is really, really, REALLY lucky?)",legaladvice,0
"This isn't good advice. This doesn't show that you didn't possess, manufacture or sell it. ",legaladvice,0
"No, there's no overlap. The last person I knew who got a copy of the contract (which is old by now that was 2 or 3 negotiations ago) spent a bit with the run around fighting to get it. To the point they made him pay per page to print it out for him. It's pretty ridiculous sounding, but real. That's the only other person I know who is kinda helping me. I honestly thought the union rep I was talking to was the only other person I trusted, but he lies too. The rest are even worse. I'll try and think about people who have left, therefor have less to lose, maybe there someone =) ",legaladvice,0
"But chili dogs and cherry limeades, /u/grasshoppa1. That shit is good. 

By ""good"" I mean ""guaranteed to turn you into a diabetic.""",legaladvice,0
[deleted],legaladvice,0
