body,subreddit,moderated
This has the feel of a law school exam prompt. ,legaladvice,1
"Depending on the specifics, the employer could be vicariously liable for the battery as well. Just another bargaining chip on the table.",legaladvice,1
"Then you're responsible for paying the LL to get t repaired, you can then sue the abuser for the cost of any damage he caused.",legaladvice,1
Good to see this rule finally existing. Maybe in another decade it'll be enforced.,legaladvice,1
Pretty much. HAHAHAH THAT BLOWS FOR YOU!!!!!!! Good luck! NOT.,legaladvice,1
"So there isn't much the school can do about this.  The one thing they can do is have a system set up where they call the parents if the children do not show up for school, which is exactly what the schools here do.  Do that not have such a system at your school?",legaladvice,1
So was Eichmann. ,legaladvice,1
"No mortgage lender is going to accept a bunch of cash that is not held in a bank as a downpayment. They do not want to be tied up in potentially fraudulent activities, especially with no way of proving the veracity of it's source. 

The only way to make this money legit is to deposit the money in increments into their normal bank account. ",legaladvice,1
"Threaten to contact the better business bureau, tell him that guitar was priceless in your opinion and you have to have another one. You can't put a monetary value on it and that you need a new guitar",legaladvice,1
"James, Check out this link immediately! Watch this short video! Let me know if you have any questions. Thank you.
   http://gwpconnectvideos.com/?rid=80&uid=24231",legaladvice,1
"#GO TO THE MEDIA!

Nothing works quite like public shaming ",legaladvice,1
A horny teenager,legaladvice,1
Give those dogs a bone! A T-bone! ,legaladvice,1
"IANAL, so take what you will of what I am about to say.

I believe that your boss is likely discriminating against you, for your gender or sex (and all the issue that define that word). But you will need to be smart in how you address this issue.

If I were in your shoes I would expect my boss to put this policy in writing and to justify the policy. If they refuse to do this, I would then calmly inform them that you until such a time as they provide a written policy, that applies to all employees, and not just the two of you, you will ignore this, likley unlawful condition of employment. I would then continue to explain that you and your coworker discuss issues of wage and workplace conditions, and that is protected by the National Labor Relations Act. This is called [Protected Concerted Activity](https://www.nlrb.gov/rights-we-protect/protected-concerted-activity).

The Federal Government, in the form of the NLRB defines Concerted Activity as:

> Federal law protects employees engaged in union activity, but that's only part of the story. Even if you're not represented by a union - even if you have zero interest in having a union - the National Labor Relations Act protects your right to band together with coworkers to improve your lives at work.

> You have the right to act with coworkers to address work-related issues in many ways. **Examples include: talking with one or more co-workers about your wages and benefits or other working conditions**, circulating a petition asking for better hours, participating in a concerted refusal to work in unsafe conditions, and joining with coworkers to talk directly to your employer, to a government agency, or to the media about problems in your workplace. Your employer cannot discharge, discipline, or threaten you for, or coercively question you about, this ""protected concerted"" activity. However, you can lose protection by saying things about your employer that are egregiously offensive or knowingly and maliciously false, or by publicly disparaging your employer's products or services without relating your complaints to any labor controversy.

By framing the issue in this manner you add another layer of protection for yourself and your coworker.

How I would respond, verbally would be something like this:

""I'm afraid that I do not understand why this policy is being applied to just the two of us. If you would be so good as to provide this policy, in writing, with the reasoning behind why this policy only applies to just the two of us, I would only be able to conclude that it is retaliation for either my gender/sex/sexual orientation, or some attempt to deny us our rights under the NLRA.""

Or you could contact an attorney in your area and ask them their opinion.


Just be aware that due to this 'at will' employment clause, your employer could terminate you. But... if you were to respond in the manner I presented, you would likely be able to provide some proof that your termination was due to retaliation in response to you asserting your rights; either those afforded you under the the NLRA (Protected Concerted Activity) or retaliation due to your specific gender.",legaladvice,1
"It is not complicated.  
Cops were friends with the attacker and they failed to make an arrest even with a 3rd party neutral witness along with the kids testimony.      

This sucks, but a lawyer is the only options as the police department has crooked cops.  The lawyer probably wont be able to do much unless you find a lawyer who is good friends with the local judge or police chief.  ",legaladvice,1
"That is a riveting tale, chap.

What is your legal question?",legaladvice,1
Ianal. Beat the shit out of the mother,legaladvice,1
"The criminal case is not ""you vs the suspect.""

It is the DA vs the suspect.

They can (and should) keep you in the loop, but right or wrong you have no legal authority to approve or deny a plea deal.  

You can sue the rapist in civil court, but the criminal case part of the ordeal is concluded.

If you feel mistreated by the prosecutor's office, you can complain to the head prosecutor, go to the media, or back his challenger in the next election.

I'm sorry this happened to you.",legaladvice,1
Get an attorney and sue the fuck out of your university. If you let them fuck you in the ass like this then nothing will change. Fuck yes means yes and fuck false rape accusations.,legaladvice,1
You can copy them for your personal use you just can't resell them. ,legaladvice,1
I sense the butt hurt is strong with this one.,legaladvice,1
Locked per policy regarding updates,legaladvice,1
If you don't want to get Subpoenaed then you need to delete your account so they can't find you ,legaladvice,1
I'd just get over it. Find a hobby,legaladvice,1
Maybe OP should get Chris Hansen involved.,legaladvice,1
/r/Iamverysmart,legaladvice,1
"You sent him notice, including pictures, and have proof of this correct?

If yes, not your monkeys, not your circus. I wouldn't even respond to him unless he sues you. Canada doesn't have security deposits, so it's not like he has anything to hold over you.",legaladvice,1
Are you a virgin,legaladvice,1
OP says he's a senior and is about to graduate. There's no real risk to him in telling them to pound sand over somethign that isn't his problem. ,legaladvice,1
"Unlikely, those passwords pictures are probably tagged on facebook right now. I bet atleast 7 people have already done it. ",legaladvice,1
"That logic doesn't work against hoplophobes, unfortunately. ",legaladvice,1
"*Your post has been removed for the following reason(s):*

**Identifiable Information**

* Posts or submissions that contain information that could be used to identify either party are subject to immediate removal. Please edit your post to remove this information, and then message the moderators asking that your post be reinstated. 



*If you feel this was in error, message the [moderators.](http://www.reddit.com/message/compose?to=%2Fr%2FLegalAdvice)*",legaladvice,1
"that is not how it will work, if she doesn't give the doctor permission to give the information to her parents they'll assume she is not a virgin

no answer of the doctor = assumed lost virginity ",legaladvice,1
"Your dog got out.

Your dog bit somebody.

You are liable.  Do you have homeowner's or renter's insurance?",legaladvice,1
"Fuck the bitch.  Call the person she sold it to and let him know that it was an illegal sale.  The kick her out and let her know never to return.  What will be next?  Your car, your gear stereo etc... Where will it stop.   Selfish sneaky cunt that's what she is...Wouldn't trust her in a million years now.",legaladvice,1
"So you're not from this country, and you're breaking not one but two laws (trespassing and posession of drugs)?

Thanks, asshole.",legaladvice,1
It's not how many fingers you have; it's how you use them. ,legaladvice,1
This is fucking insane. What kind of bizzaro world are we living in where anyone thinks this is acceptable?,legaladvice,1
"Off topic, but I would hope a lawyer would do this pro bono since it's the right thing all around.",legaladvice,1
"> took a bunch of pictures

Where are the pictures? First thing you should post if you want people to believe you. Otherwise, fuck off, troll.",legaladvice,1
"Location matters a great deal, legally, as explained in the rules of this sub.  This is legally important to a sub about legal advice.",legaladvice,1
"Love this subreddit, but it really helps to set the ""sorted by"" option to ""best"" to see the real deal advice.",legaladvice,1
Link?,legaladvice,1
"Yes, that is exactly how I would do it. I now kno this is a worthless sub",legaladvice,1
That's a strange situation.,legaladvice,1
"Any business owner that doesn't support an employee on improving their career shouldn't be a business owner. 

I have recently been a target of that greediness. I left a small welding company for a slightly larger company. The owner of the smaller company has family at the larger company and my first day on the job I was informed I would have to wait 30 days before hiring on, even though there isn't a non compete agreement with me and my previous employer or a non poaching agreement between the two companies. My old boss is just greedy and doesn't want to pay top wages for skilled hands or offer any benefits when he has the resources to do so. 

I'm not saying you're greedy or like this in any way OP, it just reminded me of my situation and struck a nerve.",legaladvice,1
Or just steal it back!,legaladvice,1
"Power of attorney doesn't necessary mean you have a full authority, it's for a specific situation, it's also a legal instrument that permits someone called “the agent” to act on behalf of ”the client” in a particular financial or legal issues for a fixed time period, mentioned in the POA form. Any person can be authorized to be an “Agent”, not necessarily have to be a lawyer https://medium.com/@CAApostilleInc/3-steps-to-prepare-your-power-of-attorney-for-use-overseas-89ef1262d51c

in your case, it's not that much complicated, you should get a free consultation from an Estate planning lawyer or an official entity.",legaladvice,1
"Hi, I know this is irrelevant to your post but did you get rid of your closed comedones with the Mizon AHA 8 % peeling serum? ",legaladvice,1
"This would be my hill to die on.  

If he persists, take your son and leave him.  It would not be you splitting the family, but your husband doing it with this half assed scheme.

It sounds like your inlaws are dreadful.",legaladvice,1
"He's definitely not going to white collar resort prison, that's for sure. No, it's federal ""pound me in the ass"" prison.",legaladvice,1
"Go ahead and deposit it.  Once you received it, it's your check. BTW ianal",legaladvice,1
No one's mentioned the possibility that she could have been cheating on you. IANAL but I'd be very interested if someone could tell me how you get caught doing something like this wouldn't the two just have to pretend they love each other? how hard is that?,legaladvice,1
I've got some good corporate attny's in chicago that could tear this fraud apart for you if you want someone to reach out to. This is very sketchy,legaladvice,1
"When fighting fire with fire you have to make some decisions about what lines are okay to cross. How would the flyer of the drone prove you used a jammer vs an in flight malfunction? 

Just don't get caught using it and you'll probably be okay.",legaladvice,1
"100,000
",legaladvice,1
"There is a case - Evans v Cross 1938. A British case where it was ruled that paint on the ground was not a traffic sign. Therefore, in my opinion, if you were in a lane and following it's direction - particularly on a highway - you are legal in overtaking on the right. In my jurisdiction you must indicate if you are shifting more than one car width. I would accept the speeding fine but dispute the penalty on the other. Do not reject it - say that you accept you have done this but you believe you are justified in your actions. If you accept liability they can not chase you for failing to pay any fines etc. Perhaps send a letter or an email explaining the situation. The suggestions of claiming ignorance through interpretation in my opinion will not get you anywhere as the purposive or mischief will will prevail. ",legaladvice,1
"Wow. Thanks for making me realize this sub is useless. You clearly didn't read anything I posted and you're also a judgmental asshole. I didn't know going 8mph faster than everyone else is grounds for ""needing"" drivers training. Also, if you read my post, you'd see that it's just a fine, as in no points will be charged against me. ",legaladvice,1
"he could sue for it since it was a gift. source: enrolled in law course, just went over claiming objects as gifts",legaladvice,1
"*Your post has been removed for the following reason(s):*

Your comment has been removed for one or more of the following reasons:

* It was generally unhelpful or in poor taste.
* It was confusing or badly written.
* It failed to add to the discussion.



*If you feel this was in error, message the [moderators.](http://www.reddit.com/message/compose?to=%2Fr%2FLegalAdvice)*",legaladvice,1
He's been paying alimony for 24 years? Jesus Christ,legaladvice,1
"He's giving you good advice.

If you have any daughters over the age of 12, I strongly advise not having this kid live with you.",legaladvice,1
"The poo won't have a big affect on your quality of life. Freaking out about the poo can and appears to be doing just that.

The dog owner is an asshole, yes. But you're letting them get to you over something that is pretty minor.",legaladvice,1
"You really need to contact either the FBI, or whatever agency brought previous charges against the guy. If you don't want to go directly to police, you might be able to work through a local reporter that covered the stories who could relay the information.

> I don't want to like call the police up because that puts me in WAY too deep.

Do you want to stop the guy or not? It's not about you, it's about his potential victims in the future.",legaladvice,1
"Most importantly, how much rank did you lose in overwatch for abandoning a match?",legaladvice,1
stdh.txt,legaladvice,1
How fucking hard is it for you to understand that when offered 2 does not make it ok to take 8?,legaladvice,1
"you have a drug dealer that you consider a close friend and someone managed to talk you into raiding a house. I don't know where you live but in my state we have a little something called castle doctrine and all your asses would be dead and to be completely honest that's the preferable outcome because now you guys are going to cost tax payers lots of money. They will come for you all eventually if you think your cousin isn't going to flip you're even stupider than you sound. The second the DA offers him 3yrs and parole instead of 10-15 he's gonna roll on you hard and if I were ""c"" I'd make sure I was at the hearing every single time you came up for parole so you did your entire time day by day.",legaladvice,1
Take it to the media,legaladvice,1
Talk to a family law attorney in your State to see what your options are. ,legaladvice,1
"Why would the cops call from a private number? Either way this is black and white and you are probably safe - if cops have proof they arrest, if they don't then they hassle you for proof. Don't answer calls. Also, if someone is calling you posing as the police then they are committing a significant crime. ",legaladvice,1
"It most certainly was not ""bad advice."" A person is not going to get a ticket in a courtroom for something s/he admits doing. A ticket can only be issued by a police officer upon witnessing an infraction, not by a judge in a courtroom. That is not contingent upon someone's location; it is a legal precedent that has been ubiquitous in American jurisprudence for eons now. 

SOURCE: I was a police officer for more than 20 years. Bad legal advice. lmfao  ",legaladvice,1
No I was not driving ,legaladvice,1
Route 66,legaladvice,1
"Go buy yourself a beater car exclusively for this purpose. Then once the valet keys it or flips out, bang, small claims.",legaladvice,1
Your family sounds completely toxic.,legaladvice,1
"In this case I would think I would be the plaintiff if any action were to occur. In fact this is kind of an early ""we're gonna contest the will"" shot across the bow.",legaladvice,1
"Presumably if it is done properly or taken care of properly it wont need to be fixed every 5 years. But if it does need redoing 10 years down the road due to a problem I dont think they will be responsible. However you should have medical insurance, will that not help at all in this case since it is causing problems? Im no expert on when dental/eye can be covered under medical or not.


How bad is the chip? Unless there is a hole in your tooth why not just leave it? I chiped a piece of tooth off. Sort of skined the tooth. Made it extra sharp so for the last 10 years of my life Ive had a personal fishing line/assorted stuff cutter.

A guy at work has two teeth chipped slightly, on the corners facing eachother. If you are doing electrical work and need a wire stripped, he can do it instantly.


Its not all bad!",legaladvice,1
"How about you put on your big girl pants, ovary up and stand up for your damn son?!?!

Conversion therapy KILLS children.  The suicide rate after Kid's go through conversion therapy is astronomical.  Even if he doesn't end up suicidal, he'll probably never speak to you again.  

He's your son for fucks sake.  Stop being a door mat to your husband and do something.  Divorce your bigoted asshole of a husband and file for sole custody.  Conversion therapy is illegal in New Jersey.  I'd hope the family court would grant sole custody based off that alone.  ",legaladvice,1
"Ok.  This is sort of a ""scam"".  Recently Florida has gotten very strict on monitoring opioid use.  Therefore, physicians are doing urine drug screens to cover their butts.  Usually the doctor does a qualitative test in the office that tells if a particular substance is present in the specimen. This looks for the drug prescribed as well as drugs not prescribed.  From there the doctor sends it to a lab for a quantitative test.  This test shows the individual drug and/or drug metabolite with high specificity and better sensitivity.  For that test, they charge a darn fortune.  However, there is good news.  Often the doctor has a ""deal"" with the lab that they will not charge over a certain amount and sometimes nothing at all except for what the insurance pays.  It is likely your mother's doctor has some kind of deal with the lab because if they are billing 11K to all her patients, she is going to be losing a lot of them.  I would suggest your first call would be to the doctor's office.  Not billing, ask for the clinic.  They know the ""sales rep"" from the lab and can work on your behalf.  Explain that your parents are indigent and you  need as much of this written off as possible.  Ask for the sales reps name if you don't get anywhere with the doctor's office.  If you PM me the lab, I may be able to give you more information.  This is big business around Florida right now BUT they are rarely going after the patients, just the insurance companies.  Good luck.",legaladvice,1
Just another reminder that pets aint fcking worth it,legaladvice,1
"You sir, are an idiot",legaladvice,1
"IF you don't see the difference between ""pay your rent or face eviction"" and ""pay me back or I'll call your employer"" than you are the dumbest fuck on the planet",legaladvice,1
That's just despicable.,legaladvice,1
You said OP proved them right (being a crybaby racist).,legaladvice,1
"
[](https://www.reddit.com/r/legaladvice/comments/5gthzc/is_my_friend_protected_by_the_fourth_amendment/)[](https://www.reddit.com/r/legaladvice/comments/5fwrmw/statute_of_limitations/) You and ""Jonathon"" are definitely going far in life.",legaladvice,1
"I work in IT for a large company spread out across the US and have to be on-call 24/7.  I get paged at all hours of the night and log in to fix whatever is broken.  They still expect me at work at the same time everyday even if I was up all night working on on-call issues.  I would look into nootropics if I were you.  I take Inositol and Choline when I know that I'm going to get very little rest, like working all night on an upgrade.  Even if I only get 4 hours of sleep, I wake up feeling refreshed and ready for the day.  YMMV.",legaladvice,1
"> HFS+

...which just celebrating the 19th anniversary since its release. ",legaladvice,1
"The Magnuson-Moss Warranty Act of 1975 prohibits a manufacturer from voiding a warranty because of a properly functioning component made by another company.

I'm far from an expert in this field, but I suppose the crux here is what the warranty for the battery says (if no warranty is provided then Magnuson–Moss compliance is not relevant), whether or not a battery charger is a ""component"" under the law, and then if this charger was ""properly functioning.""
",legaladvice,1
"ex-mod of pizzagate here. 

I have screen shotted proof that the admins were partaking in tomfoolery within our subreddit. ",legaladvice,1
No and he wont. Its about following the law. Not discrimination. Don't listen to Liberal Media. ,legaladvice,1
There has been at least one proven pregnancy that was not caused by intercourse.,legaladvice,1
"Calm down, jesus. Also this:

> Stop trying to paint me as an asshole apologist because you can't handle dissent.

LOL what? Can we paint you as an aggressive dickhead because *you* can't handle dissent?",legaladvice,1
"The city isn't responsible for the misinformation you got from your leasing office; the leasing office is responsible for that. If you sue anyone, sue the LO in small claims court.",legaladvice,1
"Whatever you do, be sure to update us!",legaladvice,1
Maybe the boss identifies as the other gender that day. ,legaladvice,1
"Really, this is /r/legaladvice, not /r/philosophicaldiscussion.",legaladvice,1
Oh come on it cant be that bad.  ,legaladvice,1
"I'll bet you a year of gold ""daddy"" doesn't know he's not the father.",legaladvice,1
"gambling isn't actually illegal in the United States. HOSTING a gambling operation in the US is what's illegal. if you want to bet on the game, set up a Bitcoin wallet on circle and buy Bitcoin that you can then transfer to many online betting sites (nitrogensports.eu). these websites are hosted offshore and can be used by Americans to sports bet.",legaladvice,1
!RemindMe 30 days,legaladvice,1
"I think what you meant to type is ""What notes? There were never any notes.""",legaladvice,1
Put her keys in a complicated puzzle box. ,legaladvice,1
First off have them buy you a pack of smokes from circle k,legaladvice,1
Obvious troll is obvious.,legaladvice,1
"I'm not a lawyer, be ready to call and ask, but spouses trying to be able to stop him from collecting the kids.",legaladvice,1
"A ""wrongful birth"" civil lawsuit would claim that the hospital is liable for the costs of taking care of the child etc. as they were negligent in detecting and informing parents of the birth defect.  This seems to be explicitly outlawed in MI under Section 600.2971:

"" A person shall not bring a civil action on a wrongful birth claim that, but for an act or omission of the defendant, a child or children would not or should not have been born.""

..and goes on to exclude medical and living expenses etc.

http://legislature.mi.gov/doc.aspx?mcl-600-2971


You should be able to file for emotional distress though.",legaladvice,1
Hah. I work for a similar luxury european car brand and the same thing is happening with a sale in another state. Like...wow...we get it....your dick is miniscule.,legaladvice,1
