body,subreddit,moderated
"I'm sorry, I guess I read that as ""prescription drugs cannot be mailed at all"" when really they meant ""op cannot mail prescription drugs"" my bad guys!",legaladvice,0
"Here's an even sillier(?) example.

It's 1865. You own slaves. Congress abolishes slavery, making it illegal to own slaves. You don't get to keep owning slaves just because you owned them before it was made illegal.",legaladvice,0
[removed],legaladvice,0
"I don't think there's much more to say. It's self-explanatory. You've come up with a smart scheme, but it's only smart in relation to your intelligence. There are more intelligent people out there, so your scheme will fail.

You might want to google Dunning-Kruger some time.",legaladvice,0
Have you talked to the public utility district? They may waive the fee if you tell them what happened nicely. ,legaladvice,0
[deleted],legaladvice,0
"Yeah, that's pretty much illegal all around. If your boyfriend doesn't claim that money on his taxes, he'll be doing something illegal too. ",legaladvice,0
That is good news. It would be horrible to be uprooted when I really just want to finish the year out here.  ,legaladvice,0
[deleted],legaladvice,0
"Well this is what im trying to say, since im overly cautious of the cameras, i make sure that im not speeding.",legaladvice,0
"Wow, I honestly haven't seen this one in a few days on here, and the ER mom is a nice new touch. Thanks OP",legaladvice,0
Is the best way to handle this situation? I would like 4 years of records to checked. I hever thought that aomeone could edit time so easily.,legaladvice,0
"They don't have to conform, just like people don't need to allow them to become a nuisance.",legaladvice,0
A lawyer could negotiate with the prosecutor for an immunity deal in exchange for your testimony. ,legaladvice,0
"You do not meet people in any IRS scam I'm aware of. 

&gt; They will meet you and inform you if you give them X amount of dollars they will do away with the warrant. ",legaladvice,0
Would it make a difference if it was in the USPS custody at any point in it's delivery? It seems more common these days for shipping companies to outsource to one another. Most of the time I buy something on Amazon it seems to switch hands several times throughout it's journey.,legaladvice,0
"My mom was a notary and kept hers at home. I found it in her drawer and stamped a million fucking papers with it.

She. Was. Pissed.

I didn't realize until I was older why she got so bent out of shape about it.",legaladvice,0
"If it helps, overnight parking is banned in my city too. However, I can always contact my local police and let them know if I need to leave a car on the street for s night or two. As long as snow plows or street sweepers aren't scheduled to go by, they approve it and I never get a ticket. ",legaladvice,0
"I kept my name when we got married. I am not looking to change her last name, only her first and middle. Would the process still be the same?",legaladvice,0
"No idea why you are being downvoted. As far as I can tell, you're exactly right. There's no actual conviction if you successfully pass court supervision as the charges are completely dismissed. ",legaladvice,0
[deleted],legaladvice,0
Was he a new employee or was from open enrollment for a new plan year?,legaladvice,0
"It depends on the specific disability policy you're under but the general answer is that they couldn't do anything as long as your need for leave was legitimate.  Running out your leave in accordance with a doctor's recommendation and quitting after you return is perfectly legal.  It's somewhat common with maternity leave.  It's not necessarily nice, but not illegal.

~~The only thing you'd owe is any insurance premiums you'd owe regardless of employment status~~.  You could be asked to return the employer's portion of health insurance premiums paid while out on leave if you don't return to work.  But you wouldn't be asked to repay benefits unless they tried to allege the leave wasn't valid in the first place.  ",legaladvice,0
"That's generally true and sound from a technical point of view (without factoring the consumption for heating/dissipation for camera enclosures which generally do not run on PoE, but that's another story). It should be noted however that while room heating and cooking might still work even without electricity (i.e. using a stove and/or propane tanks) you generally need electricity to run a surveillance system.

OP might consider trail cams, which should work off the grid, if he expects to lose the generator, making sure to check the cameras IP ratings (an IP67 might be warranted with a storm coming).

",legaladvice,0
"Yay, an OP who actually listens to advice.",legaladvice,0
"There's no reason to go to the police unless you can prove that he did it maliciously. It sounds entirely like a civil matter. You can sue your roommate, but you would be seeing a college student. Do you believe he has the money to pay? I am probably going to guess doubtful. ",legaladvice,0
Neighbor is going to prison for a very long time.,legaladvice,0
His attorney told hers that they would be taking the house and no alimony would be paid out on his part. He bought the house and appliances before the marriage.,legaladvice,0
"Well with all due respect some blame should fall on her if she allowed the child to wander outside when she was asleep, even if she was stone cold sober. ",legaladvice,0
You can deny for whatever reason you want. Doesn't mean it will stop them if they're going to search anyway. ,legaladvice,0
"1. Nobody mentions brown paper towels, and any wrongdoing from the child. So what are you rambling about?

2. You'd be happy if the teacher yelled at OPs child if there was wrong-doing. That's cool, except that's not what happened. Did you read the story? They were picking pee and shit off the floor.

3. The only people with the full picture is the teacher and two children. It doesn't matter what the principal and superintendent think then, is there? Shouldn't they be the one to listen?",legaladvice,0
"new gym hasn't given me any agreements and I have not signed anything with them.

No, unfortunately I signed up around a year and wasnt smart enough to keep it ",legaladvice,0
"The law requires that the information be given. Period. 

And if he sues *you* before your insurance company even gets a whiff that this happened? You're gonna be wishing you did this by the book. You're going to be praying that someone invents a time machine. ",legaladvice,0
"Holy shit you must have a tiny bank. There is literally no way this would happen at most financial institutions. I work at a smallish regional bank. We have tens of thousands of items going through our system every day, and it would cost WAY more to pay a bunch of people to physically examine each image than it would cost to take a forgery-related loss every once in awhile.",legaladvice,0
"IANAL but worked in sales. Your wife and SIL almost certainly signed a contract that described exactly what sorts of charges would start to occur in the future. A *lot* of cell phone places will do call overs and say ""hey, do you want a free XYZ?"" and then lock you into a multi year contract.

There's no such thing as a free lunch (or tablet). I'm curious as to the reasoning the sales person gave as to why these tablets were free and how it wouldn't cost them anything in the future.",legaladvice,0
[deleted],legaladvice,0
If I was your employer I would challenge unemployment if you refused to work in your newly assigned position. I'd say you quit,legaladvice,0
[removed],legaladvice,0
Fallacy of relative privation,legaladvice,0
Worst case they can foreclose on the house. But you won't be able to sell it until it's paid. Someday when you die they will get paid because it will be part of your estate.,legaladvice,0
"Yes, and the landlord did offer to let me move back in. But the building won't be livable for 4 months or more, and that is a long time to be a floater.",legaladvice,0
"On top of that, some universities will have a free legal service office that could help you with tenant issues.",legaladvice,0
"Without specific details no one can really help you.

The police will need to release you within 24-48 hours if they can't get a warrant.",legaladvice,0
"If you can pay for it, do it.",legaladvice,0
"I didn't think you were purely being a dick. I thought that some of your points were worthwhile but the attitude you convey definitely detracts from them.


I actually enjoy hearing peoples rules to live by but the inclusion of them in your post confused me.",legaladvice,0
Maimi is the international port.  There would be no more updates once it leaves unless Greece post uses the barcodes.  Only global international has tracking guaranteed from door to door.,legaladvice,0
Siblings and my. Not siblings and I's.,legaladvice,0
I was in a car. I did not lose my license.,legaladvice,0
"Before you leave, find out when your insurance end date is, and make sure you find out the last day to use any FSA contributions. It's not always the final date of employment.",legaladvice,0
"To withhold your transcript over something that's been determined is necessary? Probably. You're not looking at this from a logistics stand point. Even if it wasn't legal, you aren't going to convince them that they should give you your transcript without spending more time, effort, and possibly money than it would be to just sit through the damn online training. Hell, you can probably just start the thing up and walk away from the computer and answer the banal questions correctly without ever having to watch or read whatever they think is necessary. You can take a stand, or you can just go about it pragmatically. ",legaladvice,0
How exactly are you going to force a fully grown teenager to shower?,legaladvice,0
Reputable newspapers won't pay for stories and disreputable ones don't report on insider trading,legaladvice,0
[deleted],legaladvice,0
When life gives you dead puppies... make lemonade? ~~;__;~~,legaladvice,0
"Yeah it's registered with GoDaddy, has a ton of good backlinks and is 15 years old; it'll go straight to auction ",legaladvice,0
"Well, you can have your ""integrity"" or you can have your transcript. Which do you want more? The training isn't going to magically change your point of view on things. Keep your values, swallow your pride, and take the path of least resistance to get what you want. ",legaladvice,0
"Of course they can order you to do things. So can I. Or you. Hell, my 4 year old orders people to do things all the time.",legaladvice,0
"No, if the other buyer has contacted the original seller and you still have it, you can complete the sale assuming the original buyer and you agree to it.  I suggested getting it in writing.  The new buyer should pay for the shipping and should pay the seller for the item.  You have been more than kind in facilitating this.",legaladvice,0
"Even if they did send it by email, why would they send it to the student and not the parents? Think about it. If they sent it to the student, then all the student would need to do is leave their house to ""go to school."" and spend the rest of their day goofing off outside of school.

No, they would send an email like that to your parents, so that they know that  you got suspended. OP should do what you said, if it really does turn out that he is suspended, then your parents have an opportunity to raise hell in an environment where school officials can't ignore your parents without seeming like assholes.",legaladvice,0
"I'd really like to protect my daughter from any further contact with law enforcement, if possible. After the CPS investigator and three uniformed police officers left our house, she said they came to take her away because she's mad sometimes but I wouldn't let them. I cry every time I remember that. We had to stop and witness an accident last night and she cried when the police pulled up.",legaladvice,0
"Caught me! Good job. 

Except not... All I wanted was clarification. OP's post says the lease is silent, then another comment says some utilities are covered. I was just asking for the wording of the lease to understand. ",legaladvice,0
What would you do if you were in my situation? ,legaladvice,0
The law does not restrict people from telling the truth.,legaladvice,0
"&gt; and did not seem qualified or having the proper training whatsoever. 

 And you're qualified to make that assessment? Based off...? Your professional experience? ",legaladvice,0
"&gt; Meaning that if you do something that really pisses off your bosses, they can fire you regardless of what the handbook says.

or if they don't like the shirt he wore last Wednesday.",legaladvice,0
"*Your post has been removed for the following reason(s):*

**Bad Advice**

* This post is being removed because it is, frankly speaking, bad legal advice. Either it is inapplicable for the jurisdiction in which OP resides, or misunderstands the fundamentals of the applicable legal issues. 



*If you feel this was in error, message the [moderators.](http://www.reddit.com/message/compose?to=%2Fr%2FLegalAdvice)*",legaladvice,0
"&gt;except that being high is way diff erent then being drunk. you cant compare the 2.

You're an idiot.

It's legal to drink (assuming you are of age) as well. It doesn't mean you can't be fired for drinking before work. Sheesh. 

Your brain on drugs.",legaladvice,0
"And once again, the answer to your question is No, the attorney did not deceive you.  Filing a complaint with the state bar is still ridiculous. 

He/she determined which legal document fits your situation. Are you a commercial property owner? Are you subject to regulations which apply to mom-and-pop landlords as compared to regulations which apply to large scale apartment houses? Are you willing to risk your personal assets being at risk if you are sued? Are you aware of all legislative changes in the past five years in your State/County/City regulations regarding rental property? 
What about ADA requirements? All these things and more go into the determination of what is appropriate and LEGAL in your jurisdiction. 

Go right ahead and use your ""old"" lease because you think the new one is ""klunky"" - I'm not the one who will be personally liable, you will be.  But just don't go running to the State Bar complaining when your tenants take you to court and sue you personally because YOU, as a layperson believe the old and new leases are ""virtually identical.""   Good luck with that. ",legaladvice,0
"It was on a Saturday, so the gates did not open or close.",legaladvice,0
"You said 

&gt;That's who is presiding over his court case.

Do you actually have any information indicating he's currently being sued, or are you assuming it? I'd also say referring to a civil suit as a just outcome here is lackluster.",legaladvice,0
Gotta ask....what are you talking about?,legaladvice,0
"If you have any continued problems, contact the attorney general's office consumer protection division.  This office is *very* aggressive.",legaladvice,0
"Calm down, nothing is going to happen, just get the fuck off 4chan if you don't want to get Malware or some shit.",legaladvice,0
[deleted],legaladvice,0
"Im not a lawyer, just had a lot of dumbass ex friends till I cut contact a few years ago. Since your not sure if they took one of the xanax or not to test it, I have no clue what to expect. What does your ticket say? You really want to go talk to a lawyer man, they can advise you a hell of a lot better. ",legaladvice,0
Only if you get a new username.,legaladvice,0
"There's almost certainly a clause in your contract with them that lets them do this. 

Find a new place.",legaladvice,0
There's too much crazy in Texas lol.,legaladvice,0
"&gt; Yeah I have been looking at the small claims court in BC, and it costs $100 just to file a claim to make it a case, which I don't think he'll do...

If he wins, his expenses in bringing the claim (like the filing fee) gets added to what you owe. Similarly, if he wins and has to file for garnishment, the fee for that gets added to what you owe. So its not really the barrier you are thinking to sue you in small claims.

&gt; What does being ""served with a formal complaint, file a response as directed in the complaint and show up for your hearing. "" mean??

If he sues you in small claims court, he needs to serve you with the notice of claim. You need to respond with the proper form

&gt; what if he claims that the fraud was 'intentional not paying back' type of things??

As as already been explained to you, that's not fraud.",legaladvice,0
"OP. I went through your exact situation (albeit in Nebraska).

I have a lot of advice for you; I'll be back tonight to post it... I don't want to take the time to type it all up on mobile.",legaladvice,0
"Paper prescriptions are no longer valid in NY, they have to be electronically issued by the doctor directly to the pharmacy now.",legaladvice,0
"Yeah, I did a little looking around out of curiosity- it seems that SOAP notes can be used in other areas outside of medicine. Makes sense it's a good structure.",legaladvice,0
Seriously do this. I had an issue when I was laid off and there was a hang up between two systems. Over $1k worth of payment was in limbo for over a month. Nobody could help me. I would call on the assigned days and get nowhere. My local representative's office had it fixed in under 24 hours.,legaladvice,0
"AZ's implied warranty of habitability statute is [right here](http://www.azleg.state.az.us/FormatDocument.asp?inDoc=/ars/33/01324.htm&amp;Title=33&amp;DocType=ARS). If you notice, nowhere in there does it say anything about the smell of weed. 

The state makes it very clear what things it considers to be a habitability issue and the smell of weed is not one of them.",legaladvice,0
"being investigated is not a crime.. but what took place under that investigation definately is.. and a horrible one at that.
and you would have to be a lawyer to ask me ""such as?"" in a more private forum.
im american as you get pall. no affiliation with any soviet, or any one .. ive lived in the same small town near my whole life. i love hum,an life.. and if i was that type of person i would have went postal long ago.
and if they were hiding a crime that they committed.. it is a crime.
 if you still think im not intelligent or that i am lying by the post and responses ive given here.. then there is nothing i can do about that.. what i am saying is the truth. and if you heard all the details you would probably turn pale. but the details over what i have given is personal to me. and to be shared with an attorney who will consider take my case.. and in a private manor. again, im sorry if i wasted your time. i am frustrated.. so forgive me if i came across as obtuse.. but any advice you can give me, with the thought in your mind that i am telling the truth would be a big help.. and if not.. then good day and thanks for listening.
",legaladvice,0
"Location:  Texas, USA",legaladvice,0
Were you compensated fully by your insurance?,legaladvice,0
"Yup. 

""2013 New Jersey Revised Statutes
Title 39 - MOTOR VEHICLES AND TRAFFIC REGULATION
Section 39:3-69 - Horns and audible warning devices.""

Basically, you can only use a horn in response to emergency situations or to warn or alert other drivers to something. 

",legaladvice,0
"Well the only issue I really see here is neither is in your name, the  shop is not required to release a vehicle to someone it's not titled/registered too.

Where are your parents in all this?",legaladvice,0
"I appreciate the honesty. Given my child has been with me primarily since birth, does full custody seem likely or potentially an uphill battle?",legaladvice,0
Because you're under 18 you can have your [license suspended](http://www.bmv.ohio.gov/dl-gdl.aspx) regardless of the points.  You really need to stop driving like shit or you'll be paying a premium for crappy insurance.,legaladvice,0
"Correct, we knew there were minor issues (again, which we chalked up to unusual amount of rain at the time) but not to the extent that we are now encountering. 

Evidence to prove they knew about the the extent of the issue include: putting new carpet on top of the old tile, blocking off a small section of unfinished basement with unfinished drywall (where moisture is coming up), paint behind insulation, and random mold spots which were treated prior to purchase. 

I realize proving negligence will be difficult so we are carefully documenting everything that happens and have a history of communication over the initial matter. 

Also, not sure if we should contact our realtor or home inspector to see what can be done. Not sure what we'd be asking from them to be honest, maybe the realtor company would have attorneys. I feel like the home inspector did a good job and this wasn't something that you could see at the time especially since the carpet was covering the floor at the time. ",legaladvice,0
[removed],legaladvice,0
I gotta say. although my intentions are good. I am wrong. thank you so much for the people who commented. The advice means a ton.,legaladvice,0
"&gt; There is no ""best lawyer"" for one thing.

I tried to cover this with the ""better business bureau"" thing, the best lawyer is given this by his firm being chosen by the BBB, and since he did most of the work in that category he gets the title. ",legaladvice,0
"*Your post has been removed for the following reason(s):*

&gt;user reports:

&gt;2: Troll Post

&gt;1: Someone let the retard out of the attic again.




*If you feel this was in error, message the [moderators.](http://www.reddit.com/message/compose?to=%2Fr%2FLegalAdvice)*",legaladvice,0
"It's not what I did, it was not a public page for her company. Learn to comprehend your reading better ",legaladvice,0
"True, but that's the unlikely worst case scenario. He doesn't need to worry too much about it, and he can set up a contingency plan now with his other mom or his friends.",legaladvice,0
"Tacking on to this, if he does anything report him to the NV Bar",legaladvice,0
"A 6% lease breaking fee seems more than reasonable, and even perhaps quite generous.  

As to the days before the new tenant moved in, it seems likely that you were responsible for the time the apartment went unrented.  The agreement between you that you might leave early complicates that a bit, but I'm not sure that it absolves you of your liability for those days.  You could make your argument, he could make his, and a judge could decide.  

You seem to want to take the position he pushed you out early.  Another take may be that you agreed to leave early for your mutual benefit in terms of another tenant taking the property you were contracted for.  

As to the cleaning fees, those are the standard dispute.  You argue that the place was clean.  Landlord argues additional cleaning was needed.  A judge would have to decide who was right.  

Overall, it doesn't seem like a ton of money is at issue.  If you got out of two months of a lease for $468, it seems you may have gotten more than you could have hoped for.  ",legaladvice,0
Regarding what?,legaladvice,0
"Nope. Not today. 

Post deleted",legaladvice,0
Which county?,legaladvice,0
Call the court. Translators are typically provided for free.,legaladvice,0
"Thank you. I know, I need to hear that. I could have died. I lost my home. 
I need to be able to pick up the pieces. ",legaladvice,0
true i know the risks and i accept them,legaladvice,0
"My previous post have nothing to do with this one. Why do some officers have dash cams and other don't. Should I look under the Heath and safety code, Penal code, Vehicle code? I have no idea. ",legaladvice,0
"No I know what you're intent is.  While I agree that your definition is correct, I personally think that once you have taken the time to explain and defend each step properly it becomes a regular argument.  But either way, we have no disagreement.",legaladvice,0
"Your corporation's name is ""Corporation Name, Inc."" Your assumed name is ""Assumed Name."" You cannot use the term ""Inc."" with ""Assumed Name"" because ""Assumed Name"" is just that -- it's not the legal entity's legal name. In other words, ""Assumed Name"" is not a corporation, it is an assumed name of a corporation, and you can only (a) operate under an assumed name as long as you have the proper permission from the state and (b) use terms such as ""incorporated"" when using the actual name and the appropriate term for that actual name. ",legaladvice,0
"&gt;can I write a document that trumps federal law?

Seriously? 

",legaladvice,0
Perhaps you need to change your weather outlets.  I dont want to go into to much detail here but the storm is going to stay well off the Florida Coast.  Additionally the force of this storm is to the north east of this storm.  Its a non event for florida.  Maybe some improved surf and rip currents but not any significant rain.,legaladvice,0
Is she on the title to his house or is she just on the mortgage? Is the mortgage up to date?,legaladvice,0
There's no way to know. They could call you or they could break down your door. Depends on the severity of the charge/evidence. ,legaladvice,0
Ok I've been debating getting an attorney but I don't want that to make the judge angry and ramp up the sentence or find out that the cop was being nice to me and actually clocked me as going faster (although I'm pretty sure he didn't) and lose my license.,legaladvice,0
You have to give notice **in writing**,legaladvice,0
"If I do that and she denies anything is going on, what would happen then? ",legaladvice,0
No - I am trying to udnerstand the law and what it means in different situations ,legaladvice,0
