body,subreddit,moderated
"There's the smug troll we know and love! I had a feeling you'd go back to the tried and true method. No hard feelings. I understand that simple logic is pretty hard to refute and I appreciate that instead of just vanishing in embarrassment you've chosen to continue to keep me company <3

---

[Aww yiss](http://i.imgur.com/BD5dOac.png), this is my favorite part. The part where you read plain and simple logic, have absolutely nothing reasonable to say back, so your only recourse is to pretend you were too good to read it. That alone would be satisfying enough but then you also pretend your inability to format a comment is on purpose. [Oh you](http://i.imgur.com/w3qdG9G.png), I know you're just doing that to make me feel good ;) But wait, there's more! In the same point you attempt to refute something I said in my comment and simultaneously claim to not have read it. [It's like silly internet fight Christmas!](http://i.imgur.com/QFiFFem.png) You went to so much trouble to get me something and I didn't get you anything. What can I get you on such short notice? The only thing I really know about you is that you're insecure; perhaps [a motivational pillow](https://www.amazon.com/Inspirational-Motivational-Quotes-Throw-Pillow/dp/B01GJNTJGW/ref=sr_1_7?ie=UTF8&qid=1483172196&sr=8-7&keywords=motivational+pillows)? Then you can wake up inspired every day! I know it doesn't really compare to everything you got me, but I have to get you something or I'll just feel terrible.

xoxo",Overwatch,1
i have been told i have no neck,Overwatch,1
"Actually i dont need to read before downvoting, because the fact that you think Reinhardt needs a buff is fucking stupid",Overwatch,1
"I am ready for the hate I ~~might~~ will receive from writing this comment. I always tell people to kill themselves, it's just a thing I say. I don't think of it as an issue but others have and tell me ""Don't tell people to kill themselves, what if they actually do it?"". And to that my reply is always the same, ""if some random person on the internet tells you to kill yourself and you do it, then you're stupid and there probably wasn't much of a future for you anyway."" ",Overwatch,1
"I love the game Overwatch, but i am a console player at heart. For one im looking for people who want to play on ps4. Consoles need love to.
Im also looking for some help on my channel on YouTube if you are interested in watching competitive matches on console. The series im working on is called Grandmaster Quest. Like the name suggest its a series where i play competitve mode in each season trying to reach the goal of Grandmaster, difficult, i know. That won't stop me its about the journey aswell but im always looking for people to play with while i record. Its a newer channel so im not up there yet but im hoping i can turn it inyo something.
https://www.youtube.com/channel/UCvPWSDVRYpV_o19-enqf-ig
don't forget to sub and share, i appreciate all the love. If you don't want to no big deal!",Overwatch,1
"༼ つ ◕◕ ༽つ SOMBRA TAKE MY CONNECTION SPEED ༼ つ ◕◕ ༽つ

---
If before making your post you didn't check the [wiki](http://wiki.gamedetectives.net/index.php?title=Sombra_ARG), searched if the information has already been posted or are **wildly speculating** based on no verifiable facts then your bandwidth is now  taken by Sombra.",Overwatch,1
"And of course you have a mercy flair. Shows that you are a scrubby Mercy main with no skill or aim. ;)

Jesus christ you supports really hate your fellow DPS.",Overwatch,1
"https://m.youtube.com/watch?v=J-98MHc-aos
",Overwatch,1
"I still think they should be rounded up, put in a labor camp, and then shot.",Overwatch,1
"Again, can't tell if troll or stupid.  You should really stop using Daddy's acount, kiddo.  I thought I went over that yesterday.",Overwatch,1
And really... making fun of me playing the division and overwatch on console? Lol stop being such a vagina. Your mommy paid for your pc. You cant be pcmracist only she can. ,Overwatch,1
"Sigh.. How do the same retards end up moderating so many large subs?  This idea is dumb as fuck, and is clearly the result of someone on a powertrip with not enough to do.",Overwatch,1
it's sad to sit at this autistic forum with fags like you,Overwatch,1
stfu and go play at ur rank 0 retard kid virgin,Overwatch,1
"Buh-bye pussy boy, you won't be missed. Have fun not playing Overwatch. P.S. You'll still keep your preorder and buy it, because you're just being a dramatic baby on the internet because you think your opinion matters. lololol",Overwatch,1
petition to have retarded threads like this deemed cancer.,Overwatch,1
You sure it wasn't the tits?,Overwatch,1
"Console, LUL.",Overwatch,1
fucking hell this is the one time I would tell someone to kill themself. ,Overwatch,1
"god your a fucking retard. You should take a .44 put it in your mouth and blow your brains out. You are a  autisc shit head who needs to die. I like to think you where ass fucked by your dad and face fucked by a homeless man. Your dad should've pulled out you poor ugly bastard.
",Overwatch,1
Yes because on mccree i can jump over the wall. ,Overwatch,1
I'm sorry you don't have any sort of life.,Overwatch,1
Head on over to 4chan and be ready to shove things up your butt. You'll find a buyer or at least learn a few things about life.,Overwatch,1
"Uh, yeah. But thats not the wrong reason.  I was referencing /b/'s love of loli and the fact that the show starred delicious loli.

GTFO newfag.",Overwatch,1
Most people have suicidal thoughts and depression at some point. You're not special. Just grow up mate.,Overwatch,1
/r/edging ,Overwatch,1
つ ◕_◕ ༽つ GIFF SOMBRA,Overwatch,1
"[I guess you should just get som-better at the game then, huh?](https://youtu.be/PEYjSXSTj0o?list=PL4YotwytAATVbgyXZLpS6gpt4_Oo3m1-i)",Overwatch,1
Later talked about his [main account](http://masteroverwatch.com/profile/pc/us/Cody-13892/compare). I'm sure he has never been reported before /s,Overwatch,1
go kys,Overwatch,1
Kys,Overwatch,1
shut the fuck up you stupid bitch,Overwatch,1
"Hey......Hey faggot...


Git gud


",Overwatch,1
"Yup, Like League or Dota would be a nice add-on. 

***IF I HAD OVERWATCH*** ",Overwatch,1
"http://www.philosophyexperiments.com/wason/

/pat.",Overwatch,1
You are grabage and your way in words says it all..,Overwatch,1
You're the cunt with negative karma tho,Overwatch,1
つ ◕_◕ ༽つ GIFF SOMBRAつ ◕_◕ ༽つ GIFF SOMBRAつ ◕_◕ ༽つ GIFF SOMBRAつ ◕_◕ ༽つ GIFF SOMBRAつ ◕_◕ ༽つ GIFF SOMBRAつ ◕_◕ ༽つ GIFF SOMBRAつ ◕_◕ ༽つ GIFF SOMBRAつ ◕_◕ ༽つ GIFF SOMBRAつ ◕_◕ ༽つ GIFF SOMBRAつ ◕_◕ ༽つ GIFF SOMBRAつ ◕_◕ ༽つ GIFF SOMBRAつ ◕_◕ ༽つ GIFF SOMBRAつ ◕_◕ ༽つ GIFF SOMBRAつ ◕_◕ ༽つ GIFF SOMBRAつ ◕_◕ ༽つ GIFF SOMBRAつ ◕_◕ ༽つ GIFF SOMBRAつ ◕_◕ ༽つ GIFF SOMBRAつ ◕_◕ ༽つ GIFF SOMBRAつ ◕_◕ ༽つ GIFF SOMBRAつ ◕_◕ ༽つ GIFF SOMBRAつ ◕_◕ ༽つ GIFF SOMBRAつ ◕_◕ ༽つ GIFF SOMBRAつ ◕_◕ ༽つ GIFF SOMBRAつ ◕_◕ ༽つ GIFF SOMBRAつ ◕_◕ ༽つ GIFF SOMBRAつ ◕_◕ ༽つ GIFF SOMBRAつ ◕_◕ ༽つ GIFF SOMBRAつ ◕_◕ ༽つ GIFF SOMBRAつ ◕_◕ ༽つ GIFF SOMBRAつ ◕_◕ ༽つ GIFF SOMBRAつ ◕_◕ ༽つ GIFF SOMBRAつ ◕_◕ ༽つ GIFF SOMBRAつ ◕_◕ ༽つ GIFF SOMBRAつ ◕_◕ ༽つ GIFF SOMBRAつ ◕_◕ ༽つ GIFF SOMBRAつ ◕_◕ ༽つ GIFF SOMBRAつ ◕_◕ ༽つ GIFF SOMBRAつ ◕_◕ ༽つ GIFF SOMBRAつ ◕_◕ ༽つ GIFF SOMBRAつ ◕_◕ ༽つ GIFF SOMBRAつ ◕_◕ ༽つ GIFF SOMBRAつ ◕_◕ ༽つ GIFF SOMBRAつ ◕_◕ ༽つ GIFF SOMBRAつ ◕_◕ ༽つ GIFF SOMBRAつ ◕_◕ ༽つ GIFF SOMBRAつ ◕_◕ ༽つ GIFF SOMBRAつ ◕_◕ ༽つ GIFF SOMBRAつ ◕_◕ ༽つ GIFF SOMBRAつ ◕_◕ ༽つ GIFF SOMBRAつ ◕_◕ ༽つ GIFF SOMBRAつ ◕_◕ ༽つ GIFF SOMBRAつ ◕_◕ ༽つ GIFF SOMBRAつ ◕_◕ ༽つ GIFF SOMBRAつ ◕_◕ ༽つ GIFF SOMBRAつ ◕_◕ ༽つ GIFF SOMBRAつ ◕_◕ ༽つ GIFF SOMBRAつ ◕_◕ ༽つ GIFF SOMBRAつ ◕_◕ ༽つ GIFF SOMBRAつ ◕_◕ ༽つ GIFF SOMBRAつ ◕_◕ ༽つ GIFF SOMBRAつ ◕_◕ ༽つ GIFF SOMBRAつ ◕_◕ ༽つ GIFF SOMBRAつ ◕_◕ ༽つ GIFF SOMBRAつ ◕_◕ ༽つ GIFF SOMBRAつ ◕_◕ ༽つ GIFF SOMBRAつ ◕_◕ ༽つ GIFF SOMBRAつ ◕_◕ ༽つ GIFF SOMBRAつ ◕_◕ ༽つ GIFF SOMBRAつ ◕_◕ ༽つ GIFF SOMBRAつ ◕_◕ ༽つ GIFF SOMBRAつ ◕_◕ ༽つ GIFF SOMBRAつ ◕_◕ ༽つ GIFF SOMBRAつ ◕_◕ ༽つ GIFF SOMBRAつ ◕_◕ ༽つ GIFF SOMBRAつ ◕_◕ ༽つ GIFF SOMBRAつ ◕_◕ ༽つ GIFF SOMBRAつ ◕_◕ ༽つ GIFF SOMBRAつ ◕_◕ ༽つ GIFF SOMBRAつ ◕_◕ ༽つ GIFF SOMBRAつ ◕_◕ ༽つ GIFF SOMBRAつ ◕_◕ ༽つ GIFF SOMBRAつ ◕_◕ ༽つ GIFF SOMBRAつ ◕_◕ ༽つ GIFF SOMBRAつ ◕_◕ ༽つ GIFF SOMBRAつ ◕_◕ ༽つ GIFF SOMBRAつ ◕_◕ ༽つ GIFF SOMBRAつ ◕_◕ ༽つ GIFF SOMBRAつ ◕_◕ ༽つ GIFF SOMBRAつ ◕_◕ ༽つ GIFF SOMBRAつ ◕_◕ ༽つ GIFF SOMBRAつ ◕_◕ ༽つ GIFF SOMBRAつ ◕_◕ ༽つ GIFF SOMBRAつ ◕_◕ ༽つ GIFF SOMBRAつ ◕_◕ ༽つ GIFF SOMBRAつ ◕_◕ ༽つ GIFF SOMBRAつ ◕_◕ ༽つ GIFF SOMBRAつ ◕_◕ ༽つ GIFF SOMBRAつ ◕_◕ ༽つ GIFF SOMBRAつ ◕_◕ ༽つ GIFF SOMBRAつ ◕_◕ ༽つ GIFF SOMBRAつ ◕_◕ ༽つ GIFF SOMBRAつ ◕_◕ ༽つ GIFF SOMBRAつ ◕_◕ ༽つ GIFF SOMBRAつ ◕_◕ ༽つ GIFF SOMBRAつ ◕_◕ ༽つ GIFF SOMBRAつ ◕_◕ ༽つ GIFF SOMBRAつ ◕_◕ ༽つ GIFF SOMBRAつ ◕_◕ ༽つ GIFF SOMBRAつ ◕_◕ ༽つ GIFF SOMBRAつ ◕_◕ ༽つ GIFF SOMBRAつ ◕_◕ ༽つ GIFF SOMBRAつ ◕_◕ ༽つ GIFF SOMBRAつ ◕_◕ ༽つ GIFF SOMBRAつ ◕_◕ ༽つ GIFF SOMBRAつ ◕_◕ ༽つ GIFF SOMBRAつ ◕_◕ ༽つ GIFF SOMBRAつ ◕_◕ ༽つ GIFF SOMBRAつ ◕_◕ ༽つ GIFF SOMBRAつ ◕_◕ ༽つ GIFF SOMBRAつ ◕_◕ ༽つ GIFF SOMBRAつ ◕_◕ ༽つ GIFF SOMBRAつ ◕_◕ ༽つ GIFF SOMBRAつ ◕_◕ ༽つ GIFF SOMBRAつ ◕_◕ ༽つ GIFF SOMBRAつ ◕_◕ ༽つ GIFF SOMBRAつ ◕_◕ ༽つ GIFF SOMBRAつ ◕_◕ ༽つ GIFF SOMBRAつ ◕_◕ ༽つ GIFF SOMBRAつ ◕_◕ ༽つ GIFF SOMBRAつ ◕_◕ ༽つ GIFF SOMBRAつ ◕_◕ ༽つ GIFF SOMBRAつ ◕_◕ ༽つ GIFF SOMBRAつ ◕_◕ ༽つ GIFF SOMBRAつ ◕_◕ ༽つ GIFF SOMBRAつ ◕_◕ ༽つ GIFF SOMBRAつ ◕_◕ ༽つ GIFF SOMBRAつ ◕_◕ ༽つ GIFF SOMBRAつ ◕_◕ ༽つ GIFF SOMBRAつ ◕_◕ ༽つ GIFF SOMBRAつ ◕_◕ ༽つ GIFF SOMBRAつ ◕_◕ ༽つ GIFF SOMBRAつ ◕_◕ ༽つ GIFF SOMBRAつ ◕_◕ ༽つ GIFF SOMBRAつ ◕_◕ ༽つ GIFF SOMBRAつ ◕_◕ ༽つ GIFF SOMBRAつ ◕_◕ ༽つ GIFF SOMBRAつ ◕_◕ ༽つ GIFF SOMBRAつ ◕_◕ ༽つ GIFF SOMBRAつ ◕_◕ ༽つ GIFF SOMBRAつ ◕_◕ ༽つ GIFF SOMBRAつ ◕_◕ ༽つ GIFF SOMBRAつ ◕_◕ ༽つ GIFF SOMBRAつ ◕_◕ ༽つ GIFF SOMBRAつ ◕_◕ ༽つ GIFF SOMBRAつ ◕_◕ ༽つ GIFF SOMBRAつ ◕_◕ ༽つ GIFF SOMBRAつ ◕_◕ ༽つ GIFF SOMBRAつ ◕_◕ ༽つ GIFF SOMBRAつ ◕_◕ ༽つ GIFF SOMBRAつ ◕_◕ ༽つ GIFF SOMBRAつ ◕_◕ ༽つ GIFF SOMBRAつ ◕_◕ ༽つ GIFF SOMBRAつ ◕_◕ ༽つ GIFF SOMBRAつ ◕_◕ ༽つ GIFF SOMBRAつ ◕_◕ ༽つ GIFF SOMBRAつ ◕_◕ ༽つ GIFF SOMBRAつ ◕_◕ ༽つ GIFF SOMBRAつ ◕_◕ ༽つ GIFF SOMBRAつ ◕_◕ ༽つ GIFF SOMBRAつ ◕_◕ ༽つ GIFF SOMBRAつ ◕_◕ ༽つ GIFF SOMBRAつ ◕_◕ ༽つ GIFF SOMBRAつ ◕_◕ ༽つ GIFF SOMBRAつ ◕_◕ ༽つ GIFF SOMBRAつ ◕_◕ ༽つ GIFF SOMBRAつ ◕_◕ ༽つ GIFF SOMBRAつ ◕_◕ ༽つ GIFF SOMBRAつ ◕_◕ ༽つ GIFF SOMBRAつ ◕_◕ ༽つ GIFF SOMBRAつ ◕_◕ ༽つ GIFF SOMBRAつ ◕_◕ ༽つ GIFF SOMBRAつ ◕_◕ ༽つ GIFF SOMBRAつ ◕_◕ ༽つ GIFF SOMBRAつ ◕_◕ ༽つ GIFF SOMBRAつ ◕_◕ ༽つ GIFF SOMBRAつ ◕_◕ ༽つ GIFF SOMBRAつ ◕_◕ ༽つ GIFF SOMBRAつ ◕_◕ ༽つ GIFF SOMBRAつ ◕_◕ ༽つ GIFF SOMBRAつ ◕_◕ ༽つ GIFF SOMBRAつ ◕_◕ ༽つ GIFF SOMBRAつ ◕_◕ ༽つ GIFF SOMBRAつ ◕_◕ ༽つ GIFF SOMBRAつ ◕_◕ ༽つ GIFF SOMBRAつ ◕_◕ ༽つ GIFF SOMBRAつ ◕_◕ ༽つ GIFF SOMBRAつ ◕_◕ ༽つ GIFF SOMBRAつ ◕_◕ ༽つ GIFF SOMBRAつ ◕_◕ ༽つ GIFF SOMBRAつ ◕_◕ ༽つ GIFF SOMBRAつ ◕_◕ ༽つ GIFF SOMBRAつ ◕_◕ ༽つ GIFF SOMBRAつ ◕_◕ ༽つ GIFF SOMBRAつ ◕_◕ ༽つ GIFF SOMBRAつ ◕_◕ ༽つ GIFF SOMBRAつ ◕_◕ ༽つ GIFF SOMBRAつ ◕_◕ ༽つ GIFF SOMBRAつ ◕_◕ ༽つ GIFF SOMBRAつ ◕_◕ ༽つ GIFF SOMBRAつ ◕_◕ ༽つ GIFF SOMBRAつ ◕_◕ ༽つ GIFF SOMBRAつ ◕_◕ ༽つ GIFF SOMBRAつ ◕_◕ ༽つ GIFF SOMBRAつ ◕_◕ ༽つ GIFF SOMBRAつ ◕_◕ ༽つ GIFF SOMBRAつ ◕_◕ ༽つ GIFF SOMBRAつ ◕_◕ ༽つ GIFF SOMBRAつ ◕_◕ ༽つ GIFF SOMBRAつ ◕_◕ ༽つ GIFF SOMBRAつ ◕_◕ ༽つ GIFF SOMBRAつ ◕_◕ ༽つ GIFF SOMBRAつ ◕_◕ ༽つ GIFF SOMBRAつ ◕_◕ ༽つ GIFF SOMBRAつ ◕_◕ ༽つ GIFF SOMBRAつ ◕_◕ ༽つ GIFF SOMBRAつ ◕_◕ ༽つ GIFF SOMBRAつ ◕_◕ ༽つ GIFF SOMBRAつ ◕_◕ ༽つ GIFF SOMBRAつ ◕_◕ ༽つ GIFF SOMBRAつ ◕_◕ ༽つ GIFF SOMBRAつ ◕_◕ ༽つ GIFF SOMBRAつ ◕_◕ ༽つ GIFF SOMBRAつ ◕_◕ ༽つ GIFF SOMBRAつ ◕_◕ ༽つ GIFF SOMBRAつ ◕_◕ ༽つ GIFF SOMBRAつ ◕_◕ ༽つ GIFF SOMBRAつ ◕_◕ ༽つ GIFF SOMBRAつ ◕_◕ ༽つ GIFF SOMBRAつ ◕_◕ ༽つ GIFF SOMBRAつ ◕_◕ ༽つ GIFF SOMBRAつ ◕_◕ ༽つ GIFF SOMBRAつ ◕_◕ ༽つ GIFF SOMBRAつ ◕_◕ ༽つ GIFF SOMBRAつ ◕_◕ ༽つ GIFF SOMBRAつ ◕_◕ ༽つ GIFF SOMBRAつ ◕_◕ ༽つ GIFF SOMBRAつ ◕_◕ ༽つ GIFF SOMBRAつ ◕_◕ ༽つ GIFF SOMBRAつ ◕_◕ ༽つ GIFF SOMBRAつ ◕_◕ ༽つ GIFF SOMBRAつ ◕_◕ ༽つ GIFF SOMBRAつ ◕_◕ ༽つ GIFF SOMBRAつ ◕_◕ ༽つ GIFF SOMBRAつ ◕_◕ ༽つ GIFF SOMBRAつ ◕_◕ ༽つ GIFF SOMBRAつ ◕_◕ ༽つ GIFF SOMBRAつ ◕_◕ ༽つ GIFF SOMBRAつ ◕_◕ ༽つ GIFF SOMBRAつ ◕_◕ ༽つ GIFF SOMBRAつ ◕_◕ ༽つ GIFF SOMBRAつ ◕_◕ ༽つ GIFF SOMBRAつ ◕_◕ ༽つ GIFF SOMBRAつ ◕_◕ ༽つ GIFF SOMBRAつ ◕_◕ ༽つ GIFF SOMBRAつ ◕_◕ ༽つ GIFF SOMBRAつ ◕_◕ ༽つ GIFF SOMBRAつ ◕_◕ ༽つ GIFF SOMBRAつ ◕_◕ ༽つ GIFF SOMBRAつ ◕_◕ ༽つ GIFF SOMBRAつ ◕_◕ ༽つ GIFF SOMBRAつ ◕_◕ ༽つ GIFF SOMBRAつ ◕_◕ ༽つ GIFF SOMBRAつ ◕_◕ ༽つ GIFF SOMBRAつ ◕_◕ ༽つ GIFF SOMBRAつ ◕_◕ ༽つ GIFF SOMBRAつ ◕_◕ ༽つ GIFF SOMBRAつ ◕_◕ ༽つ GIFF SOMBRAつ ◕_◕ ༽つ GIFF SOMBRAつ ◕_◕ ༽つ GIFF SOMBRAつ ◕_◕ ༽つ GIFF SOMBRAつ ◕_◕ ༽つ GIFF SOMBRAつ ◕_◕ ༽つ GIFF SOMBRAつ ◕_◕ ༽つ GIFF SOMBRAつ ◕_◕ ༽つ GIFF SOMBRAつ ◕_◕ ༽つ GIFF SOMBRAつ ◕_◕ ༽つ GIFF SOMBRAつ ◕_◕ ༽つ GIFF SOMBRAつ ◕_◕ ༽つ GIFF SOMBRAつ ◕_◕ ༽つ GIFF SOMBRAつ ◕_◕ ༽つ GIFF SOMBRAつ ◕_◕ ༽つ GIFF SOMBRAつ ◕_◕ ༽つ GIFF SOMBRAつ ◕_◕ ༽つ GIFF SOMBRAつ ◕_◕ ༽つ GIFF SOMBRAつ ◕_◕ ༽つ GIFF SOMBRAつ ◕_◕ ༽つ GIFF SOMBRAつ ◕_◕ ༽つ GIFF SOMBRAつ ◕_◕ ༽つ GIFF SOMBRAつ ◕_◕ ༽つ GIFF SOMBRAつ ◕_◕ ༽つ GIFF SOMBRAつ ◕_◕ ༽つ GIFF SOMBRAつ ◕_◕ ༽つ GIFF SOMBRAつ ◕_◕ ༽つ GIFF SOMBRAつ ◕_◕ ༽つ GIFF SOMBRAつ ◕_◕ ༽つ GIFF SOMBRAつ ◕_◕ ༽つ GIFF SOMBRAつ ◕_◕ ༽つ GIFF SOMBRAつ ◕_◕ ༽つ GIFF SOMBRAつ ◕_◕ ༽つ GIFF SOMBRAつ ◕_◕ ༽つ GIFF SOMBRAつ ◕_◕ ༽つ GIFF SOMBRAつ ◕_◕ ༽つ GIFF SOMBRAつ ◕_◕ ༽つ GIFF SOMBRAつ ◕_◕ ༽つ GIFF SOMBRAつ ◕_◕ ༽つ GIFF SOMBRAつ ◕_◕ ༽つ GIFF SOMBRAつ ◕_◕ ༽つ GIFF SOMBRAつ ◕_◕ ༽つ GIFF SOMBRAつ ◕_◕ ༽つ GIFF SOMBRAつ ◕_◕ ༽つ GIFF SOMBRAつ ◕_◕ ༽つ GIFF SOMBRAつ ◕_◕ ༽つ GIFF SOMBRAつ ◕_◕ ༽つ GIFF SOMBRAつ ◕_◕ ༽つ GIFF SOMBRAつ ◕_◕ ༽つ GIFF SOMBRAつ ◕_◕ ༽つ GIFF SOMBRAつ ◕_◕ ༽つ GIFF SOMBRAつ ◕_◕ ༽つ GIFF SOMBRAつ ◕_◕ ༽つ GIFF SOMBRAつ ◕_◕ ༽つ GIFF SOMBRAつ ◕_◕ ༽つ GIFF SOMBRAつ ◕_◕ ༽つ GIFF SOMBRAつ ◕_◕ ༽つ GIFF SOMBRAつ ◕_◕ ༽つ GIFF SOMBRAつ ◕_◕ ༽つ GIFF SOMBRAつ ◕_◕ ༽つ GIFF SOMBRAつ ◕_◕ ༽つ GIFF SOMBRAつ ◕_◕ ༽つ GIFF SOMBRAつ ◕_◕ ༽つ GIFF SOMBRAつ ◕_◕ ༽つ GIFF SOMBRAつ ◕_◕ ༽つ GIFF SOMBRAつ ◕_◕ ༽つ GIFF SOMBRAつ ◕_◕ ༽つ GIFF SOMBRAつ ◕_◕ ༽つ GIFF SOMBRAつ ◕_◕ ༽つ GIFF SOMBRAつ ◕_◕ ༽つ GIFF SOMBRAつ ◕_◕ ༽つ GIFF SOMBRAつ ◕_◕ ༽つ GIFF SOMBRAつ ◕_◕ ༽つ GIFF SOMBRAつ ◕_◕ ༽つ GIFF SOMBRAつ ◕_◕ ༽つ GIFF SOMBRAつ ◕_◕ ༽つ GIFF SOMBRAつ ◕_◕ ༽つ GIFF SOMBRAつ ◕_◕ ༽つ GIFF SOMBRAつ ◕_◕ ༽つ GIFF SOMBRAつ ◕_◕ ༽つ GIFF SOMBRAつ ◕_◕ ༽つ GIFF SOMBRAつ ◕_◕ ༽つ GIFF SOMBRAつ ◕_◕ ༽つ GIFF SOMBRAつ ◕_◕ ༽つ GIFF SOMBRAつ ◕_◕ ༽つ GIFF SOMBRAつ ◕_◕ ༽つ GIFF SOMBRAつ ◕_◕ ༽つ GIFF SOMBRAつ ◕_◕ ༽つ GIFF SOMBRAつ ◕_◕ ༽つ GIFF SOMBRAつ ◕_◕ ༽つ GIFF SOMBRAつ ◕_◕ ༽つ GIFF SOMBRAつ ◕_◕ ༽つ GIFF SOMBRAつ ◕_◕ ༽つ GIFF SOMBRAつ ◕_◕ ༽つ GIFF SOMBRAつ ◕_◕ ༽つ GIFF SOMBRAつ ◕_◕ ༽つ GIFF SOMBRAつ ◕_◕ ༽つ GIFF SOMBRAつ ◕_◕ ༽つ GIFF SOMBRAつ ◕_◕ ༽つ GIFF SOMBRAつ ◕_◕ ༽つ GIFF SOMBRAつ ◕_◕ ༽つ GIFF SOMBRAつ ◕_◕ ༽つ GIFF SOMBRAつ ◕_◕ ༽つ GIFF SOMBRAつ ◕_◕ ༽つ GIFF SOMBRAつ ◕_◕ ༽つ GIFF SOMBRAつ ◕_◕ ༽つ GIFF SOMBRAつ ◕_◕ ༽つ GIFF SOMBRAつ ◕_◕ ༽つ GIFF SOMBRAつ ◕_◕ ༽つ GIFF SOMBRAつ ◕_◕ ༽つ GIFF SOMBRAつ ◕_◕ ༽つ GIFF SOMBRAつ ◕_◕ ༽つ GIFF SOMBRAつ ◕_◕ ༽つ GIFF SOMBRAつ ◕_◕ ༽つ GIFF SOMBRAつ ◕_◕ ༽つ GIFF SOMBRAつ ◕_◕ ༽つ GIFF SOMBRAつ ◕_◕ ༽つ GIFF SOMBRAつ ◕_◕ ༽つ GIFF SOMBRAつ ◕_◕ ༽つ GIFF SOMBRAつ ◕_◕ ༽つ GIFF SOMBRAつ ◕_◕ ༽つ GIFF SOMBRAつ ◕_◕ ༽つ GIFF SOMBRAつ ◕_◕ ༽つ GIFF SOMBRAつ ◕_◕ ༽つ GIFF SOMBRAつ ◕_◕ ༽つ GIFF SOMBRAつ ◕_◕ ༽つ GIFF SOMBRAつ ◕_◕ ༽つ GIFF SOMBRAつ ◕_◕ ༽つ GIFF SOMBRAつ ◕_◕ ༽つ GIFF SOMBRAつ ◕_◕ ༽つ GIFF SOMBRAつ ◕_◕ ༽つ GIFF SOMBRAつ ◕_◕ ༽つ GIFF SOMBRAつ ◕_◕ ༽つ GIFF SOMBRAつ ◕_◕ ༽つ GIFF SOMBRAつ ◕_◕ ༽つ GIFF SOMBRAつ ◕_◕ ༽つ GIFF SOMBRAつ ◕_◕ ༽つ GIFF SOMBRAつ ◕_◕ ༽つ GIFF SOMBRAつ ◕_◕ ༽つ GIFF SOMBRAつ ◕_◕ ༽つ GIFF SOMBRAつ ◕_◕ ༽つ GIFF SOMBRAつ ◕_◕ ༽つ GIFF SOMBRAつ ◕_◕ ༽つ GIFF SOMBRAつ ◕_◕ ༽つ GIFF SOMBRAつ ◕_◕ ༽つ GIFF SOMBRAつ ◕_◕ ༽つ GIFF SOMBRAつ ◕_◕ ༽つ GIFF SOMBRAつ ◕_◕ ༽つ GIFF SOMBRAつ ◕_◕ ༽つ GIFF SOMBRAつ ◕_◕ ༽つ GIFF SOMBRAつ ◕_◕ ༽つ GIFF SOMBRAつ ◕_◕ ༽つ GIFF SOMBRAつ ◕_◕ ༽つ GIFF SOMBRAつ ◕_◕ ༽つ GIFF SOMBRAつ ◕_◕ ༽つ GIFF SOMBRAつ ◕_◕ ༽つ GIFF SOMBRAつ ◕_◕ ༽つ GIFF SOMBRAつ ◕_◕ ༽つ GIFF SOMBRAつ ◕_◕ ༽つ GIFF SOMBRAつ ◕_◕ ༽つ GIFF SOMBRAつ ◕_◕ ༽つ GIFF SOMBRAつ ◕_◕ ༽つ GIFF SOMBRAつ ◕_◕ ༽つ GIFF SOMBRAつ ◕_◕ ༽つ GIFF SOMBRAつ ◕_◕ ༽つ GIFF SOMBRAつ ◕_◕ ༽つ GIFF SOMBRAつ ◕_◕ ༽つ GIFF SOMBRAつ ◕_◕ ༽つ GIFF SOMBRAつ ◕_◕ ༽つ GIFF SOMBRAつ ◕_◕ ༽つ GIFF SOMBRAつ ◕_◕ ༽つ GIFF SOMBRAつ ◕_◕ ༽つ GIFF SOMBRAつ ◕_◕ ༽つ GIFF SOMBRAつ ◕_◕ ༽つ GIFF SOMBRAつ ◕_◕ ༽つ GIFF SOMBRAつ ◕_◕ ༽つ GIFF SOMBRAつ ◕_◕ ༽つ GIFF SOMBRAつ ◕_◕ ༽つ GIFF SOMBRAつ ◕_◕ ༽つ GIFF SOMBRAつ ◕_◕ ༽つ GIFF SOMBRAつ ◕_◕ ༽つ GIFF SOMBRAつ ◕_◕ ༽つ GIFF SOMBRAつ ◕_◕ ༽つ GIFF SOMBRAつ ◕_◕ ༽つ GIFF SOMBRAつ ◕_◕ ༽つ GIFF SOMBRAつ ◕_◕ ༽つ GIFF SOMBRAつ ◕_◕ ༽つ GIFF SOMBRAつ ◕_◕ ༽つ GIFF SOMBRAつ ◕_◕ ༽つ GIFF SOMBRAつ ◕_◕ ༽つ GIFF SOMBRAつ ◕_◕ ༽つ GIFF SOMBRAつ ◕_◕ ༽つ GIFF SOMBRAつ ◕_◕ ༽つ GIFF SOMBRAつ ◕_◕ ༽つ GIFF SOMBRAつ ◕_◕ ༽つ GIFF SOMBRAつ ◕_◕ ༽つ GIFF SOMBRAつ ◕_◕ ༽つ GIFF SOMBRAつ ◕_◕ ༽つ GIFF SOMBRAつ ◕_◕ ༽つ GIFF SOMBRAつ ◕_◕ ༽つ GIFF SOMBRAつ ◕_◕ ༽つ GIFF SOMBRAつ ◕_◕ ༽つ GIFF SOMBRAつ ◕_◕ ༽つ GIFF SOMBRAつ ◕_◕ ༽つ GIFF SOMBRAつ ◕_◕ ༽つ GIFF SOMBRAつ ◕_◕ ༽つ GIFF SOMBRAつ ◕_◕ ༽つ GIFF SOMBRAつ ◕_◕ ༽つ GIFF SOMBRAつ ◕_◕ ༽つ GIFF SOMBRAつ ◕_◕ ༽つ GIFF SOMBRAつ ◕_◕ ༽つ GIFF SOMBRAつ ◕_◕ ༽つ GIFF SOMBRAつ ◕_◕ ༽つ GIFF SOMBRAつ ◕_◕ ༽つ GIFF SOMBRAつ ◕_◕ ༽つ GIFF SOMBRAつ ◕_◕ ༽つ GIFF SOMBRAつ ◕_◕ ༽つ GIFF SOMBRAつ ◕_◕ ༽つ GIFF SOMBRAつ ◕_◕ ༽つ GIFF SOMBRAつ ◕_◕ ༽つ GIFF SOMBRAつ ◕_◕ ༽つ GIFF SOMBRAつ ◕_◕ ༽つ GIFF SOMBRAつ ◕_◕ ༽つ GIFF SOMBRAつ ◕_◕ ༽つ GIFF SOMBRA,Overwatch,1
"I think you should rename the title to ""When you are in gold""",Overwatch,1
It's one pretty glaring omission. [This is me solo-killing a Rein w/ Symm.](http://b.1339.cf/wrpzuzc.webm),Overwatch,1
Cancer trash should be a term reserved for MLG faggots like yourself. Have fun playing MLG.,Overwatch,1
"Oh look, another idiot that makes a retarded, baseless theory that gets disproven with even slight research.",Overwatch,1
"This game is not for you, retarded piece of shit. I would not want a cunt like you on my team.",Overwatch,1
http://prntscr.com/c9nwqg,Overwatch,1
Have a good day! &lt;3,Overwatch,1
"[http://i.imgur.com/qMUrlCA.jpg 
](https://gfycat.com/ImmenseOldfashionedAustralianshelduck)",Overwatch,1
"was expecting a sexy girl with her tits hanging out, got a fat oinker instead :(",Overwatch,1
XD no pls. By being autisitic you ruin the game for the other 11 people you are playing with. Just take your medicine and goto sleep.,Overwatch,1
good im glad u got leavers in ur game u dumb nigger,Overwatch,1
BLIZZARD WHY?????? START IT UP GOD DAMNIT!!!,Overwatch,1
What about a watch as yours seems to be stuck on 12:00PM constantly? ,Overwatch,1
"You don't need to use a Credit Card / Paypal.

I bought 3 keys off a CDKey site because blizzard doesn't allow gifting, no way to trace that.",Overwatch,1
"Feel free to text me or call me ;) 07729721841 ask me questions, do anything ",Overwatch,1
"But you would like them more.  The default assumption for each character is heterosexual (whether you or I like it or not unfortunately).  By taking that away your taking away the similarity between the two characters.  So in other words, you're saying that your stance on liking a character more because they're like you only applies to you - which is idiotic.  

And yeah you are selfish.  And no you're not a bitch, you're a prick.  A fucking idiotic one at that.",Overwatch,1
You forgot the mossy important one /r/rule34overwatch,Overwatch,1
"5K is a steal, especially if you get the silver legend arcanas (V2.5), I want it, and I want it NOW! https://www.youtube.com/watch?v=OsDANdcyYpI",Overwatch,1
Are you that much of a dipshit,Overwatch,1
The daughters look like they have higher weight than me. Quite chubby,Overwatch,1
Lol my parents don't have a basement because this is Australia cunt no one cares about you fat neck beards in America you butt hurt fag,Overwatch,1
