body,subreddit,moderated
"The best part of this whole thread is you keep calling me ""him"" and ""he"" when I am a trans female. Thank you for assuming that much about me since I go against the narrative that has been painted for you.

My response was hyperbole to your exclamation that ""people can be fired for being gay"" when in fact, that is false. Us LGBT folk have more protections under the law than a ""straight white male"" has. What actually happens is people CLAIM to be fired for being gay, and when the employers have released the facts for their dismissal AFTER they received copious amounts of HATRED from people like you, it is proven that they were BAD AT THEIR JOB.

Your persecution complex is a disease.",Overwatch,1
No I will bash you for being proud you pressed Q killed good players then died and felt good about yourself cus you are a democrat and hate when people make fun of strangers on the Internet ,Overwatch,1
"their names are chickenrider and lightdragon.  
idk if its actual cheating or not which is why there is the ""?"" 
let me know what you guys think.",Overwatch,1
give me ur account,Overwatch,1
Glad I got to see this before that infamous mod inevitably removes it.,Overwatch,1
This is you... on a good day! https://youtu.be/Z4PRf-_eO4Y,Overwatch,1
"Don't get in a Epenis contest, dear. Just go read your naruto manga or something.",Overwatch,1
ok,Overwatch,1
"You really think they're lying? The only reason OW is popular in Korea is because people just want to take a break from LoL and OW is new. Trust me, its going to die down quick (Not trying to be anti OW but you just have to look at the facts)

Ya dumb bitch",Overwatch,1
">  (foreign accents are considered 'racist') 

I knew Europoors were stupid, I just didn't know they were retarded.",Overwatch,1
Shut the fuck up.,Overwatch,1
Kill yourself,Overwatch,1
Kill yourself.,Overwatch,1
As in straight or gay retard,Overwatch,1
"In other words ""He pointed out that a literal no-body just won, lets put together a hypothetical where eventually the facts could evolve to fit my interpretation""

You know I'm right at this point. That's why you're bailing.",Overwatch,1
well its genetic thing woman are not that good with coordination stuff,Overwatch,1
"Oh shut the fuck up. Stop whining like a little girl who lost their dolly. You seem so vaginal right now... i can smell the smegma from here. You have a shitty connection, blame your isp not the game devs. ",Overwatch,1
https://www.reddit.com/r/Overwatch/comments/5938jp/the_exact_second_the_game_is_over_leaving_should/?st=iunrpown&sh=a52adaca,Overwatch,1
[XD^XD^XD^XD^XD^XD^XD^XD^XD](http://i2.kym-cdn.com/photos/images/newsfeed/000/923/668/d83.png),Overwatch,1
https://Aimbooster.com,Overwatch,1
つ ◕_◕ ༽つ GIFF SOMBRA,Overwatch,1
I think I threw up in my mouth a little. ,Overwatch,1
[Better version](https://www.youtube.com/watch?v=RQrEudpUKLM),Overwatch,1
The fact that your face looks like a chinless donkey kind of ruins it. ,Overwatch,1
I cringe at every console gameplay XD,Overwatch,1
tl;dr ur retarded,Overwatch,1
You report it as 'im a thin skinned bitch who gets my feelings hurt on video games',Overwatch,1
"Refer to other post.  I see you only post about sports and you don't actually care about Overwatch, so I see no reason to argue with your closed minded faggotry.  Go suck Ronaldo's dick, fuckface.",Overwatch,1
"somebody's pwoor whiddle feelwings got hurt. the big bad words aren't nice, make em stop mommy.",Overwatch,1
The autism is is strong in these comments. ,Overwatch,1
hopefully not as long as it takes you to get a hint and stfu,Overwatch,1
"Disgusting, I want to see your pig sty of a battle station.
16-17 hours a day, it has to be gross.",Overwatch,1
"lol a europoor talking about going to jail for the sounds coming out of his dicksucker. 

Are you offended yet? ",Overwatch,1
It's just a soldier ult.,Overwatch,1
"i was ready to stop as soon as i written my first comment. ya'll faggots replying to me are the reason i still comment. idc about op or how fucking bad he is, it's you whiteknight retards keeping this discussion up for no reason at all.",Overwatch,1
Smells like curry ,Overwatch,1
"If she was 15, you'd still be attracted to her; this doesn't change anything",Overwatch,1
is it a band wagon i missed or reddit mob mentality or you're just retarded to counter roadhog?,Overwatch,1
sick,Overwatch,1
[Link](http://shoguchime.tumblr.com/post/144238438569/i-wonder-how-she-got-that),Overwatch,1
"Holy shit at this point I don't even care about her lore. The fact that she took this long to come out and the endless ARGs (more like ARGHs am I right) made me despise this entire shitshow of a hero release.

Bet we're not even gonna get her on 11/1, just another fucking piece of the endless puzzle.",Overwatch,1
And based on your post history you seem like a highly intelligent human being worth having a civil discussion with... wait just kidding.,Overwatch,1
"I wish I had that gif with ""your head"" and ""the joke"" on it. I believe it would be relevant right about now. 

Hint: I'm making fun of your immature response to another poster on the internet because you disagree with him by way of a call back. 

Sorry, I'll just write ""3edgy5me"" next time to give you a chance at getting it. ",Overwatch,1
Console? fucking really,Overwatch,1
this makes up for the lack of rule 34 mei. its all tracer/widow/mercy ,Overwatch,1
I didn't know Trump played Overwatch.,Overwatch,1
Petulant children,Overwatch,1
lol get fucked kiddo. ,Overwatch,1
Ohh herro Mongorian,Overwatch,1
"what's your skill rating, and how much have you played genji?

I'm curious, because I've been seeing a lot of remarkably stupid comments like this recently, and I can't help but wonder",Overwatch,1
you're fucking dumb kid,Overwatch,1
"THICC girls just have wider hips and not a 100% flat belly, she is just a fat hag",Overwatch,1
"hzst a nigger
",Overwatch,1
All I can say is that that guy in Nice actually moved the Payload and tried his best.,Overwatch,1
"[NA][PC] Competitive-minded player looking for a similarly-focused group to try and play Overwatch at higher level. 21 years old and willing to use any voice communication software is most convenient for everyone.

My most played characters are Zarya/Lucio/Mercy/Roadhog/Symmetya typically whenever I play with a group. However, I can and do play Tracer/Torb/whoever needed to fill the comp whenever I play alone.

I tend to fall into a shotcalling role whenever it's needed, especially whenever I support. So if that is something that your group needs I would be more than happy to oblige.

If you are interested in having me play with your group, or are just a single person looking for someone to queue with who will actually try to WIN the game as opposed to playing TDM, then send me a friend request at Sylariss#1292
",Overwatch,1
Kill yourself,Overwatch,1
"Spam H during loading screen. You'll hear a sound and activate a chance to be force switched to a random hero after the first goal.

You can increase your odds by having an autoclick & H Spam macro with 1MS delays and hovering your mouse over where a hero select button would be.",Overwatch,1
https://www.reddit.com/r/gaming/comments/5els35/found_this_relaxing_unorthodoxed_stream_thought/,Overwatch,1
Poor console peasents. #pcmasterrace,Overwatch,1
8==D Meme?,Overwatch,1
http://prnt.sc/d8oq8a,Overwatch,1
Maybe if you have Aspergers.    Not /s,Overwatch,1
Hahah be nice reddit? fuck off,Overwatch,1
talk like a human then,Overwatch,1
"that's life, you gay retard, what the fuck did you expect? what a garbage, narcissistic post",Overwatch,1
Arbitrarily capitalizing WORDS to highlight your AUTISM. ,Overwatch,1
"It's the idea of the sickos out there left unchecked. I'm sorry you don't feel the same, but you would defend a pedophile too probably",Overwatch,1
https://blizzard.hosted.jivesoftware.com/login.jspa?referer=/servlet/JiveServlet/Showimage/33-5776-42157/sombra.jpg,Overwatch,1
http://lmgtfy.com/?q=how+to+find+people+to+play+overwatch+with,Overwatch,1
"**TL;DR:**  Type in ¯\\\\\\\_(ツ)\_/¯ for proper formatting

Actual reply:

For the 

    ¯\_(ツ)_/¯ 

like you were trying for you need three backslashes, so it should look like this when you type it out

    ¯\\\_(ツ)_/¯ 

which will turn out like this

¯\\\_(ツ)\_/¯ 

The reason for this is that the underscore character (this one \_ ) is used to italicize words just like an asterisk does (this guy \* ).  Since the ""face"" of the emoticon has an underscore on each side it naturally wants to italicize the ""face"" (this guy (ツ) ).  The backslash is reddit's escape character (basically a character used to say that you don't want to use a special character in order to format, but rather you just want it to display).  So your first ""\\_"" is just saying ""hey, I don't want to italicize (ツ)"" so it keeps the underscore but gets rid of the backslash since it's just an escape character.  After this you still want the arm, so you have to add two more backslashes (two, not one, since backslash is an escape character, so you need an escape character for your escape character to display--confusing, I know).  Anyways, I guess that's my lesson for the day on reddit formatting lol

***CAUTION: Probably very boring edit as to why you don't need to escape the second underscore, read only if you're super bored or need to fall asleep.***

Edit: The reason you only need an escape character for the first underscore and not the second is because the second underscore (which doesn't have an escape character) doesn't have another underscore with which to italicize.  Reddit's formatting works in that you need a special character to indicate how you want to format text, then you put the text you want to format, then you put the character again.  For example, you would type \_italicize\_ or \*italicize\* in order to get _italicize_.  Since we put an escape character we have \\\_italicize\_ and don't need to escape the second underscore since there's not another non-escaped underscore with which to italicize something in between them.  So technically you could have written ¯\\\\\\\_(ツ)\\\_/¯ but you don't need to since there's not a second non-escaped underscore.  You ***would*** need to escape the second underscore if you planned on using another underscore in the same line (but not if you used a line break, aka pressed enter twice).  If you used an asterisk later though on the same line it would not work with the non-escaped underscore to italicize.  To show you this, you can type _italicize* and it should not be italicized.",Overwatch,1
"you are the asshole for the other team, u don't deserve that xp if u are an asshole in my opinion",Overwatch,1
"Lol good for you and the other 4000 retards! Im actually going to keep complaining about it, but thanks for your useless opinion!",Overwatch,1
[I like me *somb*ooty](https://youtu.be/PEYjSXSTj0o?list=PL4YotwytAATVbgyXZLpS6gpt4_Oo3m1-i),Overwatch,1
im the only one who see that aim assist hack?,Overwatch,1
"Your submission has been deleted.

The reason(s) being:

Your submission falls under the category of low effort posts and does not contribute to the discussions in this subreddit. This includes but is not limited to posts with minimal text description, ""Title."", ""DAE"", ""This"", ""MFW"", etc. For more examples and details, check out our [Low-effort (shitposting) guidelines](https://www.reddit.com/r/Overwatch/wiki/rules#wiki_low-effort_.28shitposting.29_guidelines).



If you have any questions please state them in an answer to this post.

For concerns or to contact the whole staff, please [message the moderators](https://www\.reddit\.com/message/compose?to=%2Fr%2FOverwatch&subject=Issues with the removal of my submission&message=I'm writing to you about the following submission: https://www.reddit.com/r/Overwatch/comments/4l8oo1/stop_putting_me_in_games_that_immediately_end/. %0D%0DMy issue is...).

For more information, please consult [our rules](https://www.reddit.com/r/Overwatch/wiki/rules).",Overwatch,1
don't play NA servers if you can't speak American bitch,Overwatch,1
"IMO girls are easy targets, I mean unless you are a slut why do you care? If someone called me a gimp and told me to drown in vaginal juice I wouldn't be offended lol. Why should I care what that idiot thinks?",Overwatch,1
O-oooooooooo AAAAE-A-A-I-A-U- JO-oooooooooooo AAE-O-A-A-U-U-A- E-eee-ee-eee AAAAE-A-E-I-E-A- JO-ooo-oo-oo-oo EEEEO-A-AAA-AAAA,Overwatch,1
"The machines on Hanamura you can jump into can actually be done randomly. I Jumped in there on my first day and got the lagging when u jump, but i didn't know it could crash a server so when the round started i just jumped out.",Overwatch,1
I do **not** support Drumpf. Please treat your moral and intellectual superiors with some respect. ,Overwatch,1
"Its not a label its an insult...

Thats like me calling myself a faggot.

",Overwatch,1
LOL NICE HACKS YOU FUCKING IDIOT. I don't normally call hacks but anyone has played mccree can tell this is sketch as fuck.,Overwatch,1
[Better.](https://www.youtube.com/watch?v=oc6xCgSZqYE),Overwatch,1
Lets get real they do have a gay agenda to be pushing gay shit. It's not normal.,Overwatch,1
"If you guys are interested please check out my YouTube video of a MASTERS comp game from me and my brother..

https://www.youtube.com/watch?v=xgbthXYtIwY&t=808s.

Me and my brother are doing a new series called Broverwatch where we switch from player to player to keep it interesting and to make sure we always have a lot of action going on. Check it out if you're into watching livestreams and whatnot! Thanks :D",Overwatch,1
What the fuck bro fuck you answer the question or get out fucker,Overwatch,1
"Hahahaha it's so funny that you're trivializing an entire culture that's existed for several hundred years into ""lel suicide bombing"". That's like associating the word arigato with kamikaze pilots. ",Overwatch,1
Any chance of restoring the post and taking out the NSFW content?,Overwatch,1
/r/cummingonfigurines would blow up,Overwatch,1
[The better version!](https://youtu.be/D47Z06ucLYU),Overwatch,1
"""Fuck that weak console shit, should be glad they stole it man, here's the superior version, no need to thank us.""

-Blizzard",Overwatch,1
https://www.youtube.com/watch?v=KGzSm-OOn0g OVERWATCH COPIED BO3 BLIZZARD GETTING SUED????????,Overwatch,1
"I don't even play comp but alright...

I do this shit for a living, I know if it's edited. There is *very* clearly a cut, and because you can't even fathom the possibility of a post being fake indeed makes you a fucking moron. ",Overwatch,1
"[I changed the soundfont and changed some of the rest length to make it more like a song, enjoy!](https://www.youtube.com/watch?v=V4jH0WeV67I)",Overwatch,1
If you are a Twitch streamer follow me at [darkchurroz] (https://www.twitch.tv/darkchurroz) and I'll follow you back! ,Overwatch,1
"Sweet, another 12 y o psycho, thank god you're on console",Overwatch,1
Consoles in 2016 LUL,Overwatch,1
"i never gave you my rank?

Im not even going to pretend to be in masters",Overwatch,1
it's also okay to grow a pair and ignore trolls telling you to kill yourself tho. learn that for once.,Overwatch,1
"You have shitty logic, fucking retard. If you expect 100% winrate out of me because it takes no skill, that means you expect it out of every player.  Zero logic. You interpret things like you have fucking autism, are you black?",Overwatch,1
+/u/User_Simulator GenuinePorkChops,Overwatch,1
Your welcome. Asshole,Overwatch,1
GOTCHA UR RACIST XDDDDD who fucking cares you're still a skill-less symmetra player. What are you some kind of SJW liberal who's go to trump card is calling someone a racist? you're a joke. take a trip on over to /r/fuckblacklivesmatter,Overwatch,1
Wow I bet your dick is huge please let me blow you.,Overwatch,1
hey i don't speak spanish but you're a piece of shit lol,Overwatch,1
"Great Overwatch clip. But make sure you are voting for trump on November, 8th",Overwatch,1
[Better](https://youtu.be/Wqp9Sf9pWLE),Overwatch,1
rofl virgins report me,Overwatch,1
"Go figure, the toxic faggot realizes he's been the problem all along. Brilliant",Overwatch,1
The server crashed you dipshit,Overwatch,1
All Genji players should die.,Overwatch,1
Good.  Fuck you for playing Bastion.,Overwatch,1
the aiming.. hurt..,Overwatch,1
https://www.reddit.com/r/Overwatch/comments/5938jp/the_exact_second_the_game_is_over_leaving_should/?st=iunrpown&sh=a52adaca,Overwatch,1
"Only toxic against morons my friend, only against morons.",Overwatch,1
fuck you,Overwatch,1
Lots of good players refer to inferior players as bads. L2Internet faggot.,Overwatch,1
"Who gives a shit about your shitty country man, people are so entitled sometimes ",Overwatch,1
༼ つ ◕◕ ༽つ SOMBRA TAKE MY CONNECTION SPEED ༼ つ ◕◕ ༽つ,Overwatch,1
Blizzard doesn't read these forums. How many times do you kids need to be told that?,Overwatch,1
O-oooooooooo AAAAE-A-A-I-A-U- JO-oooooooooooo AAE-O-A-A-U-U-A- E-eee-ee-eee AAAAE-A-E-I-E-A- JO-ooo-oo-oo-oo EEEEO-A-AAA-AAAA,Overwatch,1
Now all it needs is some mountain boo •ᴥ•,Overwatch,1
"Cool, now draw her being brutally fucked in the ass",Overwatch,1
"The only one I can see seriously happening by accident is on Hanamura. For Hanamura, stay out of the machines :3",Overwatch,1
HUEHUEUHE GO FUCKING KILL YOURSELF THIS IS A DISCUSSION YOU PIECE OF SHIT MOD BURN IN HELL.,Overwatch,1
"Ironic.

http://puu.sh/pPaI9/440b26a9e0.png",Overwatch,1
I think the technical term is retard.,Overwatch,1
"copy and paste for this thread

https://puu.sh/sOjIZ/d4d587bd2e.png

snowball is now the same shade of gold as the golden weapons, along with being the only thing in the game with a reflection where things are distinguishable.",Overwatch,1
"This isn't cosplay.  It's tits.  

r/gonewildcurvy is that way --->",Overwatch,1
"stfu u deaf fucking bitch, the world doesn't revolve around you! get a pair of ears instead of asking for aid you fucking commie ass bitch gtfo from america nd go to soviet putin bitch",Overwatch,1
Console is embarrassingly bad.,Overwatch,1
Well how about you go a damage character then? stupid crybaby salty toxic cancer kid.,Overwatch,1
[https://i.imgur.com/OGTcxKL.gifv](https://youtu.be/dQw4w9WgXcQ),Overwatch,1
No one said anything about switching characters you down syndrome.,Overwatch,1
"You sir are a rare breed of idiot, did you remotely thought a bit before you typed that shit, or you just typed something because you heard something about it somewhere...",Overwatch,1
man look at all these cunts defending broken games and broken balance. yeah your totally not fanboys at all. your the same kind of idiots that still buy call of duty. nothing you say matters.,Overwatch,1
Pay me $4000 to boost you,Overwatch,1
People always say that looking down on others is bad but lmao console players make it so much fun. ,Overwatch,1
"its not gg ez anymore.

Its gg ezy. Anyone saying  gg ez is an idiot old fag. ",Overwatch,1
"Christ, Zarya is one ugly dyke ",Overwatch,1
"its not murder is its justified, someone who cant play overwatch and ruins games, should be killed",Overwatch,1
Be glad narwall is a fucking idiot and deleted my post which was exactly at 6:00:00 instead of your incorrect one.,Overwatch,1
Its been down retard,Overwatch,1
"stop being autistic. Sombra is definitely op in the current meta. She has an aoe silence that also removes shields (so zarya and zen get fucked by it). Combine that with an smg that seems to have a damage output that is higher than tracer's pistols and has more range, she's basically ana 2.0, she will completely break the meta and will probably go months without a significant nerf because retards defend overdesigned characters because ""you're supposed to feel powerful""",Overwatch,1
fuck you,Overwatch,1
"Console aim,  threw upa little bit in my mouth there",Overwatch,1
"In Korea, what cute animal do they eat?

Dogs",Overwatch,1
"Dude, fuck off.",Overwatch,1
"Terrible argument, there are details in this game that are incredibly more insignificant and less noticeable.

",Overwatch,1
"You didn't provide any information or links just a typical reddit fag answer. ""Calm down with our assumptions"" lol kill yourself telling me what I can and can't think about then trying to say you cited evidence and I refuted it. ",Overwatch,1
Nobody cares about your dead game go away ,Overwatch,1
Please no!,Overwatch,1
"this is why they make limited skins, fucking retard",Overwatch,1
"I am REALLY REALLY REALLY sorry for this but.

If you kill yourself because some asshole that doesn't even know you wants to talk shit what was the point of you living? Why are you going to give up your life because someone says one small thing to you? Get over it and ignore them. Continue on with your regular life.",Overwatch,1
http://i.imgur.com/pC1hCxh.jpg,Overwatch,1
[removed],Overwatch,1
"this entire post is just a talking piece for you to push your agenda. it's a blatant lie.
>(Quick edit: this happened before the ability to disable chat was put into the game - so things have gotten a little better
the chat toggles were put in early during beta. kill yourself my man",Overwatch,1
"It's like competing in the retard Olympics. Even if you win, you're still retarded.",Overwatch,1
"It's a very large amount, fucking hell. Stop being an uppity little cunt.",Overwatch,1
"idk...sombra kinda looks like a Som-*brat*

[That was dumb. I am sorry](https://www.youtube.com/watch?v=PEYjSXSTj0o)",Overwatch,1
