body,subreddit,moderated
loved the ending,Overwatch,0
"That's interesting. I wonder if stunning the trap would free a teammate, or yourself, from it. ",Overwatch,0
"My Zarya game improved a lot when I stopped thinking of the barriers as just something to save the person with the barrier, but also as something to protect the people behind the barrier. You can throw a barrier on someone, wait until it is just about to expire, then step in front of them with a barrier on yourself. It is about 4 seconds of invulnerability for you, the person you shield and everyone behind them, and you are almost guaranteed 100 energy if you do it when they are under heavy fire.",Overwatch,0
"Your platform: **XB1**
Your region: **UK**
Your username: **Real Wick Matt**
Your active hours: **Evenings UK time**

Am 26 so would prefer to play with people of a similar age, definitely a casual gamer just looking for a group to have a bit of fun with, always have my mic on so game chat can get pretty funny. I mostly play with D.Va, Mei, Mercy or Reinhardt but happy to play as whatever my team needs!",Overwatch,0
I'm like 90% sure CS:GO has sold more copies,Overwatch,0
"I have a similar problem with the kitchen microwave messing with the Wi-Fi, so I have to make sure I'm not playing around lunch or dinner time.",Overwatch,0
"~~simple arithmetic~~

statistics",Overwatch,0
"I never lagged in this game, so I have no idea.",Overwatch,0
Gorrila.............punch.,Overwatch,0
He is especially good when the enemy is uncoordinated. Not every hook is a good hook in comp. Play competitive and work with your team. ,Overwatch,0
"Widowmaker, Hanzo, Ana.  I'm fucked",Overwatch,0
"I understand, I usually get asked how old I am and when I say 25 people's minds are blown like it's really surprising that an adult woman is playing overwatcg",Overwatch,0
"At the time of writing, only Tracer, Soldier 76, Ana, Mercy, Genji, Winston, Reaper, Torb, Reinhardt, and ~~Widowmaker~~ McCree were ever part of Overwatch.

Edit: correction.",Overwatch,0
"exactly, just such a commonish thing i wouldn't be surprised if it is used in various media forms. 

just personally speaking though, my family would never have said this as we don't drink coffee. ",Overwatch,0
"Because ""but muh socially awkward gamer"" trope has to fit in somewhere!

That said, yeah, there was nothing here. A small mistake, rectified, and then they used it as a joke for the rest of the day.",Overwatch,0
[Youtube](https://www.youtube.com/watch?v=k4V3Mo61fJM),Overwatch,0
"Get it for PC, you get to try out patches before they are live and the game is faster and you have the option to get the game for $40",Overwatch,0
A better filter would just be perma ban anyone who typed it in from ever talking in chat. And not told anyone in the patchnotes it was going to happen.,Overwatch,0
How is that possible?,Overwatch,0
i cant afford a 144hz monitor man :( i aint got no job!!! i have a deathadder chroma and it's pretty good,Overwatch,0
Should have ended 5 minutes earlier though ,Overwatch,0
[deleted],Overwatch,0
"I always thought her Junker skin was when during one of her fights against that big Omnic monster off the coast of Australia she ended up ejecting and getting knocked unconcious. She was taken in by friendly junkers after washing ashore, although she had temporary amnesia. She built herself a junker meka and during a fight against the same giant a few months later remembered who she is.

Ever since she kept the outfit and junk meka as a souvenir of her adventure in the outback.",Overwatch,0
Well done.,Overwatch,0
Rein would be horrifying. ,Overwatch,0
Well... there's bronze - silver - Gold - platinum - diamond - master - grandmaster... so pretty high,Overwatch,0
"Zarya, Pharah, Reaper, Zenyatta, in that order. Basically anyone with a Quake weapon analogue",Overwatch,0
This is such amazing artwork! ,Overwatch,0
"Well i knew this was going to happen. Too much spamming of that word and people started to report people using that. Well im gonna still continue using ""gg ez"" becase i wanna watch these kids rage and cry :)",Overwatch,0
Lots of sass! Loving it! ,Overwatch,0
"8 sets of testicles, so divine ",Overwatch,0
"Playing against a full team of Mei isn't fun though, and it's pretty much everything I've seen. ",Overwatch,0
What a Milf ,Overwatch,0
That was my first thought too! Reminds me of the Brainswalker set from SDCC this year. ,Overwatch,0
Do you know anyone that's not from /r/dreamgirlfriend ? Hahahahha,Overwatch,0
"60 Hz/FPS is quite smooth. Sure, 120 and 144 are smoother, but it's only less than 60 where it becomes truly noticeable. Okay, perhaps if I played at 120 all the time and went back to 60 I'd notice it, but it's not the same as 30 vs 60 for example.

I get about 120-130 FPS usually (VSync disabled) and so there's never any sub-60 stutter.

Here's a sample (not sure why ShadowPlay downscaled it from 2560x1600): https://youtu.be/bI9BdNQT77Y",Overwatch,0
Sombra.,Overwatch,0
"Well, uh, it's happened before.

and has been posted

on this subreddit

....

So probably not *that* low. ",Overwatch,0
No one cares. Sorry. Maybe next time Blizzard can try not fucking with its players,Overwatch,0
"Highest I had was 42 as Reaper, but you still did great! ",Overwatch,0
It didn't stop them from writing ez,Overwatch,0
LOL fuck me then,Overwatch,0
?,Overwatch,0
Uhm. Where? I've never heard of it..,Overwatch,0
What sword is he using ? this move looks hilarious,Overwatch,0
fuck man i thought i was the first  one to the joke ,Overwatch,0
Did Pharah turn into Reaper right as she hits the floor? It looks like it...,Overwatch,0
Don't pee in the bushes.,Overwatch,0
Genji sounds like claptrap when he does that ,Overwatch,0
Wouldn't turning autojoin off for team not change anything? What I want to do is be able to use group during the intermission but team during the actual game.,Overwatch,0
Do you want to know why? GOLDEN FUCKING GUNS,Overwatch,0
Until you get frozen for 3 minutes straight,Overwatch,0
You Mei'd me laugh,Overwatch,0
Blizzard has said they won't be adding heroes for the the sake of adding heroes. New heroes will need to add something new to the game.,Overwatch,0
"Roadhog: ""I like that""

Oh my...",Overwatch,0
"""I am becoming one with the objective.""",Overwatch,0
If you're talking about [this one](http://www.dell.com/en-us/shop/productdetails/alienware-17-r3/dkcwg01s) you'll be fine and will be able to run it well.,Overwatch,0
There's nothing wrong with being a solo player as long as you can accept that being a solo player means you don't get to 'pick and choose' your teammates (that means you can have good and bad teammates),Overwatch,0
"I doubt it, I think the focus will be the remaster of warcraft, maybe on the overwatch panels though?",Overwatch,0
"Oh shit.  I didn't even know that.  I've been ranting from my unread box, like legit waiting for your replies after I check a few other reddits.

I'm bored as ass right now.  I'm probably going to play a few rounds now.",Overwatch,0
[deleted],Overwatch,0
"if you feel like your teammates are bad, dont play a low-impact character like lucio. Play zarya, reinhardt, reaper, or genji",Overwatch,0
"i just tryed the microdisplacement on this model. not the best result for small detail but i also could have done a better job at converting the normal

http://i.imgur.com/IkeKsqh.png

also there seems to issues with uv subdivisions (not suported by adaptive :/)",Overwatch,0
"Ana, Reinhardt, McCree, Hanzo, Reaper, Zarya, Lucio.",Overwatch,0
"&gt;i want to play characters I want to play and not play his counter

Well you can have fun losing then. You expect a character to be removed because you don't want to take advantage of the tools that the game gives you to get rid of him. That's not a problem with the game, that's your own problem.",Overwatch,0
"I don't think I have ever seen an evenly matched game (+3500) where a Genji gets his ult before anyone else. What I have seen though, is a Nano boosted Reinhart knocking on your front door in the first 30 seconds.",Overwatch,0
This is why you should bow instead. It prevents any social awkwardness in public. Just watch your [step](http://i.imgur.com/qU0Rr14.gif),Overwatch,0
I think that's Evil Deadpool. He's just a bunch of old limbs and stuff that got chucked in a dumpster and regenerated into that thing.,Overwatch,0
"&gt; Witch Hunter McCree

Yes.

YES.

**YES.**

***TAKE THE UP DOOT AND GO.***",Overwatch,0
"I laughed for a good five minutes at this and I have no clue why.
Help me.",Overwatch,0
take my energy goddamit,Overwatch,0
[deleted],Overwatch,0
"Exactly, the only time I've muted someone so far is when a kid who is apparently a friend of my friend starts blasting EDM in party vcomm and telling me how great it is, and refused to turn it off after multiple requests but actually turned it up to spite us. If he didnt have an IEM or a headphone i'd probably be more understanding (though even then he could have easily used PTT) but he admitted he does and is just purposly broadcasting the music.",Overwatch,0
"Route 66, Gibraltar, Lijiang Towers",Overwatch,0
"ffs genji noobs, didnt even dash out of the way.",Overwatch,0
This is awesome,Overwatch,0
reminds me of an old sonic cutscene,Overwatch,0
"Yea I get that but in this instant, a player left because they failed the first capture point",Overwatch,0
When she puts someone to sleep and says نام ,Overwatch,0
"PC (NA) 
 
SR: 2156 (I've only done a few matches after solo-queue placements, and steadily climbing)

Hours: Varies depending on work/college, but I'm on around 8pm-2am EST most days.


Battletag: Haste#1944


Roles: I main Zenyatta and Zarya, usually. I'm comfortable almost any hero, but prefer Rein, Lucio, McCree, and Genji. ****Selling Point***: I never play Hanzo or Widow.

I like to take the game seriously, and try to rank up. That's the whole point of competitive, after all. So yeah, shoot me a friend request. Looking for people with mics, and preferably mature with minimal toxicity.",Overwatch,0
You gave DVa a mech. DVa is free!,Overwatch,0
2170,Overwatch,0
W̥͉̹͒ͫͧͩ͆ͦ̕͡I̮̦͆̉̓͆͑̚͡Ṋ̢̫̯̖̞͒͂̈͜Kͮͭ̎͏̱͉͈̥Y̧͇̥̻ͫ̏̅̎͢ ̧̖̝͕̠ͪ̽̃ͫ͗̊̌F̥͓͙̞͚̼̔͛̽ͦ̆ͪ̐̚A̞͕̺̭͙̜͈ͪ͋̾̈͂ͪ̃̇C̩̗̥͕̠̘͈̞̔͋̀̀̀E̴̦̜ͬ͌ͥͯ̌̄͡͝ ͑̾ͧ͌̽̏͏̲̩̲̜ͅW̵̰͉̖̝̼̥̣͎͓͐̈́ͦ͂̄ͣ͊ͫI̶̴̱̗̼̘͍̲̰͊͌Ņ̻̠͐͋͠K͎̫̪̹̊̄ͣ͐̾͒͛̓Y͖͉͕̺̬͔̒͛͗̀ͯͨ̉̀̈́̀ ̝̠͙̰͎̲̥̘̊ͯ̽̈́F̪̻̣̳̠͇͉̀ͨ̑͒͟͝ͅA̙ͭ͒̋ͮ͋ͥ̉͠ͅÇ̥̖ͥ̀͆ͣ̈́̋ͤḚ̶̲̖̞̘̾̽́͌ͤ̅̿̔͝ ͙̗̠̝̮̅̉͒ͥ͐͝Ẃ̻̜͔̹̌̑ͫ̇ͭ̄ͦI̴̢̝̞̮̲̥̯̭̙ͮ̂͜N̴̲͕̬̜̰͈̱̏͒ͭͣ̈ͫ̾ͨ͜ͅK̴͍̼̗̟̥̙̣̈́͊̑̄ͣ͒̍͡͝ͅY̡̦̗̟̺͈͑̅͌̾ͫ̔̌ ̵̨̠ͤ̆̒ͭ̀Fͣ͏̧͓͖͟A̗͕̮̬͂̊͟C̢̳̦̫̙͋ͭ͠É̛̬̘̮̪̆̏ͤͧ̕͠,Overwatch,0
[deleted],Overwatch,0
"That's a stupid reason to Nanoboost Mercy! She should be getting Nanoboosted just to see that panic on her face when she realises she has to fight or waste the ult. It's hilarious, and sometimes Mercy makes it work.

...But really, the way to convince him that it's a bad idea is to mention that it severely weakening the potential of the team's damage output. Instead of a 1000 health Reinhardt with over 100 damage hammer swings and a movement speed that's terrfiying, you have a 400 health squishy and no real benefit to anything.",Overwatch,0
Go big or go back to the bonfire,Overwatch,0
Aim for the head lol,Overwatch,0
LOL reaper was like uhhh is the payload broken,Overwatch,0
LLLLLLL,Overwatch,0
"Honestly i noped out at the first line ""agender artist"" and telling me about ""they"" pronouns.

Just be an artist for fucks sake.  ",Overwatch,0
thats how wheatley from portal solves problems... i actually wanna figure out why this is happening and how to fix it ,Overwatch,0
i think more pro mccree player use around 400*10,Overwatch,0
Why is this under news and discussion?,Overwatch,0
very nice :D,Overwatch,0
Oh dip. I gatta give that a shot.,Overwatch,0
"i don't think expansions are counted together for wow, else it would trounce everything easily.",Overwatch,0
Nice!,Overwatch,0
That's [Beta Ray Bill](https://en.wikipedia.org/wiki/Beta_Ray_Bill),Overwatch,0
"and on the other side I hope they don't change her too drastically. I'm all for that idea of the shield redesign being like, the 25 shields is a passive and her new E lets her give a mini lucio sound barrier or whatever to someone. I have 90+ hours on her so I don't want all my training to go to waste lol.",Overwatch,0
Whops,Overwatch,0
Why would you ever get mad about GG EZ?  It's a silly game dude and some stranger thousands of miles away typed 4 letters.  If seeing GG EZ really gets you that upset you probably need to not play online games and stick to less stressful things like gardening.  ,Overwatch,0
"I have one guess, symmetra didn't load because of your potato pc..",Overwatch,0
Initial sales are always large,Overwatch,0
"battleborn ?
",Overwatch,0
I don't play them much as it normally take a longer to get into one and I receive nothing  special for doing one .,Overwatch,0
I once got one for putting a single harmony orb on a bastion,Overwatch,0
"Stop being dramatic and pedantic, go blogpost somewhere else.",Overwatch,0
Blizzard plz,Overwatch,0
that was well done ,Overwatch,0
She is just the worse in general now ,Overwatch,0
Do you get a hard dick from comments like these and their replies? I pity you,Overwatch,0
"#BLESS THIS COMMENT

Seriously, I ***HATE*** when it just needs one more hit, but that stupid Genji keeps nicking it with his shurikens :c",Overwatch,0
It was just a slightly messed up handshake which got blown out of proportion because Jimmy needed material for his show.,Overwatch,0
I've never even heard of this. I'll check it out. Thanks,Overwatch,0
New wallpaper. Nice!!,Overwatch,0
Take all my votes.,Overwatch,0
This is absolutely phenomenal work. Great job!,Overwatch,0
"Tracer. You can zip in and spray him and who ever's behind his shield and then zip out, he's too slow to keep up. Rinse and repeat. He's also HUGE so it's very easy to unload a full clip of damage into him. ",Overwatch,0
"That's the thing though, why would you gain points if you lose? Having that extra player would nit have guaranteed a win, so why be rewarded at all for a game you didn't win?",Overwatch,0
What is your problem? You don't believe that I am what I told you?,Overwatch,0
Full charge zarya is insane.  Nanoboosted full charge zarya is a nightmare. ,Overwatch,0
and the shitpost of the day goes to.....,Overwatch,0
"the thing is, it will not change shit. Needing 12 shots now instead of 10 will barely change anything. 

Imo the Nanoboost is too strong. Having Dmg boost, dmg reduction AND speed boost is just too good. Lowering or removing one of those things would be a better nerf. 

Also Anas grenade got buffed from 3 to 4 meter which is pretty strong right now.",Overwatch,0
The point is it's a lot less impressive to be the #1 selling game when your competitors products cost 10 times as much.,Overwatch,0
Only Mei and Zarya needs a hero limit.,Overwatch,0
I was hoping someone would mention this. Scumbag Lucio just hides in a corner while his team gets destroyed and the point is pushed.,Overwatch,0
No,Overwatch,0
I want to believe!,Overwatch,0
*30 min later typing out a sentence*,Overwatch,0
Australian Ping is shite I you don't live near Sydney,Overwatch,0
"&gt; I can't find his battletag number.

If you still have him friended, click the friends icon in your BNet client and hover your mouse over him. ",Overwatch,0
Why would you show me this.  Now I want it so badly.  ,Overwatch,0
"I for one want to see how bad it is. Maybe then I'll be able to appreciate the people at my rank. Then again, they're bad too (attack symmetra I'm looking at you).",Overwatch,0
"I wasn't raging or anything, it didn't ruin my night. I mean, it's a brawl. I total expect that from QP and competitive.",Overwatch,0
Search this sub for 11 lootboxes... ,Overwatch,0
Yeah soldier isn't even above 50% on any of them.,Overwatch,0
"Thanks, I guess",Overwatch,0
"He's countered by like 4 Heroes so he's not overpowered, like by any means. Anybody with range and/or damage can kill him. I get fucked by McCree, fully charged Zarya, Zenyatta can melt through me if I'm discorded, and reaper if he gets the flank on me.",Overwatch,0
I tried posting a thread about this and got downvoted to hell. Surprised anyone else thinks this too.,Overwatch,0
inb4 git gud,Overwatch,0
GW2 is the greatest mediocre game ever made. Like a game based around all the features and QoL improvements that you wish were in the other games you love,Overwatch,0
👌 thats ✔ some good👌👌shit right👌👌there👌👌👌,Overwatch,0
I rather have a stat buff tbh. It's the only way he can become viable.,Overwatch,0
"It's pronounced Zar-yah.
Source: I'm Russian.",Overwatch,0
"I'm officially done with Friday-Sunday play.  So far from last night and tonight.

L1 due to 2 leavers

L2 due to Me being the solo person not on DPS

L3 Lucio refused to use healing mode and flamed us to git gud.  (This must be the new troll after Mei, ran into this same thing several times now).  Also he decided bull rushing the enemy was the best idea and died, a lot.

L4 We got demolished, couldn't even break the spawn area.  Felt like we played against a team who purposely de leveled just to steamroll the low 2000s.

W1 Other team had leavers.

W2 See above

L5 Holy fuckballs I had 4 gold's as Reinhard with 4 DPS on my team and with 12 kills, 2 objective and less than 10 seconds of time.

We need lucioball back.",Overwatch,0
I've been playing daily and I'm currently at 1896. Last night I logged out at 1980's and the night before I was in the 2000's. I'm fairly certain I am the only one playing from my PC...perhaps there's a security breach someone playing on my account elsewhere?,Overwatch,0
[Relevant](https://www.youtube.com/watch?v=HZ5py_n30to),Overwatch,0
"This explains why there's so many downies who lack fundamental understanding of the game modes... I knew fellow players were getting worse, it couldn't be me improving.",Overwatch,0
"rage-faces aside, this is kinda hilarious.",Overwatch,0
Added,Overwatch,0
"Just out of curiosity, what rank are you then?",Overwatch,0
Love it!  This is probably my favorite victory pose in the game as well.  Second would be Roadhog's touchdown one.,Overwatch,0
literally unplayable until this is fixed.,Overwatch,0
"I'm 2811 SR right now. I don't really play much rank but when I do I find that the diamonds I verse aren't any better then me. I got up to rank 60 S1 so I'm probably close to a Diamond player. I would enjoy ranked so much if I got put in games with all diamonds. Instead I am stuck with the 2700 Genji that brings his 2500 Hanzo friend with him. 

I just don't think the current ELO system takes into account SR potential enough. Someone that has 1000 games at 2500 is viewed by the system the same as someone that placed 2500. If the person placed in 2500 climbs to 3000+ then every game that person played to get there wasn't really that fair because his skill was undervalued. System doesn't match climbing SR players with climbing SR players and the games at high platinum turn into ""Which team has more potential"". If I get matched with someone that is a hard 2700 with 1000 games played the chances that they will help me make it to Diamond are very slim, sure it's just one game but the whole system works like this and most likely you'll get another in the next game.

It's why bringing in a team with people you know can perform at higher then their current SR is so much better then Solo que.

Anyways I would enjoy being the weakest link on a team. Toss me in games with Diamonds and let me win a couple to slowly climb to Diamond. I'm tired of getting tossed into middle platinum games and hoping my team contains more future Diamond players theirs.",Overwatch,0
Refer to previous comment,Overwatch,0
"Could be late but can someone rehost it on Imgur? When I try to open the image I get a message saying something like: ""This website can not provide a protected connection"" (translated so might be a little off)",Overwatch,0
"LMFAO

Where the hell do you get those numbers from?! ""Energy equivalent of a nuclear bomb?""! That's a joke right? You can't be serious.",Overwatch,0
"no we cannot have a ""report people for not doing what I say"" button",Overwatch,0
"&gt;It's-a-me, a-Lucio!

Nintendo: *It's-a-me, litigation!*",Overwatch,0
Winky Face,Overwatch,0
I think it's highly unlikely for the event to end on its actual date.,Overwatch,0
"I was like ""why aren't they hitting each other???"" then I saw the button prompts...",Overwatch,0
What characters do you usually play?,Overwatch,0
Greetings. Hello. Yo. Greetings.,Overwatch,0
"so...?


do you want a trophy or something?",Overwatch,0
"And just after that, an episode of Bulma doing something totally unrelated!",Overwatch,0
"Pretty much. I still find the brawl a blast because of the shear absurdity and, as I said, I'll miss the Ana darts when they adjust the mode. I'm a Mei-n though so I don't mind playing as Mei. That said, I can easily see why people find it annoying since most other heroes just aren't worth fielding even with the reduced cooldowns.",Overwatch,0
"When yesterday EU servers went shit and 4 people from my team and 1 from enemy just disappeared which ended up in 5v2, Blizz considered this as ""You played match so there will be no SR restoration for you"". 

I doubt blizz care about this things.",Overwatch,0
Nvidia shadowplay,Overwatch,0
"dude i dont know how to photoshop, and it was took by my shitty Nokia 530 :D",Overwatch,0
"but it's not as easy to determine the fuck-up. if you're in first person you'll see the teammate miss shots, look the wrong way, etc more clearly. This is the only reasonable explanation they don't permit it when playing. The functionality is there though because you can first person when strictly spectating.",Overwatch,0
"as a guy that sounds like a normal day online for me. 
usually this happens once every 20 matches or so. not as often. 

but as you keep climbing you will notice people are more often polite in the top levels. and you still will also notice there is a random asshole(male or female) every now and then. ",Overwatch,0
"I'm okay with that, as long as they move away from the mic to breathe in.",Overwatch,0
"If they would go this far with it I'd prefer a filter that channels out anything along the lines of ""GG, GGEZ, EZPZ, etc.""",Overwatch,0
"As someone who's conservative, I'll have you know that it isn't amazing. It's a-Mei-zing.",Overwatch,0
Love these genji bugs,Overwatch,0
"Scooby dooby dooooo!

Seeing as Bastion has the ""Da da da da da daaaaa"" (puppy power!) Scrappy doo line going for him, may as well give this to Zenyatta. ",Overwatch,0
"would have went for a scatter arrow at his feet though, simplier",Overwatch,0
I think you drastically misunderstood what they were saying,Overwatch,0
gg ez.,Overwatch,0
LMAO,Overwatch,0
"If it works the same way as the summer games did where you can't buy them using your credits, that would suck.  I don't want to spend 2 weeks waiting to get the skins that I want, only to be able to play them in November.",Overwatch,0
"Genji: my name is Hanzo Shimada, I keep one nipple exposed to get all the Tumblr fan girls/boys (it's 2064 gender/omnic equality) and I kill my brother because he dishonored the family huuuuuuuhhuhhhhhhhhh",Overwatch,0
Don't forget to thank your Zarya's people!,Overwatch,0
LMAO,Overwatch,0
"I doubt that list is close to being correct. World of Warcraft only sold 14 million copies, when they had 12 million active players back in the Wrath of the Lich King/Burning Crusade times? No way.

The source is 3 years old, but still. I bet World of Warcraft has at least 20+ million copies sold, if not way more than double of that.

http://eu.battle.net/forums/en/wow/topic/5168357592",Overwatch,0
My main is Lucio.,Overwatch,0
That's what the report button is for. I'd rather they fix their reconnecting issues so legitimate players can actually finish the game rather than lose it because of people who aren't trying to. ,Overwatch,0
Or you flank like a smart junk rat player and don't get greedy. ,Overwatch,0
This was amazing,Overwatch,0
Why do all of these work so well?,Overwatch,0
"Dude his damage fall off is from 7 per pellet
to 2 damage per pellet
At far range even IF every one hit a tank, thats only 40 damage
Just play McCree, Pharah, Genji, a Sniper (One that can atleast know where he is first, if they don't thats their own fault"" 
And after Reaper's Wraith form is on CD he is a pincushion ",Overwatch,0
[](/colgateohyou) Oh you.,Overwatch,0
Not as easy it sounds,Overwatch,0
"Overwatch is set in a hopeful future, so we'd likely not see that.",Overwatch,0
"Soon the block that, poor Brad :;(:((",Overwatch,0
"do you count all the people at the end of the round that spam ""gg ez"" as toxic because more than half of your games is a lot. I am in the 2700-2800 range and fail to find anyone on pc who acts ""toxic"".",Overwatch,0
"Yeah, we don't want to hear about your self-awareness.  Just suppress it like normal people!  /s",Overwatch,0
"There's 7 mins left, it was a lost game, just had to make the POTG worth it!",Overwatch,0
[deleted],Overwatch,0
"To practice and experiment with hitboxes on the various models.  For example, learn the exact distance that a reaper shot will do various amounts of damage, which is different with every character.",Overwatch,0
They didn't stop BMing at all. Trolls merely incorporated the translations into their repertoire. ,Overwatch,0
