body,subreddit,moderated
"SORRY SORRY SORRY SORRY SORRY SORRY SORRY SORRY SORRY SORRY SORRY SORRY SORRY SORRY SORRY SORRY SORRY SORRY SORRY SORRY SORRY SORRY SORRY SORRY SORRY SORRY SORRY SORRY SORRY SORRY SORRY SORRY SORRY SORRY SORRY SORRY SORRY SORRY SORRY SORRY SORRY SORRY SORRY SORRY SORRY SORRY SORRY SORRY SORRY SORRY SORRY SORRY SORRY SORRY SORRY SORRY SORRY SORRY SORRY SORRY SORRY SORRY SORRY SORRY SORRY SORRY SORRY SORRY SORRY SORRY SORRY SORRY SORRY SORRY SORRY SORRY SORRY SORRY SORRY SORRY SORRY SORRY SORRY SORRY SORRY SORRY SORRY SORRY SORRY SORRY SORRY SORRY SORRY SORRY SORRY SORRY SORRY SORRY SORRY SORRY SORRY SORRY SORRY SORRY SORRY SORRY SORRY SORRY SORRY SORRY SORRY SORRY SORRY SORRY SORRY SORRY SORRY SORRY SORRY SORRY SORRY SORRY SORRY SORRY SORRY SORRY SORRY SORRY SORRY SORRY SORRY SORRY SORRY SORRY SORRY SORRY SORRY SORRY SORRY SORRY SORRY SORRY SORRY SORRY SORRY SORRY SORRY SORRY SORRY SORRY SORRY SORRY SORRY SORRY SORRY SORRY SORRY SORRY SORRY SORRY SORRY SORRY SORRY SORRY SORRY SORRY SORRY SORRY SORRY SORRY SORRY SORRY SORRY SORRY SORRY SORRY SORRY SORRY SORRY SORRY SORRY SORRY SORRY SORRY SORRY SORRY SORRY SORRY SORRY SORRY SORRY SORRY SORRY SORRY SORRY SORRY SORRY SORRY SORRY SORRY SORRY SORRY SORRY SORRY SORRY SORRY SORRY SORRY SORRY SORRY SORRY SORRY SORRY SORRY SORRY SORRY SORRY SORRY SORRY SORRY SORRY SORRY SORRY SORRY SORRY SORRY SORRY SORRY SORRY SORRY SORRY SORRY SORRY SORRY SORRY SORRY SORRY SORRY SORRY SORRY SORRY SORRY SORRY SORRY SORRY SORRY SORRY SORRY SORRY SORRY SORRY SORRY SORRY SORRY SORRY SORRY SORRY SORRY SORRY SORRY SORRY SORRY SORRY SORRY SORRY SORRY SORRY SORRY SORRY SORRY SORRY SORRY SORRY SORRY SORRY SORRY SORRY SORRY SORRY SORRY SORRY SORRY SORRY SORRY SORRY SORRY SORRY SORRY SORRY SORRY SORRY SORRY SORRY SORRY SORRY SORRY SORRY SORRY SORRY SORRY SORRY SORRY SORRY SORRY SORRY SORRY SORRY SORRY SORRY SORRY SORRY SORRY SORRY SORRY SORRY SORRY SORRY SORRY SORRY SORRY SORRY SORRY SORRY SORRY SORRY SORRY SORRY SORRY SORRY SORRY SORRY SORRY SORRY SORRY SORRY SORRY SORRY SORRY SORRY SORRY SORRY SORRY SORRY SORRY SORRY SORRY SORRY SORRY SORRY SORRY SORRY SORRY SORRY SORRY SORRY SORRY SORRY SORRY SORRY SORRY SORRY SORRY SORRY SORRY SORRY SORRY SORRY SORRY SORRY SORRY SORRY SORRY SORRY SORRY SORRY SORRY SORRY SORRY SORRY SORRY SORRY SORRY SORRY SORRY SORRY SORRY SORRY SORRY SORRY SORRY SORRY SORRY SORRY SORRY SORRY SORRY SORRY SORRY SORRY SORRY SORRY SORRY SORRY SORRY SORRY SORRY SORRY SORRY SORRY SORRY SORRY SORRY SORRY SORRY SORRY SORRY SORRY SORRY SORRY SORRY SORRY SORRY SORRY SORRY SORRY SORRY SORRY SORRY SORRY SORRY SORRY SORRY SORRY SORRY SORRY SORRY SORRY SORRY SORRY SORRY SORRY SORRY SORRY SORRY SORRY SORRY SORRY SORRY SORRY SORRY SORRY SORRY SORRY SORRY SORRY SORRY SORRY SORRY SORRY SORRY SORRY SORRY SORRY SORRY SORRY SORRY SORRY SORRY SORRY SORRY SORRY SORRY SORRY SORRY SORRY SORRY SORRY SORRY SORRY SORRY SORRY SORRY SORRY SORRY SORRY SORRY SORRY SORRY SORRY SORRY SORRY SORRY SORRY SORRY SORRY SORRY SORRY SORRY SORRY SORRY SORRY SORRY SORRY SORRY SORRY SORRY SORRY SORRY SORRY SORRY SORRY SORRY SORRY SORRY SORRY SORRY SORRY SORRY SORRY SORRY SORRY SORRY SORRY SORRY SORRY SORRY SORRY SORRY SORRY SORRY SORRY SORRY SORRY SORRY SORRY SORRY SORRY SORRY SORRY SORRY SORRY SORRY SORRY SORRY SORRY SORRY SORRY SORRY SORRY SORRY SORRY SORRY SORRY SORRY SORRY SORRY SORRY SORRY SORRY SORRY SORRY SORRY SORRY SORRY SORRY SORRY SORRY SORRY SORRY SORRY SORRY SORRY SORRY SORRY SORRY SORRY SORRY SORRY SORRY SORRY SORRY SORRY SORRY SORRY SORRY SORRY SORRY SORRY SORRY SORRY SORRY SORRY SORRY SORRY SORRY SORRY SORRY SORRY SORRY SORRY SORRY SORRY SORRY SORRY SORRY SORRY SORRY SORRY SORRY SORRY SORRY SORRY SORRY SORRY SORRY SORRY SORRY SORRY SORRY SORRY SORRY SORRY SORRY SORRY SORRY SORRY SORRY SORRY SORRY SORRY SORRY SORRY SORRY SORRY SORRY SORRY SORRY SORRY SORRY SORRY SORRY SORRY SORRY SORRY SORRY SORRY SORRY SORRY SORRY SORRY SORRY SORRY SORRY SORRY SORRY SORRY SORRY SORRY SORRY SORRY SORRY SORRY SORRY SORRY SORRY SORRY SORRY SORRY SORRY SORRY SORRY SORRY SORRY SORRY SORRY SORRY SORRY SORRY SORRY SORRY SORRY SORRY SORRY SORRY SORRY SORRY SORRY SORRY SORRY SORRY SORRY SORRY SORRY SORRY SORRY SORRY SORRY SORRY SORRY SORRY
SORRY SORRY SORRY SORRY SORRY SORRY SORRY SORRY SORRY SORRY SORRY SORRY SORRY SORRY SORRY SORRY SORRY SORRY SORRY SORRY SORRY SORRY SORRY SORRY SORRY SORRY SORRY SORRY SORRY SORRY SORRY SORRY SORRY SORRY SORRY SORRY SORRY SORRY SORRY SORRY SORRY SORRY SORRY SORRY SORRY SORRY SORRY SORRY SORRY SORRY SORRY SORRY SORRY SORRY SORRY SORRY SORRY SORRY SORRY SORRY SORRY SORRY SORRY SORRY SORRY SORRY SORRY SORRY SORRY SORRY SORRY SORRY SORRY SORRY SORRY SORRY SORRY SORRY SORRY SORRY SORRY SORRY SORRY SORRY SORRY SORRY SORRY SORRY SORRY SORRY SORRY SORRY SORRY SORRY SORRY SORRY SORRY SORRY SORRY SORRY SORRY SORRY SORRY SORRY SORRY SORRY SORRY SORRY SORRY SORRY SORRY SORRY SORRY SORRY SORRY SORRY SORRY SORRY SORRY SORRY SORRY SORRY SORRY SORRY SORRY SORRY SORRY SORRY SORRY SORRY SORRY SORRY SORRY SORRY SORRY SORRY SORRY SORRY SORRY SORRY SORRY SORRY SORRY SORRY SORRY SORRY SORRY SORRY SORRY SORRY SORRY SORRY SORRY SORRY SORRY SORRY SORRY SORRY SORRY SORRY SORRY SORRY SORRY SORRY SORRY SORRY SORRY SORRY SORRY SORRY SORRY SORRY SORRY SORRY SORRY SORRY SORRY SORRY SORRY SORRY SORRY SORRY SORRY SORRY SORRY SORRY SORRY SORRY SORRY SORRY SORRY SORRY SORRY SORRY SORRY SORRY SORRY SORRY SORRY SORRY SORRY SORRY SORRY SORRY SORRY SORRY SORRY SORRY SORRY SORRY SORRY SORRY SORRY SORRY SORRY SORRY SORRY SORRY SORRY SORRY SORRY SORRY SORRY SORRY SORRY SORRY SORRY SORRY SORRY SORRY SORRY SORRY SORRY SORRY SORRY SORRY SORRY SORRY SORRY SORRY SORRY SORRY SORRY SORRY SORRY SORRY SORRY SORRY SORRY SORRY SORRY SORRY SORRY SORRY SORRY SORRY SORRY SORRY SORRY SORRY SORRY SORRY SORRY SORRY SORRY SORRY SORRY SORRY SORRY SORRY SORRY SORRY SORRY SORRY SORRY SORRY SORRY SORRY SORRY SORRY SORRY SORRY SORRY SORRY SORRY SORRY SORRY SORRY SORRY SORRY SORRY SORRY SORRY SORRY SORRY SORRY SORRY SORRY SORRY SORRY SORRY SORRY SORRY SORRY SORRY SORRY SORRY SORRY SORRY SORRY SORRY SORRY SORRY SORRY SORRY SORRY SORRY SORRY SORRY SORRY SORRY SORRY SORRY SORRY SORRY SORRY SORRY SORRY SORRY SORRY SORRY SORRY SORRY SORRY SORRY SORRY SORRY SORRY SORRY SORRY SORRY SORRY SORRY SORRY SORRY SORRY SORRY SORRY SORRY SORRY SORRY SORRY SORRY SORRY SORRY SORRY SORRY SORRY SORRY SORRY SORRY SORRY SORRY SORRY SORRY SORRY SORRY SORRY SORRY SORRY SORRY SORRY SORRY SORRY SORRY SORRY SORRY SORRY SORRY SORRY SORRY SORRY SORRY SORRY SORRY SORRY SORRY SORRY SORRY SORRY SORRY SORRY SORRY SORRY SORRY SORRY SORRY SORRY SORRY SORRY SORRY SORRY SORRY SORRY SORRY SORRY SORRY SORRY SORRY SORRY SORRY SORRY SORRY SORRY SORRY SORRY SORRY SORRY SORRY SORRY SORRY SORRY SORRY SORRY SORRY SORRY SORRY SORRY SORRY SORRY SORRY SORRY SORRY SORRY SORRY SORRY SORRY SORRY SORRY SORRY SORRY SORRY SORRY SORRY SORRY SORRY SORRY SORRY SORRY SORRY SORRY SORRY SORRY SORRY SORRY SORRY SORRY SORRY SORRY SORRY SORRY SORRY SORRY SORRY SORRY SORRY SORRY SORRY SORRY SORRY SORRY SORRY SORRY SORRY SORRY SORRY SORRY SORRY SORRY SORRY SORRY SORRY SORRY SORRY SORRY SORRY SORRY SORRY SORRY SORRY SORRY SORRY SORRY SORRY SORRY SORRY SORRY SORRY SORRY SORRY SORRY SORRY SORRY SORRY SORRY SORRY SORRY SORRY SORRY SORRY SORRY SORRY SORRY SORRY SORRY SORRY SORRY SORRY SORRY SORRY SORRY SORRY SORRY SORRY SORRY SORRY SORRY SORRY SORRY SORRY SORRY SORRY SORRY SORRY SORRY SORRY SORRY SORRY SORRY SORRY SORRY SORRY SORRY SORRY SORRY SORRY SORRY SORRY SORRY SORRY SORRY SORRY SORRY SORRY SORRY SORRY SORRY SORRY SORRY SORRY SORRY SORRY SORRY SORRY SORRY SORRY SORRY SORRY SORRY SORRY SORRY SORRY SORRY SORRY SORRY SORRY SORRY SORRY SORRY SORRY SORRY SORRY SORRY SORRY SORRY SORRY SORRY SORRY SORRY SORRY SORRY SORRY SORRY SORRY SORRY SORRY SORRY SORRY SORRY SORRY SORRY SORRY SORRY SORRY SORRY SORRY SORRY SORRY SORRY SORRY SORRY SORRY SORRY SORRY SORRY SORRY SORRY SORRY SORRY SORRY SORRY SORRY SORRY SORRY SORRY SORRY SORRY SORRY SORRY SORRY SORRY SORRY SORRY SORRY SORRY SORRY SORRY SORRY SORRY SORRY SORRY SORRY SORRY SORRY SORRY SORRY SORRY SORRY SORRY SORRY SORRY SORRY SORRY SORRY SORRY SORRY SORRY SORRY SORRY SORRY SORRY SORRY SORRY SORRY SORRY SORRY SORRY SORRY SORRY SORRY SORRY SORRY SORRY SORRY SORRY SORRY SORRY SORRY SORRY SORRY SORRY SORRY SORRY SORRY SORRY SORRY SORRY SORRY SORRY SORRY SORRY SORRY SORRY SORRY SORRY SORRY SORRY SORRY SORRY SORRY
",television,1
But why though,television,1
"> That makes no sense. It's not an appeal to intellect, it's an appeal to experience - two very different things. There's no substitute for it.

go read any of the posts there. Look how condesending they sound. Now go re-read your own comment. Please.

>Then what is there to discuss?

who said I wanted to discuss shit with you?

>Trust me, it shows.

Well.. Nice diss bro. You got me there. So if you read books so much, can you tell me how you cannot tell how you sound exactly like the posts on /r/iamverysmart  ??

Also, How did you figure that out? By reading a couple of sentences that literally took me minutes to write? or are you talking out of your ass again?",television,1
lol,television,1
>Because the television license fee is stolen money,television,1
die in a car wreck cunt. ,television,1
"Ok, so what is your plan of action for this election? Do you think protesting or not voting for Hillary and letting Donal Trump win will actually fix any of the things you're concerned about. Don't be stupid. You have to vote for Trump's opponent. There's a long road of political and social agitation ahead to fix what you're concerned about, and it can be done, but allowing Trump to become president now will just set back that process ya dummy.",television,1
"You're a user of the propaganda subreddit The_Donald and you want to lecture other people about how bad this subreddit is?

Of course your response is that I'm a CTR shill, but in reality I'm just a dumb 20 something who cannot fucking believe you are so hypocritical.",television,1
\>for a variety of reasons,television,1
"Results of holiday binge-ing (that I almost want to feel bad for but not really because they were all so good and makes spending with family bearable) 


**Flowers** - Hilarious and crazy. A definite must-watch and could not recommend more. Like a multi-episode arc of Inside No. 9. Always fun to see the charming Olivia Coleman wobbling in her green Umbridge coat. Best comedy this year.

**Fleabag** - Breaking the 4th wall meets /r/me_irl. Relatable series, half-way terrible, unapologetic without any hand-holding needed. Kinda reminds me of Miranda with 10% of the cringe.

**Search Party** - I finished this in one sitting, I probably shouldn't have but it's one of the NY-centric comedies I was able to stomach and even enjoy apart from Broad City. If you didn't like HBO mumblecore, maybe you'll like this more. The characters are terrible people but in an entertaining way. I think the show would've fallen apart with another lead so casting paid a huge part in making it one of the more delightful, self-aware and at times harrowing hipster/crime/comedy hybrid. 

**Rectify S4** (Series Finale) - I had to postpone watching this series because I wasn't in the mood for anything heavy but this season was surprisingly light, with bursts of accidental humor. No matter how sombre it was, it was a heartfelt feel-good show. Thank you Sundance, for bringing the best drama to grace our screens this decade.  

**Humans S2** - Liked it more than the first season and they improved characters and plotlines from the Swedish version. I like their take on consciousness and how they take it from interpersonal to societal level. 

**Travelers** - Interesting concept, hints of Continuum and 12 Monkeys. Pilot was intriguing enough to get me hooked. Plus I'll watch anything that has Eric McCormack in it (growing up watching Will&Grace, and yes I sat through all seasons of Perception). ",television,1
Owo thats great!,television,1
"Really? Are you trolling me?
T e e n T i t a n s G o?
e
e
n
T
i
t
a 
n
s
G
o
?",television,1
"No.  It's a very bad formulaic that happens to have superheroes.  It's pretty much 24 episodes of the same exact thing each episode, you'll find the show extremely dull and bad.",television,1
YUP! ,television,1
You must be twelve. Just visit your local historian. ,television,1
This is an American Airlines commercial. ,television,1
">Grindhouse is a legitimately good film 

Yeah no, it's fucking garbage. 

>by a director you may have heard of named ""Quentin Tarantino."" 

It's his worst film my miles and miles. 


>""I Now Pronounce You Chuck and Larry"" had a budget of $85,000,000. 


Waaaaaaahhhh Adam Sandler gets payed too much Waaaaaaahhhh. Jesus christ man that horse has been flattened. Your acting like he got payed to be racist, even in reality he gets payed to be a dumb ass. 


>When you think about the messages that these studios are bankrolling,

Sandlers shit movie didn't have a racist message, it didn't have any message at all. It's a dumb fucking braindead Sandler movie for people who will pay money to gear fart noises. Derp. Meanwhile cloud atlas has a great message and is the opposite of racist, but you're too stupid to comprehend that. 

>it makes Hollywood complicit.

No. The sales pitch for Chuck and Larry wasn't ""let's shit all over Asians!"" It was ""hey I'm going to make another dumb fart noise movie for retards want in?"" 


Chris Rock's Asian joke wasn't even offensive, it was just boring. You're just an over sensitive SJW who doesn't know the difference between innocent stupidity, and genuine malice. And zero of these examples are any evidence of discriminating hiring practices. Take your L buddy, and go watch Cloud Atlas while you're at it. 


",television,1
Easy way out. You spelled faggot wrong.,television,1
"I mentioned in the sub that it was like ""lemony snicket and wes anderson had a baby"" because the framing and the shots and the attention to detail is so incredible! I completely agree with you. I can watch this show so many times and see new things each time, I absolutely love it",television,1
"Just like you clown ass motherfuckers said he could never become president, right? Lmao. Watch him. ",television,1
To actually think about your political opinion instead of parroting whatever your facebook feed says? Wow. I can't believe you just agreed to being a parrot and are proud of it?,television,1
"Jeffrey dies from drink a cup at his wedding (it's his grandma in law) john snow dies, but lives!",television,1
"As a straight white male don't pull our whole demographic into this, you are an asshole and you speak for other assholes who think this type of stuff is great.

We aren't in a race war, you are not my comrade.",television,1
"Except I'm not a liberal, you over assuming moron. Anything else? Golf clap for effort, I guess. ",television,1
You have the best words.,television,1
The balls to go on a scripted show that she already knew what was to be said and had approved it?,television,1
Fuck darkies.,television,1
I'll be honest Jenna Coleman gives a good blowie,television,1
"Ramsay dies, Snow and sansa get back their house. Epic battle. 
haha I guess you can never be too careful.",television,1
Maybe Kari will show those titties!!!!,television,1
Damn the Lich for killing Billy in S4.,television,1
">  what some people call an SJW.

But this is not the_donald or KIA, this is r/television. 

",television,1
"I've read some Germans thought he was a doctor coming to assist their side, or tried to retreat but was confused. In reality, he dropped his weapon before sprinting over, so he did not look like an immediate threat. ",television,1
Him running for the bus is a homage to a scene from a war film where someone is trying to escape the nazis but gets shot. For the life of me I can't think of the name though.,television,1
What makes a person as fucking evil as you?,television,1
"Easy to say shit like this when you're not the one on the receiving end of abuse on a daily basis. Pathetic little douche LOL cry cry moooooore,  I just love how women are taking a stand and showing pigs like you what it feels like to be told. This is how they feel like when a pig like you tell them what they can and cannot do. So have a taste of your poison you fuckwit because NOTHING will stop them. You pigs will learn the hard way that you can't abuse people and expect them to be quiet forever. You keep abusing, they keep shouting, that's how it works. Shove your un-PC shit up your ass with a cactus. It's fucking great to see people like you getting angry, every comment I see from people like you, every downvote is like bliss, it's confirmation that you are feeling mad about it and you fucking deserve to feel that way.",television,1
"She looks like she could give a good blowie with those lips, but damn with those chompers it might cause you to lose a few inches.",television,1
"They edit out some of the subtle cuckolding shit Rebecca tried to pull off in one particular episode. Kids would have found it odd, but anyone with a frame of reference couldn't mistake what Rebecca was going for.

This show really is a piece of shit",television,1
Trumpanzees already turned on Star Wars because of mythical ess jay double yews.,television,1
Rob Thomas was killed in S2 finale of iZombie. Smooth no more.,television,1
cashing out on victimization and feminism I see,television,1
[You have my  NSFW UPVOTE.....](http://adultimg.site/bvH.gifv ),television,1
"Best scene with the Blacks is when they storm off and Aunty May screams ""Fuck toy Larry David, that's some BULLSHIT!"".",television,1
"@5:29, pretty sure The Simpsons never said ""Fuck You, Asshole"" or just ""Fuck You"" below it for the Terminator.",television,1
"#NO REFUNDS

He just trying to make a buck off of gullible liberals. Don't buy his book. Bernie Sanders is a waste who wants to influence the young and impressionable while in reality he does not have half the nut it takes to stand up for what he preaches. Guy is a con man. $200M in donations and he gave most of it to Debbie Wasserman Schultz's DNC after things got tough and he didn't have the guts to fight for what he preaches.

He is a socialist con man.

I repeat. Do not buy his book. Bernie is over. He sold out to the corrupt establishment he pretended he was fighting.

A fighter. A real revolutionary looks like Donald Trump, where he will fight tooth and nail for you. Not bend over when things get a little rough for him.

Bernie is a loser and he should be treated as one.",television,1
"Watch the episode if you have further questions. It's *Turkey in a Can* Season 4, Episode 5.",television,1
He should be in at least two scenes. One of them should be when dies.,television,1
Why would they though? She's no where near on the same level of talent & ability as William H Macy. Macy absolutely makes the show and his character is irreplaceable. The could keep her character and replace her with another actress and it would make no difference. ,television,1
"Racists like you might be jumping the gun. Jon Stewart was shit when he started, of course being 13 you probably weren't born yet. Unfortunately for you Trevor is improving every week",television,1
"Wow, it sounds alot like survivor. ",television,1
Did he ever say he hopes someone gets raped by a PACK of niggers?,television,1
"Cool story, dude.",television,1
Welcome to our fucking generation. Christ I wish I could smack that user on the fucking tit,television,1
"> HBO is one of the few networks that actively doesn't make decisions based totally on ratings

http://cdn.hbowatch.com/wp-content/uploads/2013/07/carnivale-cast.jpg

These people would like a word with you.",television,1
...,television,1
WRONG,television,1
I didn't know it was German because the toy is always made in China.,television,1
So you're a hypocritical moron?,television,1
[*psssst*](https://m.reddit.com/r/NHLStreams/) ,television,1
"cant wait for bill nye the science guy, but for more mature audiences. I credit any and all interest in science to this man and his amazing teaching aid videos. I cannot recall a time where we as 4th-12th(i shit you not I was shown him again in 12th grade) graders did not cheer when the teacher was like, here's Bill Nye!",television,1
"No, it's just a bunch of muff divers thinking they're tough shit/smart/funny. Women can be anything but those three",television,1
Its the advent of social media and rise of edgy young adults. When trump loses it'll break that autistic culture and make them fuck off and reevaluate their lives.,television,1
THANK YOU,television,1
The video addressed that too. People on the right who tried to get in the left's bubble for a conversation was labeled a sexist/racist/misogynist and kicked out. ,television,1
Any casting predictions? I could see Murphy getting Finn Wittrock on the line for Cunanan. ,television,1
Did not enjoy the first couple that I recorded. Haven't been back since.,television,1
You are obviously way too stupid to be watching Jeopardy.,television,1
"> he was speaking for the side that was for more war.

Elaborate, please.

> I guess being Muslim comes first over being American.

Going to war against ISIS is about being Muslim over being American?",television,1
https://www.youpak.com/watch?v=Nvn1laEhI_A,television,1
Because it's not in fucking English. Anglophones are so lazy.,television,1
Because most of us have jobs unlike those obama supporters,television,1
"Boring lines used by pro-gun ppl:

> ""Guns don't kill ppl, ppl kill ppl. Should we ban cars then?"" 

Except BMW isn't making cars that are lethal on purpose. What other utility does a gun provide besides shooting bullets to create damage? Do you use it as a dildo?

> ""It's our constitution to stop tyrannical government""

Against the world's most advanced and powerful Army, Navy, Air force? Your AR-15 against a drone and tank? Play Homefront instead.

",television,1
"Haha! 

Wow.

Meta humor flies over MY head, but you don't see how ""Ow My Balls"" from idiocracy is meta humor. 


It used to bug me when people said ""Oh, lol, Idiocracy is a documentary now"".

I'm beginning to think they're right.",television,1
PM me please ,television,1
I linek Reddit,television,1
"I'm glad you got cancer too. 

RemindMe! 2 years ""ask about his remission"" ",television,1
"I watched this movie a year or so ago off of recommendation, honestly such a fun watch. Also really brings you back to the time it was made, and elements of the film and its ""futurism"" are very relatable to today. Great watch. ",television,1
Come on I was waiting for that,television,0
[deleted],television,0
"&gt;Gina all the time
",television,0
We also have a problem with the power dynamics and the fact that a woman from an impoverished background is basically beholden to her husband. ,television,0
"Typically, that's under the ""Lisa and the Guest Star"" heading.",television,0
Mail order bride? That was on an episode of Viva la Bam if I remember correctly. Of course that was not going to make it on TV.,television,0
"I'm a little confused since it wasn't stated, did you meet your fiance through a marriage broker or just going through the process to get her over here from Canada? Just curious.",television,0
https://www.youtube.com/watch?v=Y1SBtxRObBc,television,0
99.9% of shows have predominantly white casts you'll be okay ,television,0
How can I block archer stories? It's a shit show,television,0
"I hate what they've done to Pam and her character. I'm fact as far as I'm concerned, the show has one more chance with this latest season to win me back or I won't watch it anymore. Breaks my heart because it was my favorite show for a few years.. ",television,0
"Don't be a dickhead. I'm well aware it's all those things, but I'm also very aware the last few seasons apparently put a sour note on the show.",television,0
[No. There isn't.](https://travel.state.gov/content/visas/en/immigrate/family/fiance-k-1.html),television,0
[deleted],television,0
Some just want to get out of their country and they dont care how. Human trafficking is a real thing though. ,television,0
[deleted],television,0
North America best America ,television,0
I thought the Willy Wonka roll was hilarious to start,television,0
"I'm surprised to see people not liking the series. The Villain was worse than Daredevil or Jessica Jones, but I think between Diamondback, Cottonmouth and Mariah they had enough good moments to carry the series. I see a lot of complaining about the fight scenes but TBH they felt fitting for a guy trying to slap around people without killing them. The pacing also felt fine. I guess I'm in the minority.

The only thing I was not a fan of was the freaking game of Horse to get the kid to talk. That felt like something that would have fit in the Ben Affleck Daredevil movie, not a Netflix series.",television,0
No. ,television,0
Boring after the 3rd or 4th season? you missed archer vice! that was a great spin on the show. ,television,0
Speechless is the name of the show,television,0
That's a perfect analysis of it.  Baldwin is my favorite Trump.  He also looked terrifying as him.,television,0
eh. after like 700 hours of Japanese schoolgirl rape porn i kinda burned myself out on Asian girls.,television,0
"Startup on Crackle, Gomorrah on Sundance, and Harley and The Davidsons on History Channel are all pretty solid shows that are under the radar here. ",television,0
[and here it is....](https://www.youtube.com/watch?v=bmG7_dvVNYk),television,0
Too bad.,television,0
