body,subreddit,moderated
Username checks out. ,television,1
So you think it's fine to believe that black people as a whole have less manners than white people as a whole. Isn't that a gross oversimplification that borders on the insulting? ,television,1
I love you.,television,1
"Trying to save their feminist propaganda show by any means necessary. This femnazi satire exploding on CBS and now, in desperation, they're bending the TV/DCEU rules to bring on Superman so he can be subjected to this feminist nonsense all to save a tired ass piece of programming that is has been bent on not 'needing' him (men) this entire time.

Pathetic. 

Its bad enough this awful hag is ruining the CW with her bullshit. Now here comes Superman to save her day too.",television,1
"He kills Abraham, and when Daryl shows affection for Glenn, kills Glenn to break Daryl 

Spoilers.",television,1
"Or in this situation, ""We all lose.""",television,1
RIP BARB. Holy shit. ,television,1
"I might have phrased that wrong, what is de who show about? ",television,1
How much shilling can Colbert do because his Sister's campaign was funded by Podesta?,television,1
/u/TheGreatEchoChamber trying to be funny but letting his political leanings seep through like the orange spray tan Donny uses.  GTFO,television,1
That is some of the stupidest shit I've ever read in my life. You had a teacher in high school that would waste time at the start of each class by dressing a children's entertainer and singing to the class? Did you go to a school for special needs children or is this the standard at American schools?,television,1
Retro and classic Must watch ðŸ‘ðŸ»ðŸ‘ðŸ»ðŸ‘ŒðŸ‘ŒðŸ‘Œï»¿,television,1
"""Bangs my nigga, really!?!""",television,1
r/pizzagate,television,1
Justin Chatwin is the murderer.,television,1
WEED EXPLOSION ,television,1
"Oh wow, you never mentioned being Canadian. How special. Hey! Guys! This guys Canadian! Come suck his dick, he's a special snowflake!",television,1
She lost. Get over it. :D,television,1
dramafever,television,1
w-w-wh--WHAAATTTT?,television,1
Good. Fucking pointless dindu-remake ,television,1
channel4 have blocked this in your country. I'm from the UK you twats,television,1
"[>Middle Class: Doctor, Store Manager, Lawyer, Mayor, Professor, etc](http://i.imgur.com/LuCtH5m.jpg)",television,1
Commie ,television,1
"Lilyand p
P http://i.imgur.com/T0XDEQs.jpg ",television,1
Yea denying global warming and wanting to bring back torture is soooo good... fucking moron.,television,1
"It is, relative to the mainstream.",television,1
"Suspicious lack of criticism? There was plenty of criticism on reddit and elsewhere. Tinfoil hat bullshit right there. 

You simply can't process that people like things you dont. There is no conspiracy to artificially trump up the merits of the show, as you are most definitely implying.

People like different things, get over it.",television,1
"Means nothing.

Two things my article (source below) gets wrong:

1) Trump HAS brought up Epstein's name numerous times against Hillary

2) Epstein doesn't haunt Trump's reputation.

Here's why:

> When asked about a subpoena served to Trump in 2009, Garten said it ""never happened."" The subpoena called for Trump to give a deposition in a case against Epstein; Garten's denial baffled Brad Edwards, one of Virginia Roberts' attorneys.

> ""There is no debate over what happened,"" Edwards told VICE news. ""I served Mr. Trump with a subpoena for deposition in 2009. He talked to me voluntarily, and consequently we withdrew the subpoena in light of his voluntarily providing informationâ€¦. I can't imagine there being any dispute of any of this.""

> **Edwards also said that it is ""obvious"" Trump himself was not involved in any of Epstein's illicit activity.**


And there you have it. The allegations are false, as stated by the rape victim's lawyer on behalf of the rape victim herself. 

https://news.vice.com/article/the-salacious-ammo-even-donald-trump-wont-use-in-a-fight-against-hillary-clinton-bill-clinton",television,1
( Í¡Â° ÍœÊ– Í¡Â°),television,1
jesus christ... i knew the westworld circlejerk was bad but this is practically parodying itself.,television,1
fuckhead,television,1
"http://couch-tuner.city/5/black-sails-s1-e1-pilot/

# ad block on!!!!!",television,1
Illegals have voted. That is fact. ,television,1
"No, you mean more like this. SAD!",television,1
$0?,television,1
"this might surprise you, but most people who have a lot of wealth and personal extravagance got that why by very very carefully not spending any money on other people. ",television,1
Women don't like meritocracy because unfortunately for them men are better at everything.,television,1
"> If you have nothing substantial to say about a candidate and their actual statements (with context) and platform and real track record, then shut the fuck up about it. No tabloids don't count as real news. No, ~~FOX~~ CNN is not real news and it never has been. No, nobody cares what this ~~pseudo-documentary~~ media mouth-piece has to say about ~~her~~ him. It's just tedious and revealing of you as a person.

> Seriously, vote for whomever you want. More power to you I guess. Just the rumors and tabloid shit is tired.

Hope that sounds familiar.",television,1
???,television,1
"Criticizing Hillary is like killing a buss full of mentally disabled children, just too easy.",television,1
"If you didn't already know this inside out you've probably been watching ""Fake News""... However, I'm genuinely happy to inform new people. 

* [Donna Brazille fired for leaking questions Clintons](http://www.independent.co.uk/arts-entertainment/tv/news/hillary-clinton-donna-brazile-cnn-political-commentator-spring-debate-question-wikileaks-john-a7389886.html). Or more likely, fired for getting caught leaking questions, but that's just my editorializing. 

* http://www.independent.co.uk/voices/hillary-clinton-wikileaks-email-isis-saudi-arabia-qatar-us-allies-funding-barack-obama-knew-all-a7362071.html

* http://www.independent.co.uk/news/people/julian-assange-clinton-foundation-isis-same-money-saudi-arabia-qatar-funding-a7397211.html
",television,1
I'm the Safety Officer where I work and I used this clip at the end of the annual Safety Training PowerPoint presentation to really drive it home.ï»¿,television,1
Pod 6 was jerks.,television,1
"MAGA! KICK THE DIRTY MEXICANS OUT OUT OUT! 

https://i.sli.mg/vsMTli.jpg",television,1
Underrated gem.,television,1
"> being Canadian 

> Expecting any forward thinking internet based service to come here 

kek ",television,1
"> not sure I'm entirely comfortable with people using VPNs to steal 

Come at me bro",television,1
"""800-588-2300 EMPIRE ðŸŽ¶ TODAY""",television,1
I didn't know Glen was dead thanks Dave.,television,1
So the fuck what? I mean honestly at this point so what? Trump is NOT qualified to lead anything and with Clinton being the only other real option that can win then so fucking what. Some of you pretentious and arrogant little teenagers need to pull your heads out of your asses. Downvote away you bunch of little hipster pussies.,television,1
"Them residuals though. But in all seriousness if you say a show can go for 20 seasons and still be REALLY REALLY compelling then you're a goddamn liar. Don't use The Simpsons as example, it got repetitive after 13 seasons.",television,1
"Don't don't just face sexism, we face MORE sexism than females. ",television,1
"I""D RATHER HAVE DARKWING",television,1
"Western countries with a 300+ million population? 

I don't think they exist except for the Unites States.

No one has enemies like we do.

You are a Bernout I am guessing. His plans don't work mathmatically.

That's why we call him CRAZY BERNIE.

Look we have hundreds of millions of guns in this country. Our president thinks he can accomplish dearming the population. 

What a bunch of Bullshit.
It doesn't even sound like we are The United States anymore.

This sounds like Stockholm Syndrome to terroism. 

Might as well start calling ourselves Unitedistan. 
",television,1
"""Let's just dump it in a poor neighborhood, because they don't mind living in their own filth.""",television,1
Christina Ricci is looking amazing.,television,1
This might interest you then http://duckbanker.blogspot.dk/p/comic-download-links.html ,television,1
Nah - burned at the stake I hear.,television,1
"""FUCK FUCK FUCKING COCK FUCK FUCK FUCK""",television,1
if someone could send a message for the links please,television,1
"no it would not. Have you, in your entire life, ever seen a politican ever lose their career over anything? We have crack smoking mayors who still get elected. ",television,1
Fuck off dude. Seriously go cry about it. Whining on Reddit is not going to change anything. Good luck. ,television,1
Stop Megyn me hard! Aaaaarrrrrrroooooooo!,television,1
"AHHHHHHHHHHHHHHHHHHHHHHHHHHHH!!!!!!!!! YESSSSSSSSSSSSSSSSS!!

Plz keep the cast, /u/netflix",television,1
"if you get the out of country block on youtube, just replace 'tube' with 'pak' in the URL and it takes you to a site where you can watch and/or download the episode.  Same goes for any region-blocked youtube clip.
",television,1
"talking to you is like talking to a schizophrenic, you are in a totally different reality.",television,1
"lol you sound like a pseudo intellectual loser, kys",television,1
she got to be the worst looking female on earth.,television,1
they ARE richer than trump. Trumps net worth is around $300 mil,television,1
"dave made it socially acceptable for a black person to host a sketch show, and he made black humor more main stream. Before chapelle show, the best you'd get on tv was some standup routines on HBO or some other paid service with a very niche audience, but dave brought racial humor into the main stream. before the chappelle show, black comedy was extremely white washed to the point of being ridiculous and completely unrealistic.  ",television,1
"> And it's freaking pointless speculation.


Its not pointless speculation.  The actor that plays Glen is off making a movie instead of making the next season of TWD... so... not really complicated. ",television,1
Leaves from the vine,television,1
Then link directly to the study.,television,1
"No, you did not reply with personal experience, you straight up disagreed with what I said.  You sprinkled in ""in my town"" or some bullshit like that in 1 comment but in all the others you were straight up disagreeing and trying to refute what my experiences are.  You also tried to twist around the meaning of my comments at least twice, probably because you realized that a proper reading of my comments left little room for disputes because it was about personal experience and not an absolute truth.",television,1
I'm the Safety Officer where I work and I used this clip at the end of the annual Safety Training PowerPoint presentation to really drive it home.,television,1
"dang I'm getting downvoted.

Liberals must be getting triggered that I do more for the environment than they do. Me, a Trump voter. Haha get triggered fucking cucks and come back to me when you've made a coherent effort in reducing your carbon footprint. Get on my level bitches. ",television,1
"Season 3 already felt like badly written fan fiction and season 4 certainly hasn't improved.  
  
They treat being smart as some kind of magical superpower. Instead of showing us some smart writing we're just told ""oh yeah, this or that person is super smart"" and then proceed to let that person act out some ridiculously stupid plan that only works because they can use ""smart magic"" like mind controlling people.

[spoiler My biggest issue though is that I don't get why they didn't bring back Moriarty  if they were going to jump the shark anyway. At least that guy's charisma could somewhat make up for the bad writing and deliver us a worthwhile villain.](/spoiler)

",television,1
"Fuhrer Drumpf is scary, not funny. Stop normalizing this illegitimate fascist.
",television,1
"Hell, the Puckle Gun was created in 1718.

Dumbasses still think the Revolution was fought with muskets.",television,1
"Better Call Saul is a slow burner, but god damn it's one of the best shows of all time.

Mash.  The Wire.  Better Call Saul.

Sure, you're nerd friends love talking about Game of Thrones OMG titties dragons.  Maybe it's Shakespeare?!?

Whatever.  Fine.

But Better Call Saul is absolutely worth your time.

Amazing, brilliant, heartbreaking show.",television,1
"[Nah, I'm good.](https://np.reddit.com/r/television/comments/4p65bx/archer_renewed_by_fx_through_season_10/d4ihvkt)",television,1
The reddit circlejerk is strong with this one.,television,1
Oh right your full of shit. Got it.,television,1
"Of course they are you aspie fuck. 

Its called fucken ads you aspie fuck.

Unless you dont know the differance between ads and a show?

On Netflix you get suggestions BUT they dont get in the way of your viewing experience.

Why is this so fucken hard for your brain to work out? ",television,1
"Oh look, another Edgy One who thinks linking to 'iamverysmart' is clever.",television,1
Never watched this ... yet! F'n amazing!,television,1
I'm the Safety Officer where I work and I used this clip at the end of the annual Safety Training PowerPoint presentation to really drive it home.ï»¿,television,1
"Looks like they raped her before this, probably was just sick though...",television,1
oh shut up fucking sjw ,television,1
Baby Boomers created this cartoons are for children culture....,television,1
"I'm French so I always get the commercial-free version, be it via Netflix or the Pirate Bay. ",television,1
"Why so many downvotes? 

Can I have some too? Here we go! 

Maybe he can make enough money imitating Trump to pay off all the assaults and lawsuits he's accumulated over he years. 

All those dirty dirty racist comments homophobic comments and photographer assaults public temper tantrums etc. 

In fact, he acts just like the guy he mocks and yet people are loving him. 

What gives? 

Downvote away because of unpopular opinions! ",television,1
come on america!,television,1
lol,television,1
"Not sure who told you that but that is incredibly wrong. The only organ that has any issue would be the kidney's because of potential ketoacidosis. Everything else is perfectly fine.
",television,1
"****Yeah I remember.. i watched it few years ago.. here is it's original link**** https://www.youtube.com/watch?v=jwmslRaINno

**First Upload Here :** https://www.youtube.com/watch?v=unW4GOJw4ro",television,1
[Mirror works?] (https://www.youpak.com/watch?v=XZNHRE96q6Y&feature=youtu.be),television,1
"If you need a hyphen to understand what Dumbfuck means, you are a dumbfuck, you Dumbfuck. 

",television,1
"This is what I was coming to say.  It's like a fat comedian making fat jokes, then being followed by a skinny guy making the same fat jokes.  Now they aren't funny anymore, they make you want to punch the guy upside the head.

The Daily Show is, at it's heart, about American politics.  And Stewart was an American who felt pain when America was hurt.  Even John Oliver, who isn't American, married an American war veteran and has enough ""skin in the game"" to be able to praise or condemn Americans.",television,1
"I already did

But of course reading is hard for some people. ",television,1
"I don't think that's a fair representation of many TERF's outlooks. It's not that they're crossdressing men, it's the fact that they're not fully, biologically women and as far as life experiences go shouldn't belong in the same sociological group. 

If you're a MtF trans woman who transitioned in your early adulthood (as most do). You actually lacked many extremely formational events that young women experience. When did they get their period? When was the first time they were catcalled as a tween? When did the hypersexualization of their body as a commodity happen? The answer is that it didn't happen. 

Trans people totally deserve all the rights and respect in the world. But I think its fucking disrespectful to the trials and tribulations that genetically born women go through to assume that men identify and thus transition later deserve the same title. You're not a woman, you're a trans woman, and that's fine, but women already have such a shitty, short end of the stick, don't cheapen their lives by being classically male patriarchy and taking and co-opting whatever the fuck you want. ",television,1
Haha Liberals get fucked. Heil Trump. ,television,1
Wasn't my point at all but w/e. You really are a condescending douchebag. ,television,1
"My take on the ""the friends from Friends were terrible people"" argument is: it was a sitcom, it was funny, so who cares?",television,1
"I read ""Anal""",television,1
Thats what a libtard would say. ,television,1
TIL,television,1
Can we get her to say truthful things about niggs? Like N*ggers commit more than 50% of the murders or No sane person who is worth of any value to themselves likes a n*gger. N*ggers eat watermelons and fried chicken because they are too lazy to be able to afford anything else. Will she do this for charity?,television,1
"Off topic: Is it me or is that man getting sexier the grayer and scruffier he becomes?

(When Daddy types suddenly find themselves attracted to a Daddy type.)",television,1
Wat u gun do bout it boii,television,1
"Oh, right, that's it, not because it looks like whiny pedantic bullshit.",television,1
"That means the season will end with a nuke going off, creating an eternal night under nuclear winter for the Strigori to prosper.",television,1
https://www.reddit.com/r/videos/comments/51lg5o/atlanta_episode_1_the_premiere_of_donald_glovers/d7d7qj6,television,1
And you didn't tag it here.,television,1
Fake news.,television,1
"The douche vs turd thing rings really hollow given that they're making it into a ""pick the least of two evils thing"" but they made an episode last season solely about how absurdly terrible Trump was and the most Clinton got was a nuke in her snatch.

It's like they *always* have to be better than everyone else by picking a ""nothing is true everyone who has an opinion is a moron and a hypocrite"" angle. It's a very risk averse, safe way to do topical humor, and it's boring.",television,1
you'll never pass.,television,1
"you realize the box cutter didn't plan a conspiracy, create cells, financing to execute a terrorist act right?

how fucking does one have to be to get on your level?",television,1
Dick,television,1
On what basis do you say the industry isn't fair to them?,television,1
The reason why we dont want free education is because it would be wasted on idiots like you. ,television,1
Good. Fuckin' took long enough.,television,1
the nose knows,television,1
">The SC has continually refused to hear lower court decisions on registration essentially confirming their legality including in New York and California

Which makes those decisions **illegal**. 

>As for the ""ninja edit"" I expounded a second after I posted. 

No, you responded at least 5 minutes afterward, as per the asterisk next to your comment.

>Of course none of that changed my initial post which is what you needed to fucking read and obviously didn't.

No, I read it, and subsequently crushed it.",television,1
"you see the BANGLA,HINDI AND ENGLISH MOVIE",television,1
Couchtunner. streaming sites.  I haven't used it since probably season 4 of TWD. But they would upload new episodes shortly after they aired. I never had a problem with it but just do a little search just in case it got sketchy. ,television,1
I'm the Safety Officer where I work and I used this clip at the end of the annual Safety Training PowerPoint presentation to really drive it home.ï»¿,television,1
Im not a fan of the show but charlie brooker is a pretty good comidian so it might be his style,television,1
[Better](https://youtu.be/Wqp9Sf9pWLE),television,1
i'd hope that nigga would do most of the painting for himself.,television,1
"TODAY IS THE DAY TO REMEMBER MY FRIENDS, TODAY IS THE DAY!!",television,1
"Fuck, I don't remember the name Angelina Jolie was a Russian spy or something. Hope that isn't a spoiler. But yea that would be a great TV show. Honestly, its basically the plot of The Blacklist just less Spader.",television,1
Guess they cancelled his show.,television,1
Except for the fact that nobody cares what his stupid African ass thinks lol.,television,1
fuck off,television,1
20 and 22 here. We've watched every episode. ,television,1
"I've watched it. Hodor! Hoooodor! 

",television,1
[Some Donald Trump Voters Warn of Revolution if Hillary Clinton Wins](http://www.nytimes.com/2016/10/28/us/politics/donald-trump-voters.html),television,1
ITT: Downvotes for anyone who speaking the truth you guys don't want to except.,television,1
My ANUS is bleeding!,television,1
"Let me guess:

Leftist hipster jackoff calls Trump all types of names, and makes a claim about ""racist white men""?

Wooooooooooooooooooooooooooooooooooooooooooooooow, how edgy! Guess we will now see videos from this bullshit show on this sub too!",television,1
"â€œFuckâ€ can be used as a verb, adverb, adjective, command, interjection, noun, and can logically be used as virtually any word in a sentence (e.g., â€œFuck the fucking fuckersâ€). Moreover, it is one of the few words in the English language which could be applied as an infix (e.g., â€œAm I sexy? Absofuckinglutely!â€; â€œBullfuckingshit!â€). It has various metaphorical meanings. The verb â€œto be fuckedâ€ can mean â€œto be cheatedâ€ (e.g., â€œI got fucked by a scam artistâ€), or alternatively, to be sexually penetrated. As a noun â€œa fuckâ€ or â€œa fuckerâ€ may describe a contemptible person. â€œA fuckâ€ may mean an act of copulation. The word can be used as an interjection, and its participle is sometimes used as a strong emphatic. The verb to fuck may be used transitively or intransitively, and it appears in compounds, including fuck off, fuck up, â€œfuck youâ€, and fuck with. In less explicit usages (but still regarded as vulgar), fuck or fuck with can mean to mess around, or to deal with unfairly or harshly. In a phrase such as â€œdonâ€™t give a fuckâ€, the word is the equivalent of â€œdamnâ€, in the sense of something having little value. In â€œwhat the fuck!â€, it serves merely as an intensive. If something is very abnormal or annoying â€œthis is fucked up!â€ may be said.
[Source](https://en.wikipedia.org/wiki/Fuck)",television,1
r/justneckbeardthings,television,1
I skipped the Deanna/lwaxanna (sp) Troi episodes of Next Gen. No ragrats.,television,1
I've only seen snippets of the site once or twice. They should've cancelled the daily show. This guy is funnier than the daily show host (who isn't funny at all),television,1
www.pirate.gov,television,1
That sounds like a personal problem.,television,1
"The Today Show used to be pretty good. I used to keep it on TV all morning as background, but now it's like a three hour BuzzFeed video. ",television,1
YES!,television,1
How true is the conspiracy? I went on the sub before it got banned and I thought it was retarded. Complete nonsense.,television,1
If you play your cards right.,television,1
Over 1 Billion Asians....,television,1
"Is this really a story from *last month* about the bush emails?  Wow, well that's one good reason to elect Felon Clinton - so we won't hear ""IT'S ALL TRUMP'S FAULT"" for a few decades.  Of course people like you will just scream ""IT'S ALL BUSH'S FAULT!"" instead, so I guess that's not much of a win.......",television,1
Heard you from the hood you rep that thing or nah?,television,1
:D,television,1
"My dear Holland, are you suggesting that the reason Miss Winona appears so high is because them titties were looking so dope?",television,1
I'm the Safety Officer where I work and I used this clip at the end of the annual Safety Training PowerPoint presentation to really drive it home.ï»¿,television,1
"And torrents haven't got rights to anything, but give us everything. Nice.",television,1
"No worries, I can see how my wording leads to that thought, all good.",television,1
"""They don't deserve or seem to want to live in democracy"" 

Who the FUCK died and made you fucking king of everyone's subjective personal opinions and beliefs? Stop generalizing dude do you actually believe all the bullshit you type out? You patronizing, condescending, useless individual.",television,1
And why the hell should I listen to you? ,television,1
It's TWENTY SIXTEEN and we're still allowing a non-Democrat candidate to run for President?! C'MON PEOPLE WHY ARE WE FIXING THIS!,television,1
Loved her as a actress.,television,1
What do you think about this??,television,1
"TL;DR:

No.",television,1
It's not anti-comedy. ,television,1
"Don't worry, snowflake. It'll be alright.",television,1
YES my praise have been answered ,television,1
"OH LAWD - is CYE for real coming back?

",television,1
I don't know. Do you?,television,1
"Wow, they're so brave. ",television,1
"It's **SKETCH**, not skit, you fucking idiot. It's right in the original title.",television,1
The real problem is they hired a damn black,television,1
"I was about to masturbate, but for you John I'll wait the extra 4 minutes.ï»¿",television,1
"I didnt get the ""if you need anything and i mean anything at all patsy is going to be at the hotel a half a mile away"" part. Can someone explain?",television,1
It's when she flips the D&D board over and shows them wills wizard figurine and the monster on top of it,television,1
PENNYCAN!!,television,1
That's not a feature anymore? What's the point of having our history visible then? ,television,1
