body,subreddit,moderated
"I mean I guess so, but 5 years is a LONG time for 7 animators to create a 1 minute short. I mean I think, I guess I don't know. It just seems crazy that there's entire video games that people have put together in less time than that with smaller teams. I mean Cave Story was a pretty big game done by 1 single guy and that took 5 years too. And Undertale took 2.7 and that was a really small team too.",television,0
A *little* butthole.,television,0
"brb, googling ""Kate McKinnon's facial"" 

",television,0
[removed],television,0
"You make a good point, and it would be interesting to see how it would play out. As a Filipino  I am a bit pessimistic when it comes to these things as there is a lot of cultural stereotyping and frustration at play for me that I am not eloquent enough to express. 

I just don't feel that the US entertainment industry is at a point yet where this is a good idea, at least in the cable side. Every other positive main Asian role is being whitewashed in movies, but you know this role won't be, and it's just a bad look.


Also, I didn't know that was the origin story for the Unbreakable Kimmy Schmidt, and I never would have guessed from the Netflix show thumbnail.",television,0
http://www.whatreallyhappened.com/RANCHO/POLITICS/BODIES.php,television,0
Season 1 was absolutely hilarious,television,0
soo good,television,0
Awesome. Thanks. Thats kind if how I felt about Treme. It wasnt about a story line. It was about people. Some of the characters in Treme seemed real to me. ,television,0
"Every thread on this subreddit has them when the video makes fun of trump.
It's pretty funny how predictable it is",television,0
they got more money from hulu,television,0
[removed],television,0
Murray Hewitt was the best.,television,0
"Wow. I never really considered that. I have a fairly myopic worldview, I suppose. I just assumed the same way India has Bollywood and their stars, china would have their own version. I can't imagine their entire entertainment industry just being dubs of ours. ",television,0
"Maybe if it was through the perspective of the Philipina bride and not a white woman. That would be a better concept. This was just a bad idea all around. 

Maybe go read some comments by actual Asian people",television,0
[deleted],television,0
Looks that way compared to Game of Thrones which you hear people talk about all the time.,television,0
[removed],television,0
"&gt;not all Asian families live like his story either

I think that's his point, they aren't telling the story he wanted them to tell",television,0
Do you ever try to watch a football game and then realize you've been watching the extras on the True Detective DVD FOR 3 days,television,0
"Come on, son.",television,0
"Holy shit, this",television,0
"On the villain comment:

I had the same thought until I went out and read what was being said on the Internet about the villians.  In Daredevil, Kingpin wasn't just a threat, logically, he should have won against a single non-super powered opponent.  We've gotten used to Villians having greater power than the Hero's they face.

Cottonmouth is the ""deer in the headlights"" villian.  Without an opponent with super powers, Cottonmouth would be unstoppable.  But, against someone like Luke Cage, he never had a chance.  He started the conflict with Cage thinking that the world was exactly the way he had always known it, then when it's too late, he realizes that Luke is unstoppable, but never changes tactics, thinking that he could beat Luke using the same tactics that had gotten him to where he was.

This -does- make Cottonmouth different from all of the other comicbook movie villians up to this point.  I kept watching Cottonmouth thinking ""Deer in the headlights"" and expecting him to get hit by gama rays and turn into a hood-monster, but no...  They plot twisted and Cottonmouth actually goes from villian to a point of sympathy almost.

Don't know.  I wont knock the writers on Cottonmouth, they actually did something very different there, and the actor did a hell of a job with what he was given.

The editing was terrible though.

",television,0
"Spotted the liberal who resorts to calling everyone who disagrees with him a racist, even when the conversation has nothing whatsoever to do with race! Racist racist race race race Racey McRaceface race race racist racist!",television,0
"And the remix:
https://youtu.be/RbM2F-cfN0A",television,0
Definitely hard to stay engaged.  I felt like I couldn't stop watching daredevil or jj.  I keep waiting and hoping a real villain will show up,television,0
"MILF Peninsula where the aerial shot looks like a penis is better.
",television,0
Oooo! I 'member!,television,0
"He's clown, he plays his own act in different styles. ",television,0
I'm not sure about the coddling.  Margaret Cho and Russell Peters imitating their family and acquaintances is hilarious.  Random dude on the radio making an accent for laughs is usually cringey.  Had no idea the later had disappeared due to FCC fines.,television,0
"&gt; that article was really forcing those Archer references...

Interestingly enough, this is the exact reason I stopped watching Archer. I used to be such a huge fan of the show, but then it just became too self referential. There were no new jokes, it was just the same ones repeated over and over. It's like they were just winking at the camera and going ""remember when we did this before?!"". A little of that is fine, but when that's ALL the show is, it just felt like the creators stroking themselves off. I lost all interest, which is a bummer, because when Archer was in it's first few seasons, it was pure comedy gold. ",television,0
"This might be the single most unintelligent comment I've ever seen.  There is a ""niche of people out there"" who dislike every show.  No show is going to have a 100% approval rating.  Hits like Breaking Bad or Game of Thrones aren't for everyone.  Having some critics is expected. ",television,0
[deleted],television,0
I would love to see an Odin spin-off from some early days with Barry as a new recruit,television,0
"And he might hit season 10 and realize he's got more story to tell, too. You never know.  

But, I heard last week Adventure Time was coming to an end on its 9th season, too.  

But, if it's got a story to tell, and it's done telling it? I'm fine with that, man.  ",television,0
"A lot of people are going to be watching the season finale of Fear the Walking Dead.  I'm not sure how much overlap there is between the two viewing audiences, but it might cut into the ratings for the pilot.",television,0
"Side note:  [Worf's hot Klingon girlfriend was Marshall's mom on HIMYM.](http://www.imdb.com/name/nm0686442/)

http://i.imgur.com/irA4fYj.jpg",television,0
You don't think that this elevates Trump? I get that they're knocking him in the skit but there was no bite to the writing here. It was basically just a bunch of confirmation bias in the form of fart joke grade humor. What was there to take away from this? I still don't believe that anything was done here.,television,0
90 Day Fiancee is still running and it's reality based......,television,0
The person you replied to is not a Trump supporter; you're agreeing with them.,television,0
"Yep, that was it",television,0
Cyber security is the term. That's what people call it. What do YOU call it?  ,television,0
That cat doesnt give two fucks,television,0
"Yeah, that's it. Reddit is full of sexist pigs. There's no other possible explanation. ",television,0
"It's captured the attentions of a lot of the population the last few years. I think it's because it's quite a pleasant, warm show that still enables people to root for their favourites. Reality TV can get so extreme and cynical, it's a nice respite from stuff like Big Brother or all the grimly aspirational Made In Chelsea/The Only Way Is Essex stuff. A cosy alternative.

A big thing is people have a lot of affection for the presenters, Mary Berry and Mel and Sue, for example. When the production company struck a deal with Channel 4, the story took on this extra dimension because people saw disloyalty in leaving the BBC. Those three presenters choosing to stay with the BBC has only compounded that. I think if they'd stayed with the show and gone to Channel 4, it wouldn't have made much of a splash in the news. But the fact that they've stood by the BBC means the story has become more about loyalty and love for the BBC, with Paul Hollywood cast as a money-grabbing villain for going to Channel 4.",television,0
Gimmie Jimmy!,television,0
"&gt; Anthony Atamanuik

Mirror? Can't access from Canada-land",television,0
Is the Wire even meant for normal people?? I tried watching it multiple times and it was really tedious and pretty boring...,television,0
[removed],television,0
its kept alive by Soros funding and the handful of new york latte-sippers who still watch this unfunny garbage,television,0
I'm sorry. I'll try to cater my jokes to everyone next time. ,television,0
"MMMmmmmm, don't agree. Bruce was ASH from episode one. I don't get what you mean by ""wasn't quite there."" He was comical and badass since S0E01. . ",television,0
Yeah vice was one of my favorite seasons.,television,0
Thx. Will try again - gave up mid-season first season.,television,0
If only there was a platform to see it on since I don't have whatever channel it's on ,television,0
"Right. Because anything you haven't experienced yourself isn't real. Only your own limited personal experiences exist, and everything else is nonsense.

",television,0
"That's the electric slide man, get hip",television,0
"Yeah you're right every problem in american history was caused by non-democrats, and everything the left does is perfect. /s",television,0
"See, I've dealt with the victims of this. You're the one that has no idea what they're talking about. ",television,0
"Go to any basic economics class. Or Hell, put an expensive bet down on black during a game of Roulette. That is what all producers do when they fund projects, make a calculated risk based on the expectation their investment will pay off successfully. Replace gambler with producer, red/black with bad ratings/good ratings and the production team with the roulette wheel spinner, and that's a simplified version of TV and film production. Understand? ",television,0
Farrell's Bush was scrumtrelescent.,television,0
Which episode was this in?,television,0
It's a fucking MELT!,television,0
"And as a Colombian woman, it baffles me how so few here don't see the similarities. ",television,0
Beyond season 3 they seem to just be repeating the same jokes from the earlier seasons. I thought it went downhill after season 4 and never fully recovered.,television,0
Pitch,television,0
"Oh wow, more ad hominem. If you have nothing to say just call the other person racist, sexist, etc. It's the new McCarthyism. 

Luckily the majority of people can see through it. It's depressing trying to put yourself in the mindset of those who think (or I should say fail to think) like you do.",television,0
"Probably because ""sir or madam""",television,0
"Graceland - a group of undercover agents who often pose as criminals to infiltrate criminal organizations. They often find themselves in positions where they have to decide between preventing people from getting hurt and blowing their cover or participate in really shitty things (murder, arms deals, drugs, etc.) in order to stay undercover and catch the really bad guys.",television,0
haha Northern Ireland is not a part of Britain,television,0
While the threat of stitches makes snitches,television,0
"Every time NBC is on my tv they're advertising for 100 new shows with increasingly stupid plot premises and again, based on the advertising, with increasingly awful acting.

Despite that some of these shit shows somehow catch on and get popular. Didn't that 'Jane the Virgin' show win some award for its first season? Boils my blood people are stupid enough to enjoy that shit, let alone critically acclaim it. ",television,0
"""GGCHHHYYYNAAA""

It's the only way I can ever say it again",television,0
"The Librarian movies are better. The Librarians Curse of the Judas Chalice is pretty good.

http://www.imdb.com/title/tt1146438/",television,0
How does it rip Hillary?,television,0
i dont know that slang,television,0
Definitely Community. Pretty sure it was Troy.,television,0
It's helping me come to terms with mine if that helps sway you,television,0
"For me I agree with the show being cancelled because the woman behind it wasn't a mail order bride herself, she just grew up with one. If/when someone who actually has this experience wants to make a show, I'll support it getting a shot comedy or not. Its like with Fresh off the Boat. Asian man behind the show sharing *his* experiences; not a white guy imagining how everything would be for an asian boy in that position. ",television,0
I actually really wanted that to be a thing. Not as a serious show but as a sitcom.,television,0
"At the time the new FCC regulation took effect, I remember some radio hosts joking about how Margaret Cho would now have to worry about how to promote herself via morning radio shows because her whole act was based on jokes about her parents, and she did their accent constantly in her act. I think it's funny that people are massively downvoting me and even saying I must be making it all up. ",television,0
"The two shows have more differences than similarities, really. ",television,0
"""Damn it Token, we have been through this.  You are Black, therefore you can play Bass.""",television,0
"There are certainly Chinese celebs, but they aren't International celebs like Brad Pitt. I mean Japanese companies quite regular use famous Americans for somewhat embarrassing [ad campaigns](https://www.youtube.com/watch?v=XOFvdjZ7BuY). We don't see the reverse happening in N/A, that's for sure. ",television,0
[removed],television,0
he is a very talented composer,television,0
"Right, WB owns it from when it was airing on the channel when it was called The WB, CW because it's syndicated channel after The WB was changed. ",television,0
"Im not talking about gillian anderson... obviously.

&gt; I do know season 3 starts out with her character giving Jamie Dornan's character medical attention to keep him alive since they only caught him at the end of season 2 and he was pretty much dying.

yes... and then another 40 mins of medical attention with a few scenes not relating to what drugs or procedures they need to give paul.",television,0
Weird that he's interested in cartoons now because he turned down a cameo in Gravity Falls a few years back.,television,0
Hit 'em with the Hein!,television,0
We no longer want to hit that. ,television,0
"Ah, the classic I can't read sarcasm only hear it issue.... pardon my ignorance",television,0
"Claire, we fucking get it, you know a great lawyer.",television,0
It was a spec and I'm pretty sure it got the writer got work because it was so good and if I'm not mistaken it got them on Community? I really wish I could recall this shit much better.,television,0
"yes

[best quality](https://www.youtube.com/watch?v=gA7uQSnpmQM)",television,0
"The female lead speaks in a stereotypical Filipino accent and makes jokes about eating dogs.  

Of course it's not racist to /u/Awhite2555.  ",television,0
[deleted],television,0
[deleted],television,0
Hahahahahaha I fucking love you,television,0
"Except she has volunteered for the role, and has as much choice over whether to accept her potential groom as any bride. That is... pretty different from human trafficking and sex slavery.

There are definitely some issues worth discussing here; I'm not saying we should all wholeheartedly approve of mail order brides. But the bald-faced claim that it's completely equivalent to human trafficking is ridiculous. ",television,0
"The Punisher salvages season 2. 

He was absolutely fucking amazing.",television,0
[removed],television,0
"His first claim to infamy was denying black people housing.

He's a racist.",television,0
Entertaining but in the worst way.,television,0
They rich as fuck. ,television,0
"Especially funny when you realize, as someone above points out, that Lester Holt plays bass.",television,0
That episode took me by surprise. My jaw was dropped through the whole episode. Never seen such a good representation of PTSD on TV before. ,television,0
No Better off Ted?,television,0
"This obnoxious comment can always be depended on to show up 

:)
",television,0
Best show ending ever,television,0
I'd be down for 4 more years of Kate McKinnon skits.,television,0
"warehouse 13, dark matter, the expanse, killjoys, stitchers, continuum, person of interest, 12 monkeys

in order of suggested 

- not sci fi totally, more like fantasy but a team searches for dangerous artificats
- 6 people wake up in a ship with no memories, they search for answers
- kinda complex to explain, just watch it, its very good. 
- follows a bounty hunter team
- a machine is used to unravel murders by sending a girl back into the persons memories
- time travel show, starts out very cop procedurally, gets into a pretty glorious time travel show
- same as above, but replace time travel with AI. a billionaire and a ex cia guy (and others later) get numbers of people relevant to a future crime. they work to stop it. ends up being a fantastic ride. 
- another time travel show, pretty interesting

I've liked all of them, not all are sci fi really, but all are very enjoyable at least to me. I'd suggest you look on IMDB for ratings/reviews/descriptions and see what appeals to you out of them ",television,0
"He bough her and although it seems archaic there are organisations that gather women in groups who are willing to marry someone they barely know usually for money and a chance to live in a more westernised country.  It is nothing more than a financial transaction ""with benefits"".

EDIT: repeated words",television,0
"""Lisa and Homer"" and ""Lisa and Bart Solve a Problem"" episodes can be quite good though. ""Lisa Vs. Society"", ""Lisa and the Guest Star"", and ""Lisa and Marge/Maggie"" are the real problems.",television,0
[removed],television,0
Just pick something and turn it on stupid.  You don't need someone else to make that decision for you. ,television,0
"thats an error in your grammar, not your spelling, find a new meme.",television,0
"America is the victim, because the stupid assholes the populate the entirety of this country left us with Hillary and her corruption and Trump and his bullshit. Like Hillary if you want, but it's pretty rich you fly off the handle and call everyone who isn't with your party victims, but you can't help crying about people having different opinions than you.",television,0
"This has to be the funniest snl segment I've seen in years, if not ever.

Also holy shit, the amount of makeup on Michael Che.",television,0
Did he imagine it was going to be like the Goldbergs?,television,0
"I feel it could be a misdirect. Since the first episode they've made him seem very shady so it could turn out that he's not involved, but he'll die helping the President or something.",television,0
Guilty as Changed.,television,0
"She became increasingly annoying as the show went on. To quote Me.Burns:


""Dear god, are you always on?""",television,0
^ I found Donald Trump's Reddit account. ,television,0
He hasn't been honest about a damn thing this entire election cycle.,television,0
Examples?,television,0
"Stan Lee Cameo!

See a crime? Report it!  poster",television,0
Not by the end when you see where they were going with the whole thing.,television,0
"I was not sold on vice for the first half of the season, but I thought the 2nd half was as good as anything else.  ",television,0
What's so offensive about how Asians are depicted on Television? ,television,0
"Sure but I don't think the one joke thing was **the** problem of this show. It was a rather minor problem, at least in the eye of the public.",television,0
"We're up to episode 10. It's real shaky for me. There are plot holes all over the place. The dialog is definitely really bad at times, and the characters slip in and out of accents at will -- may be a directorial issue?

Exposition is really obvious and done in the most cliched ways possible.

As for his super powers, I have the same problem with Luke Cage that I do with Superman. All of the fights feel like they have zero consequences because he's invincible. Found myself wishing that every fight scene would just be over with as soon as it started, because he might as well have been shooting clone troopers with a blaster. Blah blah, hurt meaningless thug, repeat.

I'm hoping that the show does something great in the last few episodes, because right now this is the biggest let down for me in the entire MCU to date.",television,0
"Yet he still managed to have ""Wesley saves the ship"" episodes somehow &gt;:(",television,0
Yes that's another good example. Still though you have to admit it isn't common. ,television,0
Daredevil is a martial artist. Luke Cage is more of a brawler. So it's not as flashy but that's to be expected.,television,0
I've hardly said that at all this season.,television,0
"Weird, it's working for me. Can you hit F12 on the loading screen and copy and paste any big red errors for me?",television,0
Now you have to put money in the swear jar,television,0
[deleted],television,0
"Melissa Villasenor's Sarah Silverman is damn accurate. It could benefit from better writing in the future, but it's good.",television,0
"I had heard of Sarah Palin before the nomination but not seen her. That first time she was on television I thought, damn she looks just like Tina Fey. ",television,0
Only two episodes posted two weeks ago. Hope they have more coming,television,0
"There's some of us who liked us! Dozens even!

Quick edit: it had one of my favorite jokes of all time

America manager: ""Black Friday is coming up so we need to get ready""

Call center employee 1: ""What's Black Friday?""

Employee 2: ""It's Martin Luther ling Jr day""",television,0
Most definitely. Adam Pally's character was great too but Penny still stole the show.,television,0
"Yeah, well, when you say it like **that** it does kind of sound disgusting.",television,0
I mean he's probably an ok tank but he certainly doesn't make the party I agree,television,0
"Cody, what did you do? You're a loose cannon! ",television,0
I am one of those sjw's and this idea was a joke. However it might serve as a great vehicle for touching upon many issues....,television,0
"first half good, last was horrible ",television,0
"All canon goes back to Amazing Spiderman

https://www.youtube.com/watch?v=NFh__GrQIPk",television,0
"The campiness is kind of why I like The Librarians.  Too much tv is so serious nowadays.  Sometimes camp is good.  Then again, I'm a child of the 70's so maybe I'm nostalgic.  ",television,0
"Yea, I've noticed that, too. I've just rewatched the four first seasons. The fifth season seems pretty lackluster compared to season 2, 3 and 4.",television,0
My favorite ever cancelled show was Firefly :(,television,0
[deleted],television,0
"I have a big crush on Kate, but of course she's actually gay.  Not that that *really* is going to make a difference on the outcome of anything ",television,0
"Oh I know. I'm just saying it's not too different from the point here. (I'm related, very closely to one of the characters Goodfellas is based upon.)",television,0
Does Netflix have a monopoly on serious shows?,television,0
Didn't Ice-T even say that episode was shit?,television,0
"Also Brian Fuller has three shows in that list already. Wonderfalls, Pushing Daisies, and Dead Like Me.
",television,0
"It's funny, I know people hated this show but my parents (who are Indian) and all their friends absolutely loved it (including me).

It was just nice to see Indians on tv.

Edit: To clarify, people hated it for being offensive but the Indian community really liked it",television,0
[deleted],television,0
What's with all these good shows ending all of a sudden. ,television,0
Uncage the Nuke Luke Cage.,television,0
IF it ever ends. I am bored to tears with the show right now.,television,0
[deleted],television,0
Agreed. SNL is always pretty hit and miss but McKinnon always seems to be solid even in the misses.,television,0
[deleted],television,0
[removed],television,0
That's not the definition or the common usage. Words can have whatever meaning you want for yourself but don't expect others to use your same narrow definitions,television,0
Foreal? That's awesome. Usually folks just blame Hydra. I'm enjoying the show thus far.,television,0
"Even though it went downhill fast (and season 8 was some of the most godawful TV I've ever seen), seasons 1-4 were very good. ",television,0
[deleted],television,0
[deleted],television,0
"That was the joke though. She almost forgot about her ""political prop"". And come on, don't act as if 70% isn't making fun of Trump anyways. 

",television,0
"Sure, anyone with common sense, your side and political position I assume too. Totally not biased. How's that 30 years of nothing but disasters from your candidate?",television,0
"Hey, my penis fills an entire tall-boy.",television,0
[removed],television,0
[deleted],television,0
"Honestly, most Trump impressions make him look too smart and present IMO. He looks like he's paying attention and responding with bluster. I've only really seen Baldwin nail the totally uninformed incoherence and pettiness Trump brings to the table.",television,0
"""The smart people! S-M-R-T!""
",television,0
[deleted],television,0
"Looking at you, Detective Conan. ",television,0
Is there a mirror for those of us in the colonies?,television,0
